[2025-11-02 02:28:47] L2 fecha:'01-03-25'->2025-03-01
[2025-11-02 02:28:47] L3 fecha:'14-05-24'->2024-05-14
[2025-11-02 02:28:47] L4 fecha:'25-09-24'->2024-09-25
[2025-11-02 02:28:47] L5 fecha:'21-01-24'->2024-01-21
[2025-11-02 02:28:47] L6 fecha:'30-06-25'->2025-06-30
[2025-11-02 02:28:47] L7 fecha:'09-08-25'->2025-08-09
[2025-11-02 02:28:47] L8 fecha:'05-09-24'->2024-09-05
[2025-11-02 02:28:47] L9 fecha:'15-01-24'->2024-01-15
[2025-11-02 02:28:47] L10 fecha:'21-08-25'->2025-08-21
[2025-11-02 02:28:47] L11 fecha:'29-07-24'->2024-07-29
[2025-11-02 02:28:47] L12 fecha:'26-03-24'->2024-03-26
[2025-11-02 02:28:47] L13 fecha:'25-03-25'->2025-03-25
[2025-11-02 02:28:47] L14 fecha:'18-11-24'->2024-11-18
[2025-11-02 02:28:47] L15 fecha:'16-04-25'->2025-04-16
[2025-11-02 02:28:47] L16 fecha:'23-08-25'->2025-08-23
[2025-11-02 02:28:47] L17 efectuada TRUE sin diagnóstico -> ERR
[2025-11-02 02:28:47] L18 fecha:'09-01-24'->2024-01-09 | diagnostico:'Hepatitis B'->'' (no efectuada)
[2025-11-02 02:28:47] L19 fecha:'12-02-24'->2024-02-12
[2025-11-02 02:28:47] L20 fecha:'27-07-24'->2024-07-27
[2025-11-02 02:28:47] L21 fecha:'27-09-24'->2024-09-27
[2025-11-02 02:28:47] L22 fecha:'25-10-24'->2024-10-25
[2025-11-02 02:28:47] L23 fecha:'01-07-25'->2025-07-01
[2025-11-02 02:28:47] L24 fecha:'02-04-25'->2025-04-02
[2025-11-02 02:28:47] L25 fecha:'05-06-24'->2024-06-05
[2025-11-02 02:28:47] L26 fecha:'18-08-24'->2024-08-18
[2025-11-02 02:28:47] L27 fecha:'30-03-25'->2025-03-30
[2025-11-02 02:28:47] L28 fecha:'30-01-25'->2025-01-30
[2025-11-02 02:28:47] L29 fecha:'13-07-24'->2024-07-13
[2025-11-02 02:28:47] L30 fecha:'16-01-25'->2025-01-16
[2025-11-02 02:28:47] L31 fecha:'14-12-24'->2024-12-14
[2025-11-02 02:28:47] L32 fecha:'12-11-24'->2024-11-12
[2025-11-02 02:28:47] L33 fecha:'05-07-25'->2025-07-05
[2025-11-02 02:28:47] L34 fecha:'12-12-24'->2024-12-12
[2025-11-02 02:28:47] L35 fecha:'19-06-24'->2024-06-19
[2025-11-02 02:28:47] L36 fecha:'02-03-24'->2024-03-02
[2025-11-02 02:28:47] L37 fecha:'08-04-24'->2024-04-08
[2025-11-02 02:28:47] L38 fecha:'29-09-24'->2024-09-29
[2025-11-02 02:28:47] L39 fecha:'31-10-24'->2024-10-31
[2025-11-02 02:28:47] L40 fecha:'18-06-25'->2025-06-18
[2025-11-02 02:28:47] L41 fecha:'02-04-25'->2025-04-02
[2025-11-02 02:28:47] L42 fecha:'22-01-24'->2024-01-22
[2025-11-02 02:28:47] L43 fecha:'16-03-24'->2024-03-16
[2025-11-02 02:28:47] L44 fecha:'24-03-25'->2025-03-24
[2025-11-02 02:28:47] L45 fecha:'06-08-24'->2024-08-06
[2025-11-02 02:28:47] L46 fecha:'06-04-24'->2024-04-06
[2025-11-02 02:28:47] L47 fecha inválida '' -> ERR
[2025-11-02 02:28:47] L48 fecha:'02-06-25'->2025-06-02
[2025-11-02 02:28:47] L49 fecha:'06-01-25'->2025-01-06
[2025-11-02 02:28:47] L50 fecha:'28-06-24'->2024-06-28
[2025-11-02 02:28:47] L51 fecha:'29-08-25'->2025-08-29
[2025-11-02 02:28:47] L52 fecha:'23-01-24'->2024-01-23
[2025-11-02 02:28:47] L53 fecha:'21-02-24'->2024-02-21
[2025-11-02 02:28:47] L54 fecha:'11-03-24'->2024-03-11
[2025-11-02 02:28:47] L55 fecha:'26-08-25'->2025-08-26
[2025-11-02 02:28:47] L56 fecha:'20-07-25'->2025-07-20
[2025-11-02 02:28:47] L57 fecha:'08-12-24'->2024-12-08
[2025-11-02 02:28:47] L58 fecha:'11-04-24'->2024-04-11
[2025-11-02 02:28:47] L59 fecha:'28-08-24'->2024-08-28
[2025-11-02 02:28:47] L60 fecha:'12-07-25'->2025-07-12
[2025-11-02 02:28:47] L61 fecha:'02-06-24'->2024-06-02
[2025-11-02 02:28:47] L62 fecha:'05-01-25'->2025-01-05
[2025-11-02 02:28:47] L63 fecha:'28-07-24'->2024-07-28
[2025-11-02 02:28:47] L64 fecha:'07-06-25'->2025-06-07
[2025-11-02 02:28:47] L65 sin ID -> ERR
[2025-11-02 02:28:47] L66 fecha:'06-06-25'->2025-06-06
[2025-11-02 02:28:47] L67 fecha:'08-10-24'->2024-10-08
[2025-11-02 02:28:47] L68 fecha:'17-03-25'->2025-03-17
[2025-11-02 02:28:47] L69 fecha:'15-03-25'->2025-03-15
[2025-11-02 02:28:47] L70 fecha:'08-06-24'->2024-06-08
[2025-11-02 02:28:47] L71 fecha:'19-10-24'->2024-10-19
[2025-11-02 02:28:47] L72 fecha:'19-07-24'->2024-07-19
[2025-11-02 02:28:47] L73 fecha:'17-03-25'->2025-03-17
[2025-11-02 02:28:47] L74 fecha:'20-07-24'->2024-07-20
[2025-11-02 02:28:47] L75 fecha:'26-10-24'->2024-10-26
[2025-11-02 02:28:47] L76 fecha:'16-07-24'->2024-07-16
[2025-11-02 02:28:47] L77 fecha:'02-01-25'->2025-01-02
[2025-11-02 02:28:47] L78 fecha:'03-08-24'->2024-08-03
[2025-11-02 02:28:47] L79 fecha:'16-05-24'->2024-05-16
[2025-11-02 02:28:47] L80 fecha:'26-04-24'->2024-04-26
[2025-11-02 02:28:47] L81 fecha:'02-02-24'->2024-02-02
[2025-11-02 02:28:47] L82 fecha:'21-10-24'->2024-10-21
[2025-11-02 02:28:47] L83 fecha:'17-10-24'->2024-10-17
[2025-11-02 02:28:47] L84 fecha:'05-07-24'->2024-07-05
[2025-11-02 02:28:47] L85 fecha:'28-03-25'->2025-03-28
[2025-11-02 02:28:47] L86 fecha:'30-10-24'->2024-10-30
[2025-11-02 02:28:47] L87 fecha:'13-07-25'->2025-07-13
[2025-11-02 02:28:47] L88 fecha:'24-07-25'->2025-07-24
[2025-11-02 02:28:47] L89 fecha:'17-05-24'->2024-05-17
[2025-11-02 02:28:47] L90 fecha:'19-01-24'->2024-01-19
[2025-11-02 02:28:47] L91 fecha:'11-07-25'->2025-07-11
[2025-11-02 02:28:47] L92 fecha:'16-05-24'->2024-05-16
[2025-11-02 02:28:47] L93 fecha:'20-02-24'->2024-02-20
[2025-11-02 02:28:47] L94 fecha:'04-02-24'->2024-02-04
[2025-11-02 02:28:47] L95 fecha:'18-06-24'->2024-06-18
[2025-11-02 02:28:47] L96 fecha:'18-04-24'->2024-04-18
[2025-11-02 02:28:47] L97 fecha:'22-07-25'->2025-07-22
[2025-11-02 02:28:47] L98 fecha:'17-05-24'->2024-05-17
[2025-11-02 02:28:47] L99 fecha:'17-01-24'->2024-01-17
[2025-11-02 02:28:47] L100 fecha:'01-10-24'->2024-10-01
[2025-11-02 02:28:47] L101 fecha:'16-10-24'->2024-10-16
[2025-11-02 02:28:47] L102 fecha:'01-04-24'->2024-04-01
[2025-11-02 02:28:47] L103 fecha:'16-08-25'->2025-08-16
[2025-11-02 02:28:47] L104 fecha:'06-01-25'->2025-01-06
[2025-11-02 02:28:47] L105 fecha:'26-08-25'->2025-08-26
[2025-11-02 02:28:47] L106 fecha:'16-01-24'->2024-01-16
[2025-11-02 02:28:47] L107 fecha:'07-03-25'->2025-03-07
[2025-11-02 02:28:47] L108 fecha:'11-02-25'->2025-02-11
[2025-11-02 02:28:47] L109 fecha:'21-05-24'->2024-05-21
[2025-11-02 02:28:47] L110 fecha:'27-10-24'->2024-10-27
[2025-11-02 02:28:47] L111 fecha:'01-05-25'->2025-05-01
[2025-11-02 02:28:47] L112 fecha:'15-05-24'->2024-05-15
[2025-11-02 02:28:47] L113 fecha:'02-07-24'->2024-07-02
[2025-11-02 02:28:47] L114 fecha:'12-12-24'->2024-12-12
[2025-11-02 02:28:47] L115 fecha:'21-03-25'->2025-03-21
[2025-11-02 02:28:47] L116 fecha:'19-06-25'->2025-06-19
[2025-11-02 02:28:47] L117 fecha:'13-07-24'->2024-07-13
[2025-11-02 02:28:47] L118 fecha:'05-09-24'->2024-09-05
[2025-11-02 02:28:47] L119 fecha:'12-07-24'->2024-07-12
[2025-11-02 02:28:47] L120 fecha:'20-07-25'->2025-07-20
[2025-11-02 02:28:47] L121 fecha:'24-01-25'->2025-01-24
[2025-11-02 02:28:47] L122 fecha:'10-08-24'->2024-08-10
[2025-11-02 02:28:47] L123 fecha:'06-03-25'->2025-03-06
[2025-11-02 02:28:47] L124 fecha:'19-05-24'->2024-05-19
[2025-11-02 02:28:47] L125 fecha:'01-02-25'->2025-02-01
[2025-11-02 02:28:47] L126 fecha:'20-10-24'->2024-10-20
[2025-11-02 02:28:47] L127 fecha:'02-06-25'->2025-06-02
[2025-11-02 02:28:47] L128 fecha:'03-08-24'->2024-08-03
[2025-11-02 02:28:47] L129 fecha:'18-06-24'->2024-06-18
[2025-11-02 02:28:47] L130 fecha:'17-12-24'->2024-12-17
[2025-11-02 02:28:47] L131 fecha:'29-03-24'->2024-03-29
[2025-11-02 02:28:47] L132 fecha:'12-04-24'->2024-04-12
[2025-11-02 02:28:47] L133 fecha:'06-12-24'->2024-12-06
[2025-11-02 02:28:47] L134 fecha:'30-12-24'->2024-12-30
[2025-11-02 02:28:47] L135 fecha:'26-03-24'->2024-03-26
[2025-11-02 02:28:47] L136 fecha:'28-01-24'->2024-01-28
[2025-11-02 02:28:47] L137 fecha:'25-11-24'->2024-11-25
[2025-11-02 02:28:47] L138 fecha:'23-01-25'->2025-01-23
[2025-11-02 02:28:47] L139 fecha:'25-10-24'->2024-10-25
[2025-11-02 02:28:47] L140 fecha:'14-03-25'->2025-03-14
[2025-11-02 02:28:47] L141 fecha:'27-11-24'->2024-11-27
[2025-11-02 02:28:47] L142 fecha:'26-07-25'->2025-07-26
[2025-11-02 02:28:47] L143 fecha:'21-11-24'->2024-11-21
[2025-11-02 02:28:47] L144 fecha:'31-01-25'->2025-01-31
[2025-11-02 02:28:47] L145 fecha:'31-05-25'->2025-05-31
[2025-11-02 02:28:47] L146 fecha:'09-01-24'->2024-01-09
[2025-11-02 02:28:47] L147 fecha:'12-04-24'->2024-04-12
[2025-11-02 02:28:47] L148 fecha:'04-02-24'->2024-02-04
[2025-11-02 02:28:47] L149 fecha:'30-08-24'->2024-08-30
[2025-11-02 02:28:47] L150 fecha:'15-12-24'->2024-12-15
[2025-11-02 02:28:47] L151 fecha:'02-03-25'->2025-03-02
[2025-11-02 02:28:47] L152 fecha:'11-11-24'->2024-11-11
[2025-11-02 02:28:47] L153 fecha:'16-05-25'->2025-05-16
[2025-11-02 02:28:47] L154 fecha:'08-01-25'->2025-01-08
[2025-11-02 02:28:47] L155 fecha:'05-10-24'->2024-10-05
[2025-11-02 02:28:47] L156 fecha:'30-01-24'->2024-01-30
[2025-11-02 02:28:47] L157 fecha:'14-08-24'->2024-08-14
[2025-11-02 02:28:47] L158 fecha:'23-02-24'->2024-02-23
[2025-11-02 02:28:47] L159 fecha:'27-11-24'->2024-11-27
[2025-11-02 02:28:47] L160 fecha:'23-09-24'->2024-09-23
[2025-11-02 02:28:47] L161 fecha:'05-03-24'->2024-03-05
[2025-11-02 02:28:47] L162 fecha:'26-08-25'->2025-08-26
[2025-11-02 02:28:47] L163 fecha:'08-07-25'->2025-07-08
[2025-11-02 02:28:47] L164 fecha:'18-06-24'->2024-06-18
[2025-11-02 02:28:47] L165 fecha:'25-06-24'->2024-06-25
[2025-11-02 02:28:47] L166 fecha:'29-08-25'->2025-08-29
[2025-11-02 02:28:47] L167 fecha:'23-02-25'->2025-02-23
[2025-11-02 02:28:47] L168 fecha:'21-04-25'->2025-04-21
[2025-11-02 02:28:47] L169 fecha:'16-04-24'->2024-04-16
[2025-11-02 02:28:47] L170 fecha:'24-04-25'->2025-04-24
[2025-11-02 02:28:47] L171 fecha:'06-01-25'->2025-01-06
[2025-11-02 02:28:47] L172 fecha:'20-03-25'->2025-03-20
[2025-11-02 02:28:47] L173 fecha:'22-04-25'->2025-04-22
[2025-11-02 02:28:47] L174 fecha:'22-11-24'->2024-11-22
[2025-11-02 02:28:47] L175 fecha:'04-01-25'->2025-01-04
[2025-11-02 02:28:47] L176 fecha:'05-02-24'->2024-02-05
[2025-11-02 02:28:47] L177 fecha:'12-06-24'->2024-06-12
[2025-11-02 02:28:47] L178 fecha:'11-09-24'->2024-09-11
[2025-11-02 02:28:47] L179 fecha:'30-04-25'->2025-04-30
[2025-11-02 02:28:47] L180 fecha:'07-04-25'->2025-04-07
[2025-11-02 02:28:47] L181 fecha:'30-06-24'->2024-06-30
[2025-11-02 02:28:47] L182 fecha:'13-08-25'->2025-08-13
[2025-11-02 02:28:47] L183 fecha:'05-06-24'->2024-06-05
[2025-11-02 02:28:47] L184 fecha:'03-11-24'->2024-11-03
[2025-11-02 02:28:47] L185 fecha:'27-04-24'->2024-04-27
[2025-11-02 02:28:47] L186 fecha:'20-08-24'->2024-08-20
[2025-11-02 02:28:47] L187 fecha:'23-07-25'->2025-07-23
[2025-11-02 02:28:47] L188 fecha:'04-08-24'->2024-08-04
[2025-11-02 02:28:47] L189 fecha:'21-07-24'->2024-07-21
[2025-11-02 02:28:47] L190 fecha:'26-01-24'->2024-01-26
[2025-11-02 02:28:47] L191 fecha:'21-06-24'->2024-06-21
[2025-11-02 02:28:47] L192 fecha:'13-06-25'->2025-06-13
[2025-11-02 02:28:47] L193 fecha:'09-10-24'->2024-10-09
[2025-11-02 02:28:47] L194 fecha:'11-02-25'->2025-02-11
[2025-11-02 02:28:47] L195 fecha:'23-08-24'->2024-08-23
[2025-11-02 02:28:47] L196 fecha:'27-07-24'->2024-07-27
[2025-11-02 02:28:47] L197 fecha:'02-05-24'->2024-05-02
[2025-11-02 02:28:47] L198 fecha:'13-04-25'->2025-04-13
[2025-11-02 02:28:47] L199 fecha:'25-02-24'->2024-02-25
[2025-11-02 02:28:47] L200 fecha:'28-03-24'->2024-03-28
[2025-11-02 02:28:47] L201 fecha:'26-02-24'->2024-02-26
[2025-11-02 02:28:47] L202 fecha:'23-05-25'->2025-05-23
[2025-11-02 02:28:47] L203 fecha:'03-03-24'->2024-03-03
[2025-11-02 02:28:47] L204 fecha:'16-05-25'->2025-05-16
[2025-11-02 02:28:47] L205 fecha:'21-05-24'->2024-05-21
[2025-11-02 02:28:47] L206 fecha:'04-02-24'->2024-02-04
[2025-11-02 02:28:47] L207 fecha:'27-09-24'->2024-09-27
[2025-11-02 02:28:47] L208 fecha:'03-04-24'->2024-04-03
[2025-11-02 02:28:47] L209 fecha:'07-07-25'->2025-07-07
[2025-11-02 02:28:47] L210 fecha:'06-06-24'->2024-06-06
[2025-11-02 02:28:47] L211 fecha:'18-09-24'->2024-09-18
[2025-11-02 02:28:47] L212 fecha:'25-10-24'->2024-10-25
[2025-11-02 02:28:47] L213 fecha:'19-04-25'->2025-04-19
[2025-11-02 02:28:47] L214 fecha:'29-07-24'->2024-07-29
[2025-11-02 02:28:47] L215 fecha:'25-07-25'->2025-07-25
[2025-11-02 02:28:47] L216 fecha:'06-01-25'->2025-01-06
[2025-11-02 02:28:47] L217 fecha:'17-05-24'->2024-05-17
[2025-11-02 02:28:47] L218 fecha:'08-12-24'->2024-12-08
[2025-11-02 02:28:47] L219 fecha:'28-01-25'->2025-01-28
[2025-11-02 02:28:47] L220 fecha:'03-08-24'->2024-08-03
[2025-11-02 02:28:47] L221 fecha:'15-03-25'->2025-03-15
[2025-11-02 02:28:47] L222 fecha:'24-06-25'->2025-06-24
[2025-11-02 02:28:47] L223 fecha:'11-07-24'->2024-07-11
[2025-11-02 02:28:47] L224 fecha:'19-06-24'->2024-06-19
[2025-11-02 02:28:47] L225 fecha:'13-02-25'->2025-02-13
[2025-11-02 02:28:47] L226 fecha:'19-10-24'->2024-10-19
[2025-11-02 02:28:47] L227 fecha:'27-05-25'->2025-05-27
[2025-11-02 02:28:47] L228 fecha:'19-07-24'->2024-07-19
[2025-11-02 02:28:47] L229 fecha:'08-05-24'->2024-05-08
[2025-11-02 02:28:47] L230 fecha:'30-06-25'->2025-06-30
[2025-11-02 02:28:47] L231 fecha:'26-08-24'->2024-08-26
[2025-11-02 02:28:47] L232 fecha:'07-08-24'->2024-08-07
[2025-11-02 02:28:47] L233 fecha:'28-03-25'->2025-03-28
[2025-11-02 02:28:47] L234 fecha:'14-03-24'->2024-03-14
[2025-11-02 02:28:47] L235 fecha:'22-10-24'->2024-10-22
[2025-11-02 02:28:47] L236 fecha:'17-02-24'->2024-02-17
[2025-11-02 02:28:47] L237 fecha:'01-04-24'->2024-04-01
[2025-11-02 02:28:47] L238 fecha:'19-10-24'->2024-10-19
[2025-11-02 02:28:47] L239 fecha:'02-06-25'->2025-06-02
[2025-11-02 02:28:47] L240 fecha:'23-03-25'->2025-03-23
[2025-11-02 02:28:47] L241 fecha:'27-06-25'->2025-06-27
[2025-11-02 02:28:47] L242 fecha:'07-11-24'->2024-11-07
[2025-11-02 02:28:47] L243 fecha:'06-04-24'->2024-04-06
[2025-11-02 02:28:47] L244 fecha:'12-05-25'->2025-05-12
[2025-11-02 02:28:47] L245 fecha:'21-11-24'->2024-11-21
[2025-11-02 02:28:47] L246 fecha:'27-06-24'->2024-06-27
[2025-11-02 02:28:47] L247 fecha:'26-06-24'->2024-06-26
[2025-11-02 02:28:47] L248 fecha:'21-06-24'->2024-06-21
[2025-11-02 02:28:47] L249 fecha:'06-11-24'->2024-11-06
[2025-11-02 02:28:47] L250 fecha:'12-09-24'->2024-09-12
[2025-11-02 02:28:47] L251 fecha:'08-06-24'->2024-06-08
[2025-11-02 02:28:47] L252 fecha:'30-01-24'->2024-01-30
[2025-11-02 02:28:47] L253 fecha:'23-06-25'->2025-06-23
[2025-11-02 02:28:47] L254 fecha:'08-03-24'->2024-03-08
[2025-11-02 02:28:47] L255 fecha:'09-06-25'->2025-06-09
[2025-11-02 02:28:47] L256 fecha:'25-05-25'->2025-05-25
[2025-11-02 02:28:47] L257 fecha:'25-01-24'->2024-01-25
[2025-11-02 02:28:47] L258 fecha:'25-04-25'->2025-04-25
[2025-11-02 02:28:47] L259 fecha:'05-06-24'->2024-06-05
[2025-11-02 02:28:47] L260 fecha:'12-03-24'->2024-03-12
[2025-11-02 02:28:47] L261 fecha:'16-01-24'->2024-01-16
[2025-11-02 02:28:47] L262 fecha:'19-11-24'->2024-11-19
[2025-11-02 02:28:47] L263 fecha:'29-05-24'->2024-05-29
[2025-11-02 02:28:47] L264 fecha:'04-04-24'->2024-04-04
[2025-11-02 02:28:47] L265 fecha:'08-06-24'->2024-06-08
[2025-11-02 02:28:47] L266 fecha:'18-12-24'->2024-12-18
[2025-11-02 02:28:47] L267 fecha:'28-03-25'->2025-03-28
[2025-11-02 02:28:47] L268 fecha:'23-05-24'->2024-05-23
[2025-11-02 02:28:47] L269 fecha:'25-10-24'->2024-10-25
[2025-11-02 02:28:47] L270 fecha:'16-06-24'->2024-06-16
[2025-11-02 02:28:47] L271 fecha:'16-05-25'->2025-05-16
[2025-11-02 02:28:47] L272 fecha:'21-06-24'->2024-06-21
[2025-11-02 02:28:47] L273 fecha:'27-05-25'->2025-05-27
[2025-11-02 02:28:47] L274 fecha:'13-04-25'->2025-04-13
[2025-11-02 02:28:47] L275 fecha:'24-08-25'->2025-08-24
[2025-11-02 02:28:47] L276 fecha:'27-05-25'->2025-05-27
[2025-11-02 02:28:47] L277 fecha:'15-03-25'->2025-03-15
[2025-11-02 02:28:47] L278 fecha:'22-05-25'->2025-05-22
[2025-11-02 02:28:47] L279 fecha:'09-03-25'->2025-03-09
[2025-11-02 02:28:47] L280 fecha:'06-07-24'->2024-07-06
[2025-11-02 02:28:47] L281 fecha:'01-02-25'->2025-02-01
[2025-11-02 02:28:47] L282 fecha:'04-10-24'->2024-10-04
[2025-11-02 02:28:47] L283 fecha:'30-11-24'->2024-11-30
[2025-11-02 02:28:47] L284 fecha:'15-12-24'->2024-12-15
[2025-11-02 02:28:47] L285 fecha:'09-01-25'->2025-01-09
[2025-11-02 02:28:47] L286 fecha:'01-07-25'->2025-07-01
[2025-11-02 02:28:47] L287 fecha:'16-06-25'->2025-06-16
[2025-11-02 02:28:47] L288 fecha:'03-02-24'->2024-02-03
[2025-11-02 02:28:47] L289 fecha:'19-02-25'->2025-02-19
[2025-11-02 02:28:47] L290 fecha:'27-10-24'->2024-10-27
[2025-11-02 02:28:47] L291 fecha:'31-10-24'->2024-10-31
[2025-11-02 02:28:47] L292 fecha:'31-07-24'->2024-07-31
[2025-11-02 02:28:47] L293 fecha:'07-07-25'->2025-07-07
[2025-11-02 02:28:47] L294 fecha:'01-11-24'->2024-11-01
[2025-11-02 02:28:47] L295 fecha:'04-02-25'->2025-02-04
[2025-11-02 02:28:47] L296 fecha:'26-02-24'->2024-02-26
[2025-11-02 02:28:47] L297 fecha:'24-03-25'->2025-03-24
[2025-11-02 02:28:47] L298 fecha:'10-03-25'->2025-03-10
[2025-11-02 02:28:47] L299 fecha:'17-08-24'->2024-08-17
[2025-11-02 02:28:47] L300 fecha:'11-09-24'->2024-09-11
[2025-11-02 02:28:47] L301 fecha:'18-03-25'->2025-03-18
[2025-11-02 02:28:47] L302 fecha:'31-12-24'->2024-12-31
[2025-11-02 02:28:47] L303 fecha:'26-05-24'->2024-05-26
[2025-11-02 02:28:47] L304 fecha:'11-08-25'->2025-08-11
[2025-11-02 02:28:47] L305 fecha:'21-05-25'->2025-05-21
[2025-11-02 02:28:47] L306 fecha:'16-06-24'->2024-06-16
[2025-11-02 02:28:47] L307 fecha:'10-02-25'->2025-02-10
[2025-11-02 02:28:47] L308 fecha:'22-02-25'->2025-02-22
[2025-11-02 02:28:47] L309 fecha:'07-11-24'->2024-11-07
[2025-11-02 02:28:47] L310 fecha:'01-01-24'->2024-01-01
[2025-11-02 02:28:47] L311 fecha:'04-03-25'->2025-03-04
[2025-11-02 02:28:47] L312 fecha:'08-11-24'->2024-11-08
[2025-11-02 02:28:47] L313 fecha:'16-12-24'->2024-12-16
[2025-11-02 02:28:47] L314 fecha:'13-01-25'->2025-01-13
[2025-11-02 02:28:47] L315 fecha:'16-06-25'->2025-06-16
[2025-11-02 02:28:47] L316 fecha:'04-07-25'->2025-07-04
[2025-11-02 02:28:47] L317 fecha:'11-04-24'->2024-04-11
[2025-11-02 02:28:47] L318 fecha:'17-05-25'->2025-05-17
[2025-11-02 02:28:47] L319 fecha:'31-08-24'->2024-08-31
[2025-11-02 02:28:47] L320 fecha:'07-11-24'->2024-11-07
[2025-11-02 02:28:47] L321 fecha:'11-03-24'->2024-03-11
[2025-11-02 02:28:47] L322 fecha:'22-10-24'->2024-10-22
[2025-11-02 02:28:47] L323 fecha:'01-11-24'->2024-11-01
[2025-11-02 02:28:47] L324 fecha:'16-06-25'->2025-06-16
[2025-11-02 02:28:47] L325 fecha:'20-04-24'->2024-04-20
[2025-11-02 02:28:47] L326 fecha:'16-07-24'->2024-07-16
[2025-11-02 02:28:47] L327 fecha:'06-07-25'->2025-07-06
[2025-11-02 02:28:47] L328 fecha:'27-05-24'->2024-05-27
[2025-11-02 02:28:47] L329 fecha:'21-05-24'->2024-05-21
[2025-11-02 02:28:47] L330 fecha:'26-11-24'->2024-11-26
[2025-11-02 02:28:47] L331 fecha:'24-02-24'->2024-02-24
[2025-11-02 02:28:47] L332 fecha:'25-05-25'->2025-05-25
[2025-11-02 02:28:47] L333 fecha:'25-01-24'->2024-01-25
[2025-11-02 02:28:47] L334 fecha:'17-11-24'->2024-11-17
[2025-11-02 02:28:47] L335 fecha:'05-02-24'->2024-02-05
[2025-11-02 02:28:47] L336 fecha:'02-11-24'->2024-11-02
[2025-11-02 02:28:47] L337 fecha:'18-06-25'->2025-06-18
[2025-11-02 02:28:47] L338 fecha:'20-05-25'->2025-05-20
[2025-11-02 02:28:47] L339 fecha:'07-05-24'->2024-05-07
[2025-11-02 02:28:47] L340 fecha:'01-09-24'->2024-09-01
[2025-11-02 02:28:47] L341 fecha:'06-02-24'->2024-02-06
[2025-11-02 02:28:47] L342 fecha:'23-05-24'->2024-05-23
[2025-11-02 02:28:47] L343 fecha:'15-08-25'->2025-08-15
[2025-11-02 02:28:47] L344 fecha:'10-12-24'->2024-12-10
[2025-11-02 02:28:47] L345 fecha:'23-02-25'->2025-02-23
[2025-11-02 02:28:47] L346 fecha:'04-08-25'->2025-08-04
[2025-11-02 02:28:47] L347 fecha:'17-02-24'->2024-02-17
[2025-11-02 02:28:47] L348 fecha:'09-05-24'->2024-05-09
[2025-11-02 02:28:47] L349 fecha:'30-10-24'->2024-10-30
[2025-11-02 02:28:47] L350 fecha:'14-02-25'->2025-02-14
[2025-11-02 02:28:47] L351 fecha:'14-05-25'->2025-05-14
[2025-11-02 02:28:47] L352 fecha:'29-09-24'->2024-09-29
[2025-11-02 02:28:47] L353 fecha:'23-01-24'->2024-01-23
[2025-11-02 02:28:47] L354 fecha:'17-06-24'->2024-06-17
[2025-11-02 02:28:47] L355 fecha:'05-02-25'->2025-02-05
[2025-11-02 02:28:47] L356 fecha:'29-10-24'->2024-10-29
[2025-11-02 02:28:47] L357 fecha:'10-08-25'->2025-08-10
[2025-11-02 02:28:47] L358 fecha:'11-10-24'->2024-10-11
[2025-11-02 02:28:47] L359 fecha:'11-01-25'->2025-01-11
[2025-11-02 02:28:47] L360 fecha:'02-07-24'->2024-07-02
[2025-11-02 02:28:47] L361 fecha:'31-12-24'->2024-12-31
[2025-11-02 02:28:47] L362 fecha:'16-01-25'->2025-01-16
[2025-11-02 02:28:47] L363 fecha:'26-08-25'->2025-08-26
[2025-11-02 02:28:47] L364 fecha:'19-03-24'->2024-03-19
[2025-11-02 02:28:47] L365 fecha:'08-06-25'->2025-06-08
[2025-11-02 02:28:47] L366 fecha:'28-10-24'->2024-10-28
[2025-11-02 02:28:47] L367 fecha:'05-06-24'->2024-06-05
[2025-11-02 02:28:47] L368 fecha:'19-08-24'->2024-08-19
[2025-11-02 02:28:47] L369 fecha:'04-08-24'->2024-08-04
[2025-11-02 02:28:47] L370 fecha:'15-04-24'->2024-04-15
[2025-11-02 02:28:47] L371 fecha:'25-07-24'->2024-07-25
[2025-11-02 02:28:47] L372 fecha:'20-04-25'->2025-04-20
[2025-11-02 02:28:47] L373 fecha:'26-12-24'->2024-12-26
[2025-11-02 02:28:47] L374 fecha:'04-04-24'->2024-04-04
[2025-11-02 02:28:47] L375 fecha:'10-12-24'->2024-12-10
[2025-11-02 02:28:47] L376 fecha:'25-03-25'->2025-03-25
[2025-11-02 02:28:47] L377 fecha:'14-12-24'->2024-12-14
[2025-11-02 02:28:47] L378 fecha:'16-06-24'->2024-06-16
[2025-11-02 02:28:47] L379 fecha:'04-05-24'->2024-05-04
[2025-11-02 02:28:47] L380 fecha:'08-01-24'->2024-01-08
[2025-11-02 02:28:47] L381 fecha:'15-03-24'->2024-03-15
[2025-11-02 02:28:47] L382 fecha:'25-03-25'->2025-03-25
[2025-11-02 02:28:47] L383 fecha:'30-04-24'->2024-04-30
[2025-11-02 02:28:47] L384 fecha:'11-07-25'->2025-07-11
[2025-11-02 02:28:47] L385 fecha:'25-05-25'->2025-05-25
[2025-11-02 02:28:47] L386 fecha:'24-10-24'->2024-10-24
[2025-11-02 02:28:47] L387 fecha:'01-01-25'->2025-01-01
[2025-11-02 02:28:47] L388 fecha:'09-04-24'->2024-04-09
[2025-11-02 02:28:47] L389 fecha:'04-04-25'->2025-04-04
[2025-11-02 02:28:47] L390 fecha:'01-05-25'->2025-05-01
[2025-11-02 02:28:47] L391 fecha:'07-07-25'->2025-07-07
[2025-11-02 02:28:47] L392 fecha:'27-02-24'->2024-02-27
[2025-11-02 02:28:47] L393 fecha:'20-03-25'->2025-03-20
[2025-11-02 02:28:47] L394 fecha:'21-02-24'->2024-02-21
[2025-11-02 02:28:47] L395 fecha:'12-07-25'->2025-07-12
[2025-11-02 02:28:47] L396 fecha:'17-06-24'->2024-06-17
[2025-11-02 02:28:47] L397 fecha:'27-06-25'->2025-06-27
[2025-11-02 02:28:47] L398 fecha:'22-05-25'->2025-05-22
[2025-11-02 02:28:47] L399 fecha:'11-02-24'->2024-02-11
[2025-11-02 02:28:47] L400 fecha:'25-04-24'->2024-04-25
[2025-11-02 02:28:47] L401 fecha:'09-01-25'->2025-01-09
[2025-11-02 02:28:47] L402 fecha:'30-03-25'->2025-03-30
[2025-11-02 02:28:47] L403 fecha:'11-03-25'->2025-03-11
[2025-11-02 02:28:47] L404 fecha:'30-03-25'->2025-03-30
[2025-11-02 02:28:47] L405 RUN paciente 621187-9 sin referencia -> ERR
[2025-11-02 02:28:47] L406 fecha:'14-06-25'->2025-06-14
[2025-11-02 02:28:47] L407 fecha:'10-01-25'->2025-01-10
[2025-11-02 02:28:47] L408 fecha:'02-04-24'->2024-04-02
[2025-11-02 02:28:47] L409 fecha:'15-06-25'->2025-06-15
[2025-11-02 02:28:47] L410 fecha:'14-07-24'->2024-07-14
[2025-11-02 02:28:47] L411 fecha:'09-11-24'->2024-11-09
[2025-11-02 02:28:47] L412 fecha:'26-04-24'->2024-04-26
[2025-11-02 02:28:47] L413 fecha:'27-02-25'->2025-02-27
[2025-11-02 02:28:47] L414 fecha:'25-02-25'->2025-02-25
[2025-11-02 02:28:47] L415 fecha:'31-07-25'->2025-07-31
[2025-11-02 02:28:47] L416 fecha:'02-04-25'->2025-04-02
[2025-11-02 02:28:47] L417 fecha:'11-09-24'->2024-09-11
[2025-11-02 02:28:47] L418 fecha:'14-08-24'->2024-08-14
[2025-11-02 02:28:47] L419 fecha:'13-02-25'->2025-02-13
[2025-11-02 02:28:47] L420 fecha:'14-11-24'->2024-11-14
[2025-11-02 02:28:47] L421 fecha:'30-06-24'->2024-06-30
[2025-11-02 02:28:47] L422 fecha:'08-07-25'->2025-07-08
[2025-11-02 02:28:47] L423 fecha:'30-10-24'->2024-10-30
[2025-11-02 02:28:47] L424 fecha:'12-04-24'->2024-04-12
[2025-11-02 02:28:47] L425 fecha:'19-08-24'->2024-08-19
[2025-11-02 02:28:47] L426 fecha:'25-03-25'->2025-03-25
[2025-11-02 02:28:47] L427 fecha:'04-05-25'->2025-05-04
[2025-11-02 02:28:47] L428 fecha:'17-06-25'->2025-06-17
[2025-11-02 02:28:47] L429 fecha:'17-02-24'->2024-02-17
[2025-11-02 02:28:47] L430 fecha:'07-03-25'->2025-03-07
[2025-11-02 02:28:47] L431 fecha:'12-07-24'->2024-07-12
[2025-11-02 02:28:47] L432 fecha:'19-11-24'->2024-11-19
[2025-11-02 02:28:47] L433 fecha:'23-05-24'->2024-05-23
[2025-11-02 02:28:47] L434 fecha:'26-10-24'->2024-10-26
[2025-11-02 02:28:47] L435 fecha:'17-09-24'->2024-09-17
[2025-11-02 02:28:47] L436 fecha:'18-04-24'->2024-04-18
[2025-11-02 02:28:47] L437 fecha:'29-02-24'->2024-02-29
[2025-11-02 02:28:47] L438 fecha:'16-03-25'->2025-03-16
[2025-11-02 02:28:47] L439 fecha:'20-02-24'->2024-02-20
[2025-11-02 02:28:47] L440 fecha:'27-09-24'->2024-09-27
[2025-11-02 02:28:47] L441 fecha:'20-08-24'->2024-08-20
[2025-11-02 02:28:47] L442 fecha:'30-08-24'->2024-08-30
[2025-11-02 02:28:47] L443 fecha:'21-09-24'->2024-09-21
[2025-11-02 02:28:47] L444 fecha:'02-08-25'->2025-08-02
[2025-11-02 02:28:47] L445 fecha:'12-05-24'->2024-05-12
[2025-11-02 02:28:47] L446 fecha:'14-04-25'->2025-04-14
[2025-11-02 02:28:47] L447 fecha:'15-08-25'->2025-08-15
[2025-11-02 02:28:47] L448 fecha:'23-06-24'->2024-06-23
[2025-11-02 02:28:47] L449 fecha:'05-04-24'->2024-04-05
[2025-11-02 02:28:47] L450 fecha:'01-05-24'->2024-05-01
[2025-11-02 02:28:47] L451 fecha:'13-09-24'->2024-09-13
[2025-11-02 02:28:47] L452 fecha:'11-09-24'->2024-09-11
[2025-11-02 02:28:47] L453 fecha:'19-06-24'->2024-06-19
[2025-11-02 02:28:47] L454 fecha:'16-05-24'->2024-05-16
[2025-11-02 02:28:47] L455 fecha:'21-05-24'->2024-05-21
[2025-11-02 02:28:47] L456 fecha:'17-10-24'->2024-10-17
[2025-11-02 02:28:47] L457 fecha:'18-04-25'->2025-04-18
[2025-11-02 02:28:47] L458 fecha:'13-02-25'->2025-02-13
[2025-11-02 02:28:47] L459 fecha:'21-12-24'->2024-12-21
[2025-11-02 02:28:47] L460 fecha:'15-04-24'->2024-04-15
[2025-11-02 02:28:47] L461 fecha:'14-05-24'->2024-05-14
[2025-11-02 02:28:47] L462 fecha:'31-03-24'->2024-03-31
[2025-11-02 02:28:47] L463 fecha:'06-07-25'->2025-07-06
[2025-11-02 02:28:47] L464 fecha:'01-03-24'->2024-03-01
[2025-11-02 02:28:47] L465 fecha:'18-03-25'->2025-03-18
[2025-11-02 02:28:47] L466 fecha:'15-05-25'->2025-05-15
[2025-11-02 02:28:47] L467 fecha:'03-01-25'->2025-01-03
[2025-11-02 02:28:47] L468 fecha:'13-08-25'->2025-08-13
[2025-11-02 02:28:47] L469 fecha:'08-12-24'->2024-12-08
[2025-11-02 02:28:47] L470 fecha:'17-08-25'->2025-08-17
[2025-11-02 02:28:47] L471 fecha:'24-03-25'->2025-03-24
[2025-11-02 02:28:47] L472 fecha:'14-11-24'->2024-11-14
[2025-11-02 02:28:47] L473 fecha:'04-01-24'->2024-01-04
[2025-11-02 02:28:47] L474 fecha:'22-08-24'->2024-08-22
[2025-11-02 02:28:47] L475 fecha:'03-01-25'->2025-01-03
[2025-11-02 02:28:47] L476 fecha:'25-01-25'->2025-01-25
[2025-11-02 02:28:47] L477 fecha:'09-03-24'->2024-03-09
[2025-11-02 02:28:47] L478 fecha:'01-02-25'->2025-02-01
[2025-11-02 02:28:47] L479 fecha:'04-10-24'->2024-10-04
[2025-11-02 02:28:47] L480 fecha:'05-05-25'->2025-05-05
[2025-11-02 02:28:47] L481 fecha:'24-08-25'->2025-08-24
[2025-11-02 02:28:47] L482 fecha:'22-01-24'->2024-01-22
[2025-11-02 02:28:47] L483 fecha:'14-01-24'->2024-01-14
[2025-11-02 02:28:47] L484 fecha:'19-07-25'->2025-07-19
[2025-11-02 02:28:47] L485 fecha:'09-08-24'->2024-08-09
[2025-11-02 02:28:47] L486 fecha:'19-01-25'->2025-01-19
[2025-11-02 02:28:47] L487 fecha:'20-09-24'->2024-09-20
[2025-11-02 02:28:47] L488 fecha:'13-06-24'->2024-06-13
[2025-11-02 02:28:47] L489 fecha:'23-04-25'->2025-04-23
[2025-11-02 02:28:47] L490 fecha:'12-08-24'->2024-08-12
[2025-11-02 02:28:47] L491 fecha:'11-07-24'->2024-07-11
[2025-11-02 02:28:47] L492 fecha:'03-03-24'->2024-03-03
[2025-11-02 02:28:47] L493 fecha:'04-05-25'->2025-05-04
[2025-11-02 02:28:47] L494 fecha:'13-09-24'->2024-09-13
[2025-11-02 02:28:47] L495 fecha:'21-02-24'->2024-02-21
[2025-11-02 02:28:47] L496 fecha:'23-08-24'->2024-08-23
[2025-11-02 02:28:47] L497 fecha:'18-11-24'->2024-11-18
[2025-11-02 02:28:47] L498 fecha:'10-06-24'->2024-06-10
[2025-11-02 02:28:47] L499 fecha:'01-01-25'->2025-01-01
[2025-11-02 02:28:47] L500 fecha:'25-05-24'->2024-05-25
[2025-11-02 02:28:47] L501 fecha:'24-10-24'->2024-10-24
[2025-11-02 02:28:47] L502 fecha:'14-03-24'->2024-03-14
[2025-11-02 02:28:47] L503 fecha:'19-05-25'->2025-05-19
[2025-11-02 02:28:47] L504 fecha:'25-06-25'->2025-06-25
[2025-11-02 02:28:47] L505 fecha:'05-04-25'->2025-04-05
[2025-11-02 02:28:47] L506 fecha:'11-07-24'->2024-07-11
[2025-11-02 02:28:47] L507 fecha:'10-03-24'->2024-03-10
[2025-11-02 02:28:47] L508 fecha:'06-07-25'->2025-07-06
[2025-11-02 02:28:47] L509 fecha:'15-01-25'->2025-01-15
[2025-11-02 02:28:47] L510 fecha:'15-07-24'->2024-07-15
[2025-11-02 02:28:47] L511 fecha:'02-01-24'->2024-01-02
[2025-11-02 02:28:47] L512 fecha:'20-04-25'->2025-04-20
[2025-11-02 02:28:47] L513 fecha:'23-01-25'->2025-01-23
[2025-11-02 02:28:47] L514 fecha:'25-01-25'->2025-01-25
[2025-11-02 02:28:47] L515 fecha:'01-06-25'->2025-06-01
[2025-11-02 02:28:47] L516 fecha:'08-05-24'->2024-05-08
[2025-11-02 02:28:47] L517 fecha:'25-10-24'->2024-10-25
[2025-11-02 02:28:47] L518 fecha:'11-07-24'->2024-07-11
[2025-11-02 02:28:47] L519 fecha:'05-06-24'->2024-06-05
[2025-11-02 02:28:47] L520 fecha:'04-06-24'->2024-06-04
[2025-11-02 02:28:47] L521 fecha:'16-07-25'->2025-07-16
[2025-11-02 02:28:47] L522 fecha:'15-05-24'->2024-05-15
[2025-11-02 02:28:47] L523 fecha:'24-07-25'->2025-07-24
[2025-11-02 02:28:47] L524 fecha:'29-08-24'->2024-08-29
[2025-11-02 02:28:47] L525 fecha:'29-07-24'->2024-07-29
[2025-11-02 02:28:47] L526 fecha:'29-08-24'->2024-08-29
[2025-11-02 02:28:47] L527 fecha:'12-10-24'->2024-10-12
[2025-11-02 02:28:47] L528 fecha:'21-12-24'->2024-12-21
[2025-11-02 02:28:47] L529 fecha:'06-10-24'->2024-10-06
[2025-11-02 02:28:47] L530 fecha:'11-02-24'->2024-02-11
[2025-11-02 02:28:47] L531 fecha:'09-01-24'->2024-01-09
[2025-11-02 02:28:47] L532 fecha:'23-07-24'->2024-07-23
[2025-11-02 02:28:47] L533 fecha:'30-05-25'->2025-05-30
[2025-11-02 02:28:47] L534 fecha:'23-06-24'->2024-06-23
[2025-11-02 02:28:47] L535 fecha:'07-07-25'->2025-07-07
[2025-11-02 02:28:47] L536 fecha:'28-05-24'->2024-05-28
[2025-11-02 02:28:47] L537 fecha:'05-03-24'->2024-03-05
[2025-11-02 02:28:47] L538 fecha:'13-05-25'->2025-05-13
[2025-11-02 02:28:47] L539 fecha:'04-03-25'->2025-03-04
[2025-11-02 02:28:47] L540 fecha:'18-06-25'->2025-06-18
[2025-11-02 02:28:47] L541 fecha:'26-09-24'->2024-09-26
[2025-11-02 02:28:47] L542 fecha:'16-06-25'->2025-06-16
[2025-11-02 02:28:47] L543 fecha:'24-03-25'->2025-03-24
[2025-11-02 02:28:47] L544 fecha:'09-10-24'->2024-10-09
[2025-11-02 02:28:47] L545 fecha:'04-05-25'->2025-05-04
[2025-11-02 02:28:47] L546 fecha:'21-05-24'->2024-05-21
[2025-11-02 02:28:47] L547 fecha:'15-08-24'->2024-08-15
[2025-11-02 02:28:47] L548 fecha:'27-06-25'->2025-06-27
[2025-11-02 02:28:47] L549 fecha:'08-05-24'->2024-05-08
[2025-11-02 02:28:47] L550 fecha:'18-07-25'->2025-07-18
[2025-11-02 02:28:47] L551 fecha:'19-01-25'->2025-01-19
[2025-11-02 02:28:47] L552 fecha:'19-03-24'->2024-03-19
[2025-11-02 02:28:47] L553 fecha:'18-05-25'->2025-05-18
[2025-11-02 02:28:47] L554 fecha:'12-07-24'->2024-07-12
[2025-11-02 02:28:47] L555 fecha:'05-12-24'->2024-12-05
[2025-11-02 02:28:47] L556 fecha:'06-07-24'->2024-07-06
[2025-11-02 02:28:47] L557 RUN paciente 802322-0 sin referencia -> ERR
[2025-11-02 02:28:47] L558 fecha:'04-04-25'->2025-04-04
[2025-11-02 02:28:47] L559 fecha:'19-08-24'->2024-08-19
[2025-11-02 02:28:47] L560 fecha:'25-01-24'->2024-01-25
[2025-11-02 02:28:47] L561 fecha:'11-05-24'->2024-05-11
[2025-11-02 02:28:47] L562 fecha:'21-10-24'->2024-10-21
[2025-11-02 02:28:47] L563 fecha:'01-07-25'->2025-07-01
[2025-11-02 02:28:47] L564 fecha:'20-09-24'->2024-09-20
[2025-11-02 02:28:47] L565 fecha:'26-08-24'->2024-08-26
[2025-11-02 02:28:47] L566 fecha:'26-08-25'->2025-08-26
[2025-11-02 02:28:47] L567 fecha:'21-04-25'->2025-04-21
[2025-11-02 02:28:47] L568 fecha:'17-08-24'->2024-08-17
[2025-11-02 02:28:47] L569 fecha:'21-08-24'->2024-08-21
[2025-11-02 02:28:47] L570 fecha:'15-06-25'->2025-06-15
[2025-11-02 02:28:47] L571 fecha:'17-08-24'->2024-08-17
[2025-11-02 02:28:47] L572 fecha:'10-08-24'->2024-08-10
[2025-11-02 02:28:47] L573 fecha:'24-04-24'->2024-04-24
[2025-11-02 02:28:47] L574 fecha:'05-08-25'->2025-08-05
[2025-11-02 02:28:47] L575 fecha:'15-08-24'->2024-08-15
[2025-11-02 02:28:47] L576 fecha:'13-07-24'->2024-07-13
[2025-11-02 02:28:47] L577 fecha:'08-01-25'->2025-01-08
[2025-11-02 02:28:47] L578 fecha:'31-10-24'->2024-10-31
[2025-11-02 02:28:47] L579 fecha:'06-05-25'->2025-05-06
[2025-11-02 02:28:47] L580 fecha:'28-01-25'->2025-01-28
[2025-11-02 02:28:47] L581 fecha:'13-11-24'->2024-11-13
[2025-11-02 02:28:47] L582 fecha:'24-05-25'->2025-05-24
[2025-11-02 02:28:47] L583 fecha:'30-09-24'->2024-09-30
[2025-11-02 02:28:47] L584 fecha:'30-01-25'->2025-01-30
[2025-11-02 02:28:47] L585 fecha:'14-12-24'->2024-12-14
[2025-11-02 02:28:47] L586 fecha:'02-06-24'->2024-06-02
[2025-11-02 02:28:47] L587 fecha:'31-07-24'->2024-07-31
[2025-11-02 02:28:47] L588 fecha:'08-05-25'->2025-05-08
[2025-11-02 02:28:47] L589 fecha:'12-06-25'->2025-06-12
[2025-11-02 02:28:47] L590 fecha:'05-06-25'->2025-06-05
[2025-11-02 02:28:47] L591 fecha:'28-08-25'->2025-08-28
[2025-11-02 02:28:47] L592 fecha:'04-02-24'->2024-02-04
[2025-11-02 02:28:47] L593 fecha:'14-07-25'->2025-07-14
[2025-11-02 02:28:47] L594 fecha:'01-10-24'->2024-10-01
[2025-11-02 02:28:47] L595 fecha:'08-01-25'->2025-01-08
[2025-11-02 02:28:47] L596 fecha:'23-07-24'->2024-07-23
[2025-11-02 02:28:47] L597 fecha:'08-09-24'->2024-09-08
[2025-11-02 02:28:47] L598 fecha:'12-04-24'->2024-04-12
[2025-11-02 02:28:47] L599 fecha:'11-02-24'->2024-02-11
[2025-11-02 02:28:47] L600 fecha:'12-04-24'->2024-04-12
[2025-11-02 02:28:47] L601 fecha:'11-06-24'->2024-06-11
[2025-11-02 02:28:47] L602 fecha:'22-06-24'->2024-06-22
[2025-11-02 02:28:47] L603 fecha:'28-04-24'->2024-04-28
[2025-11-02 02:28:47] L604 fecha:'25-07-25'->2025-07-25
[2025-11-02 02:28:47] L605 fecha:'10-04-24'->2024-04-10
[2025-11-02 02:28:47] L606 fecha:'25-05-24'->2024-05-25
[2025-11-02 02:28:47] L607 fecha:'11-06-25'->2025-06-11
[2025-11-02 02:28:47] L608 fecha:'03-04-25'->2025-04-03
[2025-11-02 02:28:47] L609 fecha:'02-07-24'->2024-07-02
[2025-11-02 02:28:47] L610 fecha:'22-01-24'->2024-01-22
[2025-11-02 02:28:47] L611 fecha:'02-05-25'->2025-05-02
[2025-11-02 02:28:47] L612 fecha:'11-08-25'->2025-08-11
[2025-11-02 02:28:47] L613 fecha:'23-07-25'->2025-07-23
[2025-11-02 02:28:47] L614 fecha:'13-05-25'->2025-05-13
[2025-11-02 02:28:47] L615 fecha:'15-06-25'->2025-06-15
[2025-11-02 02:28:47] L616 fecha:'24-08-25'->2025-08-24
[2025-11-02 02:28:47] L617 fecha:'30-05-25'->2025-05-30
[2025-11-02 02:28:47] L618 fecha:'20-06-24'->2024-06-20
[2025-11-02 02:28:47] L619 fecha:'19-11-24'->2024-11-19
[2025-11-02 02:28:47] L620 fecha:'06-12-24'->2024-12-06
[2025-11-02 02:28:47] L621 fecha:'08-12-24'->2024-12-08
[2025-11-02 02:28:47] L622 fecha:'09-07-25'->2025-07-09
[2025-11-02 02:28:47] L623 fecha:'05-01-24'->2024-01-05
[2025-11-02 02:28:47] L624 fecha:'13-03-24'->2024-03-13
[2025-11-02 02:28:47] L625 fecha:'12-07-25'->2025-07-12
[2025-11-02 02:28:47] L626 fecha:'04-02-24'->2024-02-04
[2025-11-02 02:28:47] L627 fecha:'20-07-24'->2024-07-20
[2025-11-02 02:28:47] L628 fecha:'27-03-24'->2024-03-27
[2025-11-02 02:28:47] L629 fecha:'20-08-24'->2024-08-20
[2025-11-02 02:28:47] L630 fecha:'06-08-24'->2024-08-06
[2025-11-02 02:28:47] L631 fecha:'19-02-25'->2025-02-19
[2025-11-02 02:28:47] L632 fecha:'04-06-25'->2025-06-04
[2025-11-02 02:28:47] L633 fecha:'11-07-25'->2025-07-11
[2025-11-02 02:28:47] L634 fecha:'09-10-24'->2024-10-09
[2025-11-02 02:28:47] L635 fecha:'04-05-25'->2025-05-04
[2025-11-02 02:28:47] L636 fecha:'21-04-24'->2024-04-21
[2025-11-02 02:28:47] L637 fecha:'24-04-24'->2024-04-24
[2025-11-02 02:28:47] L638 fecha:'17-07-25'->2025-07-17
[2025-11-02 02:28:47] L639 fecha:'21-09-24'->2024-09-21
[2025-11-02 02:28:47] L640 fecha:'04-07-24'->2024-07-04
[2025-11-02 02:28:47] L641 fecha:'28-12-24'->2024-12-28
[2025-11-02 02:28:47] L642 fecha:'08-02-25'->2025-02-08
[2025-11-02 02:28:47] L643 fecha:'02-11-24'->2024-11-02
[2025-11-02 02:28:47] L644 fecha:'30-05-25'->2025-05-30
[2025-11-02 02:28:47] L645 fecha:'17-04-24'->2024-04-17
[2025-11-02 02:28:47] L646 fecha:'08-05-24'->2024-05-08
[2025-11-02 02:28:47] L647 fecha:'29-11-24'->2024-11-29
[2025-11-02 02:28:47] L648 fecha:'15-07-25'->2025-07-15
[2025-11-02 02:28:47] L649 fecha:'16-12-24'->2024-12-16
[2025-11-02 02:28:47] L650 fecha:'03-12-24'->2024-12-03
[2025-11-02 02:28:47] L651 fecha:'19-07-24'->2024-07-19
[2025-11-02 02:28:47] L652 fecha:'30-05-24'->2024-05-30
[2025-11-02 02:28:47] L653 fecha:'20-06-24'->2024-06-20
[2025-11-02 02:28:47] L654 fecha:'04-01-25'->2025-01-04
[2025-11-02 02:28:47] L655 fecha:'02-09-24'->2024-09-02
[2025-11-02 02:28:47] L656 fecha:'22-07-24'->2024-07-22
[2025-11-02 02:28:47] L657 fecha:'10-06-24'->2024-06-10
[2025-11-02 02:28:47] L658 fecha:'26-02-25'->2025-02-26
[2025-11-02 02:28:47] L659 fecha:'27-02-25'->2025-02-27
[2025-11-02 02:28:47] L660 fecha:'24-06-25'->2025-06-24
[2025-11-02 02:28:47] L661 fecha:'03-07-24'->2024-07-03
[2025-11-02 02:28:47] L662 fecha:'02-06-24'->2024-06-02
[2025-11-02 02:28:47] L663 fecha:'31-07-25'->2025-07-31
[2025-11-02 02:28:47] L664 fecha:'08-02-24'->2024-02-08
[2025-11-02 02:28:47] L665 fecha:'10-07-25'->2025-07-10
[2025-11-02 02:28:47] L666 fecha:'23-11-24'->2024-11-23
[2025-11-02 02:28:47] L667 fecha:'21-02-24'->2024-02-21
[2025-11-02 02:28:47] L668 fecha:'14-05-24'->2024-05-14
[2025-11-02 02:28:47] L669 fecha:'26-06-24'->2024-06-26
[2025-11-02 02:28:47] L670 fecha:'25-05-24'->2024-05-25
[2025-11-02 02:28:47] L671 fecha:'18-07-24'->2024-07-18
[2025-11-02 02:28:47] L672 fecha:'12-03-24'->2024-03-12
[2025-11-02 02:28:47] L673 fecha:'03-04-25'->2025-04-03
[2025-11-02 02:28:47] L674 fecha:'03-11-24'->2024-11-03
[2025-11-02 02:28:47] L675 fecha:'01-08-24'->2024-08-01
[2025-11-02 02:28:47] L676 fecha:'16-11-24'->2024-11-16
[2025-11-02 02:28:47] L677 fecha:'18-10-24'->2024-10-18
[2025-11-02 02:28:47] L678 fecha:'19-07-24'->2024-07-19
[2025-11-02 02:28:47] L679 fecha:'27-06-24'->2024-06-27
[2025-11-02 02:28:47] L680 fecha:'08-12-24'->2024-12-08
[2025-11-02 02:28:47] L681 fecha:'17-09-24'->2024-09-17
[2025-11-02 02:28:47] L682 fecha:'20-11-24'->2024-11-20
[2025-11-02 02:28:47] L683 fecha:'05-02-25'->2025-02-05
[2025-11-02 02:28:47] L684 fecha:'03-05-24'->2024-05-03
[2025-11-02 02:28:47] L685 fecha:'15-02-25'->2025-02-15
[2025-11-02 02:28:47] L686 fecha:'20-08-24'->2024-08-20
[2025-11-02 02:28:47] L687 fecha:'02-08-25'->2025-08-02
[2025-11-02 02:28:47] L688 fecha:'17-10-24'->2024-10-17
[2025-11-02 02:28:47] L689 fecha:'02-07-24'->2024-07-02
[2025-11-02 02:28:47] L690 fecha:'19-03-25'->2025-03-19
[2025-11-02 02:28:47] L691 fecha:'04-12-24'->2024-12-04
[2025-11-02 02:28:47] L692 fecha:'05-01-25'->2025-01-05
[2025-11-02 02:28:47] L693 fecha:'24-10-24'->2024-10-24
[2025-11-02 02:28:47] L694 fecha:'07-04-24'->2024-04-07
[2025-11-02 02:28:47] L695 fecha:'14-01-25'->2025-01-14
[2025-11-02 02:28:47] L696 fecha:'30-07-25'->2025-07-30
[2025-11-02 02:28:47] L697 fecha:'18-04-24'->2024-04-18
[2025-11-02 02:28:47] L698 fecha:'05-06-24'->2024-06-05
[2025-11-02 02:28:47] L699 fecha:'13-09-24'->2024-09-13
[2025-11-02 02:28:47] L700 fecha:'09-03-25'->2025-03-09
[2025-11-02 02:28:47] L701 fecha:'25-01-25'->2025-01-25
[2025-11-02 02:28:47] L702 fecha:'27-11-24'->2024-11-27
[2025-11-02 02:28:47] L703 fecha:'28-09-24'->2024-09-28
[2025-11-02 02:28:47] L704 fecha:'23-06-25'->2025-06-23
[2025-11-02 02:28:47] L705 fecha:'16-08-24'->2024-08-16
[2025-11-02 02:28:47] L706 fecha:'22-01-25'->2025-01-22
[2025-11-02 02:28:47] L707 fecha:'22-09-24'->2024-09-22
[2025-11-02 02:28:47] L708 fecha:'31-08-24'->2024-08-31
[2025-11-02 02:28:47] L709 fecha:'31-01-24'->2024-01-31
[2025-11-02 02:28:47] L710 fecha:'30-09-24'->2024-09-30
[2025-11-02 02:28:47] L711 fecha:'15-11-24'->2024-11-15
[2025-11-02 02:28:47] L712 fecha:'24-06-25'->2025-06-24
[2025-11-02 02:28:47] L713 fecha:'04-10-24'->2024-10-04
[2025-11-02 02:28:47] L714 fecha:'02-04-24'->2024-04-02
[2025-11-02 02:28:47] L715 fecha:'23-11-24'->2024-11-23
[2025-11-02 02:28:47] L716 fecha:'24-03-24'->2024-03-24
[2025-11-02 02:28:47] L717 fecha:'14-10-24'->2024-10-14
[2025-11-02 02:28:47] L718 fecha:'10-01-24'->2024-01-10
[2025-11-02 02:28:47] L719 fecha:'05-02-25'->2025-02-05
[2025-11-02 02:28:47] L720 fecha:'14-01-24'->2024-01-14
[2025-11-02 02:28:47] L721 fecha:'15-04-24'->2024-04-15
[2025-11-02 02:28:47] L722 fecha:'02-07-24'->2024-07-02
[2025-11-02 02:28:47] L723 fecha:'24-02-24'->2024-02-24
[2025-11-02 02:28:47] L724 fecha:'19-07-24'->2024-07-19
[2025-11-02 02:28:47] L725 fecha:'24-01-24'->2024-01-24
[2025-11-02 02:28:47] L726 fecha:'27-10-24'->2024-10-27
[2025-11-02 02:28:47] L727 fecha:'17-07-25'->2025-07-17
[2025-11-02 02:28:47] L728 fecha:'05-07-24'->2024-07-05
[2025-11-02 02:28:47] L729 fecha:'21-03-25'->2025-03-21
[2025-11-02 02:28:47] L730 fecha:'03-07-24'->2024-07-03
[2025-11-02 02:28:47] L731 fecha:'10-10-24'->2024-10-10
[2025-11-02 02:28:47] L732 fecha:'31-01-25'->2025-01-31
[2025-11-02 02:28:47] L733 fecha:'16-02-25'->2025-02-16
[2025-11-02 02:28:47] L734 fecha:'12-02-25'->2025-02-12
[2025-11-02 02:28:47] L735 fecha:'21-10-24'->2024-10-21
[2025-11-02 02:28:47] L736 fecha:'12-03-24'->2024-03-12
[2025-11-02 02:28:47] L737 fecha:'30-06-25'->2025-06-30
[2025-11-02 02:28:47] L738 fecha:'26-05-25'->2025-05-26
[2025-11-02 02:28:47] L739 fecha:'06-07-25'->2025-07-06
[2025-11-02 02:28:47] L740 fecha:'06-10-24'->2024-10-06
[2025-11-02 02:28:47] L741 fecha:'26-01-25'->2025-01-26
[2025-11-02 02:28:47] L742 fecha:'05-05-25'->2025-05-05
[2025-11-02 02:28:47] L743 fecha:'06-08-24'->2024-08-06
[2025-11-02 02:28:47] L744 fecha:'18-02-24'->2024-02-18
[2025-11-02 02:28:47] L745 fecha:'20-09-24'->2024-09-20
[2025-11-02 02:28:47] L746 fecha:'26-01-25'->2025-01-26
[2025-11-02 02:28:47] L747 fecha:'19-06-25'->2025-06-19
[2025-11-02 02:28:47] L748 fecha:'27-01-24'->2024-01-27
[2025-11-02 02:28:47] L749 fecha:'01-08-25'->2025-08-01
[2025-11-02 02:28:47] L750 fecha:'07-04-24'->2024-04-07
[2025-11-02 02:28:47] L751 fecha:'19-04-24'->2024-04-19
[2025-11-02 02:28:47] L752 fecha:'01-06-24'->2024-06-01
[2025-11-02 02:28:47] L753 fecha:'16-11-24'->2024-11-16
[2025-11-02 02:28:47] L754 fecha:'11-05-24'->2024-05-11
[2025-11-02 02:28:47] L755 fecha:'14-02-25'->2025-02-14
[2025-11-02 02:28:47] L756 fecha:'30-03-25'->2025-03-30
[2025-11-02 02:28:47] L757 fecha:'06-11-24'->2024-11-06
[2025-11-02 02:28:47] L758 fecha:'05-02-25'->2025-02-05
[2025-11-02 02:28:47] L759 fecha:'11-10-24'->2024-10-11
[2025-11-02 02:28:47] L760 fecha:'20-05-25'->2025-05-20
[2025-11-02 02:28:47] L761 fecha:'11-02-24'->2024-02-11
[2025-11-02 02:28:47] L762 fecha:'29-05-24'->2024-05-29
[2025-11-02 02:28:47] L763 fecha:'16-09-24'->2024-09-16
[2025-11-02 02:28:47] L764 fecha:'28-06-25'->2025-06-28
[2025-11-02 02:28:47] L765 fecha:'19-09-24'->2024-09-19
[2025-11-02 02:28:47] L766 fecha:'10-05-25'->2025-05-10
[2025-11-02 02:28:47] L767 fecha:'23-12-24'->2024-12-23
[2025-11-02 02:28:47] L768 fecha:'05-12-24'->2024-12-05
[2025-11-02 02:28:47] L769 fecha:'25-03-25'->2025-03-25
[2025-11-02 02:28:47] L770 fecha:'07-05-25'->2025-05-07
[2025-11-02 02:28:47] L771 fecha:'10-05-24'->2024-05-10
[2025-11-02 02:28:47] L772 fecha:'30-07-25'->2025-07-30
[2025-11-02 02:28:47] L773 fecha:'27-06-25'->2025-06-27
[2025-11-02 02:28:47] L774 fecha:'07-04-25'->2025-04-07
[2025-11-02 02:28:47] L775 fecha:'18-07-25'->2025-07-18
[2025-11-02 02:28:47] L776 fecha:'16-05-25'->2025-05-16
[2025-11-02 02:28:47] L777 fecha:'03-08-24'->2024-08-03
[2025-11-02 02:28:47] L778 fecha:'19-05-25'->2025-05-19
[2025-11-02 02:28:47] L779 fecha:'25-06-25'->2025-06-25
[2025-11-02 02:28:47] L780 fecha:'03-02-25'->2025-02-03
[2025-11-02 02:28:47] L781 fecha:'09-07-25'->2025-07-09
[2025-11-02 02:28:47] L782 fecha:'26-11-24'->2024-11-26
[2025-11-02 02:28:47] L783 fecha:'24-09-24'->2024-09-24
[2025-11-02 02:28:47] L784 fecha:'01-07-25'->2025-07-01
[2025-11-02 02:28:47] L785 fecha:'03-05-24'->2024-05-03
[2025-11-02 02:28:47] L786 fecha:'20-07-24'->2024-07-20
[2025-11-02 02:28:47] L787 fecha:'05-06-25'->2025-06-05
[2025-11-02 02:28:47] L788 fecha:'18-05-25'->2025-05-18
[2025-11-02 02:28:47] L789 fecha:'16-02-25'->2025-02-16
[2025-11-02 02:28:47] L790 fecha:'11-01-24'->2024-01-11
[2025-11-02 02:28:47] L791 fecha:'07-10-24'->2024-10-07
[2025-11-02 02:28:47] L792 fecha:'02-12-24'->2024-12-02
[2025-11-02 02:28:47] L793 fecha:'25-01-24'->2024-01-25
[2025-11-02 02:28:47] L794 fecha:'15-02-25'->2025-02-15
[2025-11-02 02:28:47] L795 fecha:'25-01-25'->2025-01-25
[2025-11-02 02:28:47] L796 fecha:'03-10-24'->2024-10-03
[2025-11-02 02:28:47] L797 fecha:'28-05-24'->2024-05-28
[2025-11-02 02:28:47] L798 fecha:'09-12-24'->2024-12-09
[2025-11-02 02:28:47] L799 fecha:'13-03-25'->2025-03-13
[2025-11-02 02:28:47] L800 fecha:'29-07-25'->2025-07-29
[2025-11-02 02:28:47] L801 fecha:'28-06-25'->2025-06-28
[2025-11-02 02:28:47] L802 fecha:'07-07-24'->2024-07-07
[2025-11-02 02:28:47] L803 fecha:'22-10-24'->2024-10-22
[2025-11-02 02:28:47] L804 fecha:'03-04-25'->2025-04-03
[2025-11-02 02:28:47] L805 fecha:'27-05-25'->2025-05-27
[2025-11-02 02:28:47] L806 fecha:'22-02-24'->2024-02-22
[2025-11-02 02:28:47] L807 fecha:'12-04-24'->2024-04-12
[2025-11-02 02:28:47] L808 fecha:'06-08-25'->2025-08-06
[2025-11-02 02:28:47] L809 fecha:'01-01-24'->2024-01-01
[2025-11-02 02:28:47] L810 fecha:'23-11-24'->2024-11-23
[2025-11-02 02:28:47] L811 fecha:'25-10-24'->2024-10-25
[2025-11-02 02:28:47] L812 fecha:'18-06-25'->2025-06-18
[2025-11-02 02:28:47] L813 fecha:'24-03-25'->2025-03-24
[2025-11-02 02:28:47] L814 fecha:'07-05-24'->2024-05-07
[2025-11-02 02:28:47] L815 fecha:'08-02-25'->2025-02-08
[2025-11-02 02:28:47] L816 fecha:'24-07-25'->2025-07-24
[2025-11-02 02:28:47] L817 fecha:'25-03-25'->2025-03-25
[2025-11-02 02:28:47] L818 fecha:'16-09-24'->2024-09-16
[2025-11-02 02:28:47] L819 fecha:'22-05-24'->2024-05-22
[2025-11-02 02:28:47] L820 fecha:'04-04-24'->2024-04-04
[2025-11-02 02:28:47] L821 fecha:'03-10-24'->2024-10-03
[2025-11-02 02:28:47] L822 fecha:'18-02-24'->2024-02-18
[2025-11-02 02:28:47] L823 fecha:'04-12-24'->2024-12-04
[2025-11-02 02:28:47] L824 fecha:'01-06-25'->2025-06-01
[2025-11-02 02:28:47] L825 fecha:'28-02-24'->2024-02-28
[2025-11-02 02:28:47] L826 fecha:'12-05-25'->2025-05-12
[2025-11-02 02:28:47] L827 fecha:'14-05-25'->2025-05-14
[2025-11-02 02:28:47] L828 fecha:'08-07-24'->2024-07-08
[2025-11-02 02:28:47] L829 fecha:'26-03-24'->2024-03-26
[2025-11-02 02:28:47] L830 fecha:'21-05-24'->2024-05-21
[2025-11-02 02:28:47] L831 fecha:'06-01-24'->2024-01-06
[2025-11-02 02:28:47] L832 fecha:'28-05-24'->2024-05-28
[2025-11-02 02:28:47] L833 fecha:'30-09-24'->2024-09-30
[2025-11-02 02:28:47] L834 fecha:'31-12-24'->2024-12-31
[2025-11-02 02:28:47] L835 fecha:'03-06-24'->2024-06-03
[2025-11-02 02:28:47] L836 fecha:'05-07-24'->2024-07-05
[2025-11-02 02:28:47] L837 fecha:'22-05-25'->2025-05-22
[2025-11-02 02:28:47] L838 fecha:'09-06-25'->2025-06-09
[2025-11-02 02:28:47] L839 fecha:'19-06-24'->2024-06-19
[2025-11-02 02:28:47] L840 fecha:'12-07-24'->2024-07-12
[2025-11-02 02:28:47] L841 fecha:'25-07-24'->2024-07-25
[2025-11-02 02:28:47] L842 fecha:'10-07-25'->2025-07-10
[2025-11-02 02:28:47] L843 fecha:'29-11-24'->2024-11-29
[2025-11-02 02:28:47] L844 fecha:'20-02-25'->2025-02-20
[2025-11-02 02:28:47] L845 fecha:'23-04-24'->2024-04-23
[2025-11-02 02:28:47] L846 fecha:'30-05-24'->2024-05-30
[2025-11-02 02:28:47] L847 fecha:'24-01-25'->2025-01-24
[2025-11-02 02:28:47] L848 fecha:'30-03-25'->2025-03-30
[2025-11-02 02:28:47] L849 fecha:'15-01-24'->2024-01-15
[2025-11-02 02:28:47] L850 fecha:'09-08-24'->2024-08-09
[2025-11-02 02:28:47] L851 fecha:'17-09-24'->2024-09-17
[2025-11-02 02:28:47] L852 fecha:'11-03-25'->2025-03-11
[2025-11-02 02:28:47] L853 fecha:'01-01-25'->2025-01-01
[2025-11-02 02:28:47] L854 fecha:'01-05-24'->2024-05-01
[2025-11-02 02:28:47] L855 fecha:'28-01-24'->2024-01-28
[2025-11-02 02:28:47] L856 fecha:'30-03-24'->2024-03-30
[2025-11-02 02:28:47] L857 fecha:'14-06-24'->2024-06-14
[2025-11-02 02:28:47] L858 fecha:'27-09-24'->2024-09-27
[2025-11-02 02:28:47] L859 fecha:'16-09-24'->2024-09-16
[2025-11-02 02:28:47] L860 fecha:'07-04-24'->2024-04-07
[2025-11-02 02:28:47] L861 fecha:'17-10-24'->2024-10-17
[2025-11-02 02:28:47] L862 fecha:'05-02-25'->2025-02-05
[2025-11-02 02:28:47] L863 fecha:'01-05-24'->2024-05-01
[2025-11-02 02:28:47] L864 fecha:'11-05-25'->2025-05-11
[2025-11-02 02:28:47] L865 fecha:'08-02-24'->2024-02-08
[2025-11-02 02:28:47] L866 fecha:'16-01-24'->2024-01-16
[2025-11-02 02:28:47] L867 fecha:'31-01-25'->2025-01-31
[2025-11-02 02:28:47] L868 fecha:'07-05-24'->2024-05-07
[2025-11-02 02:28:47] L869 fecha:'11-04-24'->2024-04-11
[2025-11-02 02:28:47] L870 fecha:'03-01-25'->2025-01-03
[2025-11-02 02:28:47] L871 fecha:'08-09-24'->2024-09-08
[2025-11-02 02:28:47] L872 fecha:'17-09-24'->2024-09-17
[2025-11-02 02:28:47] L873 fecha:'03-08-25'->2025-08-03
[2025-11-02 02:28:47] L874 fecha:'28-07-25'->2025-07-28
[2025-11-02 02:28:47] L875 fecha:'16-01-25'->2025-01-16
[2025-11-02 02:28:47] L876 fecha:'31-07-25'->2025-07-31
[2025-11-02 02:28:47] L877 fecha:'01-01-25'->2025-01-01
[2025-11-02 02:28:47] L878 fecha:'02-06-24'->2024-06-02
[2025-11-02 02:28:47] L879 fecha:'23-07-25'->2025-07-23
[2025-11-02 02:28:47] L880 fecha:'25-04-24'->2024-04-25
[2025-11-02 02:28:47] L881 fecha:'08-03-25'->2025-03-08
[2025-11-02 02:28:47] L882 fecha:'29-03-24'->2024-03-29
[2025-11-02 02:28:47] L883 fecha:'02-06-25'->2025-06-02
[2025-11-02 02:28:47] L884 fecha:'20-09-24'->2024-09-20
[2025-11-02 02:28:47] L885 fecha:'30-05-24'->2024-05-30
[2025-11-02 02:28:47] L886 fecha:'24-05-25'->2025-05-24
[2025-11-02 02:28:47] L887 fecha:'16-12-24'->2024-12-16
[2025-11-02 02:28:47] L888 fecha:'06-05-25'->2025-05-06
[2025-11-02 02:28:47] L889 fecha:'21-09-24'->2024-09-21
[2025-11-02 02:28:47] L890 fecha:'22-05-25'->2025-05-22
[2025-11-02 02:28:47] L891 fecha:'12-07-25'->2025-07-12
[2025-11-02 02:28:47] L892 fecha:'29-06-25'->2025-06-29
[2025-11-02 02:28:47] L893 fecha:'25-06-24'->2024-06-25
[2025-11-02 02:28:47] L894 fecha:'16-06-24'->2024-06-16
[2025-11-02 02:28:47] L895 fecha:'24-03-24'->2024-03-24
[2025-11-02 02:28:47] L896 fecha:'28-05-24'->2024-05-28
[2025-11-02 02:28:47] L897 fecha:'09-05-25'->2025-05-09
[2025-11-02 02:28:47] L898 fecha:'03-05-25'->2025-05-03
[2025-11-02 02:28:47] L899 fecha:'17-07-24'->2024-07-17
[2025-11-02 02:28:47] L900 fecha:'27-01-24'->2024-01-27
[2025-11-02 02:28:47] L901 fecha:'11-07-25'->2025-07-11
[2025-11-02 02:28:47] L902 fecha:'15-02-25'->2025-02-15
[2025-11-02 02:28:47] L903 fecha:'10-08-24'->2024-08-10
[2025-11-02 02:28:47] L904 fecha:'01-01-24'->2024-01-01
[2025-11-02 02:28:47] L905 fecha:'28-02-24'->2024-02-28
[2025-11-02 02:28:47] L906 fecha:'17-08-24'->2024-08-17
[2025-11-02 02:28:47] L907 fecha:'14-02-24'->2024-02-14
[2025-11-02 02:28:47] L908 fecha:'18-01-24'->2024-01-18
[2025-11-02 02:28:47] L909 fecha:'20-01-25'->2025-01-20
[2025-11-02 02:28:47] L910 fecha:'12-07-24'->2024-07-12
[2025-11-02 02:28:47] L911 fecha:'23-06-24'->2024-06-23
[2025-11-02 02:28:47] L912 fecha:'29-09-24'->2024-09-29
[2025-11-02 02:28:47] L913 fecha:'03-01-24'->2024-01-03
[2025-11-02 02:28:47] L914 fecha:'04-01-25'->2025-01-04
[2025-11-02 02:28:47] L915 fecha:'29-06-25'->2025-06-29
[2025-11-02 02:28:47] L916 fecha:'31-10-24'->2024-10-31
[2025-11-02 02:28:47] L917 fecha:'03-08-24'->2024-08-03
[2025-11-02 02:28:47] L918 fecha:'06-03-25'->2025-03-06
[2025-11-02 02:28:47] L919 fecha:'15-07-25'->2025-07-15
[2025-11-02 02:28:47] L920 fecha:'08-04-25'->2025-04-08
[2025-11-02 02:28:47] L921 fecha:'18-08-24'->2024-08-18
[2025-11-02 02:28:47] L922 fecha:'02-08-25'->2025-08-02
[2025-11-02 02:28:47] L923 fecha:'05-05-25'->2025-05-05
[2025-11-02 02:28:47] L924 fecha:'12-07-25'->2025-07-12
[2025-11-02 02:28:47] L925 fecha:'14-06-25'->2025-06-14
[2025-11-02 02:28:47] L926 fecha:'14-08-25'->2025-08-14
[2025-11-02 02:28:47] L927 fecha:'12-10-24'->2024-10-12
[2025-11-02 02:28:47] L928 fecha:'29-09-24'->2024-09-29
[2025-11-02 02:28:47] L929 fecha:'10-01-24'->2024-01-10
[2025-11-02 02:28:47] L930 fecha:'18-08-25'->2025-08-18
[2025-11-02 02:28:47] L931 fecha:'03-05-25'->2025-05-03
[2025-11-02 02:28:47] L932 fecha:'11-12-24'->2024-12-11
[2025-11-02 02:28:47] L933 fecha:'23-04-24'->2024-04-23
[2025-11-02 02:28:47] L934 fecha:'08-06-25'->2025-06-08
[2025-11-02 02:28:47] L935 fecha:'12-04-25'->2025-04-12
[2025-11-02 02:28:47] L936 fecha:'05-07-24'->2024-07-05
[2025-11-02 02:28:47] L937 fecha:'27-03-24'->2024-03-27
[2025-11-02 02:28:47] L938 fecha:'13-02-24'->2024-02-13
[2025-11-02 02:28:47] L939 fecha:'14-01-25'->2025-01-14
[2025-11-02 02:28:47] L940 fecha:'24-02-24'->2024-02-24
[2025-11-02 02:28:47] L941 fecha:'05-08-25'->2025-08-05
[2025-11-02 02:28:47] L942 fecha:'11-09-24'->2024-09-11
[2025-11-02 02:28:47] L943 fecha:'30-04-25'->2025-04-30
[2025-11-02 02:28:47] L944 fecha:'02-11-24'->2024-11-02
[2025-11-02 02:28:47] L945 fecha:'26-06-24'->2024-06-26
[2025-11-02 02:28:47] L946 fecha:'21-01-24'->2024-01-21
[2025-11-02 02:28:47] L947 fecha:'09-08-25'->2025-08-09
[2025-11-02 02:28:47] L948 fecha:'24-12-24'->2024-12-24
[2025-11-02 02:28:47] L949 fecha:'06-05-25'->2025-05-06
[2025-11-02 02:28:47] L950 fecha:'25-12-24'->2024-12-25
[2025-11-02 02:28:47] L951 fecha:'08-03-24'->2024-03-08
[2025-11-02 02:28:47] L952 fecha:'04-12-24'->2024-12-04
[2025-11-02 02:28:47] L953 fecha:'20-10-24'->2024-10-20
[2025-11-02 02:28:47] L954 fecha:'08-06-25'->2025-06-08
[2025-11-02 02:28:47] L955 fecha:'14-08-24'->2024-08-14
[2025-11-02 02:28:47] L956 fecha:'06-07-24'->2024-07-06
[2025-11-02 02:28:47] L957 fecha:'21-10-24'->2024-10-21
[2025-11-02 02:28:47] L958 fecha:'21-12-24'->2024-12-21
[2025-11-02 02:28:47] L959 fecha:'23-07-25'->2025-07-23
[2025-11-02 02:28:47] L960 fecha:'05-08-24'->2024-08-05
[2025-11-02 02:28:47] L961 fecha:'09-07-24'->2024-07-09
[2025-11-02 02:28:47] L962 fecha:'02-11-24'->2024-11-02
[2025-11-02 02:28:47] L963 fecha:'26-01-25'->2025-01-26
[2025-11-02 02:28:47] L964 fecha:'09-05-25'->2025-05-09
[2025-11-02 02:28:47] L965 fecha:'26-01-24'->2024-01-26
[2025-11-02 02:28:47] L966 fecha:'04-04-24'->2024-04-04
[2025-11-02 02:28:47] L967 fecha:'20-01-24'->2024-01-20
[2025-11-02 02:28:47] L968 fecha:'19-07-24'->2024-07-19
[2025-11-02 02:28:47] L969 fecha:'03-11-24'->2024-11-03
[2025-11-02 02:28:47] L970 fecha:'29-12-24'->2024-12-29
[2025-11-02 02:28:47] L971 fecha:'28-11-24'->2024-11-28
[2025-11-02 02:28:47] L972 fecha:'22-01-24'->2024-01-22
[2025-11-02 02:28:47] L973 fecha:'26-03-24'->2024-03-26
[2025-11-02 02:28:47] L974 fecha:'07-02-24'->2024-02-07
[2025-11-02 02:28:47] L975 fecha:'02-04-25'->2025-04-02
[2025-11-02 02:28:47] L976 fecha:'19-11-24'->2024-11-19
[2025-11-02 02:28:47] L977 fecha:'03-11-24'->2024-11-03
[2025-11-02 02:28:47] L978 fecha:'11-07-25'->2025-07-11
[2025-11-02 02:28:47] L979 fecha:'22-07-24'->2024-07-22
[2025-11-02 02:28:47] L980 fecha:'04-07-25'->2025-07-04
[2025-11-02 02:28:47] L981 fecha:'02-11-24'->2024-11-02
[2025-11-02 02:28:47] L982 fecha:'20-02-25'->2025-02-20
[2025-11-02 02:28:47] L983 fecha:'07-04-25'->2025-04-07
[2025-11-02 02:28:47] L984 fecha:'17-04-24'->2024-04-17
[2025-11-02 02:28:47] L985 fecha:'29-02-24'->2024-02-29
[2025-11-02 02:28:47] L986 fecha:'03-06-24'->2024-06-03
[2025-11-02 02:28:47] L987 fecha:'13-08-25'->2025-08-13
[2025-11-02 02:28:47] L988 fecha:'14-08-24'->2024-08-14
[2025-11-02 02:28:47] L989 fecha:'18-05-25'->2025-05-18
[2025-11-02 02:28:47] L990 fecha:'02-07-25'->2025-07-02
[2025-11-02 02:28:47] L991 fecha:'28-07-24'->2024-07-28
[2025-11-02 02:28:47] L992 fecha:'02-03-24'->2024-03-02
[2025-11-02 02:28:47] L993 fecha:'28-07-25'->2025-07-28
[2025-11-02 02:28:47] L994 fecha:'18-02-25'->2025-02-18
[2025-11-02 02:28:47] L995 fecha:'22-07-25'->2025-07-22
[2025-11-02 02:28:47] L996 fecha:'21-03-24'->2024-03-21
[2025-11-02 02:28:47] L997 fecha:'22-04-24'->2024-04-22
[2025-11-02 02:28:47] L998 fecha:'09-06-24'->2024-06-09
[2025-11-02 02:28:47] L999 fecha:'28-06-24'->2024-06-28
[2025-11-02 02:28:47] L1000 fecha:'15-08-24'->2024-08-15
[2025-11-02 02:28:47] L1001 fecha:'21-03-25'->2025-03-21
[2025-11-02 02:28:47] L1002 fecha:'20-04-24'->2024-04-20
[2025-11-02 02:28:47] L1003 fecha:'02-11-24'->2024-11-02
[2025-11-02 02:28:47] L1004 fecha:'13-10-24'->2024-10-13
[2025-11-02 02:28:47] L1005 fecha:'31-01-24'->2024-01-31
[2025-11-02 02:28:47] L1006 fecha:'11-07-24'->2024-07-11
[2025-11-02 02:28:47] L1007 fecha:'30-04-24'->2024-04-30
[2025-11-02 02:28:47] L1008 fecha:'14-01-24'->2024-01-14
[2025-11-02 02:28:47] L1009 fecha:'15-06-25'->2025-06-15
[2025-11-02 02:28:47] L1010 fecha:'14-03-24'->2024-03-14
[2025-11-02 02:28:47] L1011 fecha:'29-08-25'->2025-08-29
[2025-11-02 02:28:47] L1012 fecha:'13-04-25'->2025-04-13
[2025-11-02 02:28:47] L1013 fecha:'03-06-24'->2024-06-03
[2025-11-02 02:28:47] L1014 fecha:'07-08-24'->2024-08-07
[2025-11-02 02:28:47] L1015 fecha:'25-01-25'->2025-01-25
[2025-11-02 02:28:47] L1016 fecha:'23-01-25'->2025-01-23
[2025-11-02 02:28:47] L1017 fecha:'09-01-24'->2024-01-09
[2025-11-02 02:28:47] L1018 fecha:'02-03-25'->2025-03-02
[2025-11-02 02:28:47] L1019 fecha:'18-02-24'->2024-02-18
[2025-11-02 02:28:47] L1020 fecha:'08-01-25'->2025-01-08
[2025-11-02 02:28:47] L1021 fecha:'09-08-25'->2025-08-09
[2025-11-02 02:28:47] L1022 fecha:'30-04-24'->2024-04-30
[2025-11-02 02:28:47] L1023 fecha:'07-03-25'->2025-03-07
[2025-11-02 02:28:47] L1024 fecha:'06-04-25'->2025-04-06
[2025-11-02 02:28:47] L1025 fecha:'07-08-25'->2025-08-07
[2025-11-02 02:28:47] L1026 fecha:'24-03-24'->2024-03-24
[2025-11-02 02:28:47] L1027 fecha:'25-09-24'->2024-09-25
[2025-11-02 02:28:47] L1028 fecha:'13-09-24'->2024-09-13
[2025-11-02 02:28:47] L1029 fecha:'21-12-24'->2024-12-21
[2025-11-02 02:28:47] L1030 fecha:'13-02-25'->2025-02-13
[2025-11-02 02:28:47] L1031 fecha:'30-05-24'->2024-05-30
[2025-11-02 02:28:47] L1032 fecha:'08-08-24'->2024-08-08
[2025-11-02 02:28:47] L1033 fecha:'24-06-25'->2025-06-24
[2025-11-02 02:28:47] L1034 fecha:'10-09-24'->2024-09-10
[2025-11-02 02:28:47] L1035 fecha:'09-08-25'->2025-08-09
[2025-11-02 02:28:47] L1036 fecha:'26-09-24'->2024-09-26
[2025-11-02 02:28:47] L1037 fecha:'05-02-25'->2025-02-05
[2025-11-02 02:28:47] L1038 fecha:'08-02-25'->2025-02-08
[2025-11-02 02:28:47] L1039 fecha:'06-03-25'->2025-03-06
[2025-11-02 02:28:47] L1040 fecha:'19-02-25'->2025-02-19
[2025-11-02 02:28:47] L1041 fecha:'26-07-24'->2024-07-26
[2025-11-02 02:28:47] L1042 fecha:'16-07-24'->2024-07-16
[2025-11-02 02:28:47] L1043 fecha:'17-11-24'->2024-11-17
[2025-11-02 02:28:47] L1044 fecha:'11-12-24'->2024-12-11
[2025-11-02 02:28:47] L1045 fecha:'18-01-25'->2025-01-18
[2025-11-02 02:28:47] L1046 fecha:'15-02-25'->2025-02-15
[2025-11-02 02:28:47] L1047 fecha:'31-05-25'->2025-05-31
[2025-11-02 02:28:47] L1048 fecha:'26-07-24'->2024-07-26
[2025-11-02 02:28:47] L1049 fecha:'14-04-25'->2025-04-14
[2025-11-02 02:28:47] L1050 fecha:'20-12-24'->2024-12-20
[2025-11-02 02:28:47] L1051 fecha:'25-01-25'->2025-01-25
[2025-11-02 02:28:47] L1052 fecha:'04-01-24'->2024-01-04
[2025-11-02 02:28:47] L1053 fecha:'04-04-25'->2025-04-04
[2025-11-02 02:28:47] L1054 fecha:'01-06-24'->2024-06-01
[2025-11-02 02:28:47] L1055 fecha:'13-02-25'->2025-02-13
[2025-11-02 02:28:47] L1056 fecha:'12-08-24'->2024-08-12
[2025-11-02 02:28:47] L1057 fecha:'28-09-24'->2024-09-28
[2025-11-02 02:28:47] L1058 fecha:'19-01-24'->2024-01-19
[2025-11-02 02:28:47] L1059 fecha:'24-07-24'->2024-07-24
[2025-11-02 02:28:47] L1060 fecha:'23-08-24'->2024-08-23
[2025-11-02 02:28:47] L1061 fecha:'14-01-25'->2025-01-14
[2025-11-02 02:28:47] L1062 fecha:'23-08-24'->2024-08-23
[2025-11-02 02:28:47] L1063 fecha:'01-01-25'->2025-01-01
[2025-11-02 02:28:47] L1064 fecha:'01-02-25'->2025-02-01
[2025-11-02 02:28:47] L1065 fecha:'02-04-25'->2025-04-02
[2025-11-02 02:28:47] L1066 fecha:'14-03-25'->2025-03-14
[2025-11-02 02:28:47] L1067 fecha:'13-09-24'->2024-09-13
[2025-11-02 02:28:47] L1068 fecha:'10-12-24'->2024-12-10
[2025-11-02 02:28:47] L1069 fecha:'28-06-25'->2025-06-28
[2025-11-02 02:28:47] L1070 fecha:'21-02-24'->2024-02-21
[2025-11-02 02:28:47] L1071 fecha:'01-12-24'->2024-12-01
[2025-11-02 02:28:47] L1072 fecha:'21-05-24'->2024-05-21
[2025-11-02 02:28:47] L1073 fecha:'28-05-24'->2024-05-28
[2025-11-02 02:28:47] L1074 fecha:'15-04-25'->2025-04-15
[2025-11-02 02:28:47] L1075 fecha:'22-01-24'->2024-01-22
[2025-11-02 02:28:47] L1076 fecha:'05-08-24'->2024-08-05
[2025-11-02 02:28:47] L1077 fecha:'13-04-25'->2025-04-13
[2025-11-02 02:28:47] L1078 fecha:'27-02-25'->2025-02-27
[2025-11-02 02:28:47] L1079 fecha:'18-12-24'->2024-12-18
[2025-11-02 02:28:47] L1080 fecha:'04-01-25'->2025-01-04
[2025-11-02 02:28:47] L1081 fecha:'21-06-24'->2024-06-21
[2025-11-02 02:28:47] L1082 fecha:'12-12-24'->2024-12-12
[2025-11-02 02:28:47] L1083 fecha:'10-01-24'->2024-01-10
[2025-11-02 02:28:47] L1084 fecha:'01-05-24'->2024-05-01
[2025-11-02 02:28:47] L1085 fecha:'10-08-24'->2024-08-10
[2025-11-02 02:28:47] L1086 fecha:'26-12-24'->2024-12-26
[2025-11-02 02:28:47] L1087 fecha:'20-07-25'->2025-07-20
[2025-11-02 02:28:47] L1088 fecha:'22-04-24'->2024-04-22
[2025-11-02 02:28:47] L1089 fecha:'14-06-24'->2024-06-14
[2025-11-02 02:28:47] L1090 fecha:'22-08-25'->2025-08-22
[2025-11-02 02:28:47] L1091 fecha:'19-06-24'->2024-06-19
[2025-11-02 02:28:47] L1092 fecha:'08-04-24'->2024-04-08
[2025-11-02 02:28:47] L1093 fecha:'30-06-24'->2024-06-30
[2025-11-02 02:28:47] L1094 fecha:'16-05-24'->2024-05-16
[2025-11-02 02:28:47] L1095 fecha:'07-06-24'->2024-06-07
[2025-11-02 02:28:47] L1096 fecha:'20-10-24'->2024-10-20
[2025-11-02 02:28:47] L1097 fecha:'13-07-25'->2025-07-13
[2025-11-02 02:28:47] L1098 fecha:'16-09-24'->2024-09-16
[2025-11-02 02:28:47] L1099 fecha:'06-08-24'->2024-08-06
[2025-11-02 02:28:47] L1100 fecha:'14-07-24'->2024-07-14
[2025-11-02 02:28:47] L1101 fecha:'06-09-24'->2024-09-06
[2025-11-02 02:28:47] L1102 fecha:'29-03-24'->2024-03-29
[2025-11-02 02:28:47] L1103 fecha:'12-02-25'->2025-02-12
[2025-11-02 02:28:47] L1104 fecha:'26-02-25'->2025-02-26
[2025-11-02 02:28:47] L1105 fecha:'14-09-24'->2024-09-14
[2025-11-02 02:28:47] L1106 fecha:'26-03-24'->2024-03-26
[2025-11-02 02:28:47] L1107 fecha:'22-01-24'->2024-01-22
[2025-11-02 02:28:47] L1108 fecha:'19-02-25'->2025-02-19
[2025-11-02 02:28:47] L1109 fecha:'18-01-24'->2024-01-18
[2025-11-02 02:28:47] L1110 fecha:'30-11-24'->2024-11-30
[2025-11-02 02:28:47] L1111 fecha:'28-06-24'->2024-06-28
[2025-11-02 02:28:47] L1112 fecha:'20-02-24'->2024-02-20
[2025-11-02 02:28:47] L1113 fecha:'01-06-25'->2025-06-01
[2025-11-02 02:28:47] L1114 fecha:'31-10-24'->2024-10-31
[2025-11-02 02:28:47] L1115 fecha:'17-10-24'->2024-10-17
[2025-11-02 02:28:47] L1116 fecha:'28-07-24'->2024-07-28
[2025-11-02 02:28:47] L1117 fecha:'17-07-24'->2024-07-17
[2025-11-02 02:28:47] L1118 fecha:'11-12-24'->2024-12-11
[2025-11-02 02:28:47] L1119 fecha:'05-04-25'->2025-04-05
[2025-11-02 02:28:47] L1120 fecha:'17-08-24'->2024-08-17
[2025-11-02 02:28:47] L1121 fecha:'22-04-25'->2025-04-22
[2025-11-02 02:28:47] L1122 fecha:'16-04-24'->2024-04-16
[2025-11-02 02:28:47] L1123 fecha:'07-09-24'->2024-09-07
[2025-11-02 02:28:47] L1124 fecha:'18-11-24'->2024-11-18
[2025-11-02 02:28:47] L1125 fecha:'08-02-25'->2025-02-08
[2025-11-02 02:28:47] L1126 fecha:'29-11-24'->2024-11-29
[2025-11-02 02:28:47] L1127 fecha:'18-01-25'->2025-01-18
[2025-11-02 02:28:47] L1128 fecha:'26-04-25'->2025-04-26
[2025-11-02 02:28:47] L1129 fecha:'02-03-25'->2025-03-02
[2025-11-02 02:28:47] L1130 fecha:'05-02-24'->2024-02-05
[2025-11-02 02:28:47] L1131 fecha:'15-05-25'->2025-05-15
[2025-11-02 02:28:47] L1132 fecha:'06-04-25'->2025-04-06
[2025-11-02 02:28:47] L1133 fecha:'11-10-24'->2024-10-11
[2025-11-02 02:28:47] L1134 fecha:'12-01-25'->2025-01-12
[2025-11-02 02:28:47] L1135 fecha:'08-02-24'->2024-02-08
[2025-11-02 02:28:47] L1136 fecha:'26-09-24'->2024-09-26
[2025-11-02 02:28:47] L1137 fecha:'17-04-25'->2025-04-17
[2025-11-02 02:28:47] L1138 fecha:'13-10-24'->2024-10-13
[2025-11-02 02:28:47] L1139 fecha:'31-07-25'->2025-07-31
[2025-11-02 02:28:47] L1140 fecha:'12-07-24'->2024-07-12
[2025-11-02 02:28:47] L1141 fecha:'20-05-24'->2024-05-20
[2025-11-02 02:28:47] L1142 fecha:'23-03-25'->2025-03-23
[2025-11-02 02:28:47] L1143 fecha:'02-01-24'->2024-01-02
[2025-11-02 02:28:47] L1144 fecha:'10-01-25'->2025-01-10
[2025-11-02 02:28:47] L1145 fecha:'27-09-24'->2024-09-27
[2025-11-02 02:28:47] L1146 fecha:'29-06-24'->2024-06-29
[2025-11-02 02:28:47] L1147 fecha:'14-01-24'->2024-01-14
[2025-11-02 02:28:47] L1148 fecha:'01-04-25'->2025-04-01
[2025-11-02 02:28:47] L1149 fecha:'10-04-24'->2024-04-10
[2025-11-02 02:28:47] L1150 fecha:'06-05-25'->2025-05-06
[2025-11-02 02:28:47] L1151 fecha:'28-09-24'->2024-09-28
[2025-11-02 02:28:47] L1152 fecha:'02-04-25'->2025-04-02
[2025-11-02 02:28:47] L1153 fecha:'27-08-24'->2024-08-27
[2025-11-02 02:28:47] L1154 fecha:'20-05-24'->2024-05-20
[2025-11-02 02:28:47] L1155 fecha:'27-06-24'->2024-06-27
[2025-11-02 02:28:47] L1156 fecha:'24-08-25'->2025-08-24
[2025-11-02 02:28:47] L1157 fecha:'11-08-25'->2025-08-11
[2025-11-02 02:28:47] L1158 fecha:'23-09-24'->2024-09-23
[2025-11-02 02:28:47] L1159 fecha:'13-12-24'->2024-12-13
[2025-11-02 02:28:47] L1160 fecha:'25-01-25'->2025-01-25
[2025-11-02 02:28:47] L1161 fecha:'13-05-25'->2025-05-13
[2025-11-02 02:28:47] L1162 fecha:'12-01-25'->2025-01-12
[2025-11-02 02:28:47] L1163 fecha:'09-04-25'->2025-04-09
[2025-11-02 02:28:47] L1164 fecha:'08-07-24'->2024-07-08
[2025-11-02 02:28:47] L1165 fecha:'07-02-24'->2024-02-07
[2025-11-02 02:28:47] L1166 fecha:'13-03-25'->2025-03-13
[2025-11-02 02:28:47] L1167 fecha:'03-07-25'->2025-07-03
[2025-11-02 02:28:47] L1168 fecha:'19-01-25'->2025-01-19
[2025-11-02 02:28:47] L1169 fecha:'14-03-24'->2024-03-14
[2025-11-02 02:28:47] L1170 fecha:'01-03-25'->2025-03-01
[2025-11-02 02:28:47] L1171 fecha:'25-08-24'->2024-08-25
[2025-11-02 02:28:47] L1172 fecha:'29-05-25'->2025-05-29
[2025-11-02 02:28:47] L1173 fecha:'25-08-25'->2025-08-25
[2025-11-02 02:28:47] L1174 fecha:'29-08-24'->2024-08-29
[2025-11-02 02:28:47] L1175 fecha:'07-03-25'->2025-03-07
[2025-11-02 02:28:47] L1176 fecha:'20-05-25'->2025-05-20
[2025-11-02 02:28:47] L1177 fecha:'01-09-24'->2024-09-01
[2025-11-02 02:28:47] L1178 fecha:'22-06-24'->2024-06-22
[2025-11-02 02:28:47] L1179 fecha:'06-04-25'->2025-04-06
[2025-11-02 02:28:47] L1180 fecha:'01-05-24'->2024-05-01
[2025-11-02 02:28:47] L1181 fecha:'21-01-24'->2024-01-21
[2025-11-02 02:28:47] L1182 fecha:'26-02-25'->2025-02-26
[2025-11-02 02:28:47] L1183 fecha:'19-06-25'->2025-06-19
[2025-11-02 02:28:47] L1184 fecha:'25-02-24'->2024-02-25
[2025-11-02 02:28:47] L1185 fecha:'13-01-24'->2024-01-13
[2025-11-02 02:28:47] L1186 fecha:'31-08-24'->2024-08-31
[2025-11-02 02:28:47] L1187 fecha:'31-05-24'->2024-05-31
[2025-11-02 02:28:47] L1188 fecha:'02-01-25'->2025-01-02
[2025-11-02 02:28:47] L1189 fecha:'10-10-24'->2024-10-10
[2025-11-02 02:28:47] L1190 fecha:'29-10-24'->2024-10-29
[2025-11-02 02:28:47] L1191 fecha:'30-07-24'->2024-07-30
[2025-11-02 02:28:47] L1192 fecha:'21-03-25'->2025-03-21
[2025-11-02 02:28:47] L1193 fecha:'26-09-24'->2024-09-26
[2025-11-02 02:28:47] L1194 fecha:'01-08-25'->2025-08-01
[2025-11-02 02:28:47] L1195 fecha:'05-01-24'->2024-01-05
[2025-11-02 02:28:47] L1196 fecha:'27-07-25'->2025-07-27
[2025-11-02 02:28:47] L1197 fecha:'12-02-24'->2024-02-12
[2025-11-02 02:28:47] L1198 fecha:'27-09-24'->2024-09-27
[2025-11-02 02:28:47] L1199 fecha:'16-10-24'->2024-10-16
[2025-11-02 02:28:47] L1200 fecha:'16-01-25'->2025-01-16
[2025-11-02 02:28:47] L1201 fecha:'02-01-24'->2024-01-02
[2025-11-02 02:28:47] L1202 fecha:'26-05-25'->2025-05-26
[2025-11-02 02:28:47] L1203 fecha:'27-10-24'->2024-10-27
[2025-11-02 02:28:47] L1204 fecha:'25-04-25'->2025-04-25
[2025-11-02 02:28:47] L1205 fecha:'15-06-24'->2024-06-15
[2025-11-02 02:28:47] L1206 fecha:'02-05-24'->2024-05-02
[2025-11-02 02:28:47] L1207 fecha:'06-09-24'->2024-09-06
[2025-11-02 02:28:47] L1208 fecha:'21-03-25'->2025-03-21
[2025-11-02 02:28:47] L1209 fecha:'12-01-24'->2024-01-12
[2025-11-02 02:28:47] L1210 fecha:'08-09-24'->2024-09-08
[2025-11-02 02:28:47] L1211 fecha:'09-05-25'->2025-05-09
[2025-11-02 02:28:47] L1212 fecha:'05-07-24'->2024-07-05
[2025-11-02 02:28:47] L1213 fecha:'04-04-25'->2025-04-04
[2025-11-02 02:28:47] L1214 fecha:'26-03-25'->2025-03-26
[2025-11-02 02:28:47] L1215 fecha:'02-12-24'->2024-12-02
[2025-11-02 02:28:47] L1216 fecha:'19-02-24'->2024-02-19
[2025-11-02 02:28:47] L1217 fecha:'18-04-25'->2025-04-18
[2025-11-02 02:28:47] L1218 fecha:'21-01-24'->2024-01-21
[2025-11-02 02:28:47] L1219 fecha:'29-04-24'->2024-04-29
[2025-11-02 02:28:47] L1220 fecha:'14-04-24'->2024-04-14
[2025-11-02 02:28:47] L1221 fecha:'10-07-24'->2024-07-10
[2025-11-02 02:28:47] L1222 fecha:'22-04-24'->2024-04-22
[2025-11-02 02:28:47] L1223 fecha:'14-05-24'->2024-05-14
[2025-11-02 02:28:47] L1224 fecha:'13-06-25'->2025-06-13
[2025-11-02 02:28:47] L1225 fecha:'23-12-24'->2024-12-23
[2025-11-02 02:28:47] L1226 fecha:'14-01-25'->2025-01-14
[2025-11-02 02:28:47] L1227 fecha:'27-03-24'->2024-03-27
[2025-11-02 02:28:47] L1228 fecha:'22-04-24'->2024-04-22
[2025-11-02 02:28:47] L1229 fecha:'12-04-24'->2024-04-12
[2025-11-02 02:28:47] L1230 fecha:'22-04-25'->2025-04-22
[2025-11-02 02:28:47] L1231 fecha:'20-09-24'->2024-09-20
[2025-11-02 02:28:47] L1232 fecha:'22-01-24'->2024-01-22
[2025-11-02 02:28:47] L1233 fecha:'29-07-24'->2024-07-29
[2025-11-02 02:28:47] L1234 fecha:'22-02-25'->2025-02-22
[2025-11-02 02:28:47] L1235 fecha:'05-07-25'->2025-07-05
[2025-11-02 02:28:47] L1236 fecha:'28-08-25'->2025-08-28
[2025-11-02 02:28:47] L1237 fecha:'19-06-25'->2025-06-19
[2025-11-02 02:28:47] L1238 fecha:'11-11-24'->2024-11-11
[2025-11-02 02:28:47] L1239 fecha:'08-03-25'->2025-03-08
[2025-11-02 02:28:47] L1240 fecha:'26-04-25'->2025-04-26
[2025-11-02 02:28:47] L1241 fecha:'09-12-24'->2024-12-09
[2025-11-02 02:28:47] L1242 fecha:'16-02-25'->2025-02-16
[2025-11-02 02:28:47] L1243 fecha:'28-06-25'->2025-06-28
[2025-11-02 02:28:47] L1244 fecha:'09-01-24'->2024-01-09
[2025-11-02 02:28:47] L1245 fecha:'13-09-24'->2024-09-13
[2025-11-02 02:28:47] L1246 fecha:'31-03-25'->2025-03-31
[2025-11-02 02:28:47] L1247 fecha:'23-06-25'->2025-06-23
[2025-11-02 02:28:47] L1248 fecha:'17-05-24'->2024-05-17
[2025-11-02 02:28:47] L1249 fecha:'06-10-24'->2024-10-06
[2025-11-02 02:28:47] L1250 fecha:'29-10-24'->2024-10-29
[2025-11-02 02:28:47] L1251 fecha:'07-03-25'->2025-03-07
[2025-11-02 02:28:47] L1252 fecha:'24-02-25'->2025-02-24
[2025-11-02 02:28:47] L1253 fecha:'10-01-24'->2024-01-10
[2025-11-02 02:28:47] L1254 fecha:'27-04-25'->2025-04-27
[2025-11-02 02:28:47] L1255 fecha:'12-04-25'->2025-04-12
[2025-11-02 02:28:47] L1256 fecha:'26-10-24'->2024-10-26
[2025-11-02 02:28:47] L1257 fecha:'21-11-24'->2024-11-21
[2025-11-02 02:28:47] L1258 fecha:'05-11-24'->2024-11-05
[2025-11-02 02:28:47] L1259 fecha:'05-04-24'->2024-04-05
[2025-11-02 02:28:47] L1260 fecha:'24-03-25'->2025-03-24
[2025-11-02 02:28:47] L1261 fecha:'05-10-24'->2024-10-05
[2025-11-02 02:28:47] L1262 fecha:'12-07-24'->2024-07-12
[2025-11-02 02:28:47] L1263 fecha:'13-08-25'->2025-08-13
[2025-11-02 02:28:47] L1264 fecha:'12-04-25'->2025-04-12
[2025-11-02 02:28:47] L1265 fecha:'07-03-25'->2025-03-07
[2025-11-02 02:28:47] L1266 fecha:'30-08-25'->2025-08-30
[2025-11-02 02:28:47] L1267 fecha:'15-07-24'->2024-07-15
[2025-11-02 02:28:47] L1268 fecha:'18-07-24'->2024-07-18
[2025-11-02 02:28:47] L1269 fecha:'27-06-24'->2024-06-27
[2025-11-02 02:28:47] L1270 fecha:'21-10-24'->2024-10-21
[2025-11-02 02:28:47] L1271 fecha:'11-12-24'->2024-12-11
[2025-11-02 02:28:47] L1272 fecha:'29-05-25'->2025-05-29
[2025-11-02 02:28:47] L1273 fecha:'07-01-25'->2025-01-07
[2025-11-02 02:28:47] L1274 fecha:'01-06-25'->2025-06-01
[2025-11-02 02:28:47] L1275 fecha:'05-12-24'->2024-12-05
[2025-11-02 02:28:47] L1276 fecha:'10-03-24'->2024-03-10
[2025-11-02 02:28:47] L1277 fecha:'01-12-24'->2024-12-01
[2025-11-02 02:28:47] L1278 fecha:'05-12-24'->2024-12-05
[2025-11-02 02:28:47] L1279 fecha:'02-01-25'->2025-01-02
[2025-11-02 02:28:47] L1280 fecha:'18-06-25'->2025-06-18
[2025-11-02 02:28:47] L1281 fecha:'02-12-24'->2024-12-02
[2025-11-02 02:28:47] L1282 fecha:'13-03-24'->2024-03-13
[2025-11-02 02:28:47] L1283 fecha:'22-04-25'->2025-04-22
[2025-11-02 02:28:47] L1284 fecha:'10-08-24'->2024-08-10
[2025-11-02 02:28:47] L1285 fecha:'29-03-24'->2024-03-29
[2025-11-02 02:28:47] L1286 fecha:'18-01-25'->2025-01-18
[2025-11-02 02:28:47] L1287 fecha:'29-10-24'->2024-10-29
[2025-11-02 02:28:47] L1288 fecha:'16-02-24'->2024-02-16
[2025-11-02 02:28:47] L1289 fecha:'06-10-24'->2024-10-06
[2025-11-02 02:28:47] L1290 fecha:'11-01-24'->2024-01-11
[2025-11-02 02:28:47] L1291 fecha:'01-06-25'->2025-06-01
[2025-11-02 02:28:47] L1292 fecha:'01-02-25'->2025-02-01
[2025-11-02 02:28:47] L1293 fecha:'29-01-25'->2025-01-29
[2025-11-02 02:28:47] L1294 fecha:'22-02-25'->2025-02-22
[2025-11-02 02:28:47] L1295 fecha:'07-11-24'->2024-11-07
[2025-11-02 02:28:47] L1296 fecha:'07-09-24'->2024-09-07
[2025-11-02 02:28:47] L1297 fecha:'21-03-24'->2024-03-21
[2025-11-02 02:28:47] L1298 fecha:'31-07-25'->2025-07-31
[2025-11-02 02:28:47] L1299 fecha:'14-12-24'->2024-12-14
[2025-11-02 02:28:47] L1300 fecha:'21-03-25'->2025-03-21
[2025-11-02 02:28:47] L1301 fecha:'22-03-25'->2025-03-22
[2025-11-02 02:28:47] L1302 fecha:'15-07-25'->2025-07-15
[2025-11-02 02:28:47] L1303 fecha:'11-03-24'->2024-03-11
[2025-11-02 02:28:47] L1304 fecha:'29-04-25'->2025-04-29
[2025-11-02 02:28:47] L1305 fecha:'11-02-24'->2024-02-11
[2025-11-02 02:28:47] L1306 fecha:'01-03-24'->2024-03-01
[2025-11-02 02:28:47] L1307 fecha:'01-12-24'->2024-12-01
[2025-11-02 02:28:47] L1308 fecha:'31-12-24'->2024-12-31
[2025-11-02 02:28:47] L1309 fecha:'09-05-24'->2024-05-09
[2025-11-02 02:28:47] L1310 fecha:'30-07-25'->2025-07-30
[2025-11-02 02:28:47] L1311 fecha:'04-11-24'->2024-11-04
[2025-11-02 02:28:47] L1312 fecha:'16-10-24'->2024-10-16
[2025-11-02 02:28:47] L1313 fecha:'08-08-25'->2025-08-08
[2025-11-02 02:28:47] L1314 fecha:'03-04-25'->2025-04-03
[2025-11-02 02:28:47] L1315 fecha:'06-12-24'->2024-12-06
[2025-11-02 02:28:47] L1316 fecha:'19-09-24'->2024-09-19
[2025-11-02 02:28:47] L1317 fecha:'27-05-24'->2024-05-27
[2025-11-02 02:28:47] L1318 fecha:'17-06-25'->2025-06-17
[2025-11-02 02:28:47] L1319 fecha:'04-05-24'->2024-05-04
[2025-11-02 02:28:47] L1320 fecha:'22-03-25'->2025-03-22
[2025-11-02 02:28:47] L1321 fecha:'23-06-25'->2025-06-23
[2025-11-02 02:28:47] L1322 fecha:'25-05-25'->2025-05-25
[2025-11-02 02:28:47] L1323 fecha:'01-07-25'->2025-07-01
[2025-11-02 02:28:47] L1324 fecha:'30-07-24'->2024-07-30
[2025-11-02 02:28:47] L1325 fecha:'15-12-24'->2024-12-15
[2025-11-02 02:28:47] L1326 fecha:'07-07-24'->2024-07-07
[2025-11-02 02:28:47] L1327 fecha:'08-05-24'->2024-05-08
[2025-11-02 02:28:47] L1328 fecha:'06-08-25'->2025-08-06
[2025-11-02 02:28:47] L1329 fecha:'09-04-24'->2024-04-09
[2025-11-02 02:28:47] L1330 fecha:'15-02-25'->2025-02-15
[2025-11-02 02:28:47] L1331 fecha:'19-08-25'->2025-08-19
[2025-11-02 02:28:47] L1332 fecha:'03-02-25'->2025-02-03
[2025-11-02 02:28:47] L1333 fecha:'18-04-25'->2025-04-18
[2025-11-02 02:28:47] L1334 fecha:'08-05-25'->2025-05-08
[2025-11-02 02:28:47] L1335 fecha:'17-09-24'->2024-09-17
[2025-11-02 02:28:47] L1336 fecha:'01-02-25'->2025-02-01
[2025-11-02 02:28:47] L1337 fecha:'18-05-24'->2024-05-18
[2025-11-02 02:28:47] L1338 fecha:'25-04-24'->2024-04-25
[2025-11-02 02:28:47] L1339 fecha:'28-01-24'->2024-01-28
[2025-11-02 02:28:47] L1340 fecha:'08-02-24'->2024-02-08
[2025-11-02 02:28:47] L1341 fecha:'22-05-25'->2025-05-22
[2025-11-02 02:28:47] L1342 fecha:'15-11-24'->2024-11-15
[2025-11-02 02:28:47] L1343 fecha:'15-05-25'->2025-05-15
[2025-11-02 02:28:47] L1344 fecha:'22-10-24'->2024-10-22
[2025-11-02 02:28:47] L1345 fecha:'27-07-24'->2024-07-27
[2025-11-02 02:28:47] L1346 fecha:'11-08-24'->2024-08-11
[2025-11-02 02:28:47] L1347 fecha:'26-08-24'->2024-08-26
[2025-11-02 02:28:47] L1348 fecha:'27-02-25'->2025-02-27
[2025-11-02 02:28:47] L1349 fecha:'03-01-24'->2024-01-03
[2025-11-02 02:28:47] L1350 fecha:'02-03-24'->2024-03-02
[2025-11-02 02:28:47] L1351 fecha:'29-08-25'->2025-08-29
[2025-11-02 02:28:47] L1352 fecha:'11-12-24'->2024-12-11
[2025-11-02 02:28:47] L1353 fecha:'29-06-24'->2024-06-29
[2025-11-02 02:28:47] L1354 fecha:'15-02-24'->2024-02-15
[2025-11-02 02:28:47] L1355 fecha:'07-05-24'->2024-05-07
[2025-11-02 02:28:47] L1356 fecha:'17-02-24'->2024-02-17
[2025-11-02 02:28:47] L1357 fecha:'25-01-25'->2025-01-25
[2025-11-02 02:28:47] L1358 fecha:'25-09-24'->2024-09-25
[2025-11-02 02:28:47] L1359 fecha:'21-09-24'->2024-09-21
[2025-11-02 02:28:47] L1360 fecha:'04-12-24'->2024-12-04
[2025-11-02 02:28:47] L1361 fecha:'24-04-25'->2025-04-24
[2025-11-02 02:28:47] L1362 fecha:'08-01-25'->2025-01-08
[2025-11-02 02:28:47] L1363 fecha:'12-03-25'->2025-03-12
[2025-11-02 02:28:47] L1364 fecha:'23-04-25'->2025-04-23
[2025-11-02 02:28:47] L1365 fecha:'31-08-24'->2024-08-31
[2025-11-02 02:28:47] L1366 fecha:'04-07-25'->2025-07-04
[2025-11-02 02:28:47] L1367 fecha:'12-04-25'->2025-04-12
[2025-11-02 02:28:47] L1368 fecha:'23-02-25'->2025-02-23
[2025-11-02 02:28:47] L1369 fecha:'23-08-25'->2025-08-23
[2025-11-02 02:28:47] L1370 fecha:'06-08-25'->2025-08-06
[2025-11-02 02:28:47] L1371 fecha:'19-02-24'->2024-02-19
[2025-11-02 02:28:47] L1372 fecha:'10-08-25'->2025-08-10
[2025-11-02 02:28:47] L1373 fecha:'20-03-24'->2024-03-20
[2025-11-02 02:28:47] L1374 fecha:'04-01-25'->2025-01-04
[2025-11-02 02:28:47] L1375 fecha:'21-02-24'->2024-02-21
[2025-11-02 02:28:47] L1376 fecha:'13-02-24'->2024-02-13
[2025-11-02 02:28:47] L1377 fecha:'21-10-24'->2024-10-21
[2025-11-02 02:28:47] L1378 fecha:'16-12-24'->2024-12-16
[2025-11-02 02:28:47] L1379 fecha:'29-05-25'->2025-05-29
[2025-11-02 02:28:47] L1380 fecha:'10-04-24'->2024-04-10
[2025-11-02 02:28:47] L1381 fecha:'16-03-25'->2025-03-16
[2025-11-02 02:28:47] L1382 fecha:'15-02-24'->2024-02-15
[2025-11-02 02:28:47] L1383 fecha:'28-08-25'->2025-08-28
[2025-11-02 02:28:47] L1384 fecha:'25-05-25'->2025-05-25
[2025-11-02 02:28:47] L1385 fecha:'26-10-24'->2024-10-26
[2025-11-02 02:28:47] L1386 fecha:'11-03-25'->2025-03-11
[2025-11-02 02:28:47] L1387 fecha:'15-10-24'->2024-10-15
[2025-11-02 02:28:47] L1388 fecha:'06-11-24'->2024-11-06
[2025-11-02 02:28:47] L1389 fecha:'22-09-24'->2024-09-22
[2025-11-02 02:28:47] L1390 fecha:'25-02-25'->2025-02-25
[2025-11-02 02:28:47] L1391 fecha:'21-09-24'->2024-09-21
[2025-11-02 02:28:47] L1392 fecha:'05-08-24'->2024-08-05
[2025-11-02 02:28:47] L1393 fecha:'19-03-25'->2025-03-19
[2025-11-02 02:28:47] L1394 fecha:'23-10-24'->2024-10-23
[2025-11-02 02:28:47] L1395 fecha:'22-06-25'->2025-06-22
[2025-11-02 02:28:47] L1396 fecha:'11-04-25'->2025-04-11
[2025-11-02 02:28:47] L1397 fecha:'29-01-24'->2024-01-29
[2025-11-02 02:28:47] L1398 fecha:'17-08-25'->2025-08-17
[2025-11-02 02:28:47] L1399 fecha:'14-05-24'->2024-05-14
[2025-11-02 02:28:47] L1400 fecha:'18-03-24'->2024-03-18
[2025-11-02 02:28:47] L1401 fecha:'26-08-25'->2025-08-26
[2025-11-02 02:28:47] L1402 fecha:'26-03-25'->2025-03-26
[2025-11-02 02:28:47] L1403 fecha:'25-04-25'->2025-04-25
[2025-11-02 02:28:47] L1404 fecha:'04-10-24'->2024-10-04
[2025-11-02 02:28:47] L1405 fecha:'04-07-24'->2024-07-04
[2025-11-02 02:28:47] L1406 fecha:'27-02-24'->2024-02-27
[2025-11-02 02:28:47] L1407 fecha:'23-04-25'->2025-04-23
[2025-11-02 02:28:47] L1408 fecha:'14-06-25'->2025-06-14
[2025-11-02 02:28:47] L1409 fecha:'15-07-24'->2024-07-15
[2025-11-02 02:28:47] L1410 fecha:'07-06-25'->2025-06-07
[2025-11-02 02:28:47] L1411 fecha:'18-07-25'->2025-07-18
[2025-11-02 02:28:47] L1412 fecha:'19-02-24'->2024-02-19
[2025-11-02 02:28:47] L1413 fecha:'09-09-24'->2024-09-09
[2025-11-02 02:28:47] L1414 fecha:'10-07-24'->2024-07-10
[2025-11-02 02:28:47] L1415 fecha:'16-06-25'->2025-06-16
[2025-11-02 02:28:47] L1416 fecha:'12-01-24'->2024-01-12
[2025-11-02 02:28:47] L1417 fecha:'12-01-24'->2024-01-12
[2025-11-02 02:28:47] L1418 fecha:'12-05-25'->2025-05-12
[2025-11-02 02:28:47] L1419 fecha:'12-01-25'->2025-01-12
[2025-11-02 02:28:47] L1420 fecha:'13-03-25'->2025-03-13
[2025-11-02 02:28:47] L1421 fecha:'05-01-24'->2024-01-05
[2025-11-02 02:28:47] L1422 fecha:'19-01-24'->2024-01-19
[2025-11-02 02:28:47] L1423 fecha:'03-06-25'->2025-06-03
[2025-11-02 02:28:47] L1424 fecha:'14-12-24'->2024-12-14
[2025-11-02 02:28:47] L1425 fecha:'24-05-24'->2024-05-24
[2025-11-02 02:28:47] L1426 fecha:'25-06-25'->2025-06-25
[2025-11-02 02:28:47] L1427 fecha:'08-08-24'->2024-08-08
[2025-11-02 02:28:47] L1428 fecha:'02-01-25'->2025-01-02
[2025-11-02 02:28:47] L1429 fecha:'25-06-25'->2025-06-25
[2025-11-02 02:28:47] L1430 fecha:'10-12-24'->2024-12-10
[2025-11-02 02:28:47] L1431 fecha:'12-10-24'->2024-10-12
[2025-11-02 02:28:47] L1432 fecha:'08-08-24'->2024-08-08
[2025-11-02 02:28:47] L1433 fecha:'23-05-24'->2024-05-23
[2025-11-02 02:28:47] L1434 fecha:'06-05-24'->2024-05-06
[2025-11-02 02:28:47] L1435 fecha:'31-07-24'->2024-07-31
[2025-11-02 02:28:47] L1436 fecha:'01-01-24'->2024-01-01
[2025-11-02 02:28:47] L1437 fecha:'20-08-25'->2025-08-20
[2025-11-02 02:28:47] L1438 fecha:'14-12-24'->2024-12-14
[2025-11-02 02:28:47] L1439 fecha:'03-01-24'->2024-01-03
[2025-11-02 02:28:47] L1440 fecha:'27-06-24'->2024-06-27
[2025-11-02 02:28:47] L1441 fecha:'24-07-24'->2024-07-24
[2025-11-02 02:28:47] L1442 fecha:'20-03-24'->2024-03-20
[2025-11-02 02:28:47] L1443 fecha:'04-08-24'->2024-08-04
[2025-11-02 02:28:47] L1444 fecha:'01-06-24'->2024-06-01
[2025-11-02 02:28:47] L1445 fecha:'02-12-24'->2024-12-02
[2025-11-02 02:28:47] L1446 fecha:'22-10-24'->2024-10-22
[2025-11-02 02:28:47] L1447 fecha:'28-08-24'->2024-08-28
[2025-11-02 02:28:47] L1448 fecha:'19-09-24'->2024-09-19
[2025-11-02 02:28:47] L1449 fecha:'06-07-25'->2025-07-06
[2025-11-02 02:28:47] L1450 fecha:'06-10-24'->2024-10-06
[2025-11-02 02:28:47] L1451 fecha:'08-08-24'->2024-08-08
[2025-11-02 02:28:47] L1452 fecha:'19-04-25'->2025-04-19
[2025-11-02 02:28:47] L1453 fecha:'21-06-25'->2025-06-21
[2025-11-02 02:28:47] L1454 fecha:'09-10-24'->2024-10-09
[2025-11-02 02:28:47] L1455 fecha:'31-07-24'->2024-07-31
[2025-11-02 02:28:47] L1456 fecha:'31-03-25'->2025-03-31
[2025-11-02 02:28:47] L1457 fecha:'03-02-25'->2025-02-03
[2025-11-02 02:28:47] L1458 fecha:'28-08-24'->2024-08-28
[2025-11-02 02:28:47] L1459 fecha:'20-06-25'->2025-06-20
[2025-11-02 02:28:47] L1460 fecha:'16-07-25'->2025-07-16
[2025-11-02 02:28:47] L1461 fecha:'24-11-24'->2024-11-24
[2025-11-02 02:28:47] L1462 fecha:'21-06-24'->2024-06-21
[2025-11-02 02:28:47] L1463 fecha:'16-08-24'->2024-08-16
[2025-11-02 02:28:47] L1464 fecha:'20-11-24'->2024-11-20
[2025-11-02 02:28:47] L1465 fecha:'22-07-25'->2025-07-22
[2025-11-02 02:28:47] L1466 fecha:'01-02-25'->2025-02-01
[2025-11-02 02:28:47] L1467 fecha:'05-03-24'->2024-03-05
[2025-11-02 02:28:47] L1468 fecha:'19-06-24'->2024-06-19
[2025-11-02 02:28:47] L1469 fecha:'22-05-25'->2025-05-22
[2025-11-02 02:28:47] L1470 fecha:'16-04-24'->2024-04-16
[2025-11-02 02:28:47] L1471 fecha:'24-11-24'->2024-11-24
[2025-11-02 02:28:47] L1472 fecha:'05-04-24'->2024-04-05
[2025-11-02 02:28:47] L1473 fecha:'10-03-24'->2024-03-10
[2025-11-02 02:28:47] L1474 fecha:'22-04-25'->2025-04-22
[2025-11-02 02:28:47] L1475 fecha:'26-02-25'->2025-02-26
[2025-11-02 02:28:47] L1476 fecha:'20-07-25'->2025-07-20
[2025-11-02 02:28:47] L1477 fecha:'14-01-25'->2025-01-14
[2025-11-02 02:28:47] L1478 fecha:'27-09-24'->2024-09-27
[2025-11-02 02:28:47] L1479 fecha:'22-11-24'->2024-11-22
[2025-11-02 02:28:47] L1480 fecha:'04-06-24'->2024-06-04
[2025-11-02 02:28:47] L1481 fecha:'12-04-25'->2025-04-12
[2025-11-02 02:28:47] L1482 fecha:'28-08-24'->2024-08-28
[2025-11-02 02:28:47] L1483 fecha:'12-02-24'->2024-02-12
[2025-11-02 02:28:47] L1484 fecha:'24-01-24'->2024-01-24
[2025-11-02 02:28:47] L1485 fecha:'20-04-24'->2024-04-20
[2025-11-02 02:28:47] L1486 fecha:'23-03-24'->2024-03-23
[2025-11-02 02:28:47] L1487 fecha:'11-06-25'->2025-06-11
[2025-11-02 02:28:47] L1488 fecha:'06-07-24'->2024-07-06
[2025-11-02 02:28:47] L1489 fecha:'21-08-24'->2024-08-21
[2025-11-02 02:28:47] L1490 fecha:'29-12-24'->2024-12-29
[2025-11-02 02:28:47] L1491 fecha:'27-01-24'->2024-01-27
[2025-11-02 02:28:47] L1492 fecha:'08-11-24'->2024-11-08
[2025-11-02 02:28:47] L1493 fecha:'22-01-24'->2024-01-22
[2025-11-02 02:28:47] L1494 fecha:'10-02-25'->2025-02-10
[2025-11-02 02:28:47] L1495 fecha:'11-05-24'->2024-05-11
[2025-11-02 02:28:47] L1496 fecha:'14-05-25'->2025-05-14
[2025-11-02 02:28:47] L1497 fecha:'09-05-24'->2024-05-09
[2025-11-02 02:28:47] L1498 fecha:'04-11-24'->2024-11-04
[2025-11-02 02:28:47] L1499 fecha:'22-02-25'->2025-02-22
[2025-11-02 02:28:47] L1500 fecha:'09-07-25'->2025-07-09
[2025-11-02 02:28:47] L1501 fecha:'28-11-24'->2024-11-28
[2025-11-02 02:28:47] L1502 fecha:'13-03-24'->2024-03-13
[2025-11-02 02:28:47] L1503 fecha:'22-03-25'->2025-03-22
[2025-11-02 02:28:47] L1504 fecha:'24-06-24'->2024-06-24
[2025-11-02 02:28:47] L1505 fecha:'30-04-24'->2024-04-30
[2025-11-02 02:28:47] L1506 fecha:'15-03-24'->2024-03-15
[2025-11-02 02:28:47] L1507 fecha:'11-01-24'->2024-01-11
[2025-11-02 02:28:47] L1508 fecha:'30-12-24'->2024-12-30
[2025-11-02 02:28:47] L1509 fecha:'11-11-24'->2024-11-11
[2025-11-02 02:28:47] L1510 fecha:'06-08-24'->2024-08-06
[2025-11-02 02:28:47] L1511 fecha:'25-03-24'->2024-03-25
[2025-11-02 02:28:47] L1512 fecha:'07-07-24'->2024-07-07
[2025-11-02 02:28:47] L1513 fecha:'08-06-25'->2025-06-08
[2025-11-02 02:28:47] L1514 fecha:'05-01-24'->2024-01-05
[2025-11-02 02:28:47] L1515 fecha:'10-12-24'->2024-12-10
[2025-11-02 02:28:47] L1516 fecha:'12-11-24'->2024-11-12
[2025-11-02 02:28:47] L1517 fecha:'18-02-24'->2024-02-18
[2025-11-02 02:28:47] L1518 fecha:'31-05-25'->2025-05-31
[2025-11-02 02:28:47] L1519 fecha:'21-10-24'->2024-10-21
[2025-11-02 02:28:47] L1520 fecha:'10-01-24'->2024-01-10
[2025-11-02 02:28:47] L1521 fecha:'02-02-25'->2025-02-02
[2025-11-02 02:28:47] L1522 fecha:'02-07-24'->2024-07-02
[2025-11-02 02:28:47] L1523 fecha:'22-06-24'->2024-06-22
[2025-11-02 02:28:47] L1524 fecha:'18-03-25'->2025-03-18
[2025-11-02 02:28:47] L1525 fecha:'10-04-25'->2025-04-10
[2025-11-02 02:28:47] L1526 fecha:'19-03-25'->2025-03-19
[2025-11-02 02:28:47] L1527 fecha:'20-05-25'->2025-05-20
[2025-11-02 02:28:47] L1528 fecha:'23-08-24'->2024-08-23
[2025-11-02 02:28:47] L1529 fecha:'24-04-24'->2024-04-24
[2025-11-02 02:28:47] L1530 fecha:'06-08-24'->2024-08-06
[2025-11-02 02:28:47] L1531 fecha:'20-08-24'->2024-08-20
[2025-11-02 02:28:47] L1532 fecha:'16-06-24'->2024-06-16
[2025-11-02 02:28:47] L1533 fecha:'23-07-25'->2025-07-23
[2025-11-02 02:28:47] L1534 fecha:'12-02-25'->2025-02-12
[2025-11-02 02:28:47] L1535 fecha:'05-03-24'->2024-03-05
[2025-11-02 02:28:47] L1536 fecha:'25-04-24'->2024-04-25
[2025-11-02 02:28:47] L1537 fecha:'08-11-24'->2024-11-08
[2025-11-02 02:28:47] L1538 fecha:'25-02-24'->2024-02-25
[2025-11-02 02:28:47] L1539 fecha:'27-01-24'->2024-01-27
[2025-11-02 02:28:47] L1540 fecha:'30-04-25'->2025-04-30
[2025-11-02 02:28:47] L1541 fecha:'08-01-25'->2025-01-08
[2025-11-02 02:28:47] L1542 fecha:'13-08-24'->2024-08-13
[2025-11-02 02:28:47] L1543 fecha:'17-02-24'->2024-02-17
[2025-11-02 02:28:47] L1544 fecha:'10-05-25'->2025-05-10
[2025-11-02 02:28:47] L1545 fecha:'22-04-24'->2024-04-22
[2025-11-02 02:28:47] L1546 fecha:'10-09-24'->2024-09-10
[2025-11-02 02:28:47] L1547 fecha:'10-11-24'->2024-11-10
[2025-11-02 02:28:47] L1548 fecha:'09-10-24'->2024-10-09
[2025-11-02 02:28:47] L1549 fecha:'04-05-25'->2025-05-04
[2025-11-02 02:28:47] L1550 fecha:'25-10-24'->2024-10-25
[2025-11-02 02:28:47] L1551 fecha:'30-12-24'->2024-12-30
[2025-11-02 02:28:47] L1552 fecha:'20-06-25'->2025-06-20
[2025-11-02 02:28:47] L1553 fecha:'08-07-25'->2025-07-08
[2025-11-02 02:28:47] L1554 fecha:'24-08-25'->2025-08-24
[2025-11-02 02:28:47] L1555 fecha:'02-01-24'->2024-01-02
[2025-11-02 02:28:47] L1556 fecha:'02-07-24'->2024-07-02
[2025-11-02 02:28:47] L1557 fecha:'20-03-25'->2025-03-20
[2025-11-02 02:28:47] L1558 fecha:'28-05-25'->2025-05-28
[2025-11-02 02:28:47] L1559 fecha:'14-08-24'->2024-08-14
[2025-11-02 02:28:47] L1560 fecha:'28-02-24'->2024-02-28
[2025-11-02 02:28:47] L1561 fecha:'05-06-24'->2024-06-05
[2025-11-02 02:28:47] L1562 fecha:'02-07-25'->2025-07-02
[2025-11-02 02:28:47] L1563 fecha:'05-07-25'->2025-07-05
[2025-11-02 02:28:47] L1564 fecha:'09-04-25'->2025-04-09
[2025-11-02 02:28:47] L1565 fecha:'18-01-25'->2025-01-18
[2025-11-02 02:28:47] L1566 fecha:'14-04-25'->2025-04-14
[2025-11-02 02:28:47] L1567 fecha:'08-10-24'->2024-10-08
[2025-11-02 02:28:47] L1568 fecha:'15-08-25'->2025-08-15
[2025-11-02 02:28:47] L1569 fecha:'07-01-24'->2024-01-07
[2025-11-02 02:28:47] L1570 fecha:'04-10-24'->2024-10-04
[2025-11-02 02:28:47] L1571 fecha:'11-01-25'->2025-01-11
[2025-11-02 02:28:47] L1572 fecha:'10-09-24'->2024-09-10
[2025-11-02 02:28:47] L1573 fecha:'20-02-24'->2024-02-20
[2025-11-02 02:28:47] L1574 fecha:'28-03-25'->2025-03-28
[2025-11-02 02:28:47] L1575 fecha:'02-03-25'->2025-03-02
[2025-11-02 02:28:47] L1576 fecha:'05-03-24'->2024-03-05
[2025-11-02 02:28:47] L1577 fecha:'04-03-24'->2024-03-04
[2025-11-02 02:28:47] L1578 fecha:'30-05-25'->2025-05-30
[2025-11-02 02:28:47] L1579 fecha:'19-04-25'->2025-04-19
[2025-11-02 02:28:47] L1580 fecha:'24-07-25'->2025-07-24
[2025-11-02 02:28:47] L1581 fecha:'01-02-25'->2025-02-01
[2025-11-02 02:28:47] L1582 fecha:'20-02-25'->2025-02-20
[2025-11-02 02:28:47] L1583 fecha:'06-02-25'->2025-02-06
[2025-11-02 02:28:47] L1584 fecha:'03-04-24'->2024-04-03
[2025-11-02 02:28:47] L1585 fecha:'16-05-24'->2024-05-16
[2025-11-02 02:28:47] L1586 fecha:'29-05-24'->2024-05-29
[2025-11-02 02:28:47] L1587 fecha:'29-01-24'->2024-01-29
[2025-11-02 02:28:47] L1588 fecha:'20-06-24'->2024-06-20
[2025-11-02 02:28:47] L1589 fecha:'30-10-24'->2024-10-30
[2025-11-02 02:28:47] L1590 fecha:'22-03-25'->2025-03-22
[2025-11-02 02:28:47] L1591 fecha:'02-02-24'->2024-02-02
[2025-11-02 02:28:47] L1592 fecha:'03-10-24'->2024-10-03
[2025-11-02 02:28:47] L1593 fecha:'10-07-25'->2025-07-10
[2025-11-02 02:28:47] L1594 fecha:'08-01-25'->2025-01-08
[2025-11-02 02:28:47] L1595 fecha:'02-08-25'->2025-08-02
[2025-11-02 02:28:47] L1596 fecha:'10-05-24'->2024-05-10
[2025-11-02 02:28:47] L1597 fecha:'24-01-25'->2025-01-24
[2025-11-02 02:28:47] L1598 fecha:'11-06-25'->2025-06-11
[2025-11-02 02:28:47] L1599 fecha:'08-04-25'->2025-04-08
[2025-11-02 02:28:47] L1600 fecha:'20-03-24'->2024-03-20
[2025-11-02 02:28:47] L1601 fecha:'22-06-24'->2024-06-22
[2025-11-02 02:28:47] L1602 fecha:'08-08-24'->2024-08-08
[2025-11-02 02:28:47] L1603 fecha:'16-07-25'->2025-07-16
[2025-11-02 02:28:47] L1604 fecha:'01-06-24'->2024-06-01
[2025-11-02 02:28:47] L1605 fecha:'18-07-25'->2025-07-18
[2025-11-02 02:28:47] L1606 fecha:'01-03-24'->2024-03-01
[2025-11-02 02:28:47] L1607 fecha:'13-07-25'->2025-07-13
[2025-11-02 02:28:47] L1608 fecha:'19-08-25'->2025-08-19
[2025-11-02 02:28:47] L1609 fecha:'30-10-24'->2024-10-30
[2025-11-02 02:28:47] L1610 fecha:'09-02-24'->2024-02-09
[2025-11-02 02:28:47] L1611 fecha:'04-04-25'->2025-04-04
[2025-11-02 02:28:47] L1612 fecha:'26-04-25'->2025-04-26
[2025-11-02 02:28:47] L1613 fecha:'25-10-24'->2024-10-25
[2025-11-02 02:28:47] L1614 fecha:'12-02-25'->2025-02-12
[2025-11-02 02:28:47] L1615 fecha:'01-10-24'->2024-10-01
[2025-11-02 02:28:47] L1616 fecha:'27-03-24'->2024-03-27
[2025-11-02 02:28:47] L1617 fecha:'01-03-25'->2025-03-01
[2025-11-02 02:28:47] L1618 fecha:'16-11-24'->2024-11-16
[2025-11-02 02:28:47] L1619 fecha:'22-04-24'->2024-04-22
[2025-11-02 02:28:47] L1620 fecha:'30-08-24'->2024-08-30
[2025-11-02 02:28:47] L1621 fecha:'03-05-25'->2025-05-03
[2025-11-02 02:28:47] L1622 fecha:'30-06-25'->2025-06-30
[2025-11-02 02:28:47] L1623 fecha:'11-07-24'->2024-07-11
[2025-11-02 02:28:47] L1624 fecha:'21-07-25'->2025-07-21
[2025-11-02 02:28:47] L1625 fecha:'05-07-25'->2025-07-05
[2025-11-02 02:28:47] L1626 fecha:'19-02-24'->2024-02-19
[2025-11-02 02:28:47] L1627 fecha:'12-06-24'->2024-06-12
[2025-11-02 02:28:47] L1628 fecha:'20-03-24'->2024-03-20
[2025-11-02 02:28:47] L1629 fecha:'30-03-24'->2024-03-30
[2025-11-02 02:28:47] L1630 fecha:'08-02-24'->2024-02-08
[2025-11-02 02:28:47] L1631 fecha:'11-02-25'->2025-02-11
[2025-11-02 02:28:47] L1632 fecha:'21-09-24'->2024-09-21
[2025-11-02 02:28:47] L1633 fecha:'12-05-24'->2024-05-12
[2025-11-02 02:28:47] L1634 fecha:'14-06-24'->2024-06-14
[2025-11-02 02:28:47] L1635 fecha:'20-05-24'->2024-05-20
[2025-11-02 02:28:47] L1636 fecha:'06-10-24'->2024-10-06
[2025-11-02 02:28:47] L1637 fecha:'05-12-24'->2024-12-05
[2025-11-02 02:28:47] L1638 fecha:'29-04-24'->2024-04-29
[2025-11-02 02:28:47] L1639 fecha:'07-01-24'->2024-01-07
[2025-11-02 02:28:47] L1640 fecha:'03-03-25'->2025-03-03
[2025-11-02 02:28:47] L1641 fecha:'05-09-24'->2024-09-05
[2025-11-02 02:28:47] L1642 fecha:'03-01-25'->2025-01-03
[2025-11-02 02:28:47] L1643 fecha:'11-04-24'->2024-04-11
[2025-11-02 02:28:47] L1644 fecha:'01-04-25'->2025-04-01
[2025-11-02 02:28:47] L1645 fecha:'01-07-24'->2024-07-01
[2025-11-02 02:28:47] L1646 fecha:'09-03-25'->2025-03-09
[2025-11-02 02:28:47] L1647 fecha:'02-02-25'->2025-02-02
[2025-11-02 02:28:47] L1648 fecha:'27-01-25'->2025-01-27
[2025-11-02 02:28:47] L1649 fecha:'08-04-24'->2024-04-08
[2025-11-02 02:28:47] L1650 fecha:'03-03-25'->2025-03-03
[2025-11-02 02:28:47] L1651 fecha:'24-01-24'->2024-01-24
[2025-11-02 02:28:47] L1652 fecha:'08-08-24'->2024-08-08
[2025-11-02 02:28:47] L1653 fecha:'05-03-25'->2025-03-05
[2025-11-02 02:28:47] L1654 fecha:'18-11-24'->2024-11-18
[2025-11-02 02:28:47] L1655 fecha:'25-03-25'->2025-03-25
[2025-11-02 02:28:47] L1656 fecha:'26-04-25'->2025-04-26
[2025-11-02 02:28:47] L1657 fecha:'14-03-25'->2025-03-14
[2025-11-02 02:28:47] L1658 fecha:'09-04-24'->2024-04-09
[2025-11-02 02:28:47] L1659 fecha:'10-09-24'->2024-09-10
[2025-11-02 02:28:47] L1660 fecha:'09-02-24'->2024-02-09
[2025-11-02 02:28:47] L1661 fecha:'15-04-25'->2025-04-15
[2025-11-02 02:28:47] L1662 fecha:'28-07-25'->2025-07-28
[2025-11-02 02:28:47] L1663 fecha:'27-09-24'->2024-09-27
[2025-11-02 02:28:47] L1664 fecha:'21-05-25'->2025-05-21
[2025-11-02 02:28:47] L1665 fecha:'12-05-24'->2024-05-12
[2025-11-02 02:28:47] L1666 fecha:'23-08-24'->2024-08-23
[2025-11-02 02:28:47] L1667 fecha:'20-06-24'->2024-06-20
[2025-11-02 02:28:47] L1668 fecha:'21-02-25'->2025-02-21
[2025-11-02 02:28:47] L1669 fecha:'09-01-25'->2025-01-09
[2025-11-02 02:28:47] L1670 fecha:'13-11-24'->2024-11-13
[2025-11-02 02:28:47] L1671 fecha:'08-01-24'->2024-01-08
[2025-11-02 02:28:47] L1672 fecha:'15-03-24'->2024-03-15
[2025-11-02 02:28:47] L1673 fecha:'01-08-25'->2025-08-01
[2025-11-02 02:28:47] L1674 fecha:'15-03-24'->2024-03-15
[2025-11-02 02:28:47] L1675 fecha:'06-02-24'->2024-02-06
[2025-11-02 02:28:47] L1676 fecha:'28-06-24'->2024-06-28
[2025-11-02 02:28:47] L1677 fecha:'13-08-24'->2024-08-13
[2025-11-02 02:28:47] L1678 fecha:'12-07-24'->2024-07-12
[2025-11-02 02:28:47] L1679 fecha:'15-11-24'->2024-11-15
[2025-11-02 02:28:47] L1680 fecha:'20-02-24'->2024-02-20
[2025-11-02 02:28:47] L1681 fecha:'07-05-25'->2025-05-07
[2025-11-02 02:28:47] L1682 fecha:'04-01-24'->2024-01-04
[2025-11-02 02:28:47] L1683 fecha:'09-05-24'->2024-05-09
[2025-11-02 02:28:47] L1684 fecha:'08-07-24'->2024-07-08
[2025-11-02 02:28:47] L1685 fecha:'02-08-25'->2025-08-02
[2025-11-02 02:28:47] L1686 fecha:'31-07-25'->2025-07-31
[2025-11-02 02:28:47] L1687 fecha:'09-08-24'->2024-08-09
[2025-11-02 02:28:47] L1688 fecha:'01-10-24'->2024-10-01
[2025-11-02 02:28:47] L1689 fecha:'23-04-24'->2024-04-23
[2025-11-02 02:28:47] L1690 fecha:'11-01-24'->2024-01-11
[2025-11-02 02:28:47] L1691 fecha:'14-01-24'->2024-01-14
[2025-11-02 02:28:47] L1692 fecha:'05-05-25'->2025-05-05
[2025-11-02 02:28:47] L1693 fecha:'15-05-24'->2024-05-15
[2025-11-02 02:28:47] L1694 fecha:'10-02-24'->2024-02-10
[2025-11-02 02:28:47] L1695 fecha:'17-04-24'->2024-04-17
[2025-11-02 02:28:47] L1696 fecha:'12-05-24'->2024-05-12
[2025-11-02 02:28:47] L1697 fecha:'25-06-25'->2025-06-25
[2025-11-02 02:28:47] L1698 fecha:'05-05-25'->2025-05-05
[2025-11-02 02:28:47] L1699 fecha:'10-06-25'->2025-06-10
[2025-11-02 02:28:47] L1700 fecha:'25-03-24'->2024-03-25
[2025-11-02 02:28:47] L1701 fecha:'06-03-25'->2025-03-06
[2025-11-02 02:28:47] L1702 fecha:'09-01-25'->2025-01-09
[2025-11-02 02:28:47] L1703 fecha:'16-05-25'->2025-05-16
[2025-11-02 02:28:47] L1704 fecha:'06-05-25'->2025-05-06
[2025-11-02 02:28:47] L1705 fecha:'11-12-24'->2024-12-11
[2025-11-02 02:28:47] L1706 fecha:'03-05-25'->2025-05-03
[2025-11-02 02:28:47] L1707 fecha:'19-04-25'->2025-04-19
[2025-11-02 02:28:47] L1708 fecha:'30-04-25'->2025-04-30
[2025-11-02 02:28:47] L1709 fecha:'04-03-24'->2024-03-04
[2025-11-02 02:28:47] L1710 fecha:'20-04-24'->2024-04-20
[2025-11-02 02:28:47] L1711 fecha:'09-04-25'->2025-04-09
[2025-11-02 02:28:47] L1712 fecha:'05-02-25'->2025-02-05
[2025-11-02 02:28:47] L1713 fecha:'14-10-24'->2024-10-14
[2025-11-02 02:28:47] L1714 fecha:'20-03-25'->2025-03-20
[2025-11-02 02:28:47] L1715 fecha:'15-06-25'->2025-06-15
[2025-11-02 02:28:47] L1716 fecha:'05-03-25'->2025-03-05
[2025-11-02 02:28:47] L1717 fecha:'31-07-24'->2024-07-31
[2025-11-02 02:28:47] L1718 fecha:'06-05-25'->2025-05-06
[2025-11-02 02:28:47] L1719 fecha:'28-03-25'->2025-03-28
[2025-11-02 02:28:47] L1720 fecha:'30-08-25'->2025-08-30
[2025-11-02 02:28:47] L1721 fecha:'21-02-24'->2024-02-21
[2025-11-02 02:28:47] L1722 fecha:'05-03-24'->2024-03-05
[2025-11-02 02:28:47] L1723 fecha:'14-08-24'->2024-08-14
[2025-11-02 02:28:47] L1724 fecha:'02-02-25'->2025-02-02
[2025-11-02 02:28:47] L1725 fecha:'09-01-24'->2024-01-09
[2025-11-02 02:28:47] L1726 fecha:'07-07-24'->2024-07-07
[2025-11-02 02:28:47] L1727 fecha:'09-10-24'->2024-10-09
[2025-11-02 02:28:47] L1728 fecha:'24-03-24'->2024-03-24
[2025-11-02 02:28:47] L1729 fecha:'21-06-24'->2024-06-21
[2025-11-02 02:28:47] L1730 fecha:'10-02-25'->2025-02-10
[2025-11-02 02:28:47] L1731 fecha:'24-06-25'->2025-06-24
[2025-11-02 02:28:47] L1732 fecha:'10-11-24'->2024-11-10
[2025-11-02 02:28:47] L1733 fecha:'15-06-25'->2025-06-15
[2025-11-02 02:28:47] L1734 fecha:'09-02-24'->2024-02-09
[2025-11-02 02:28:47] L1735 fecha:'17-04-25'->2025-04-17
[2025-11-02 02:28:47] L1736 fecha:'10-04-24'->2024-04-10
[2025-11-02 02:28:47] L1737 fecha:'11-12-24'->2024-12-11
[2025-11-02 02:28:47] L1738 fecha:'14-03-25'->2025-03-14
[2025-11-02 02:28:47] L1739 fecha:'04-12-24'->2024-12-04
[2025-11-02 02:28:47] L1740 fecha:'25-07-25'->2025-07-25
[2025-11-02 02:28:47] L1741 fecha:'27-02-24'->2024-02-27
[2025-11-02 02:28:47] L1742 fecha:'05-05-25'->2025-05-05
[2025-11-02 02:28:47] L1743 fecha:'04-10-24'->2024-10-04
[2025-11-02 02:28:47] L1744 fecha:'23-10-24'->2024-10-23
[2025-11-02 02:28:47] L1745 fecha:'20-03-25'->2025-03-20
[2025-11-02 02:28:47] L1746 fecha:'15-07-25'->2025-07-15
[2025-11-02 02:28:47] L1747 fecha:'14-04-24'->2024-04-14
[2025-11-02 02:28:47] L1748 fecha:'19-01-25'->2025-01-19
[2025-11-02 02:28:47] L1749 fecha:'05-07-24'->2024-07-05
[2025-11-02 02:28:47] L1750 fecha:'12-05-25'->2025-05-12
[2025-11-02 02:28:47] L1751 fecha:'23-06-24'->2024-06-23
[2025-11-02 02:28:47] L1752 fecha:'15-02-25'->2025-02-15
[2025-11-02 02:28:47] L1753 fecha:'18-01-24'->2024-01-18
[2025-11-02 02:28:47] L1754 fecha:'13-05-25'->2025-05-13
[2025-11-02 02:28:47] L1755 fecha:'21-02-24'->2024-02-21
[2025-11-02 02:28:47] L1756 fecha:'05-07-24'->2024-07-05
[2025-11-02 02:28:47] L1757 fecha:'10-08-25'->2025-08-10
[2025-11-02 02:28:47] L1758 fecha:'08-03-24'->2024-03-08
[2025-11-02 02:28:47] L1759 fecha:'27-04-25'->2025-04-27
[2025-11-02 02:28:47] L1760 fecha:'18-09-24'->2024-09-18
[2025-11-02 02:28:47] L1761 fecha:'27-11-24'->2024-11-27
[2025-11-02 02:28:47] L1762 fecha:'25-08-25'->2025-08-25
[2025-11-02 02:28:47] L1763 fecha:'02-08-24'->2024-08-02
[2025-11-02 02:28:47] L1764 fecha:'01-03-24'->2024-03-01
[2025-11-02 02:28:47] L1765 fecha:'13-11-24'->2024-11-13
[2025-11-02 02:28:47] L1766 fecha:'10-05-24'->2024-05-10
[2025-11-02 02:28:47] L1767 fecha:'14-05-25'->2025-05-14
[2025-11-02 02:28:47] L1768 fecha:'31-12-24'->2024-12-31
[2025-11-02 02:28:47] L1769 fecha:'29-02-24'->2024-02-29
[2025-11-02 02:28:47] L1770 fecha:'02-07-25'->2025-07-02
[2025-11-02 02:28:47] L1771 fecha:'20-08-25'->2025-08-20
[2025-11-02 02:28:47] L1772 fecha:'04-11-24'->2024-11-04
[2025-11-02 02:28:47] L1773 fecha:'09-11-24'->2024-11-09
[2025-11-02 02:28:47] L1774 fecha:'29-06-25'->2025-06-29
[2025-11-02 02:28:47] L1775 fecha:'14-06-25'->2025-06-14
[2025-11-02 02:28:47] L1776 fecha:'12-02-24'->2024-02-12
[2025-11-02 02:28:47] L1777 fecha:'08-09-24'->2024-09-08
[2025-11-02 02:28:47] L1778 fecha:'27-04-25'->2025-04-27
[2025-11-02 02:28:47] L1779 fecha:'07-04-24'->2024-04-07
[2025-11-02 02:28:47] L1780 fecha:'18-03-24'->2024-03-18
[2025-11-02 02:28:47] L1781 fecha:'14-08-25'->2025-08-14
[2025-11-02 02:28:47] L1782 fecha:'29-06-24'->2024-06-29
[2025-11-02 02:28:47] L1783 fecha:'05-06-25'->2025-06-05
[2025-11-02 02:28:47] L1784 fecha:'19-05-25'->2025-05-19
[2025-11-02 02:28:47] L1785 fecha:'05-08-25'->2025-08-05
[2025-11-02 02:28:47] L1786 fecha:'14-06-25'->2025-06-14
[2025-11-02 02:28:47] L1787 fecha:'08-08-25'->2025-08-08
[2025-11-02 02:28:47] L1788 fecha:'22-03-25'->2025-03-22
[2025-11-02 02:28:47] L1789 fecha:'20-04-24'->2024-04-20
[2025-11-02 02:28:47] L1790 fecha:'02-12-24'->2024-12-02
[2025-11-02 02:28:47] L1791 fecha:'01-08-25'->2025-08-01
[2025-11-02 02:28:47] L1792 fecha:'15-09-24'->2024-09-15
[2025-11-02 02:28:47] L1793 fecha:'09-08-24'->2024-08-09
[2025-11-02 02:28:47] L1794 fecha:'20-04-24'->2024-04-20
[2025-11-02 02:28:47] L1795 fecha:'24-05-24'->2024-05-24
[2025-11-02 02:28:47] L1796 fecha:'29-12-24'->2024-12-29
[2025-11-02 02:28:47] L1797 fecha:'09-05-24'->2024-05-09
[2025-11-02 02:28:47] L1798 fecha:'06-02-25'->2025-02-06
[2025-11-02 02:28:47] L1799 fecha:'16-11-24'->2024-11-16
[2025-11-02 02:28:47] L1800 fecha:'02-12-24'->2024-12-02
[2025-11-02 02:28:47] L1801 fecha:'08-06-24'->2024-06-08
[2025-11-02 02:28:47] L1802 fecha:'26-05-25'->2025-05-26
[2025-11-02 02:28:47] L1803 fecha:'01-08-25'->2025-08-01
[2025-11-02 02:28:47] L1804 fecha:'22-02-25'->2025-02-22
[2025-11-02 02:28:47] L1805 fecha:'02-10-24'->2024-10-02
[2025-11-02 02:28:47] L1806 fecha:'22-05-24'->2024-05-22
[2025-11-02 02:28:47] L1807 fecha:'01-08-25'->2025-08-01
[2025-11-02 02:28:47] L1808 fecha:'12-11-24'->2024-11-12
[2025-11-02 02:28:47] L1809 fecha:'27-07-24'->2024-07-27
[2025-11-02 02:28:47] L1810 fecha:'23-05-25'->2025-05-23
[2025-11-02 02:28:47] L1811 fecha:'22-01-24'->2024-01-22
[2025-11-02 02:28:47] L1812 fecha:'15-02-24'->2024-02-15
[2025-11-02 02:28:47] L1813 fecha:'05-07-25'->2025-07-05
[2025-11-02 02:28:47] L1814 fecha:'15-01-25'->2025-01-15
[2025-11-02 02:28:47] L1815 fecha:'30-01-24'->2024-01-30
[2025-11-02 02:28:47] L1816 fecha:'30-08-24'->2024-08-30
[2025-11-02 02:28:47] L1817 fecha:'27-05-25'->2025-05-27
[2025-11-02 02:28:47] L1818 fecha:'16-11-24'->2024-11-16
[2025-11-02 02:28:47] L1819 fecha:'26-02-24'->2024-02-26
[2025-11-02 02:28:47] L1820 fecha:'11-04-25'->2025-04-11
[2025-11-02 02:28:47] L1821 fecha:'25-09-24'->2024-09-25
[2025-11-02 02:28:47] L1822 fecha:'25-01-25'->2025-01-25
[2025-11-02 02:28:47] L1823 fecha:'19-02-25'->2025-02-19
[2025-11-02 02:28:47] L1824 fecha:'18-12-24'->2024-12-18
[2025-11-02 02:28:47] L1825 fecha:'03-05-24'->2024-05-03
[2025-11-02 02:28:47] L1826 fecha:'07-11-24'->2024-11-07
[2025-11-02 02:28:47] L1827 fecha:'06-08-24'->2024-08-06
[2025-11-02 02:28:47] L1828 fecha:'14-11-24'->2024-11-14
[2025-11-02 02:28:47] L1829 fecha:'10-07-24'->2024-07-10
[2025-11-02 02:28:47] L1830 fecha:'22-06-24'->2024-06-22
[2025-11-02 02:28:47] L1831 fecha:'01-08-25'->2025-08-01
[2025-11-02 02:28:47] L1832 fecha:'13-01-25'->2025-01-13
[2025-11-02 02:28:47] L1833 fecha:'23-12-24'->2024-12-23
[2025-11-02 02:28:47] L1834 fecha:'29-08-24'->2024-08-29
[2025-11-02 02:28:47] L1835 fecha:'10-08-25'->2025-08-10
[2025-11-02 02:28:47] L1836 fecha:'13-03-24'->2024-03-13
[2025-11-02 02:28:47] L1837 fecha:'06-03-25'->2025-03-06
[2025-11-02 02:28:47] L1838 fecha:'26-04-24'->2024-04-26
[2025-11-02 02:28:47] L1839 fecha:'08-03-25'->2025-03-08
[2025-11-02 02:28:47] L1840 fecha:'08-12-24'->2024-12-08
[2025-11-02 02:28:47] L1841 fecha:'13-06-24'->2024-06-13
[2025-11-02 02:28:47] L1842 fecha:'11-03-25'->2025-03-11
[2025-11-02 02:28:47] L1843 fecha:'29-03-25'->2025-03-29
[2025-11-02 02:28:47] L1844 fecha:'14-07-24'->2024-07-14
[2025-11-02 02:28:47] L1845 fecha:'18-05-24'->2024-05-18
[2025-11-02 02:28:47] L1846 fecha:'02-02-25'->2025-02-02
[2025-11-02 02:28:47] L1847 fecha:'01-02-24'->2024-02-01
[2025-11-02 02:28:47] L1848 fecha:'10-11-24'->2024-11-10
[2025-11-02 02:28:47] L1849 fecha:'07-08-24'->2024-08-07
[2025-11-02 02:28:47] L1850 fecha:'01-07-24'->2024-07-01
[2025-11-02 02:28:47] L1851 fecha:'26-06-24'->2024-06-26
[2025-11-02 02:28:47] L1852 fecha:'10-07-25'->2025-07-10
[2025-11-02 02:28:47] L1853 fecha:'09-01-25'->2025-01-09
[2025-11-02 02:28:47] L1854 fecha:'06-03-24'->2024-03-06
[2025-11-02 02:28:47] L1855 fecha:'29-03-24'->2024-03-29
[2025-11-02 02:28:47] L1856 fecha:'23-09-24'->2024-09-23
[2025-11-02 02:28:47] L1857 fecha:'13-03-25'->2025-03-13
[2025-11-02 02:28:47] L1858 fecha:'14-01-25'->2025-01-14
[2025-11-02 02:28:47] L1859 fecha:'30-03-25'->2025-03-30
[2025-11-02 02:28:47] L1860 fecha:'04-10-24'->2024-10-04
[2025-11-02 02:28:47] L1861 fecha:'27-03-25'->2025-03-27
[2025-11-02 02:28:47] L1862 fecha:'16-10-24'->2024-10-16
[2025-11-02 02:28:47] L1863 fecha:'18-04-24'->2024-04-18
[2025-11-02 02:28:47] L1864 fecha:'19-05-24'->2024-05-19
[2025-11-02 02:28:47] L1865 fecha:'07-01-24'->2024-01-07
[2025-11-02 02:28:47] L1866 fecha:'21-06-24'->2024-06-21
[2025-11-02 02:28:47] L1867 fecha:'17-09-24'->2024-09-17
[2025-11-02 02:28:47] L1868 fecha:'07-07-25'->2025-07-07
[2025-11-02 02:28:47] L1869 fecha:'04-07-24'->2024-07-04
[2025-11-02 02:28:47] L1870 fecha:'28-08-24'->2024-08-28
[2025-11-02 02:28:47] L1871 fecha:'02-04-24'->2024-04-02
[2025-11-02 02:28:47] L1872 fecha:'18-07-24'->2024-07-18
[2025-11-02 02:28:47] L1873 fecha:'29-11-24'->2024-11-29
[2025-11-02 02:28:47] L1874 fecha:'20-06-25'->2025-06-20
[2025-11-02 02:28:47] L1875 fecha:'10-01-24'->2024-01-10
[2025-11-02 02:28:47] L1876 fecha:'09-06-24'->2024-06-09
[2025-11-02 02:28:47] L1877 fecha:'05-12-24'->2024-12-05
[2025-11-02 02:28:47] L1878 fecha:'01-05-24'->2024-05-01
[2025-11-02 02:28:47] L1879 fecha:'05-03-24'->2024-03-05
[2025-11-02 02:28:47] L1880 fecha:'08-11-24'->2024-11-08
[2025-11-02 02:28:47] L1881 fecha:'01-03-24'->2024-03-01
[2025-11-02 02:28:47] L1882 fecha:'01-05-24'->2024-05-01
[2025-11-02 02:28:47] L1883 fecha:'09-05-24'->2024-05-09
[2025-11-02 02:28:47] L1884 fecha:'08-08-24'->2024-08-08
[2025-11-02 02:28:47] L1885 fecha:'24-04-25'->2025-04-24
[2025-11-02 02:28:47] L1886 fecha:'09-03-24'->2024-03-09
[2025-11-02 02:28:47] L1887 fecha:'10-09-24'->2024-09-10
[2025-11-02 02:28:47] L1888 fecha:'15-07-24'->2024-07-15
[2025-11-02 02:28:47] L1889 fecha:'04-01-24'->2024-01-04
[2025-11-02 02:28:47] L1890 fecha:'24-02-24'->2024-02-24
[2025-11-02 02:28:47] L1891 fecha:'26-06-24'->2024-06-26
[2025-11-02 02:28:47] L1892 fecha:'19-08-24'->2024-08-19
[2025-11-02 02:28:47] L1893 fecha:'18-06-25'->2025-06-18
[2025-11-02 02:28:47] L1894 fecha:'04-03-24'->2024-03-04
[2025-11-02 02:28:47] L1895 fecha:'25-06-25'->2025-06-25
[2025-11-02 02:28:47] L1896 fecha:'23-05-24'->2024-05-23
[2025-11-02 02:28:47] L1897 fecha:'29-03-24'->2024-03-29
[2025-11-02 02:28:47] L1898 fecha:'10-01-24'->2024-01-10
[2025-11-02 02:28:47] L1899 fecha:'02-02-25'->2025-02-02
[2025-11-02 02:28:47] L1900 fecha:'20-04-24'->2024-04-20
[2025-11-02 02:28:47] L1901 fecha:'03-04-25'->2025-04-03
[2025-11-02 02:28:47] L1902 fecha:'07-11-24'->2024-11-07
[2025-11-02 02:28:47] L1903 fecha:'15-04-24'->2024-04-15
[2025-11-02 02:28:47] L1904 fecha:'13-06-24'->2024-06-13
[2025-11-02 02:28:47] L1905 fecha:'21-02-25'->2025-02-21
[2025-11-02 02:28:47] L1906 fecha:'16-01-25'->2025-01-16
[2025-11-02 02:28:47] L1907 fecha:'08-12-24'->2024-12-08
[2025-11-02 02:28:47] L1908 fecha:'04-11-24'->2024-11-04
[2025-11-02 02:28:47] L1909 fecha:'03-09-24'->2024-09-03
[2025-11-02 02:28:47] L1910 fecha:'17-06-25'->2025-06-17
[2025-11-02 02:28:47] L1911 fecha:'27-06-25'->2025-06-27
[2025-11-02 02:28:47] L1912 fecha:'07-05-25'->2025-05-07
[2025-11-02 02:28:47] L1913 fecha:'01-02-24'->2024-02-01
[2025-11-02 02:28:47] L1914 fecha:'12-11-24'->2024-11-12
[2025-11-02 02:28:47] L1915 fecha:'21-04-24'->2024-04-21
[2025-11-02 02:28:47] L1916 fecha:'31-10-24'->2024-10-31
[2025-11-02 02:28:47] L1917 fecha:'17-04-24'->2024-04-17
[2025-11-02 02:28:47] L1918 fecha:'20-08-25'->2025-08-20
[2025-11-02 02:28:47] L1919 fecha:'02-06-25'->2025-06-02
[2025-11-02 02:28:47] L1920 fecha:'01-07-25'->2025-07-01
[2025-11-02 02:28:47] L1921 fecha:'23-02-25'->2025-02-23
[2025-11-02 02:28:47] L1922 fecha:'10-02-24'->2024-02-10
[2025-11-02 02:28:47] L1923 fecha:'09-04-25'->2025-04-09
[2025-11-02 02:28:47] L1924 fecha:'19-09-24'->2024-09-19
[2025-11-02 02:28:47] L1925 fecha:'23-05-24'->2024-05-23
[2025-11-02 02:28:47] L1926 fecha:'19-11-24'->2024-11-19
[2025-11-02 02:28:47] L1927 fecha:'25-11-24'->2024-11-25
[2025-11-02 02:28:47] L1928 fecha:'19-08-24'->2024-08-19
[2025-11-02 02:28:47] L1929 fecha:'11-01-24'->2024-01-11
[2025-11-02 02:28:47] L1930 fecha:'18-07-24'->2024-07-18
[2025-11-02 02:28:47] L1931 fecha:'23-01-24'->2024-01-23
[2025-11-02 02:28:47] L1932 fecha:'31-08-24'->2024-08-31
[2025-11-02 02:28:47] L1933 fecha:'29-06-25'->2025-06-29
[2025-11-02 02:28:47] L1934 fecha:'26-10-24'->2024-10-26
[2025-11-02 02:28:47] L1935 fecha:'30-08-24'->2024-08-30
[2025-11-02 02:28:47] L1936 fecha:'13-07-25'->2025-07-13
[2025-11-02 02:28:47] L1937 fecha:'27-01-24'->2024-01-27
[2025-11-02 02:28:47] L1938 fecha:'26-04-25'->2025-04-26
[2025-11-02 02:28:47] L1939 fecha:'10-06-24'->2024-06-10
[2025-11-02 02:28:47] L1940 fecha:'31-08-24'->2024-08-31
[2025-11-02 02:28:47] L1941 fecha:'05-08-25'->2025-08-05
[2025-11-02 02:28:47] L1942 fecha:'13-11-24'->2024-11-13
[2025-11-02 02:28:47] L1943 fecha:'08-06-24'->2024-06-08
[2025-11-02 02:28:47] L1944 fecha:'04-11-24'->2024-11-04
[2025-11-02 02:28:47] L1945 fecha:'05-02-24'->2024-02-05
[2025-11-02 02:28:47] L1946 fecha:'23-06-24'->2024-06-23
[2025-11-02 02:28:47] L1947 fecha:'30-10-24'->2024-10-30
[2025-11-02 02:28:47] L1948 fecha:'30-07-25'->2025-07-30
[2025-11-02 02:28:47] L1949 fecha:'01-03-25'->2025-03-01
[2025-11-02 02:28:47] L1950 fecha:'20-01-24'->2024-01-20
[2025-11-02 02:28:47] L1951 fecha:'19-01-25'->2025-01-19
[2025-11-02 02:28:47] L1952 fecha:'09-01-25'->2025-01-09
[2025-11-02 02:28:47] L1953 fecha:'28-01-24'->2024-01-28
[2025-11-02 02:28:47] L1954 fecha:'24-06-24'->2024-06-24
[2025-11-02 02:28:47] L1955 fecha:'22-05-24'->2024-05-22
[2025-11-02 02:28:47] L1956 fecha:'08-04-24'->2024-04-08
[2025-11-02 02:28:47] L1957 fecha:'09-08-25'->2025-08-09
[2025-11-02 02:28:47] L1958 fecha:'27-07-24'->2024-07-27
[2025-11-02 02:28:47] L1959 fecha:'28-08-24'->2024-08-28
[2025-11-02 02:28:47] L1960 fecha:'25-05-24'->2024-05-25
[2025-11-02 02:28:47] L1961 fecha:'01-10-24'->2024-10-01
[2025-11-02 02:28:47] L1962 fecha:'15-01-25'->2025-01-15
[2025-11-02 02:28:47] L1963 fecha:'25-02-25'->2025-02-25
[2025-11-02 02:28:47] L1964 fecha:'20-03-24'->2024-03-20
[2025-11-02 02:28:47] L1965 fecha:'26-10-24'->2024-10-26
[2025-11-02 02:28:47] L1966 fecha:'03-02-24'->2024-02-03
[2025-11-02 02:28:47] L1967 fecha:'25-01-25'->2025-01-25
[2025-11-02 02:28:47] L1968 fecha:'26-04-24'->2024-04-26
[2025-11-02 02:28:47] L1969 fecha:'09-08-25'->2025-08-09
[2025-11-02 02:28:47] L1970 fecha:'12-05-24'->2024-05-12
[2025-11-02 02:28:47] L1971 fecha:'23-01-24'->2024-01-23
[2025-11-02 02:28:47] L1972 fecha:'26-09-24'->2024-09-26
[2025-11-02 02:28:47] L1973 fecha:'20-05-25'->2025-05-20
[2025-11-02 02:28:47] L1974 fecha:'28-02-25'->2025-02-28
[2025-11-02 02:28:47] L1975 fecha:'09-11-24'->2024-11-09
[2025-11-02 02:28:47] L1976 fecha:'10-02-25'->2025-02-10
[2025-11-02 02:28:47] L1977 fecha:'25-02-24'->2024-02-25
[2025-11-02 02:28:47] L1978 fecha:'21-07-24'->2024-07-21
[2025-11-02 02:28:47] L1979 fecha:'27-07-24'->2024-07-27
[2025-11-02 02:28:47] L1980 fecha:'19-03-25'->2025-03-19
[2025-11-02 02:28:47] L1981 fecha:'07-01-24'->2024-01-07
[2025-11-02 02:28:47] L1982 fecha:'01-10-24'->2024-10-01
[2025-11-02 02:28:47] L1983 fecha:'22-06-24'->2024-06-22
[2025-11-02 02:28:47] L1984 fecha:'16-12-24'->2024-12-16
[2025-11-02 02:28:47] L1985 fecha:'20-06-24'->2024-06-20
[2025-11-02 02:28:47] L1986 fecha:'15-09-24'->2024-09-15
[2025-11-02 02:28:47] L1987 fecha:'21-07-24'->2024-07-21
[2025-11-02 02:28:47] L1988 fecha:'03-02-25'->2025-02-03
[2025-11-02 02:28:47] L1989 fecha:'31-07-24'->2024-07-31
[2025-11-02 02:28:47] L1990 fecha:'03-07-24'->2024-07-03
[2025-11-02 02:28:47] L1991 fecha:'29-12-24'->2024-12-29
[2025-11-02 02:28:47] L1992 fecha:'06-07-24'->2024-07-06
[2025-11-02 02:28:47] L1993 fecha:'02-10-24'->2024-10-02
[2025-11-02 02:28:47] L1994 fecha:'18-09-24'->2024-09-18
[2025-11-02 02:28:47] L1995 fecha:'13-11-24'->2024-11-13
[2025-11-02 02:28:47] L1996 fecha:'23-03-24'->2024-03-23
[2025-11-02 02:28:47] L1997 fecha:'03-08-25'->2025-08-03
[2025-11-02 02:28:47] L1998 fecha:'13-06-25'->2025-06-13
[2025-11-02 02:28:47] L1999 fecha:'15-04-24'->2024-04-15
[2025-11-02 02:28:47] L2000 fecha:'24-05-24'->2024-05-24
[2025-11-02 02:28:47] L2001 fecha:'02-08-24'->2024-08-02
[2025-11-02 02:28:47] L2002 fecha:'30-01-25'->2025-01-30
[2025-11-02 02:28:47] L2003 fecha:'02-02-25'->2025-02-02
[2025-11-02 02:28:47] L2004 fecha:'25-04-25'->2025-04-25
[2025-11-02 02:28:47] L2005 fecha:'08-08-25'->2025-08-08
[2025-11-02 02:28:47] L2006 fecha:'02-05-24'->2024-05-02
[2025-11-02 02:28:47] L2007 fecha:'06-04-25'->2025-04-06
[2025-11-02 02:28:47] L2008 fecha:'22-07-24'->2024-07-22
[2025-11-02 02:28:47] L2009 fecha:'25-03-24'->2024-03-25
[2025-11-02 02:28:47] L2010 fecha:'27-02-25'->2025-02-27
[2025-11-02 02:28:47] L2011 fecha:'28-05-24'->2024-05-28
[2025-11-02 02:28:47] L2012 fecha:'02-08-25'->2025-08-02
[2025-11-02 02:28:47] L2013 fecha:'02-09-24'->2024-09-02
[2025-11-02 02:28:47] L2014 fecha:'16-01-24'->2024-01-16
[2025-11-02 02:28:47] L2015 fecha:'13-07-24'->2024-07-13
[2025-11-02 02:28:47] L2016 fecha:'10-06-25'->2025-06-10
[2025-11-02 02:28:47] L2017 fecha:'08-12-24'->2024-12-08
[2025-11-02 02:28:47] L2018 fecha:'02-05-24'->2024-05-02
[2025-11-02 02:28:47] L2019 fecha:'14-02-24'->2024-02-14
[2025-11-02 02:28:47] L2020 fecha:'18-05-25'->2025-05-18
[2025-11-02 02:28:47] L2021 fecha:'02-07-24'->2024-07-02
[2025-11-02 02:28:47] L2022 fecha:'28-08-24'->2024-08-28
[2025-11-02 02:28:47] L2023 fecha:'15-10-24'->2024-10-15
[2025-11-02 02:28:47] L2024 fecha:'10-05-24'->2024-05-10
[2025-11-02 02:28:47] L2025 fecha:'10-05-25'->2025-05-10
[2025-11-02 02:28:47] L2026 fecha:'18-06-24'->2024-06-18
[2025-11-02 02:28:47] L2027 fecha:'07-07-24'->2024-07-07
[2025-11-02 02:28:47] L2028 fecha:'29-12-24'->2024-12-29
[2025-11-02 02:28:47] L2029 fecha:'01-09-24'->2024-09-01
[2025-11-02 02:28:47] L2030 fecha:'04-11-24'->2024-11-04
[2025-11-02 02:28:47] L2031 RUN paciente 621187-9 sin referencia -> ERR
[2025-11-02 02:28:47] L2032 fecha:'15-11-24'->2024-11-15
[2025-11-02 02:28:47] L2033 fecha:'27-10-24'->2024-10-27
[2025-11-02 02:28:47] L2034 fecha:'21-08-24'->2024-08-21
[2025-11-02 02:28:47] L2035 fecha:'06-02-25'->2025-02-06
[2025-11-02 02:28:47] L2036 fecha:'20-01-24'->2024-01-20
[2025-11-02 02:28:47] L2037 fecha:'25-05-25'->2025-05-25
[2025-11-02 02:28:47] L2038 fecha:'26-06-25'->2025-06-26
[2025-11-02 02:28:47] L2039 fecha:'23-08-24'->2024-08-23
[2025-11-02 02:28:47] L2040 fecha:'05-03-24'->2024-03-05
[2025-11-02 02:28:47] L2041 fecha:'09-06-24'->2024-06-09
[2025-11-02 02:28:47] L2042 fecha:'26-02-24'->2024-02-26
[2025-11-02 02:28:47] L2043 fecha:'20-10-24'->2024-10-20
[2025-11-02 02:28:47] L2044 fecha:'16-07-25'->2025-07-16
[2025-11-02 02:28:47] L2045 fecha:'30-03-24'->2024-03-30
[2025-11-02 02:28:47] L2046 fecha:'28-06-25'->2025-06-28
[2025-11-02 02:28:47] L2047 fecha:'23-08-25'->2025-08-23
[2025-11-02 02:28:47] L2048 fecha:'17-06-25'->2025-06-17
[2025-11-02 02:28:47] L2049 fecha:'01-05-25'->2025-05-01
[2025-11-02 02:28:47] L2050 fecha:'19-10-24'->2024-10-19
[2025-11-02 02:28:47] L2051 fecha:'10-07-24'->2024-07-10
[2025-11-02 02:28:47] L2052 fecha:'19-11-24'->2024-11-19
[2025-11-02 02:28:47] L2053 fecha:'25-08-25'->2025-08-25
[2025-11-02 02:28:47] L2054 fecha:'08-10-24'->2024-10-08
[2025-11-02 02:28:47] L2055 fecha:'06-02-24'->2024-02-06
[2025-11-02 02:28:47] L2056 fecha:'31-05-24'->2024-05-31
[2025-11-02 02:28:47] L2057 fecha:'17-05-24'->2024-05-17
[2025-11-02 02:28:47] L2058 fecha:'18-10-24'->2024-10-18
[2025-11-02 02:28:47] L2059 fecha:'16-04-24'->2024-04-16
[2025-11-02 02:28:47] L2060 fecha:'13-05-25'->2025-05-13
[2025-11-02 02:28:47] L2061 fecha:'31-05-25'->2025-05-31
[2025-11-02 02:28:47] L2062 fecha:'14-02-24'->2024-02-14
[2025-11-02 02:28:47] L2063 fecha:'07-07-24'->2024-07-07
[2025-11-02 02:28:47] L2064 fecha:'12-11-24'->2024-11-12
[2025-11-02 02:28:47] L2065 fecha:'05-11-24'->2024-11-05
[2025-11-02 02:28:47] L2066 fecha:'01-04-25'->2025-04-01
[2025-11-02 02:28:47] L2067 fecha:'27-08-25'->2025-08-27
[2025-11-02 02:28:47] L2068 fecha:'04-07-24'->2024-07-04
[2025-11-02 02:28:47] L2069 fecha:'03-10-24'->2024-10-03
[2025-11-02 02:28:47] L2070 fecha:'21-04-25'->2025-04-21
[2025-11-02 02:28:47] L2071 fecha:'28-06-24'->2024-06-28
[2025-11-02 02:28:47] L2072 fecha:'07-07-25'->2025-07-07
[2025-11-02 02:28:47] L2073 fecha:'30-06-24'->2024-06-30
[2025-11-02 02:28:47] L2074 fecha:'15-03-25'->2025-03-15
[2025-11-02 02:28:47] L2075 fecha:'10-08-25'->2025-08-10
[2025-11-02 02:28:47] L2076 fecha:'05-06-25'->2025-06-05
[2025-11-02 02:28:47] L2077 fecha:'07-03-25'->2025-03-07
[2025-11-02 02:28:47] L2078 fecha:'10-02-24'->2024-02-10
[2025-11-02 02:28:47] L2079 fecha:'31-07-25'->2025-07-31
[2025-11-02 02:28:47] L2080 fecha:'17-02-25'->2025-02-17
[2025-11-02 02:28:47] L2081 fecha:'30-01-25'->2025-01-30
[2025-11-02 02:28:47] L2082 fecha:'30-10-24'->2024-10-30
[2025-11-02 02:28:47] L2083 fecha:'05-05-25'->2025-05-05
[2025-11-02 02:28:47] L2084 fecha:'04-03-25'->2025-03-04
[2025-11-02 02:28:47] L2085 fecha:'13-03-24'->2024-03-13
[2025-11-02 02:28:47] L2086 fecha:'16-07-25'->2025-07-16
[2025-11-02 02:28:47] L2087 fecha:'02-03-25'->2025-03-02
[2025-11-02 02:28:47] L2088 fecha:'04-09-24'->2024-09-04
[2025-11-02 02:28:47] L2089 fecha:'11-07-24'->2024-07-11
[2025-11-02 02:28:47] L2090 fecha:'12-10-24'->2024-10-12
[2025-11-02 02:28:47] L2091 fecha:'14-06-25'->2025-06-14
[2025-11-02 02:28:47] L2092 fecha:'13-06-24'->2024-06-13
[2025-11-02 02:28:47] L2093 fecha:'21-04-24'->2024-04-21
[2025-11-02 02:28:47] L2094 fecha:'02-12-24'->2024-12-02
[2025-11-02 02:28:47] L2095 fecha:'08-06-25'->2025-06-08
[2025-11-02 02:28:47] L2096 fecha:'14-11-24'->2024-11-14
[2025-11-02 02:28:47] L2097 fecha:'27-07-24'->2024-07-27
[2025-11-02 02:28:47] L2098 fecha:'22-08-25'->2025-08-22
[2025-11-02 02:28:47] L2099 fecha:'15-05-25'->2025-05-15
[2025-11-02 02:28:47] L2100 fecha:'06-06-25'->2025-06-06
[2025-11-02 02:28:47] L2101 fecha:'31-10-24'->2024-10-31
[2025-11-02 02:28:47] L2102 fecha:'27-10-24'->2024-10-27
[2025-11-02 02:28:47] L2103 fecha:'25-06-25'->2025-06-25
[2025-11-02 02:28:47] L2104 fecha:'05-02-25'->2025-02-05
[2025-11-02 02:28:47] L2105 fecha:'17-09-24'->2024-09-17
[2025-11-02 02:28:47] L2106 fecha:'28-06-25'->2025-06-28
[2025-11-02 02:28:47] L2107 fecha:'04-06-25'->2025-06-04
[2025-11-02 02:28:47] L2108 fecha:'19-09-24'->2024-09-19
[2025-11-02 02:28:47] L2109 fecha:'24-01-25'->2025-01-24
[2025-11-02 02:28:47] L2110 fecha:'20-12-24'->2024-12-20
[2025-11-02 02:28:47] L2111 fecha:'08-02-25'->2025-02-08
[2025-11-02 02:28:47] L2112 fecha:'12-01-24'->2024-01-12
[2025-11-02 02:28:47] L2113 fecha:'12-08-25'->2025-08-12
[2025-11-02 02:28:47] L2114 fecha:'20-01-24'->2024-01-20
[2025-11-02 02:28:47] L2115 fecha:'27-03-24'->2024-03-27
[2025-11-02 02:28:47] L2116 fecha:'19-09-24'->2024-09-19
[2025-11-02 02:28:47] L2117 fecha:'16-08-25'->2025-08-16
[2025-11-02 02:28:47] L2118 fecha:'07-02-24'->2024-02-07
[2025-11-02 02:28:47] L2119 fecha:'29-06-25'->2025-06-29
[2025-11-02 02:28:47] L2120 fecha:'17-05-24'->2024-05-17
[2025-11-02 02:28:47] L2121 fecha:'22-04-25'->2025-04-22
[2025-11-02 02:28:47] L2122 fecha:'05-07-25'->2025-07-05
[2025-11-02 02:28:47] L2123 fecha:'27-10-24'->2024-10-27
[2025-11-02 02:28:47] L2124 fecha:'06-08-24'->2024-08-06
[2025-11-02 02:28:47] L2125 fecha:'08-02-25'->2025-02-08
[2025-11-02 02:28:47] L2126 fecha:'29-04-24'->2024-04-29
[2025-11-02 02:28:47] L2127 fecha:'25-07-24'->2024-07-25
[2025-11-02 02:28:47] L2128 fecha:'27-01-25'->2025-01-27
[2025-11-02 02:28:47] L2129 fecha:'14-07-24'->2024-07-14
[2025-11-02 02:28:47] L2130 fecha:'01-01-24'->2024-01-01
[2025-11-02 02:28:47] L2131 fecha:'11-06-24'->2024-06-11
[2025-11-02 02:28:47] L2132 fecha:'28-03-24'->2024-03-28
[2025-11-02 02:28:47] L2133 fecha:'07-10-24'->2024-10-07
[2025-11-02 02:28:47] L2134 fecha:'23-02-24'->2024-02-23
[2025-11-02 02:28:47] L2135 fecha:'30-09-24'->2024-09-30
[2025-11-02 02:28:47] L2136 fecha:'10-03-25'->2025-03-10
[2025-11-02 02:28:47] L2137 fecha:'06-03-24'->2024-03-06
[2025-11-02 02:28:47] L2138 fecha:'03-08-25'->2025-08-03
[2025-11-02 02:28:47] L2139 fecha:'21-05-24'->2024-05-21
[2025-11-02 02:28:47] L2140 fecha:'21-11-24'->2024-11-21
[2025-11-02 02:28:47] L2141 fecha:'24-05-25'->2025-05-24
[2025-11-02 02:28:47] L2142 fecha:'20-12-24'->2024-12-20
[2025-11-02 02:28:47] L2143 fecha:'23-10-24'->2024-10-23
[2025-11-02 02:28:47] L2144 fecha:'28-03-25'->2025-03-28
[2025-11-02 02:28:47] L2145 fecha:'25-12-24'->2024-12-25
[2025-11-02 02:28:47] L2146 fecha:'25-05-25'->2025-05-25
[2025-11-02 02:28:47] L2147 fecha:'19-04-25'->2025-04-19
[2025-11-02 02:28:47] L2148 fecha:'06-07-25'->2025-07-06
[2025-11-02 02:28:47] L2149 fecha:'15-09-24'->2024-09-15
[2025-11-02 02:28:47] L2150 fecha:'16-02-25'->2025-02-16
[2025-11-02 02:28:47] L2151 fecha:'20-04-24'->2024-04-20
[2025-11-02 02:28:47] L2152 fecha:'16-04-25'->2025-04-16
[2025-11-02 02:28:47] L2153 fecha:'23-04-24'->2024-04-23
[2025-11-02 02:28:47] L2154 fecha:'19-11-24'->2024-11-19
[2025-11-02 02:28:47] L2155 fecha:'28-08-25'->2025-08-28
[2025-11-02 02:28:47] L2156 fecha:'08-06-24'->2024-06-08
[2025-11-02 02:28:47] L2157 fecha:'14-09-24'->2024-09-14
[2025-11-02 02:28:47] L2158 fecha:'02-08-24'->2024-08-02
[2025-11-02 02:28:47] L2159 fecha:'15-02-24'->2024-02-15
[2025-11-02 02:28:47] L2160 fecha:'18-05-25'->2025-05-18
[2025-11-02 02:28:47] L2161 fecha:'15-05-25'->2025-05-15
[2025-11-02 02:28:47] L2162 fecha:'24-11-24'->2024-11-24
[2025-11-02 02:28:47] L2163 fecha:'09-04-24'->2024-04-09
[2025-11-02 02:28:47] L2164 fecha:'03-08-25'->2025-08-03
[2025-11-02 02:28:47] L2165 fecha:'06-11-24'->2024-11-06
[2025-11-02 02:28:47] L2166 fecha:'29-06-24'->2024-06-29
[2025-11-02 02:28:47] L2167 fecha:'05-04-24'->2024-04-05
[2025-11-02 02:28:47] L2168 fecha:'23-08-25'->2025-08-23
[2025-11-02 02:28:47] L2169 fecha:'04-03-24'->2024-03-04
[2025-11-02 02:28:47] L2170 fecha:'22-04-24'->2024-04-22
[2025-11-02 02:28:47] L2171 fecha:'22-01-24'->2024-01-22
[2025-11-02 02:28:47] L2172 fecha:'23-08-24'->2024-08-23
[2025-11-02 02:28:47] L2173 fecha:'02-03-24'->2024-03-02
[2025-11-02 02:28:47] L2174 fecha:'19-12-24'->2024-12-19
[2025-11-02 02:28:47] L2175 fecha:'18-04-24'->2024-04-18
[2025-11-02 02:28:47] L2176 fecha:'04-06-24'->2024-06-04
[2025-11-02 02:28:47] L2177 fecha:'21-10-24'->2024-10-21
[2025-11-02 02:28:47] L2178 fecha:'16-05-25'->2025-05-16
[2025-11-02 02:28:47] L2179 fecha:'04-08-25'->2025-08-04
[2025-11-02 02:28:47] L2180 fecha:'27-11-24'->2024-11-27
[2025-11-02 02:28:47] L2181 fecha:'06-12-24'->2024-12-06
[2025-11-02 02:28:47] L2182 fecha:'20-04-25'->2025-04-20
[2025-11-02 02:28:47] L2183 RUN paciente 802322-0 sin referencia -> ERR
[2025-11-02 02:28:47] L2184 fecha:'27-05-25'->2025-05-27
[2025-11-02 02:28:47] L2185 fecha:'26-02-24'->2024-02-26
[2025-11-02 02:28:47] L2186 fecha:'03-01-25'->2025-01-03
[2025-11-02 02:28:47] L2187 fecha:'29-07-25'->2025-07-29
[2025-11-02 02:28:47] L2188 fecha:'31-05-24'->2024-05-31
[2025-11-02 02:28:47] L2189 fecha:'23-11-24'->2024-11-23
[2025-11-02 02:28:47] L2190 fecha:'26-05-25'->2025-05-26
[2025-11-02 02:28:47] L2191 fecha:'11-11-24'->2024-11-11
[2025-11-02 02:28:47] L2192 fecha:'18-04-24'->2024-04-18
[2025-11-02 02:28:47] L2193 fecha:'09-06-25'->2025-06-09
[2025-11-02 02:28:47] L2194 fecha:'14-07-25'->2025-07-14
[2025-11-02 02:28:47] L2195 fecha:'27-01-24'->2024-01-27
[2025-11-02 02:28:47] L2196 fecha:'16-09-24'->2024-09-16
[2025-11-02 02:28:47] L2197 fecha:'18-01-25'->2025-01-18
[2025-11-02 02:28:47] L2198 fecha:'10-01-24'->2024-01-10
[2025-11-02 02:28:47] L2199 fecha:'01-07-25'->2025-07-01
[2025-11-02 02:28:47] L2200 fecha:'30-05-24'->2024-05-30
[2025-11-02 02:28:47] L2201 fecha:'18-03-24'->2024-03-18
[2025-11-02 02:28:47] L2202 fecha:'22-07-24'->2024-07-22
[2025-11-02 02:28:47] L2203 fecha:'23-05-24'->2024-05-23
[2025-11-02 02:28:47] L2204 fecha:'26-02-24'->2024-02-26
[2025-11-02 02:28:47] L2205 fecha:'13-04-25'->2025-04-13
[2025-11-02 02:28:47] L2206 fecha:'06-03-24'->2024-03-06
[2025-11-02 02:28:47] L2207 fecha:'17-11-24'->2024-11-17
[2025-11-02 02:28:47] L2208 fecha:'25-01-24'->2024-01-25
[2025-11-02 02:28:47] L2209 fecha:'01-01-24'->2024-01-01
[2025-11-02 02:28:47] L2210 fecha:'14-02-24'->2024-02-14
[2025-11-02 02:28:47] L2211 fecha:'26-01-25'->2025-01-26
[2025-11-02 02:28:47] L2212 fecha:'31-10-24'->2024-10-31
[2025-11-02 02:28:47] L2213 fecha:'07-05-24'->2024-05-07
[2025-11-02 02:28:47] L2214 fecha:'10-04-25'->2025-04-10
[2025-11-02 02:28:47] L2215 fecha:'20-08-25'->2025-08-20
[2025-11-02 02:28:47] L2216 fecha:'04-11-24'->2024-11-04
[2025-11-02 02:28:47] L2217 fecha:'20-09-24'->2024-09-20
[2025-11-02 02:28:47] L2218 fecha:'17-08-25'->2025-08-17
[2025-11-02 02:28:47] L2219 fecha:'11-03-24'->2024-03-11
[2025-11-02 02:28:47] L2220 fecha:'27-03-25'->2025-03-27
[2025-11-02 02:28:47] L2221 fecha:'28-10-24'->2024-10-28
[2025-11-02 02:28:47] L2222 fecha:'11-06-24'->2024-06-11
[2025-11-02 02:28:47] L2223 fecha:'19-03-25'->2025-03-19
[2025-11-02 02:28:47] L2224 fecha:'08-02-24'->2024-02-08
[2025-11-02 02:28:47] L2225 fecha:'05-02-25'->2025-02-05
[2025-11-02 02:28:47] L2226 fecha:'21-01-24'->2024-01-21
[2025-11-02 02:28:47] L2227 fecha:'30-07-24'->2024-07-30
[2025-11-02 02:28:47] L2228 fecha:'10-05-25'->2025-05-10
[2025-11-02 02:28:47] L2229 fecha:'27-02-25'->2025-02-27
[2025-11-02 02:28:47] L2230 fecha:'21-07-24'->2024-07-21
[2025-11-02 02:28:47] L2231 fecha:'24-06-24'->2024-06-24
[2025-11-02 02:28:47] L2232 fecha:'15-06-24'->2024-06-15
[2025-11-02 02:28:47] L2233 fecha:'03-01-24'->2024-01-03
[2025-11-02 02:28:47] L2234 fecha:'10-05-24'->2024-05-10
[2025-11-02 02:28:47] L2235 fecha:'19-10-24'->2024-10-19
[2025-11-02 02:28:47] L2236 fecha:'15-01-24'->2024-01-15
[2025-11-02 02:28:47] L2237 fecha:'10-01-25'->2025-01-10
[2025-11-02 02:28:47] L2238 fecha:'24-07-24'->2024-07-24
[2025-11-02 02:28:47] L2239 fecha:'03-11-24'->2024-11-03
[2025-11-02 02:28:47] L2240 fecha:'20-07-24'->2024-07-20
[2025-11-02 02:28:47] L2241 fecha:'15-03-25'->2025-03-15
[2025-11-02 02:28:47] L2242 fecha:'13-09-24'->2024-09-13
[2025-11-02 02:28:47] L2243 fecha:'24-08-24'->2024-08-24
[2025-11-02 02:28:47] L2244 fecha:'22-09-24'->2024-09-22
[2025-11-02 02:28:47] L2245 fecha:'25-07-24'->2024-07-25
[2025-11-02 02:28:47] L2246 fecha:'17-12-24'->2024-12-17
[2025-11-02 02:28:47] L2247 fecha:'29-06-25'->2025-06-29
[2025-11-02 02:28:47] L2248 fecha:'21-12-24'->2024-12-21
[2025-11-02 02:28:47] L2249 fecha:'08-10-24'->2024-10-08
[2025-11-02 02:28:47] L2250 fecha:'23-01-25'->2025-01-23
[2025-11-02 02:28:47] L2251 fecha:'03-04-25'->2025-04-03
[2025-11-02 02:28:47] L2252 fecha:'02-01-24'->2024-01-02
[2025-11-02 02:28:47] L2253 fecha:'28-12-24'->2024-12-28
[2025-11-02 02:28:47] L2254 fecha:'02-05-25'->2025-05-02
[2025-11-02 02:28:47] L2255 fecha:'30-04-25'->2025-04-30
[2025-11-02 02:28:47] L2256 fecha:'20-07-24'->2024-07-20
[2025-11-02 02:28:47] L2257 fecha:'10-11-24'->2024-11-10
[2025-11-02 02:28:47] L2258 fecha:'01-06-24'->2024-06-01
[2025-11-02 02:28:47] L2259 fecha:'19-12-24'->2024-12-19
[2025-11-02 02:28:47] L2260 fecha:'14-01-25'->2025-01-14
[2025-11-02 02:28:47] L2261 fecha:'28-05-24'->2024-05-28
[2025-11-02 02:28:47] L2262 fecha:'24-06-25'->2025-06-24
[2025-11-02 02:28:47] L2263 fecha:'10-06-25'->2025-06-10
[2025-11-02 02:28:47] L2264 fecha:'29-01-25'->2025-01-29
[2025-11-02 02:28:47] L2265 fecha:'30-04-25'->2025-04-30
[2025-11-02 02:28:47] L2266 fecha:'15-02-25'->2025-02-15
[2025-11-02 02:28:47] L2267 fecha:'08-03-25'->2025-03-08
[2025-11-02 02:28:47] L2268 fecha:'02-01-24'->2024-01-02
[2025-11-02 02:28:47] L2269 fecha:'02-06-24'->2024-06-02
[2025-11-02 02:28:47] L2270 fecha:'10-07-25'->2025-07-10
[2025-11-02 02:28:47] L2271 fecha:'20-04-25'->2025-04-20
[2025-11-02 02:28:47] L2272 fecha:'19-09-24'->2024-09-19
[2025-11-02 02:28:47] L2273 fecha:'19-08-24'->2024-08-19
[2025-11-02 02:28:47] L2274 fecha:'19-08-24'->2024-08-19
[2025-11-02 02:28:47] L2275 fecha:'20-10-24'->2024-10-20
[2025-11-02 02:28:47] L2276 fecha:'19-06-25'->2025-06-19
[2025-11-02 02:28:47] L2277 fecha:'14-01-24'->2024-01-14
[2025-11-02 02:28:47] L2278 fecha:'23-02-25'->2025-02-23
[2025-11-02 02:28:47] L2279 fecha:'26-01-24'->2024-01-26
[2025-11-02 02:28:47] L2280 fecha:'31-07-24'->2024-07-31
[2025-11-02 02:28:47] L2281 fecha:'25-03-24'->2024-03-25
[2025-11-02 02:28:47] L2282 fecha:'16-05-25'->2025-05-16
[2025-11-02 02:28:47] L2283 fecha:'14-06-25'->2025-06-14
[2025-11-02 02:28:47] L2284 fecha:'05-02-24'->2024-02-05
[2025-11-02 02:28:47] L2285 fecha:'09-05-24'->2024-05-09
[2025-11-02 02:28:47] L2286 fecha:'28-05-25'->2025-05-28
[2025-11-02 02:28:47] L2287 fecha:'12-01-25'->2025-01-12
[2025-11-02 02:28:47] L2288 fecha:'04-03-25'->2025-03-04
[2025-11-02 02:28:47] L2289 fecha:'15-11-24'->2024-11-15
[2025-11-02 02:28:47] L2290 fecha:'04-10-24'->2024-10-04
[2025-11-02 02:28:47] L2291 fecha:'15-07-24'->2024-07-15
[2025-11-02 02:28:47] L2292 fecha:'19-05-25'->2025-05-19
[2025-11-02 02:28:47] L2293 fecha:'29-06-24'->2024-06-29
[2025-11-02 02:28:47] L2294 fecha:'07-08-24'->2024-08-07
[2025-11-02 02:28:47] L2295 fecha:'25-09-24'->2024-09-25
[2025-11-02 02:28:47] L2296 fecha:'01-02-25'->2025-02-01
[2025-11-02 02:28:47] L2297 fecha:'23-04-25'->2025-04-23
[2025-11-02 02:28:47] L2298 fecha:'05-04-24'->2024-04-05
[2025-11-02 02:28:47] L2299 fecha:'25-06-24'->2024-06-25
[2025-11-02 02:28:47] L2300 fecha:'02-06-24'->2024-06-02
[2025-11-02 02:28:47] L2301 fecha:'07-08-25'->2025-08-07
[2025-11-02 02:28:47] L2302 fecha:'09-04-24'->2024-04-09
[2025-11-02 02:28:47] L2303 fecha:'11-01-25'->2025-01-11
[2025-11-02 02:28:47] L2304 fecha:'21-03-25'->2025-03-21
[2025-11-02 02:28:47] L2305 fecha:'30-05-25'->2025-05-30
[2025-11-02 02:28:47] L2306 fecha:'02-11-24'->2024-11-02
[2025-11-02 02:28:47] L2307 fecha:'02-08-25'->2025-08-02
[2025-11-02 02:28:47] L2308 fecha:'31-05-25'->2025-05-31
[2025-11-02 02:28:47] L2309 fecha:'30-11-24'->2024-11-30
[2025-11-02 02:28:47] L2310 fecha:'25-09-24'->2024-09-25
[2025-11-02 02:28:47] L2311 fecha:'19-10-24'->2024-10-19
[2025-11-02 02:28:47] L2312 fecha:'24-12-24'->2024-12-24
[2025-11-02 02:28:47] L2313 fecha:'01-01-24'->2024-01-01
[2025-11-02 02:28:47] L2314 fecha:'30-01-24'->2024-01-30
[2025-11-02 02:28:47] L2315 fecha:'19-01-25'->2025-01-19
[2025-11-02 02:28:47] L2316 fecha:'31-01-25'->2025-01-31
[2025-11-02 02:28:47] L2317 fecha:'20-02-25'->2025-02-20
[2025-11-02 02:28:47] L2318 fecha:'10-01-24'->2024-01-10
[2025-11-02 02:28:47] L2319 fecha:'10-06-25'->2025-06-10
[2025-11-02 02:28:47] L2320 fecha:'12-06-25'->2025-06-12
[2025-11-02 02:28:47] L2321 fecha:'26-11-24'->2024-11-26
[2025-11-02 02:28:47] L2322 fecha:'16-01-25'->2025-01-16
[2025-11-02 02:28:47] L2323 fecha:'23-06-24'->2024-06-23
[2025-11-02 02:28:47] L2324 fecha:'20-03-24'->2024-03-20
[2025-11-02 02:28:47] L2325 fecha:'24-12-24'->2024-12-24
[2025-11-02 02:28:47] L2326 fecha:'04-01-24'->2024-01-04
[2025-11-02 02:28:47] L2327 fecha:'25-05-25'->2025-05-25
[2025-11-02 02:28:47] L2328 fecha:'23-05-25'->2025-05-23
[2025-11-02 02:28:47] L2329 fecha:'14-10-24'->2024-10-14
[2025-11-02 02:28:47] L2330 fecha:'29-05-25'->2025-05-29
[2025-11-02 02:28:47] L2331 fecha:'28-08-25'->2025-08-28
[2025-11-02 02:28:47] L2332 fecha:'17-07-25'->2025-07-17
[2025-11-02 02:28:47] L2333 fecha:'29-12-24'->2024-12-29
[2025-11-02 02:28:47] L2334 fecha:'24-08-24'->2024-08-24
[2025-11-02 02:28:47] L2335 fecha:'23-12-24'->2024-12-23
[2025-11-02 02:28:47] L2336 fecha:'24-09-24'->2024-09-24
[2025-11-02 02:28:47] L2337 fecha:'08-02-24'->2024-02-08
[2025-11-02 02:28:47] L2338 fecha:'02-10-24'->2024-10-02
[2025-11-02 02:28:47] L2339 fecha:'01-09-24'->2024-09-01
[2025-11-02 02:28:47] L2340 fecha:'07-01-24'->2024-01-07
[2025-11-02 02:28:47] L2341 fecha:'30-04-24'->2024-04-30
[2025-11-02 02:28:47] L2342 fecha:'10-04-24'->2024-04-10
[2025-11-02 02:28:47] L2343 fecha:'03-07-25'->2025-07-03
[2025-11-02 02:28:47] L2344 fecha:'10-02-24'->2024-02-10
[2025-11-02 02:28:47] L2345 fecha:'13-03-25'->2025-03-13
[2025-11-02 02:28:47] L2346 fecha:'29-08-24'->2024-08-29
[2025-11-02 02:28:47] L2347 fecha:'29-11-24'->2024-11-29
[2025-11-02 02:28:47] L2348 fecha:'13-12-24'->2024-12-13
[2025-11-02 02:28:47] L2349 fecha:'03-05-25'->2025-05-03
[2025-11-02 02:28:47] L2350 fecha:'25-10-24'->2024-10-25
[2025-11-02 02:28:47] L2351 fecha:'03-04-24'->2024-04-03
[2025-11-02 02:28:47] L2352 fecha:'23-04-24'->2024-04-23
[2025-11-02 02:28:47] L2353 fecha:'10-10-24'->2024-10-10
[2025-11-02 02:28:47] L2354 fecha:'24-02-24'->2024-02-24
[2025-11-02 02:28:47] L2355 fecha:'13-09-24'->2024-09-13
[2025-11-02 02:28:47] L2356 fecha:'16-03-24'->2024-03-16
[2025-11-02 02:28:47] L2357 fecha:'17-07-24'->2024-07-17
[2025-11-02 02:28:47] L2358 fecha:'13-09-24'->2024-09-13
[2025-11-02 02:28:47] L2359 fecha:'09-03-25'->2025-03-09
[2025-11-02 02:28:47] L2360 fecha:'12-07-25'->2025-07-12
[2025-11-02 02:28:47] L2361 fecha:'06-05-25'->2025-05-06
[2025-11-02 02:28:47] L2362 fecha:'01-01-25'->2025-01-01
[2025-11-02 02:28:47] L2363 fecha:'15-01-25'->2025-01-15
[2025-11-02 02:28:47] L2364 fecha:'09-04-25'->2025-04-09
[2025-11-02 02:28:47] L2365 fecha:'29-02-24'->2024-02-29
[2025-11-02 02:28:47] L2366 fecha:'28-05-25'->2025-05-28
[2025-11-02 02:28:47] L2367 fecha:'09-03-24'->2024-03-09
[2025-11-02 02:28:47] L2368 fecha:'11-04-25'->2025-04-11
[2025-11-02 02:28:47] L2369 fecha:'02-04-25'->2025-04-02
[2025-11-02 02:28:47] L2370 fecha:'22-05-24'->2024-05-22
[2025-11-02 02:28:47] L2371 fecha:'21-11-24'->2024-11-21
[2025-11-02 02:28:47] L2372 fecha:'14-08-25'->2025-08-14
[2025-11-02 02:28:47] L2373 fecha:'03-06-24'->2024-06-03
[2025-11-02 02:28:47] L2374 fecha:'24-09-24'->2024-09-24
[2025-11-02 02:28:47] L2375 fecha:'26-08-25'->2025-08-26
[2025-11-02 02:28:47] L2376 fecha:'09-12-24'->2024-12-09
[2025-11-02 02:28:47] L2377 fecha:'19-08-24'->2024-08-19
[2025-11-02 02:28:47] L2378 fecha:'26-02-24'->2024-02-26
[2025-11-02 02:28:47] L2379 fecha:'05-03-24'->2024-03-05
[2025-11-02 02:28:47] L2380 fecha:'23-03-24'->2024-03-23
[2025-11-02 02:28:47] L2381 fecha:'13-02-25'->2025-02-13
[2025-11-02 02:28:47] L2382 fecha:'30-06-24'->2024-06-30
[2025-11-02 02:28:47] L2383 fecha:'23-04-24'->2024-04-23
[2025-11-02 02:28:47] L2384 fecha:'03-12-24'->2024-12-03
[2025-11-02 02:28:47] L2385 fecha:'25-02-24'->2024-02-25
[2025-11-02 02:28:47] L2386 fecha:'11-02-24'->2024-02-11
[2025-11-02 02:28:47] L2387 fecha:'01-06-24'->2024-06-01
[2025-11-02 02:28:47] L2388 fecha:'17-10-24'->2024-10-17
[2025-11-02 02:28:47] L2389 fecha:'10-03-24'->2024-03-10
[2025-11-02 02:28:47] L2390 fecha:'02-04-25'->2025-04-02
[2025-11-02 02:28:47] L2391 fecha:'08-03-24'->2024-03-08
[2025-11-02 02:28:47] L2392 fecha:'03-07-25'->2025-07-03
[2025-11-02 02:28:47] L2393 fecha:'14-04-25'->2025-04-14
[2025-11-02 02:28:47] L2394 fecha:'14-12-24'->2024-12-14
[2025-11-02 02:28:47] L2395 fecha:'06-01-24'->2024-01-06
[2025-11-02 02:28:47] L2396 fecha:'22-08-24'->2024-08-22
[2025-11-02 02:28:47] L2397 fecha:'12-02-24'->2024-02-12
[2025-11-02 02:28:47] L2398 fecha:'14-05-24'->2024-05-14
[2025-11-02 02:28:47] L2399 fecha:'24-10-24'->2024-10-24
[2025-11-02 02:28:47] L2400 fecha:'19-08-25'->2025-08-19
[2025-11-02 02:28:47] L2401 fecha:'12-07-24'->2024-07-12
[2025-11-02 02:28:47] L2402 fecha:'02-07-25'->2025-07-02
[2025-11-02 02:28:47] L2403 fecha:'10-04-25'->2025-04-10
[2025-11-02 02:28:47] L2404 fecha:'23-02-24'->2024-02-23
[2025-11-02 02:28:47] L2405 fecha:'16-09-24'->2024-09-16
[2025-11-02 02:28:47] L2406 fecha:'27-10-24'->2024-10-27
[2025-11-02 02:28:47] L2407 fecha:'28-05-24'->2024-05-28
[2025-11-02 02:28:47] L2408 fecha:'01-03-25'->2025-03-01
[2025-11-02 02:28:47] L2409 fecha:'19-08-24'->2024-08-19
[2025-11-02 02:28:47] L2410 fecha:'07-03-25'->2025-03-07
[2025-11-02 02:28:47] L2411 fecha:'31-01-24'->2024-01-31
[2025-11-02 02:28:47] L2412 fecha:'23-08-25'->2025-08-23
[2025-11-02 02:28:47] L2413 fecha:'15-06-25'->2025-06-15
[2025-11-02 02:28:47] L2414 fecha:'17-01-25'->2025-01-17
[2025-11-02 02:28:47] L2415 fecha:'22-02-25'->2025-02-22
[2025-11-02 02:28:47] L2416 fecha:'14-03-25'->2025-03-14
[2025-11-02 02:28:47] L2417 fecha:'30-11-24'->2024-11-30
[2025-11-02 02:28:47] L2418 fecha:'24-09-24'->2024-09-24
[2025-11-02 02:28:47] L2419 fecha:'10-03-25'->2025-03-10
[2025-11-02 02:28:47] L2420 fecha:'19-01-25'->2025-01-19
[2025-11-02 02:28:47] L2421 fecha:'02-06-24'->2024-06-02
[2025-11-02 02:28:47] L2422 fecha:'04-07-25'->2025-07-04
[2025-11-02 02:28:47] L2423 fecha:'26-03-24'->2024-03-26
[2025-11-02 02:28:47] L2424 fecha:'30-03-24'->2024-03-30
[2025-11-02 02:28:47] L2425 fecha:'11-06-24'->2024-06-11
[2025-11-02 02:28:47] L2426 fecha:'03-11-24'->2024-11-03
[2025-11-02 02:28:47] L2427 fecha:'08-05-24'->2024-05-08
[2025-11-02 02:28:47] L2428 fecha:'31-03-24'->2024-03-31
[2025-11-02 02:28:47] L2429 fecha:'10-08-25'->2025-08-10
[2025-11-02 02:28:47] L2430 fecha:'09-12-24'->2024-12-09
[2025-11-02 02:28:47] L2431 fecha:'25-02-24'->2024-02-25
[2025-11-02 02:28:47] L2432 fecha:'05-03-25'->2025-03-05
[2025-11-02 02:28:47] L2433 fecha:'15-10-24'->2024-10-15
[2025-11-02 02:28:47] L2434 fecha:'16-08-24'->2024-08-16
[2025-11-02 02:28:47] L2435 fecha:'19-09-24'->2024-09-19
[2025-11-02 02:28:47] L2436 fecha:'19-01-25'->2025-01-19
[2025-11-02 02:28:47] L2437 fecha:'15-10-24'->2024-10-15
[2025-11-02 02:28:47] L2438 fecha:'05-04-24'->2024-04-05
[2025-11-02 02:28:47] L2439 fecha:'19-06-25'->2025-06-19
[2025-11-02 02:28:47] L2440 fecha:'19-04-25'->2025-04-19
[2025-11-02 02:28:47] L2441 fecha:'18-03-24'->2024-03-18
[2025-11-02 02:28:47] L2442 fecha:'29-09-24'->2024-09-29
[2025-11-02 02:28:47] L2443 fecha:'10-02-24'->2024-02-10
[2025-11-02 02:28:47] L2444 fecha:'06-10-24'->2024-10-06
[2025-11-02 02:28:47] L2445 fecha:'09-11-24'->2024-11-09
[2025-11-02 02:28:47] L2446 fecha:'15-03-25'->2025-03-15
[2025-11-02 02:28:47] L2447 fecha:'02-02-25'->2025-02-02
[2025-11-02 02:28:47] L2448 fecha:'24-07-24'->2024-07-24
[2025-11-02 02:28:47] L2449 fecha:'31-01-24'->2024-01-31
[2025-11-02 02:28:47] L2450 fecha:'09-06-24'->2024-06-09
[2025-11-02 02:28:47] L2451 fecha:'30-09-24'->2024-09-30
[2025-11-02 02:28:47] L2452 fecha:'14-08-24'->2024-08-14
[2025-11-02 02:28:47] L2453 fecha:'08-03-25'->2025-03-08
[2025-11-02 02:28:47] L2454 fecha:'03-03-24'->2024-03-03
[2025-11-02 02:28:47] L2455 fecha:'07-07-25'->2025-07-07
[2025-11-02 02:28:47] L2456 fecha:'10-03-24'->2024-03-10
[2025-11-02 02:28:47] L2457 fecha:'22-02-24'->2024-02-22
[2025-11-02 02:28:47] L2458 fecha:'11-03-25'->2025-03-11
[2025-11-02 02:28:47] L2459 fecha:'06-02-25'->2025-02-06
[2025-11-02 02:28:47] L2460 fecha:'03-07-25'->2025-07-03
[2025-11-02 02:28:47] L2461 fecha:'14-07-25'->2025-07-14
[2025-11-02 02:28:47] L2462 fecha:'29-09-24'->2024-09-29
[2025-11-02 02:28:47] L2463 fecha:'10-01-24'->2024-01-10
[2025-11-02 02:28:47] L2464 fecha:'22-06-24'->2024-06-22
[2025-11-02 02:28:47] L2465 fecha:'21-09-24'->2024-09-21
[2025-11-02 02:28:47] L2466 fecha:'08-08-25'->2025-08-08
[2025-11-02 02:28:47] L2467 fecha:'31-10-24'->2024-10-31
[2025-11-02 02:28:47] L2468 fecha:'26-05-25'->2025-05-26
[2025-11-02 02:28:47] L2469 fecha:'17-02-25'->2025-02-17
[2025-11-02 02:28:47] L2470 fecha:'27-03-25'->2025-03-27
[2025-11-02 02:28:47] L2471 fecha:'20-08-24'->2024-08-20
[2025-11-02 02:28:47] L2472 fecha:'29-04-24'->2024-04-29
[2025-11-02 02:28:47] L2473 fecha:'13-05-25'->2025-05-13
[2025-11-02 02:28:47] L2474 fecha:'15-01-25'->2025-01-15
[2025-11-02 02:28:47] L2475 fecha:'07-03-24'->2024-03-07
[2025-11-02 02:28:47] L2476 fecha:'10-06-24'->2024-06-10
[2025-11-02 02:28:47] L2477 fecha:'08-06-25'->2025-06-08
[2025-11-02 02:28:47] L2478 fecha:'26-12-24'->2024-12-26
[2025-11-02 02:28:47] L2479 fecha:'16-11-24'->2024-11-16
[2025-11-02 02:28:47] L2480 fecha:'11-01-25'->2025-01-11
[2025-11-02 02:28:47] L2481 fecha:'01-01-25'->2025-01-01
[2025-11-02 02:28:47] L2482 fecha:'07-01-24'->2024-01-07
[2025-11-02 02:28:47] L2483 fecha:'09-01-25'->2025-01-09
[2025-11-02 02:28:47] L2484 fecha:'20-08-25'->2025-08-20
[2025-11-02 02:28:47] L2485 fecha:'20-11-24'->2024-11-20
[2025-11-02 02:28:47] L2486 fecha:'19-10-24'->2024-10-19
[2025-11-02 02:28:47] L2487 fecha:'28-03-25'->2025-03-28
[2025-11-02 02:28:47] L2488 fecha:'10-04-24'->2024-04-10
[2025-11-02 02:28:47] L2489 fecha:'16-04-25'->2025-04-16
[2025-11-02 02:28:47] L2490 fecha:'10-05-25'->2025-05-10
[2025-11-02 02:28:47] L2491 fecha:'05-05-24'->2024-05-05
[2025-11-02 02:28:47] L2492 fecha:'13-02-25'->2025-02-13
[2025-11-02 02:28:47] L2493 fecha:'10-02-25'->2025-02-10
[2025-11-02 02:28:47] L2494 fecha:'06-06-24'->2024-06-06
[2025-11-02 02:28:47] L2495 fecha:'13-05-25'->2025-05-13
[2025-11-02 02:28:47] L2496 fecha:'11-11-24'->2024-11-11
[2025-11-02 02:28:47] L2497 fecha:'20-03-25'->2025-03-20
[2025-11-02 02:28:47] L2498 fecha:'24-07-24'->2024-07-24
[2025-11-02 02:28:47] L2499 fecha:'27-06-24'->2024-06-27
[2025-11-02 02:28:47] L2500 fecha:'01-02-24'->2024-02-01
[2025-11-02 02:28:47] L2501 fecha:'12-05-24'->2024-05-12
[2025-11-02 02:28:47] L2502 fecha:'04-02-25'->2025-02-04
[2025-11-02 02:28:47] L2503 fecha:'13-02-24'->2024-02-13
[2025-11-02 02:28:47] L2504 fecha:'13-06-25'->2025-06-13
[2025-11-02 02:28:47] L2505 fecha:'22-01-25'->2025-01-22
[2025-11-02 02:28:47] L2506 fecha:'20-03-25'->2025-03-20
[2025-11-02 02:28:47] L2507 fecha:'08-06-25'->2025-06-08
[2025-11-02 02:28:47] L2508 fecha:'13-11-24'->2024-11-13
[2025-11-02 02:28:47] L2509 fecha:'05-05-25'->2025-05-05
[2025-11-02 02:28:47] L2510 fecha:'04-01-25'->2025-01-04
[2025-11-02 02:28:47] L2511 fecha:'18-02-24'->2024-02-18
[2025-11-02 02:28:47] L2512 fecha:'28-02-25'->2025-02-28
[2025-11-02 02:28:47] L2513 fecha:'28-07-25'->2025-07-28
[2025-11-02 02:28:47] L2514 fecha:'10-07-25'->2025-07-10
[2025-11-02 02:28:47] L2515 fecha:'05-03-25'->2025-03-05
[2025-11-02 02:28:47] L2516 fecha:'16-08-25'->2025-08-16
[2025-11-02 02:28:47] L2517 fecha:'19-04-24'->2024-04-19
[2025-11-02 02:28:47] L2518 fecha:'11-02-24'->2024-02-11
[2025-11-02 02:28:47] L2519 fecha:'09-08-25'->2025-08-09
[2025-11-02 02:28:47] L2520 fecha:'25-12-24'->2024-12-25
[2025-11-02 02:28:47] L2521 fecha:'07-07-24'->2024-07-07
[2025-11-02 02:28:47] L2522 fecha:'15-02-25'->2025-02-15
[2025-11-02 02:28:47] L2523 fecha:'19-04-25'->2025-04-19
[2025-11-02 02:28:47] L2524 fecha:'28-03-25'->2025-03-28
[2025-11-02 02:28:47] L2525 fecha:'19-12-24'->2024-12-19
[2025-11-02 02:28:47] L2526 fecha:'17-07-24'->2024-07-17
[2025-11-02 02:28:47] L2527 fecha:'20-06-25'->2025-06-20
[2025-11-02 02:28:47] L2528 fecha:'16-07-25'->2025-07-16
[2025-11-02 02:28:47] L2529 fecha:'03-12-24'->2024-12-03
[2025-11-02 02:28:47] L2530 fecha:'17-06-25'->2025-06-17
[2025-11-02 02:28:47] L2531 fecha:'30-09-24'->2024-09-30
[2025-11-02 02:28:47] L2532 fecha:'19-01-25'->2025-01-19
[2025-11-02 02:28:47] L2533 fecha:'08-02-25'->2025-02-08
[2025-11-02 02:28:47] L2534 fecha:'20-06-24'->2024-06-20
[2025-11-02 02:28:47] L2535 fecha:'18-07-25'->2025-07-18
[2025-11-02 02:28:47] L2536 fecha:'28-06-24'->2024-06-28
[2025-11-02 02:28:47] L2537 fecha:'27-07-25'->2025-07-27
[2025-11-02 02:28:47] L2538 fecha:'06-06-24'->2024-06-06
[2025-11-02 02:28:47] L2539 fecha:'04-01-25'->2025-01-04
[2025-11-02 02:28:47] L2540 fecha:'11-10-24'->2024-10-11
[2025-11-02 02:28:47] L2541 fecha:'08-05-25'->2025-05-08
[2025-11-02 02:28:47] L2542 fecha:'10-02-25'->2025-02-10
[2025-11-02 02:28:47] L2543 fecha:'21-06-24'->2024-06-21
[2025-11-02 02:28:47] L2544 fecha:'24-12-24'->2024-12-24
[2025-11-02 02:28:47] L2545 fecha:'23-01-25'->2025-01-23
[2025-11-02 02:28:47] L2546 fecha:'22-05-24'->2024-05-22
[2025-11-02 02:28:47] L2547 fecha:'09-02-25'->2025-02-09
[2025-11-02 02:28:47] L2548 fecha:'19-08-24'->2024-08-19
[2025-11-02 02:28:47] L2549 fecha:'23-11-24'->2024-11-23
[2025-11-02 02:28:47] L2550 fecha:'22-08-24'->2024-08-22
[2025-11-02 02:28:47] L2551 fecha:'18-08-24'->2024-08-18
[2025-11-02 02:28:47] L2552 fecha:'05-12-24'->2024-12-05
[2025-11-02 02:28:47] L2553 fecha:'03-05-24'->2024-05-03
[2025-11-02 02:28:47] L2554 fecha:'23-04-25'->2025-04-23
[2025-11-02 02:28:47] L2555 fecha:'10-07-25'->2025-07-10
[2025-11-02 02:28:47] L2556 fecha:'03-03-25'->2025-03-03
[2025-11-02 02:28:47] L2557 fecha:'25-03-24'->2024-03-25
[2025-11-02 02:28:47] L2558 fecha:'09-01-24'->2024-01-09
[2025-11-02 02:28:47] L2559 fecha:'13-06-25'->2025-06-13
[2025-11-02 02:28:47] L2560 fecha:'14-03-25'->2025-03-14
[2025-11-02 02:28:47] L2561 fecha:'06-05-24'->2024-05-06
[2025-11-02 02:28:47] L2562 fecha:'27-05-25'->2025-05-27
[2025-11-02 02:28:47] L2563 fecha:'10-06-25'->2025-06-10
[2025-11-02 02:28:47] L2564 fecha:'18-11-24'->2024-11-18
[2025-11-02 02:28:47] L2565 fecha:'06-04-24'->2024-04-06
[2025-11-02 02:28:47] L2566 fecha:'29-04-25'->2025-04-29
[2025-11-02 02:28:47] L2567 fecha:'23-03-24'->2024-03-23
[2025-11-02 02:28:47] L2568 fecha:'27-01-25'->2025-01-27
[2025-11-02 02:28:47] L2569 fecha:'02-06-24'->2024-06-02
[2025-11-02 02:28:47] L2570 fecha:'31-01-24'->2024-01-31
[2025-11-02 02:28:47] L2571 fecha:'06-09-24'->2024-09-06
[2025-11-02 02:28:47] L2572 fecha:'24-11-24'->2024-11-24
[2025-11-02 02:28:47] L2573 fecha:'17-05-25'->2025-05-17
[2025-11-02 02:28:47] L2574 fecha:'08-01-25'->2025-01-08
[2025-11-02 02:28:47] L2575 fecha:'24-06-25'->2025-06-24
[2025-11-02 02:28:47] L2576 fecha:'05-03-24'->2024-03-05
[2025-11-02 02:28:47] L2577 fecha:'21-06-25'->2025-06-21
[2025-11-02 02:28:47] L2578 fecha:'05-02-24'->2024-02-05
[2025-11-02 02:28:47] L2579 fecha:'31-10-24'->2024-10-31
[2025-11-02 02:28:47] L2580 fecha:'10-08-24'->2024-08-10
[2025-11-02 02:28:47] L2581 fecha:'12-03-24'->2024-03-12
[2025-11-02 02:28:47] L2582 fecha:'30-11-24'->2024-11-30
[2025-11-02 02:28:47] L2583 fecha:'20-01-25'->2025-01-20
[2025-11-02 02:28:47] L2584 fecha:'04-01-25'->2025-01-04
[2025-11-02 02:28:47] L2585 fecha:'26-02-24'->2024-02-26
[2025-11-02 02:28:47] L2586 fecha:'18-05-24'->2024-05-18
[2025-11-02 02:28:47] L2587 fecha:'16-02-25'->2025-02-16
[2025-11-02 02:28:47] L2588 fecha:'15-03-25'->2025-03-15
[2025-11-02 02:28:47] L2589 fecha:'29-07-25'->2025-07-29
[2025-11-02 02:28:47] L2590 fecha:'23-05-24'->2024-05-23
[2025-11-02 02:28:47] L2591 fecha:'27-02-25'->2025-02-27
[2025-11-02 02:28:47] L2592 fecha:'01-11-24'->2024-11-01
[2025-11-02 02:28:47] L2593 fecha:'04-08-25'->2025-08-04
[2025-11-02 02:28:47] L2594 fecha:'14-05-25'->2025-05-14
[2025-11-02 02:28:47] L2595 fecha:'03-04-24'->2024-04-03
[2025-11-02 02:28:47] L2596 fecha:'22-02-24'->2024-02-22
[2025-11-02 02:28:47] L2597 fecha:'12-04-24'->2024-04-12
[2025-11-02 02:28:47] L2598 fecha:'10-08-25'->2025-08-10
[2025-11-02 02:28:47] L2599 fecha:'22-01-25'->2025-01-22
[2025-11-02 02:28:47] L2600 fecha:'14-03-25'->2025-03-14
[2025-11-02 02:28:47] L2601 fecha:'08-07-25'->2025-07-08
[2025-11-02 02:28:47] L2602 fecha:'11-05-24'->2024-05-11
[2025-11-02 02:28:47] L2603 fecha:'05-06-25'->2025-06-05
[2025-11-02 02:28:47] L2604 fecha:'26-06-24'->2024-06-26
[2025-11-02 02:28:47] L2605 fecha:'06-01-25'->2025-01-06
[2025-11-02 02:28:47] L2606 fecha:'23-08-25'->2025-08-23
[2025-11-02 02:28:47] L2607 fecha:'03-03-24'->2024-03-03
[2025-11-02 02:28:47] L2608 fecha:'02-12-24'->2024-12-02
[2025-11-02 02:28:47] L2609 fecha:'23-02-24'->2024-02-23
[2025-11-02 02:28:47] L2610 fecha:'28-08-25'->2025-08-28
[2025-11-02 02:28:47] L2611 fecha:'28-12-24'->2024-12-28
[2025-11-02 02:28:47] L2612 fecha:'19-12-24'->2024-12-19
[2025-11-02 02:28:47] L2613 fecha:'09-06-25'->2025-06-09
[2025-11-02 02:28:47] L2614 fecha:'17-04-24'->2024-04-17
[2025-11-02 02:28:47] L2615 fecha:'27-06-24'->2024-06-27
[2025-11-02 02:28:47] L2616 fecha:'05-08-24'->2024-08-05
[2025-11-02 02:28:47] L2617 fecha:'15-06-25'->2025-06-15
[2025-11-02 02:28:47] L2618 fecha:'31-05-25'->2025-05-31
[2025-11-02 02:28:47] L2619 fecha:'12-07-24'->2024-07-12
[2025-11-02 02:28:47] L2620 fecha:'04-04-24'->2024-04-04
[2025-11-02 02:28:47] L2621 fecha:'19-01-24'->2024-01-19
[2025-11-02 02:28:47] L2622 fecha:'11-05-25'->2025-05-11
[2025-11-02 02:28:47] L2623 fecha:'06-04-24'->2024-04-06
[2025-11-02 02:28:47] L2624 fecha:'07-05-25'->2025-05-07
[2025-11-02 02:28:47] L2625 fecha:'07-05-24'->2024-05-07
[2025-11-02 02:28:47] L2626 fecha:'21-01-25'->2025-01-21
[2025-11-02 02:28:47] L2627 fecha:'26-05-25'->2025-05-26
[2025-11-02 02:28:47] L2628 fecha:'07-12-24'->2024-12-07
[2025-11-02 02:28:47] L2629 fecha:'23-02-24'->2024-02-23
[2025-11-02 02:28:47] L2630 fecha:'09-02-24'->2024-02-09
[2025-11-02 02:28:47] L2631 fecha:'22-02-25'->2025-02-22
[2025-11-02 02:28:47] L2632 fecha:'16-08-25'->2025-08-16
[2025-11-02 02:28:47] L2633 fecha:'08-04-24'->2024-04-08
[2025-11-02 02:28:47] L2634 fecha:'25-04-24'->2024-04-25
[2025-11-02 02:28:47] L2635 fecha:'02-12-24'->2024-12-02
[2025-11-02 02:28:47] L2636 fecha:'19-05-24'->2024-05-19
[2025-11-02 02:28:47] L2637 fecha:'14-06-24'->2024-06-14
[2025-11-02 02:28:47] L2638 fecha:'07-02-25'->2025-02-07
[2025-11-02 02:28:47] L2639 fecha:'27-11-24'->2024-11-27
[2025-11-02 02:28:47] L2640 fecha:'11-02-24'->2024-02-11
[2025-11-02 02:28:47] L2641 fecha:'18-12-24'->2024-12-18
[2025-11-02 02:28:47] L2642 fecha:'04-02-25'->2025-02-04
[2025-11-02 02:28:47] L2643 fecha:'28-05-25'->2025-05-28
[2025-11-02 02:28:47] L2644 fecha:'18-10-24'->2024-10-18
[2025-11-02 02:28:47] L2645 fecha:'30-10-24'->2024-10-30
[2025-11-02 02:28:47] L2646 fecha:'06-08-24'->2024-08-06
[2025-11-02 02:28:47] L2647 fecha:'15-11-24'->2024-11-15
[2025-11-02 02:28:47] L2648 fecha:'15-11-24'->2024-11-15
[2025-11-02 02:28:47] L2649 fecha:'30-08-24'->2024-08-30
[2025-11-02 02:28:47] L2650 fecha:'12-01-25'->2025-01-12
[2025-11-02 02:28:47] L2651 fecha:'23-08-24'->2024-08-23
[2025-11-02 02:28:47] L2652 fecha:'11-07-24'->2024-07-11
[2025-11-02 02:28:47] L2653 fecha:'25-05-24'->2024-05-25
[2025-11-02 02:28:47] L2654 fecha:'12-03-25'->2025-03-12
[2025-11-02 02:28:47] L2655 fecha:'01-02-24'->2024-02-01
[2025-11-02 02:28:47] L2656 fecha:'12-11-24'->2024-11-12
[2025-11-02 02:28:47] L2657 fecha:'03-09-24'->2024-09-03
[2025-11-02 02:28:47] L2658 fecha:'22-11-24'->2024-11-22
[2025-11-02 02:28:47] L2659 fecha:'23-04-24'->2024-04-23
[2025-11-02 02:28:47] L2660 fecha:'18-04-24'->2024-04-18
[2025-11-02 02:28:47] L2661 fecha:'04-07-25'->2025-07-04
[2025-11-02 02:28:47] L2662 fecha:'14-06-25'->2025-06-14
[2025-11-02 02:28:47] L2663 fecha:'26-06-24'->2024-06-26
[2025-11-02 02:28:47] L2664 fecha:'20-11-24'->2024-11-20
[2025-11-02 02:28:47] L2665 fecha:'11-02-25'->2025-02-11
[2025-11-02 02:28:47] L2666 fecha:'16-04-25'->2025-04-16
[2025-11-02 02:28:47] L2667 fecha:'24-07-25'->2025-07-24
[2025-11-02 02:28:47] L2668 fecha:'22-11-24'->2024-11-22
[2025-11-02 02:28:47] L2669 fecha:'21-08-25'->2025-08-21
[2025-11-02 02:28:47] L2670 fecha:'02-07-25'->2025-07-02
[2025-11-02 02:28:47] L2671 fecha:'16-08-24'->2024-08-16
[2025-11-02 02:28:47] L2672 fecha:'28-02-24'->2024-02-28
[2025-11-02 02:28:47] L2673 fecha:'28-05-24'->2024-05-28
[2025-11-02 02:28:47] L2674 fecha:'15-03-24'->2024-03-15
[2025-11-02 02:28:47] L2675 fecha:'11-05-25'->2025-05-11
[2025-11-02 02:28:47] L2676 fecha:'15-07-25'->2025-07-15
[2025-11-02 02:28:47] L2677 fecha:'20-03-25'->2025-03-20
[2025-11-02 02:28:47] L2678 fecha:'29-10-24'->2024-10-29
[2025-11-02 02:28:47] L2679 fecha:'05-07-24'->2024-07-05
[2025-11-02 02:28:47] L2680 fecha:'30-09-24'->2024-09-30
[2025-11-02 02:28:47] L2681 fecha:'06-04-24'->2024-04-06
[2025-11-02 02:28:47] L2682 fecha:'29-10-24'->2024-10-29
[2025-11-02 02:28:47] L2683 fecha:'06-03-25'->2025-03-06
[2025-11-02 02:28:47] L2684 fecha:'06-07-24'->2024-07-06
[2025-11-02 02:28:47] L2685 fecha:'22-01-25'->2025-01-22
[2025-11-02 02:28:47] L2686 fecha:'28-08-25'->2025-08-28
[2025-11-02 02:28:47] L2687 fecha:'18-06-25'->2025-06-18
[2025-11-02 02:28:47] L2688 fecha:'20-03-24'->2024-03-20
[2025-11-02 02:28:47] L2689 fecha:'24-04-24'->2024-04-24
[2025-11-02 02:28:47] L2690 fecha:'04-06-25'->2025-06-04
[2025-11-02 02:28:47] L2691 fecha:'27-11-24'->2024-11-27
[2025-11-02 02:28:47] L2692 fecha:'02-08-25'->2025-08-02
[2025-11-02 02:28:47] L2693 fecha:'06-02-24'->2024-02-06
[2025-11-02 02:28:47] L2694 fecha:'18-10-24'->2024-10-18
[2025-11-02 02:28:47] L2695 fecha:'17-01-24'->2024-01-17
[2025-11-02 02:28:47] L2696 fecha:'01-04-24'->2024-04-01
[2025-11-02 02:28:47] L2697 fecha:'03-04-25'->2025-04-03
[2025-11-02 02:28:47] L2698 fecha:'21-04-25'->2025-04-21
[2025-11-02 02:28:47] L2699 fecha:'29-05-25'->2025-05-29
[2025-11-02 02:28:47] L2700 fecha:'09-07-25'->2025-07-09
[2025-11-02 02:28:47] L2701 fecha:'01-09-24'->2024-09-01
[2025-11-02 02:28:47] L2702 fecha:'22-01-24'->2024-01-22
[2025-11-02 02:28:47] L2703 fecha:'23-03-24'->2024-03-23
[2025-11-02 02:28:47] L2704 fecha:'02-09-24'->2024-09-02
[2025-11-02 02:28:47] L2705 fecha:'02-02-25'->2025-02-02
[2025-11-02 02:28:47] L2706 fecha:'15-06-24'->2024-06-15
[2025-11-02 02:28:47] L2707 fecha:'25-01-24'->2024-01-25
[2025-11-02 02:28:47] L2708 fecha:'15-01-25'->2025-01-15
[2025-11-02 02:28:47] L2709 fecha:'31-07-25'->2025-07-31
[2025-11-02 02:28:47] L2710 fecha:'30-09-24'->2024-09-30
[2025-11-02 02:28:47] L2711 fecha:'23-09-24'->2024-09-23
[2025-11-02 02:28:47] L2712 fecha:'04-09-24'->2024-09-04
[2025-11-02 02:28:47] L2713 fecha:'10-05-24'->2024-05-10
[2025-11-02 02:28:47] L2714 fecha:'25-04-24'->2024-04-25
[2025-11-02 02:28:47] L2715 fecha:'20-04-24'->2024-04-20
[2025-11-02 02:28:47] L2716 fecha:'26-08-25'->2025-08-26
[2025-11-02 02:28:47] L2717 fecha:'26-06-24'->2024-06-26
[2025-11-02 02:28:47] L2718 fecha:'10-02-25'->2025-02-10
[2025-11-02 02:28:47] L2719 fecha:'02-11-24'->2024-11-02
[2025-11-02 02:28:47] L2720 fecha:'22-01-24'->2024-01-22
[2025-11-02 02:28:47] L2721 fecha:'05-03-24'->2024-03-05
[2025-11-02 02:28:47] L2722 fecha:'15-07-24'->2024-07-15
[2025-11-02 02:28:47] L2723 fecha:'16-07-24'->2024-07-16
[2025-11-02 02:28:47] L2724 fecha:'19-07-24'->2024-07-19
[2025-11-02 02:28:47] L2725 fecha:'21-03-24'->2024-03-21
[2025-11-02 02:28:47] L2726 fecha:'29-10-24'->2024-10-29
[2025-11-02 02:28:47] L2727 fecha:'14-02-25'->2025-02-14
[2025-11-02 02:28:47] L2728 fecha:'23-07-25'->2025-07-23
[2025-11-02 02:28:47] L2729 fecha:'06-09-24'->2024-09-06
[2025-11-02 02:28:47] L2730 fecha:'27-08-24'->2024-08-27
[2025-11-02 02:28:47] L2731 fecha:'20-07-24'->2024-07-20
[2025-11-02 02:28:47] L2732 fecha:'07-06-25'->2025-06-07
[2025-11-02 02:28:47] L2733 fecha:'11-03-24'->2024-03-11
[2025-11-02 02:28:47] L2734 fecha:'09-02-25'->2025-02-09
[2025-11-02 02:28:47] L2735 fecha:'28-06-24'->2024-06-28
[2025-11-02 02:28:47] L2736 fecha:'09-02-24'->2024-02-09
[2025-11-02 02:28:47] L2737 fecha:'18-02-25'->2025-02-18
[2025-11-02 02:28:47] L2738 fecha:'03-05-24'->2024-05-03
[2025-11-02 02:28:47] L2739 fecha:'21-02-24'->2024-02-21
[2025-11-02 02:28:47] L2740 fecha:'12-09-24'->2024-09-12
[2025-11-02 02:28:47] L2741 fecha:'23-10-24'->2024-10-23
[2025-11-02 02:28:47] L2742 fecha:'30-01-24'->2024-01-30
[2025-11-02 02:28:47] L2743 fecha:'24-07-25'->2025-07-24
[2025-11-02 02:28:47] L2744 fecha:'19-08-24'->2024-08-19
[2025-11-02 02:28:47] L2745 fecha:'27-03-24'->2024-03-27
[2025-11-02 02:28:47] L2746 fecha:'06-02-24'->2024-02-06
[2025-11-02 02:28:47] L2747 fecha:'27-08-25'->2025-08-27
[2025-11-02 02:28:47] L2748 fecha:'06-03-25'->2025-03-06
[2025-11-02 02:28:47] L2749 fecha:'13-05-25'->2025-05-13
[2025-11-02 02:28:47] L2750 fecha:'04-03-24'->2024-03-04
[2025-11-02 02:28:47] L2751 fecha:'14-08-24'->2024-08-14
[2025-11-02 02:28:47] L2752 fecha:'24-04-24'->2024-04-24
[2025-11-02 02:28:47] L2753 fecha:'13-04-24'->2024-04-13
[2025-11-02 02:28:47] L2754 fecha:'25-06-25'->2025-06-25
[2025-11-02 02:28:47] L2755 fecha:'31-01-24'->2024-01-31
[2025-11-02 02:28:47] L2756 fecha:'21-10-24'->2024-10-21
[2025-11-02 02:28:47] L2757 fecha:'01-02-24'->2024-02-01
[2025-11-02 02:28:47] L2758 fecha:'21-04-25'->2025-04-21
[2025-11-02 02:28:47] L2759 fecha:'13-03-24'->2024-03-13
[2025-11-02 02:28:47] L2760 fecha:'24-11-24'->2024-11-24
[2025-11-02 02:28:47] L2761 fecha:'15-06-24'->2024-06-15
[2025-11-02 02:28:47] L2762 fecha:'14-06-25'->2025-06-14
[2025-11-02 02:28:47] L2763 fecha:'23-12-24'->2024-12-23
[2025-11-02 02:28:47] L2764 fecha:'22-06-24'->2024-06-22
[2025-11-02 02:28:47] L2765 fecha:'17-03-25'->2025-03-17
[2025-11-02 02:28:47] L2766 fecha:'12-05-24'->2024-05-12
[2025-11-02 02:28:47] L2767 fecha:'08-04-24'->2024-04-08
[2025-11-02 02:28:47] L2768 fecha:'04-04-25'->2025-04-04
[2025-11-02 02:28:47] L2769 fecha:'05-06-25'->2025-06-05
[2025-11-02 02:28:47] L2770 fecha:'20-08-25'->2025-08-20
[2025-11-02 02:28:47] L2771 fecha:'21-07-25'->2025-07-21
[2025-11-02 02:28:47] L2772 fecha:'01-06-24'->2024-06-01
[2025-11-02 02:28:47] L2773 fecha:'16-08-25'->2025-08-16
[2025-11-02 02:28:47] L2774 fecha:'30-03-25'->2025-03-30
[2025-11-02 02:28:47] L2775 fecha:'13-08-24'->2024-08-13
[2025-11-02 02:28:47] L2776 fecha:'17-06-25'->2025-06-17
[2025-11-02 02:28:47] L2777 fecha:'25-08-25'->2025-08-25
[2025-11-02 02:28:47] L2778 fecha:'30-12-24'->2024-12-30
[2025-11-02 02:28:47] L2779 fecha:'27-02-24'->2024-02-27
[2025-11-02 02:28:47] L2780 fecha:'25-08-24'->2024-08-25
[2025-11-02 02:28:47] L2781 fecha:'29-08-24'->2024-08-29
[2025-11-02 02:28:47] L2782 fecha:'30-01-24'->2024-01-30
[2025-11-02 02:28:47] L2783 fecha:'25-10-24'->2024-10-25
[2025-11-02 02:28:47] L2784 fecha:'16-03-25'->2025-03-16
[2025-11-02 02:28:47] L2785 fecha:'14-06-25'->2025-06-14
[2025-11-02 02:28:47] L2786 fecha:'31-07-24'->2024-07-31
[2025-11-02 02:28:47] L2787 fecha:'12-08-24'->2024-08-12
[2025-11-02 02:28:47] L2788 fecha:'07-03-24'->2024-03-07
[2025-11-02 02:28:47] L2789 fecha:'16-01-25'->2025-01-16
[2025-11-02 02:28:47] L2790 fecha:'02-03-25'->2025-03-02
[2025-11-02 02:28:47] L2791 fecha:'28-07-24'->2024-07-28
[2025-11-02 02:28:47] L2792 fecha:'14-04-25'->2025-04-14
[2025-11-02 02:28:47] L2793 fecha:'20-10-24'->2024-10-20
[2025-11-02 02:28:47] L2794 fecha:'21-01-25'->2025-01-21
[2025-11-02 02:28:47] L2795 fecha:'05-07-25'->2025-07-05
[2025-11-02 02:28:47] L2796 fecha:'27-06-24'->2024-06-27
[2025-11-02 02:28:47] L2797 fecha:'17-01-25'->2025-01-17
[2025-11-02 02:28:47] L2798 fecha:'03-03-25'->2025-03-03
[2025-11-02 02:28:47] L2799 fecha:'07-02-24'->2024-02-07
[2025-11-02 02:28:47] L2800 fecha:'09-10-24'->2024-10-09
[2025-11-02 02:28:47] L2801 fecha:'21-02-25'->2025-02-21
[2025-11-02 02:28:47] L2802 fecha:'03-03-25'->2025-03-03
[2025-11-02 02:28:47] L2803 fecha:'16-03-25'->2025-03-16
[2025-11-02 02:28:47] L2804 fecha:'21-02-25'->2025-02-21
[2025-11-02 02:28:47] L2805 fecha:'18-02-24'->2024-02-18
[2025-11-02 02:28:47] L2806 fecha:'04-11-24'->2024-11-04
[2025-11-02 02:28:47] L2807 fecha:'05-03-24'->2024-03-05
[2025-11-02 02:28:47] L2808 fecha:'23-05-24'->2024-05-23
[2025-11-02 02:28:47] L2809 fecha:'13-01-24'->2024-01-13
[2025-11-02 02:28:47] L2810 fecha:'10-01-24'->2024-01-10
[2025-11-02 02:28:47] L2811 fecha:'05-05-24'->2024-05-05
[2025-11-02 02:28:47] L2812 fecha:'22-02-24'->2024-02-22
[2025-11-02 02:28:47] L2813 fecha:'11-08-25'->2025-08-11
[2025-11-02 02:28:47] L2814 fecha:'03-07-24'->2024-07-03
[2025-11-02 02:28:47] L2815 fecha:'27-08-24'->2024-08-27
[2025-11-02 02:28:47] L2816 fecha:'14-10-24'->2024-10-14
[2025-11-02 02:28:47] L2817 fecha:'23-04-25'->2025-04-23
[2025-11-02 02:28:47] L2818 fecha:'30-08-25'->2025-08-30
[2025-11-02 02:28:47] L2819 fecha:'12-06-25'->2025-06-12
[2025-11-02 02:28:47] L2820 fecha:'24-03-24'->2024-03-24
[2025-11-02 02:28:47] L2821 fecha:'10-11-24'->2024-11-10
[2025-11-02 02:28:47] L2822 fecha:'30-01-24'->2024-01-30
[2025-11-02 02:28:47] L2823 fecha:'04-07-24'->2024-07-04
[2025-11-02 02:28:47] L2824 fecha:'26-04-24'->2024-04-26
[2025-11-02 02:28:47] L2825 fecha:'10-06-24'->2024-06-10
[2025-11-02 02:28:47] L2826 fecha:'31-08-24'->2024-08-31
[2025-11-02 02:28:47] L2827 fecha:'27-08-24'->2024-08-27
[2025-11-02 02:28:47] L2828 fecha:'12-04-25'->2025-04-12
[2025-11-02 02:28:47] L2829 fecha:'09-04-25'->2025-04-09
[2025-11-02 02:28:47] L2830 fecha:'10-05-25'->2025-05-10
[2025-11-02 02:28:47] L2831 fecha:'29-10-24'->2024-10-29
[2025-11-02 02:28:47] L2832 fecha:'20-03-24'->2024-03-20
[2025-11-02 02:28:47] L2833 fecha:'02-07-24'->2024-07-02
[2025-11-02 02:28:47] L2834 fecha:'14-02-25'->2025-02-14
[2025-11-02 02:28:47] L2835 fecha:'24-12-24'->2024-12-24
[2025-11-02 02:28:47] L2836 fecha:'05-06-24'->2024-06-05
[2025-11-02 02:28:47] L2837 fecha:'10-03-24'->2024-03-10
[2025-11-02 02:28:47] L2838 fecha:'10-01-24'->2024-01-10
[2025-11-02 02:28:47] L2839 fecha:'16-02-24'->2024-02-16
[2025-11-02 02:28:47] L2840 fecha:'06-02-25'->2025-02-06
[2025-11-02 02:28:47] L2841 fecha:'22-06-25'->2025-06-22
[2025-11-02 02:28:47] L2842 fecha:'12-02-25'->2025-02-12
[2025-11-02 02:28:47] L2843 fecha:'08-10-24'->2024-10-08
[2025-11-02 02:28:47] L2844 fecha:'29-04-25'->2025-04-29
[2025-11-02 02:28:47] L2845 fecha:'16-09-24'->2024-09-16
[2025-11-02 02:28:47] L2846 fecha:'27-06-24'->2024-06-27
[2025-11-02 02:28:47] L2847 fecha:'30-01-24'->2024-01-30
[2025-11-02 02:28:47] L2848 fecha:'12-07-24'->2024-07-12
[2025-11-02 02:28:47] L2849 fecha:'25-07-24'->2024-07-25
[2025-11-02 02:28:47] L2850 fecha:'19-06-24'->2024-06-19
[2025-11-02 02:28:47] L2851 fecha:'12-08-24'->2024-08-12
[2025-11-02 02:28:47] L2852 fecha:'09-08-25'->2025-08-09
[2025-11-02 02:28:47] L2853 fecha:'07-11-24'->2024-11-07
[2025-11-02 02:28:47] L2854 fecha:'01-01-24'->2024-01-01
[2025-11-02 02:28:47] L2855 fecha:'07-01-24'->2024-01-07
[2025-11-02 02:28:47] L2856 fecha:'06-05-24'->2024-05-06
[2025-11-02 02:28:47] L2857 fecha:'26-06-24'->2024-06-26
[2025-11-02 02:28:47] L2858 fecha:'22-03-24'->2024-03-22
[2025-11-02 02:28:47] L2859 fecha:'03-05-24'->2024-05-03
[2025-11-02 02:28:47] L2860 fecha:'15-09-24'->2024-09-15
[2025-11-02 02:28:47] L2861 fecha:'02-03-24'->2024-03-02
[2025-11-02 02:28:47] L2862 fecha:'16-01-25'->2025-01-16
[2025-11-02 02:28:47] L2863 fecha:'19-04-24'->2024-04-19
[2025-11-02 02:28:47] L2864 fecha:'01-05-25'->2025-05-01
[2025-11-02 02:28:47] L2865 fecha:'05-07-24'->2024-07-05
[2025-11-02 02:28:47] L2866 fecha:'20-07-25'->2025-07-20
[2025-11-02 02:28:47] L2867 fecha:'10-08-24'->2024-08-10
[2025-11-02 02:28:47] L2868 fecha:'28-02-25'->2025-02-28
[2025-11-02 02:28:47] L2869 fecha:'13-08-25'->2025-08-13
[2025-11-02 02:28:47] L2870 fecha:'07-12-24'->2024-12-07
[2025-11-02 02:28:47] L2871 fecha:'09-04-25'->2025-04-09
[2025-11-02 02:28:47] L2872 fecha:'09-05-25'->2025-05-09
[2025-11-02 02:28:47] L2873 fecha:'13-10-24'->2024-10-13
[2025-11-02 02:28:47] L2874 fecha:'15-06-25'->2025-06-15
[2025-11-02 02:28:47] L2875 fecha:'09-04-24'->2024-04-09
[2025-11-02 02:28:47] L2876 fecha:'08-03-24'->2024-03-08
[2025-11-02 02:28:47] L2877 fecha:'21-02-24'->2024-02-21
[2025-11-02 02:28:47] L2878 fecha:'23-01-24'->2024-01-23
[2025-11-02 02:28:47] L2879 fecha:'27-05-24'->2024-05-27
[2025-11-02 02:28:47] L2880 fecha:'04-05-24'->2024-05-04
[2025-11-02 02:28:47] L2881 fecha:'09-02-24'->2024-02-09
[2025-11-02 02:28:47] L2882 fecha:'01-05-25'->2025-05-01
[2025-11-02 02:28:47] L2883 fecha:'23-02-24'->2024-02-23
[2025-11-02 02:28:47] L2884 fecha:'02-04-25'->2025-04-02
[2025-11-02 02:28:47] L2885 fecha:'03-10-24'->2024-10-03
[2025-11-02 02:28:47] L2886 fecha:'17-04-24'->2024-04-17
[2025-11-02 02:28:47] L2887 fecha:'18-09-24'->2024-09-18
[2025-11-02 02:28:47] L2888 fecha:'21-04-25'->2025-04-21
[2025-11-02 02:28:47] L2889 fecha:'20-08-25'->2025-08-20
[2025-11-02 02:28:47] L2890 fecha:'16-11-24'->2024-11-16
[2025-11-02 02:28:47] L2891 fecha:'16-05-24'->2024-05-16
[2025-11-02 02:28:47] L2892 fecha:'06-01-25'->2025-01-06
[2025-11-02 02:28:47] L2893 fecha:'02-07-25'->2025-07-02
[2025-11-02 02:28:47] L2894 fecha:'25-10-24'->2024-10-25
[2025-11-02 02:28:47] L2895 fecha:'22-07-25'->2025-07-22
[2025-11-02 02:28:47] L2896 fecha:'20-11-24'->2024-11-20
[2025-11-02 02:28:47] L2897 fecha:'25-02-24'->2024-02-25
[2025-11-02 02:28:47] L2898 fecha:'18-04-24'->2024-04-18
[2025-11-02 02:28:47] L2899 fecha:'25-12-24'->2024-12-25
[2025-11-02 02:28:47] L2900 fecha:'14-07-25'->2025-07-14
[2025-11-02 02:28:47] L2901 fecha:'04-08-25'->2025-08-04
[2025-11-02 02:28:47] L2902 fecha:'20-01-24'->2024-01-20
[2025-11-02 02:28:47] L2903 fecha:'16-10-24'->2024-10-16
[2025-11-02 02:28:47] L2904 fecha:'28-08-24'->2024-08-28
[2025-11-02 02:28:47] L2905 fecha:'03-03-24'->2024-03-03
[2025-11-02 02:28:47] L2906 fecha:'03-01-25'->2025-01-03
[2025-11-02 02:28:47] L2907 fecha:'02-08-25'->2025-08-02
[2025-11-02 02:28:47] L2908 fecha:'17-04-25'->2025-04-17
[2025-11-02 02:28:47] L2909 fecha:'11-02-25'->2025-02-11
[2025-11-02 02:28:47] L2910 fecha:'01-04-24'->2024-04-01
[2025-11-02 02:28:47] L2911 fecha:'12-02-25'->2025-02-12
[2025-11-02 02:28:47] L2912 fecha:'07-10-24'->2024-10-07
[2025-11-02 02:28:47] L2913 fecha:'28-06-25'->2025-06-28
[2025-11-02 02:28:47] L2914 fecha:'07-07-24'->2024-07-07
[2025-11-02 02:28:47] L2915 fecha:'06-08-25'->2025-08-06
[2025-11-02 02:28:47] L2916 fecha:'24-05-24'->2024-05-24
[2025-11-02 02:28:47] L2917 fecha:'22-01-25'->2025-01-22
[2025-11-02 02:28:47] L2918 fecha:'08-03-24'->2024-03-08
[2025-11-02 02:28:47] L2919 fecha:'09-02-24'->2024-02-09
[2025-11-02 02:28:47] L2920 fecha:'18-11-24'->2024-11-18
[2025-11-02 02:28:47] L2921 fecha:'12-10-24'->2024-10-12
[2025-11-02 02:28:47] L2922 fecha:'11-01-24'->2024-01-11
[2025-11-02 02:28:47] L2923 fecha:'23-08-24'->2024-08-23
[2025-11-02 02:28:47] L2924 fecha:'21-01-25'->2025-01-21
[2025-11-02 02:28:47] L2925 fecha:'05-09-24'->2024-09-05
[2025-11-02 02:28:47] L2926 fecha:'14-07-25'->2025-07-14
[2025-11-02 02:28:47] L2927 fecha:'13-01-24'->2024-01-13
[2025-11-02 02:28:47] L2928 fecha:'20-07-25'->2025-07-20
[2025-11-02 02:28:47] L2929 fecha:'07-08-24'->2024-08-07
[2025-11-02 02:28:47] L2930 fecha:'18-04-25'->2025-04-18
[2025-11-02 02:28:47] L2931 fecha:'18-04-24'->2024-04-18
[2025-11-02 02:28:47] L2932 fecha:'06-04-25'->2025-04-06
[2025-11-02 02:28:47] L2933 fecha:'15-02-25'->2025-02-15
[2025-11-02 02:28:47] L2934 fecha:'23-04-24'->2024-04-23
[2025-11-02 02:28:47] L2935 fecha:'06-02-25'->2025-02-06
[2025-11-02 02:28:47] L2936 fecha:'05-06-24'->2024-06-05
[2025-11-02 02:28:47] L2937 fecha:'10-01-24'->2024-01-10
[2025-11-02 02:28:47] L2938 fecha:'09-02-25'->2025-02-09
[2025-11-02 02:28:47] L2939 fecha:'20-07-25'->2025-07-20
[2025-11-02 02:28:47] L2940 fecha:'19-01-24'->2024-01-19
[2025-11-02 02:28:47] L2941 fecha:'16-07-25'->2025-07-16
[2025-11-02 02:28:47] L2942 fecha:'18-02-24'->2024-02-18
[2025-11-02 02:28:47] L2943 fecha:'24-07-24'->2024-07-24
[2025-11-02 02:28:47] L2944 fecha:'17-03-24'->2024-03-17
[2025-11-02 02:28:47] L2945 fecha:'16-04-25'->2025-04-16
[2025-11-02 02:28:47] L2946 fecha:'03-08-25'->2025-08-03
[2025-11-02 02:28:47] L2947 fecha:'12-08-24'->2024-08-12
[2025-11-02 02:28:47] L2948 fecha:'16-06-25'->2025-06-16
[2025-11-02 02:28:47] L2949 fecha:'02-12-24'->2024-12-02
[2025-11-02 02:28:47] L2950 fecha:'09-06-25'->2025-06-09
[2025-11-02 02:28:47] L2951 fecha:'13-06-24'->2024-06-13
[2025-11-02 02:28:47] L2952 fecha:'06-08-25'->2025-08-06
[2025-11-02 02:28:47] L2953 fecha:'09-03-25'->2025-03-09
[2025-11-02 02:28:47] L2954 fecha:'31-05-25'->2025-05-31
[2025-11-02 02:28:47] L2955 fecha:'26-08-25'->2025-08-26
[2025-11-02 02:28:47] L2956 fecha:'20-04-25'->2025-04-20
[2025-11-02 02:28:47] L2957 fecha:'17-03-24'->2024-03-17
[2025-11-02 02:28:47] L2958 fecha:'25-06-25'->2025-06-25
[2025-11-02 02:28:47] L2959 fecha:'24-01-25'->2025-01-24
[2025-11-02 02:28:47] L2960 fecha:'13-02-25'->2025-02-13
[2025-11-02 02:28:47] L2961 fecha:'09-07-25'->2025-07-09
[2025-11-02 02:28:47] L2962 fecha:'18-08-25'->2025-08-18
[2025-11-02 02:28:47] L2963 fecha:'11-03-25'->2025-03-11
[2025-11-02 02:28:47] L2964 fecha:'11-01-25'->2025-01-11
[2025-11-02 02:28:47] L2965 fecha:'14-06-24'->2024-06-14
[2025-11-02 02:28:47] L2966 fecha:'18-12-24'->2024-12-18
[2025-11-02 02:28:47] L2967 fecha:'24-01-24'->2024-01-24
[2025-11-02 02:28:47] L2968 fecha:'28-01-25'->2025-01-28
[2025-11-02 02:28:47] L2969 fecha:'27-08-25'->2025-08-27
[2025-11-02 02:28:47] L2970 fecha:'20-06-25'->2025-06-20
[2025-11-02 02:28:47] L2971 fecha:'23-02-25'->2025-02-23
[2025-11-02 02:28:47] L2972 fecha:'14-10-24'->2024-10-14
[2025-11-02 02:28:47] L2973 fecha:'01-07-24'->2024-07-01
[2025-11-02 02:28:47] L2974 fecha:'11-02-24'->2024-02-11
[2025-11-02 02:28:47] L2975 fecha:'02-01-24'->2024-01-02
[2025-11-02 02:28:47] L2976 fecha:'01-07-24'->2024-07-01
[2025-11-02 02:28:47] L2977 fecha:'01-01-24'->2024-01-01
[2025-11-02 02:28:47] L2978 fecha:'29-06-24'->2024-06-29
[2025-11-02 02:28:47] L2979 fecha:'14-05-25'->2025-05-14
[2025-11-02 02:28:47] L2980 fecha:'25-02-25'->2025-02-25
[2025-11-02 02:28:47] L2981 fecha:'31-01-24'->2024-01-31
[2025-11-02 02:28:47] L2982 fecha:'30-04-24'->2024-04-30
[2025-11-02 02:28:47] L2983 fecha:'14-06-24'->2024-06-14
[2025-11-02 02:28:47] L2984 fecha:'27-01-25'->2025-01-27
[2025-11-02 02:28:47] L2985 fecha:'25-06-25'->2025-06-25
[2025-11-02 02:28:47] L2986 fecha:'30-01-24'->2024-01-30
[2025-11-02 02:28:47] L2987 fecha:'10-08-25'->2025-08-10
[2025-11-02 02:28:47] L2988 fecha:'18-08-25'->2025-08-18
[2025-11-02 02:28:47] L2989 fecha:'17-03-24'->2024-03-17
[2025-11-02 02:28:47] L2990 fecha:'04-10-24'->2024-10-04
[2025-11-02 02:28:47] L2991 fecha:'02-08-24'->2024-08-02
[2025-11-02 02:28:47] L2992 fecha:'27-02-25'->2025-02-27
[2025-11-02 02:28:47] L2993 fecha:'15-01-24'->2024-01-15
[2025-11-02 02:28:47] L2994 fecha:'17-01-25'->2025-01-17
[2025-11-02 02:28:47] L2995 fecha:'06-02-25'->2025-02-06
[2025-11-02 02:28:47] L2996 fecha:'24-01-24'->2024-01-24
[2025-11-02 02:28:47] L2997 fecha:'18-08-25'->2025-08-18
[2025-11-02 02:28:47] L2998 fecha:'05-09-24'->2024-09-05
[2025-11-02 02:28:47] L2999 fecha:'26-03-25'->2025-03-26
[2025-11-02 02:28:47] L3000 fecha:'12-04-24'->2024-04-12
[2025-11-02 02:28:47] L3001 fecha:'21-10-24'->2024-10-21
[2025-11-02 02:28:47] L3002 fecha:'26-06-24'->2024-06-26
[2025-11-02 02:28:47] L3003 fecha:'26-08-25'->2025-08-26
[2025-11-02 02:28:47] L3004 fecha:'04-01-25'->2025-01-04
[2025-11-02 02:28:47] L3005 fecha:'20-09-24'->2024-09-20
[2025-11-02 02:28:47] L3006 fecha:'08-01-24'->2024-01-08
[2025-11-02 02:28:47] L3007 fecha:'11-10-24'->2024-10-11
[2025-11-02 02:28:47] L3008 fecha:'26-09-24'->2024-09-26
[2025-11-02 02:28:47] L3009 fecha:'09-06-24'->2024-06-09
[2025-11-02 02:28:47] L3010 fecha:'14-05-25'->2025-05-14
[2025-11-02 02:28:47] L3011 fecha:'20-07-25'->2025-07-20
[2025-11-02 02:28:47] L3012 fecha:'06-12-24'->2024-12-06
[2025-11-02 02:28:47] L3013 fecha:'20-01-24'->2024-01-20
[2025-11-02 02:28:47] L3014 fecha:'09-12-24'->2024-12-09
[2025-11-02 02:28:47] L3015 fecha:'16-03-24'->2024-03-16
[2025-11-02 02:28:47] L3016 fecha:'27-08-24'->2024-08-27
[2025-11-02 02:28:47] L3017 fecha:'02-09-24'->2024-09-02
[2025-11-02 02:28:47] L3018 fecha:'06-10-24'->2024-10-06
[2025-11-02 02:28:47] L3019 fecha:'19-03-25'->2025-03-19
[2025-11-02 02:28:47] L3020 fecha:'18-01-25'->2025-01-18
[2025-11-02 02:28:47] L3021 fecha:'07-05-24'->2024-05-07
[2025-11-02 02:28:47] L3022 fecha:'27-12-24'->2024-12-27
[2025-11-02 02:28:47] L3023 fecha:'16-02-24'->2024-02-16
[2025-11-02 02:28:47] L3024 fecha:'31-05-24'->2024-05-31
[2025-11-02 02:28:47] L3025 fecha:'03-04-24'->2024-04-03
[2025-11-02 02:28:47] L3026 fecha:'11-04-24'->2024-04-11
[2025-11-02 02:28:47] L3027 fecha:'26-03-25'->2025-03-26
[2025-11-02 02:28:47] L3028 fecha:'20-12-24'->2024-12-20
[2025-11-02 02:28:47] L3029 fecha:'24-01-25'->2025-01-24
[2025-11-02 02:28:47] L3030 fecha:'27-02-24'->2024-02-27
[2025-11-02 02:28:47] L3031 fecha:'23-01-24'->2024-01-23
[2025-11-02 02:28:47] L3032 fecha:'01-10-24'->2024-10-01
[2025-11-02 02:28:47] L3033 fecha:'19-06-24'->2024-06-19
[2025-11-02 02:28:47] L3034 fecha:'09-01-24'->2024-01-09
[2025-11-02 02:28:47] L3035 fecha:'06-06-24'->2024-06-06
[2025-11-02 02:28:47] L3036 fecha:'21-04-25'->2025-04-21
[2025-11-02 02:28:47] L3037 fecha:'03-04-24'->2024-04-03
[2025-11-02 02:28:47] L3038 fecha:'27-04-25'->2025-04-27
[2025-11-02 02:28:47] L3039 fecha:'17-10-24'->2024-10-17
[2025-11-02 02:28:47] L3040 fecha:'02-03-24'->2024-03-02
[2025-11-02 02:28:47] L3041 fecha:'03-02-24'->2024-02-03
[2025-11-02 02:28:47] L3042 fecha:'21-05-24'->2024-05-21
[2025-11-02 02:28:47] L3043 fecha:'11-05-25'->2025-05-11
[2025-11-02 02:28:47] L3044 fecha:'03-02-25'->2025-02-03
[2025-11-02 02:28:47] L3045 fecha:'15-02-24'->2024-02-15
[2025-11-02 02:28:47] L3046 fecha:'08-08-25'->2025-08-08
[2025-11-02 02:28:47] L3047 fecha:'12-11-24'->2024-11-12
[2025-11-02 02:28:47] L3048 fecha:'11-12-24'->2024-12-11
[2025-11-02 02:28:47] L3049 fecha:'12-08-25'->2025-08-12
[2025-11-02 02:28:47] L3050 fecha:'05-05-25'->2025-05-05
[2025-11-02 02:28:47] L3051 fecha:'02-03-25'->2025-03-02
[2025-11-02 02:28:47] L3052 fecha:'19-07-25'->2025-07-19
[2025-11-02 02:28:47] L3053 fecha:'26-01-24'->2024-01-26
[2025-11-02 02:28:47] L3054 fecha:'16-03-25'->2025-03-16
[2025-11-02 02:28:47] L3055 fecha:'27-02-25'->2025-02-27
[2025-11-02 02:28:47] L3056 fecha:'17-08-24'->2024-08-17
[2025-11-02 02:28:47] L3057 fecha:'05-06-25'->2025-06-05
[2025-11-02 02:28:47] L3058 fecha:'04-08-25'->2025-08-04
[2025-11-02 02:28:47] L3059 fecha:'08-03-24'->2024-03-08
[2025-11-02 02:28:47] L3060 fecha:'21-03-25'->2025-03-21
[2025-11-02 02:28:47] L3061 fecha:'08-12-24'->2024-12-08
[2025-11-02 02:28:47] L3062 fecha:'28-02-24'->2024-02-28
[2025-11-02 02:28:47] L3063 fecha:'20-02-25'->2025-02-20
[2025-11-02 02:28:47] L3064 fecha:'22-12-24'->2024-12-22
[2025-11-02 02:28:47] L3065 fecha:'15-02-25'->2025-02-15
[2025-11-02 02:28:47] L3066 fecha:'20-08-24'->2024-08-20
[2025-11-02 02:28:47] L3067 fecha:'22-04-25'->2025-04-22
[2025-11-02 02:28:47] L3068 fecha:'06-02-25'->2025-02-06
[2025-11-02 02:28:47] L3069 fecha:'26-02-25'->2025-02-26
[2025-11-02 02:28:47] L3070 fecha:'26-04-24'->2024-04-26
[2025-11-02 02:28:47] L3071 fecha:'17-04-24'->2024-04-17
[2025-11-02 02:28:47] L3072 fecha:'02-08-24'->2024-08-02
[2025-11-02 02:28:47] L3073 fecha:'17-01-25'->2025-01-17
[2025-11-02 02:28:47] L3074 fecha:'18-04-25'->2025-04-18
[2025-11-02 02:28:47] L3075 fecha:'11-11-24'->2024-11-11
[2025-11-02 02:28:47] L3076 fecha:'02-04-24'->2024-04-02
[2025-11-02 02:28:47] L3077 fecha:'07-06-25'->2025-06-07
[2025-11-02 02:28:47] L3078 fecha:'29-10-24'->2024-10-29
[2025-11-02 02:28:47] L3079 fecha:'22-06-25'->2025-06-22
[2025-11-02 02:28:47] L3080 fecha:'24-05-24'->2024-05-24
[2025-11-02 02:28:47] L3081 fecha:'03-03-25'->2025-03-03
[2025-11-02 02:28:47] L3082 fecha:'23-04-24'->2024-04-23
[2025-11-02 02:28:47] L3083 fecha:'11-07-25'->2025-07-11
[2025-11-02 02:28:47] L3084 fecha:'30-06-24'->2024-06-30
[2025-11-02 02:28:47] L3085 fecha:'01-02-24'->2024-02-01
[2025-11-02 02:28:47] L3086 fecha:'21-11-24'->2024-11-21
[2025-11-02 02:28:47] L3087 fecha:'16-10-24'->2024-10-16
[2025-11-02 02:28:47] L3088 fecha:'21-03-24'->2024-03-21
[2025-11-02 02:28:47] L3089 fecha:'26-02-24'->2024-02-26
[2025-11-02 02:28:47] L3090 fecha:'24-01-25'->2025-01-24
[2025-11-02 02:28:47] L3091 fecha:'15-06-24'->2024-06-15
[2025-11-02 02:28:47] L3092 fecha:'05-11-24'->2024-11-05
[2025-11-02 02:28:47] L3093 fecha:'09-09-24'->2024-09-09
[2025-11-02 02:28:47] L3094 fecha:'26-12-24'->2024-12-26
[2025-11-02 02:28:47] L3095 fecha:'22-05-25'->2025-05-22
[2025-11-02 02:28:47] L3096 fecha:'02-04-25'->2025-04-02
[2025-11-02 02:28:47] L3097 fecha:'21-07-24'->2024-07-21
[2025-11-02 02:28:47] L3098 fecha:'12-03-24'->2024-03-12
[2025-11-02 02:28:47] L3099 fecha:'05-03-25'->2025-03-05
[2025-11-02 02:28:47] L3100 fecha:'24-01-24'->2024-01-24
[2025-11-02 02:28:47] L3101 fecha:'14-05-24'->2024-05-14
[2025-11-02 02:28:47] L3102 fecha:'15-01-24'->2024-01-15
[2025-11-02 02:28:47] L3103 fecha:'25-01-24'->2024-01-25
[2025-11-02 02:28:47] L3104 fecha:'27-03-24'->2024-03-27
[2025-11-02 02:28:47] L3105 fecha:'04-04-24'->2024-04-04
[2025-11-02 02:28:47] L3106 fecha:'10-02-25'->2025-02-10
[2025-11-02 02:28:47] L3107 fecha:'18-03-24'->2024-03-18
[2025-11-02 02:28:47] L3108 fecha:'24-09-24'->2024-09-24
[2025-11-02 02:28:47] L3109 fecha:'22-07-24'->2024-07-22
[2025-11-02 02:28:47] L3110 fecha:'12-01-25'->2025-01-12
[2025-11-02 02:28:47] L3111 fecha:'09-02-24'->2024-02-09
[2025-11-02 02:28:47] L3112 fecha:'20-08-24'->2024-08-20
[2025-11-02 02:28:47] L3113 fecha:'12-02-24'->2024-02-12
[2025-11-02 02:28:47] L3114 fecha:'14-01-25'->2025-01-14
[2025-11-02 02:28:47] L3115 fecha:'05-07-24'->2024-07-05
[2025-11-02 02:28:47] L3116 fecha:'07-01-24'->2024-01-07
[2025-11-02 02:28:47] L3117 fecha:'22-01-24'->2024-01-22
[2025-11-02 02:28:47] L3118 fecha:'10-02-25'->2025-02-10
[2025-11-02 02:28:47] L3119 fecha:'22-02-25'->2025-02-22
[2025-11-02 02:28:47] L3120 fecha:'01-06-24'->2024-06-01
[2025-11-02 02:28:47] L3121 fecha:'17-06-24'->2024-06-17
[2025-11-02 02:28:47] L3122 fecha:'02-04-25'->2025-04-02
[2025-11-02 02:28:47] L3123 fecha:'05-02-24'->2024-02-05
[2025-11-02 02:28:47] L3124 fecha:'06-12-24'->2024-12-06
[2025-11-02 02:28:47] L3125 fecha:'08-03-25'->2025-03-08
[2025-11-02 02:28:47] L3126 fecha:'21-06-25'->2025-06-21
[2025-11-02 02:28:47] L3127 fecha:'02-01-25'->2025-01-02
[2025-11-02 02:28:47] L3128 fecha:'06-06-25'->2025-06-06
[2025-11-02 02:28:47] L3129 fecha:'11-01-24'->2024-01-11
[2025-11-02 02:28:47] L3130 fecha:'23-01-25'->2025-01-23
[2025-11-02 02:28:47] L3131 fecha:'22-04-24'->2024-04-22
[2025-11-02 02:28:47] L3132 fecha:'18-03-25'->2025-03-18
[2025-11-02 02:28:47] L3133 fecha:'20-11-24'->2024-11-20
[2025-11-02 02:28:47] L3134 fecha:'08-07-24'->2024-07-08
[2025-11-02 02:28:47] L3135 fecha:'16-01-25'->2025-01-16
[2025-11-02 02:28:47] L3136 fecha:'01-12-24'->2024-12-01
[2025-11-02 02:28:47] L3137 fecha:'06-07-24'->2024-07-06
[2025-11-02 02:28:47] L3138 fecha:'28-02-25'->2025-02-28
[2025-11-02 02:28:47] L3139 fecha:'01-04-25'->2025-04-01
[2025-11-02 02:28:47] L3140 fecha:'07-08-25'->2025-08-07
[2025-11-02 02:28:47] L3141 fecha:'27-08-24'->2024-08-27
[2025-11-02 02:28:47] L3142 fecha:'27-03-25'->2025-03-27
[2025-11-02 02:28:47] L3143 fecha:'28-05-24'->2024-05-28
[2025-11-02 02:28:47] L3144 fecha:'05-10-24'->2024-10-05
[2025-11-02 02:28:47] L3145 fecha:'31-12-24'->2024-12-31
[2025-11-02 02:28:47] L3146 fecha:'15-07-24'->2024-07-15
[2025-11-02 02:28:47] L3147 fecha:'04-09-24'->2024-09-04
[2025-11-02 02:28:47] L3148 fecha:'01-04-25'->2025-04-01
[2025-11-02 02:28:47] L3149 fecha:'07-02-24'->2024-02-07
[2025-11-02 02:28:47] L3150 fecha:'25-02-24'->2024-02-25
[2025-11-02 02:28:47] L3151 fecha:'11-02-25'->2025-02-11
[2025-11-02 02:28:47] L3152 fecha:'03-03-24'->2024-03-03
[2025-11-02 02:28:47] L3153 fecha:'04-05-24'->2024-05-04
[2025-11-02 02:28:47] L3154 fecha:'31-07-24'->2024-07-31
[2025-11-02 02:28:47] L3155 fecha:'18-06-25'->2025-06-18
[2025-11-02 02:28:47] L3156 fecha:'22-07-24'->2024-07-22
[2025-11-02 02:28:47] L3157 fecha:'30-06-25'->2025-06-30
[2025-11-02 02:28:47] L3158 fecha:'12-11-24'->2024-11-12
[2025-11-02 02:28:47] L3159 fecha:'11-01-25'->2025-01-11
[2025-11-02 02:28:47] L3160 fecha:'05-02-25'->2025-02-05
[2025-11-02 02:28:47] L3161 fecha:'17-02-25'->2025-02-17
[2025-11-02 02:28:47] L3162 fecha:'02-08-24'->2024-08-02
[2025-11-02 02:28:47] L3163 fecha:'12-12-24'->2024-12-12
[2025-11-02 02:28:47] L3164 fecha:'13-10-24'->2024-10-13
[2025-11-02 02:28:47] L3165 fecha:'21-03-25'->2025-03-21
[2025-11-02 02:28:47] L3166 fecha:'09-06-24'->2024-06-09
[2025-11-02 02:28:47] L3167 fecha:'06-08-25'->2025-08-06
[2025-11-02 02:28:47] L3168 fecha:'15-02-25'->2025-02-15
[2025-11-02 02:28:47] L3169 fecha:'02-06-24'->2024-06-02
[2025-11-02 02:28:47] L3170 fecha:'09-12-24'->2024-12-09
[2025-11-02 02:28:47] L3171 fecha:'27-01-24'->2024-01-27
[2025-11-02 02:28:47] L3172 fecha:'08-02-24'->2024-02-08
[2025-11-02 02:28:47] L3173 fecha:'09-01-24'->2024-01-09
[2025-11-02 02:28:47] L3174 fecha:'26-08-25'->2025-08-26
[2025-11-02 02:28:47] L3175 fecha:'17-05-25'->2025-05-17
[2025-11-02 02:28:47] L3176 fecha:'23-03-25'->2025-03-23
[2025-11-02 02:28:47] L3177 fecha:'31-05-25'->2025-05-31
[2025-11-02 02:28:47] L3178 fecha:'30-06-25'->2025-06-30
[2025-11-02 02:28:47] L3179 fecha:'27-12-24'->2024-12-27
[2025-11-02 02:28:47] L3180 fecha:'02-01-24'->2024-01-02
[2025-11-02 02:28:47] L3181 fecha:'09-08-24'->2024-08-09
[2025-11-02 02:28:47] L3182 fecha:'13-01-25'->2025-01-13
[2025-11-02 02:28:47] L3183 fecha:'09-12-24'->2024-12-09
[2025-11-02 02:28:47] L3184 fecha:'29-06-25'->2025-06-29
[2025-11-02 02:28:47] L3185 fecha:'09-02-25'->2025-02-09
[2025-11-02 02:28:47] L3186 fecha:'15-07-25'->2025-07-15
[2025-11-02 02:28:47] L3187 fecha:'13-10-24'->2024-10-13
[2025-11-02 02:28:47] L3188 fecha:'25-01-25'->2025-01-25
[2025-11-02 02:28:47] L3189 fecha:'26-05-24'->2024-05-26
[2025-11-02 02:28:47] L3190 fecha:'21-01-25'->2025-01-21
[2025-11-02 02:28:47] L3191 fecha:'28-06-24'->2024-06-28
[2025-11-02 02:28:47] L3192 fecha:'01-03-24'->2024-03-01
[2025-11-02 02:28:47] L3193 fecha:'04-10-24'->2024-10-04
[2025-11-02 02:28:47] L3194 fecha:'05-06-25'->2025-06-05
[2025-11-02 02:28:47] L3195 fecha:'26-03-24'->2024-03-26
[2025-11-02 02:28:47] L3196 fecha:'05-03-25'->2025-03-05
[2025-11-02 02:28:47] L3197 fecha:'17-11-24'->2024-11-17
[2025-11-02 02:28:47] L3198 fecha:'10-07-25'->2025-07-10
[2025-11-02 02:28:47] L3199 fecha:'26-05-25'->2025-05-26
[2025-11-02 02:28:47] L3200 fecha:'25-01-25'->2025-01-25
[2025-11-02 02:28:47] L3201 fecha:'10-03-24'->2024-03-10
[2025-11-02 02:28:47] L3202 fecha:'23-06-25'->2025-06-23
[2025-11-02 02:28:47] L3203 fecha:'30-04-24'->2024-04-30
[2025-11-02 02:28:47] L3204 fecha:'30-03-24'->2024-03-30
[2025-11-02 02:28:47] L3205 fecha:'12-07-24'->2024-07-12
[2025-11-02 02:28:47] L3206 fecha:'26-04-25'->2025-04-26
[2025-11-02 02:28:47] L3207 fecha:'24-01-25'->2025-01-24
[2025-11-02 02:28:47] L3208 fecha:'06-11-24'->2024-11-06
[2025-11-02 02:28:47] L3209 fecha:'24-12-24'->2024-12-24
[2025-11-02 02:28:47] L3210 fecha:'03-02-25'->2025-02-03
[2025-11-02 02:28:47] L3211 fecha:'18-08-24'->2024-08-18
[2025-11-02 02:28:47] L3212 fecha:'30-11-24'->2024-11-30
[2025-11-02 02:28:47] L3213 fecha:'10-09-24'->2024-09-10
[2025-11-02 02:28:47] L3214 fecha:'24-07-25'->2025-07-24
[2025-11-02 02:28:47] L3215 fecha:'11-04-24'->2024-04-11
[2025-11-02 02:28:47] L3216 fecha:'19-01-24'->2024-01-19
[2025-11-02 02:28:47] L3217 fecha:'10-10-24'->2024-10-10
[2025-11-02 02:28:47] L3218 fecha:'26-07-25'->2025-07-26
[2025-11-02 02:28:47] L3219 fecha:'09-08-25'->2025-08-09
[2025-11-02 02:28:47] L3220 fecha:'10-03-25'->2025-03-10
[2025-11-02 02:28:47] L3221 fecha:'07-01-24'->2024-01-07
[2025-11-02 02:28:47] L3222 fecha:'02-04-24'->2024-04-02
[2025-11-02 02:28:47] L3223 fecha:'09-09-24'->2024-09-09
[2025-11-02 02:28:47] L3224 fecha:'01-11-24'->2024-11-01
[2025-11-02 02:28:47] L3225 fecha:'24-01-25'->2025-01-24
[2025-11-02 02:28:47] L3226 fecha:'05-10-24'->2024-10-05
[2025-11-02 02:28:47] L3227 fecha:'22-02-25'->2025-02-22
[2025-11-02 02:28:47] L3228 fecha:'31-12-24'->2024-12-31
[2025-11-02 02:28:47] L3229 fecha:'31-01-24'->2024-01-31
[2025-11-02 02:28:47] L3230 fecha:'22-03-25'->2025-03-22
[2025-11-02 02:28:47] L3231 fecha:'08-04-25'->2025-04-08
[2025-11-02 02:28:47] L3232 fecha:'18-04-25'->2025-04-18
[2025-11-02 02:28:47] L3233 fecha:'19-06-25'->2025-06-19
[2025-11-02 02:28:47] L3234 fecha:'28-02-24'->2024-02-28
[2025-11-02 02:28:47] L3235 fecha:'07-09-24'->2024-09-07
[2025-11-02 02:28:47] L3236 fecha:'17-07-25'->2025-07-17
[2025-11-02 02:28:47] L3237 fecha:'16-07-24'->2024-07-16
[2025-11-02 02:28:47] L3238 fecha:'08-04-24'->2024-04-08
[2025-11-02 02:28:47] L3239 fecha:'07-06-25'->2025-06-07
[2025-11-02 02:28:47] L3240 fecha:'05-04-25'->2025-04-05
[2025-11-02 02:28:47] L3241 fecha:'29-10-24'->2024-10-29
[2025-11-02 02:28:47] L3242 fecha:'21-12-24'->2024-12-21
[2025-11-02 02:28:47] L3243 fecha:'28-04-24'->2024-04-28
[2025-11-02 02:28:47] L3244 fecha:'18-01-25'->2025-01-18
[2025-11-02 02:28:47] L3245 fecha:'24-06-24'->2024-06-24
[2025-11-02 02:28:47] L3246 fecha:'20-07-25'->2025-07-20
[2025-11-02 02:28:47] L3247 fecha:'03-04-24'->2024-04-03
[2025-11-02 02:28:47] L3248 fecha:'27-07-24'->2024-07-27
[2025-11-02 02:28:47] L3249 fecha:'17-06-24'->2024-06-17
[2025-11-02 02:28:47] L3250 fecha:'05-01-25'->2025-01-05
[2025-11-02 02:28:47] L3251 fecha:'25-01-24'->2024-01-25
[2025-11-02 02:28:47] L3252 fecha:'30-07-24'->2024-07-30
[2025-11-02 02:28:47] L3253 fecha:'08-10-24'->2024-10-08
[2025-11-02 02:28:47] L3254 fecha:'13-08-25'->2025-08-13
[2025-11-02 02:28:47] L3255 fecha:'16-08-24'->2024-08-16
[2025-11-02 02:28:47] L3256 fecha:'14-05-24'->2024-05-14
[2025-11-02 02:28:47] L3257 fecha:'14-01-25'->2025-01-14
[2025-11-02 02:28:47] L3258 fecha:'01-01-25'->2025-01-01
[2025-11-02 02:28:47] L3259 fecha:'29-03-24'->2024-03-29
[2025-11-02 02:28:47] L3260 fecha:'03-09-24'->2024-09-03
[2025-11-02 02:28:47] L3261 fecha:'19-06-24'->2024-06-19
[2025-11-02 02:28:47] L3262 fecha:'12-12-24'->2024-12-12
[2025-11-02 02:28:47] L3263 fecha:'30-05-25'->2025-05-30
[2025-11-02 02:28:47] L3264 fecha:'07-01-25'->2025-01-07
[2025-11-02 02:28:47] L3265 fecha:'03-01-24'->2024-01-03
[2025-11-02 02:28:47] L3266 fecha:'31-01-24'->2024-01-31
[2025-11-02 02:28:47] L3267 fecha:'10-07-24'->2024-07-10
[2025-11-02 02:28:47] L3268 fecha:'12-10-24'->2024-10-12
[2025-11-02 02:28:47] L3269 fecha:'25-02-24'->2024-02-25
[2025-11-02 02:28:47] L3270 fecha:'26-07-24'->2024-07-26
[2025-11-02 02:28:47] L3271 fecha:'14-09-24'->2024-09-14
[2025-11-02 02:28:47] L3272 fecha:'06-06-25'->2025-06-06
[2025-11-02 02:28:47] L3273 fecha:'11-12-24'->2024-12-11
[2025-11-02 02:28:47] L3274 fecha:'22-01-25'->2025-01-22
[2025-11-02 02:28:47] L3275 fecha:'22-11-24'->2024-11-22
[2025-11-02 02:28:47] L3276 fecha:'05-09-24'->2024-09-05
[2025-11-02 02:28:47] L3277 fecha:'07-10-24'->2024-10-07
[2025-11-02 02:28:47] L3278 fecha:'01-05-24'->2024-05-01
[2025-11-02 02:28:47] L3279 fecha:'29-02-24'->2024-02-29
[2025-11-02 02:28:47] L3280 fecha:'04-03-25'->2025-03-04
[2025-11-02 02:28:47] L3281 fecha:'05-04-25'->2025-04-05
[2025-11-02 02:28:47] L3282 fecha:'08-08-24'->2024-08-08
[2025-11-02 02:28:47] L3283 fecha:'27-06-24'->2024-06-27
[2025-11-02 02:28:47] L3284 fecha:'16-12-24'->2024-12-16
[2025-11-02 02:28:47] L3285 fecha:'05-04-24'->2024-04-05
[2025-11-02 02:28:47] L3286 fecha:'17-05-25'->2025-05-17
[2025-11-02 02:28:47] L3287 fecha:'27-05-24'->2024-05-27
[2025-11-02 02:28:47] L3288 fecha:'01-08-25'->2025-08-01
[2025-11-02 02:28:47] L3289 fecha:'15-03-24'->2024-03-15
[2025-11-02 02:28:47] L3290 fecha:'26-07-24'->2024-07-26
[2025-11-02 02:28:47] L3291 fecha:'17-01-25'->2025-01-17
[2025-11-02 02:28:47] L3292 fecha:'13-08-24'->2024-08-13
[2025-11-02 02:28:47] L3293 fecha:'16-05-24'->2024-05-16
[2025-11-02 02:28:47] L3294 fecha:'30-03-25'->2025-03-30
[2025-11-02 02:28:47] L3295 fecha:'10-05-24'->2024-05-10
[2025-11-02 02:28:47] L3296 fecha:'17-06-25'->2025-06-17
[2025-11-02 02:28:47] L3297 fecha:'24-02-24'->2024-02-24
[2025-11-02 02:28:47] L3298 fecha:'08-01-24'->2024-01-08
[2025-11-02 02:28:47] L3299 fecha:'11-04-25'->2025-04-11
[2025-11-02 02:28:47] L3300 fecha:'28-03-24'->2024-03-28
[2025-11-02 02:28:47] L3301 fecha:'27-09-24'->2024-09-27
[2025-11-02 02:28:47] L3302 fecha:'18-07-24'->2024-07-18
[2025-11-02 02:28:47] L3303 fecha:'25-12-24'->2024-12-25
[2025-11-02 02:28:47] L3304 fecha:'03-07-24'->2024-07-03
[2025-11-02 02:28:47] L3305 fecha:'04-11-24'->2024-11-04
[2025-11-02 02:28:47] L3306 fecha:'28-03-24'->2024-03-28
[2025-11-02 02:28:47] L3307 fecha:'21-12-24'->2024-12-21
[2025-11-02 02:28:47] L3308 fecha:'25-01-24'->2024-01-25
[2025-11-02 02:28:47] L3309 fecha:'28-06-25'->2025-06-28
[2025-11-02 02:28:47] L3310 fecha:'27-02-24'->2024-02-27
[2025-11-02 02:28:47] L3311 fecha:'06-06-25'->2025-06-06
[2025-11-02 02:28:47] L3312 fecha:'06-11-24'->2024-11-06
[2025-11-02 02:28:47] L3313 fecha:'19-12-24'->2024-12-19
[2025-11-02 02:28:47] L3314 fecha:'22-04-25'->2025-04-22
[2025-11-02 02:28:47] L3315 fecha:'22-04-24'->2024-04-22
[2025-11-02 02:28:47] L3316 fecha:'30-05-24'->2024-05-30
[2025-11-02 02:28:47] L3317 fecha:'02-05-24'->2024-05-02
[2025-11-02 02:28:47] L3318 fecha:'06-07-24'->2024-07-06
[2025-11-02 02:28:47] L3319 fecha:'16-03-24'->2024-03-16
[2025-11-02 02:28:47] L3320 fecha:'18-09-24'->2024-09-18
[2025-11-02 02:28:47] L3321 fecha:'12-11-24'->2024-11-12
[2025-11-02 02:28:47] L3322 fecha:'13-07-25'->2025-07-13
[2025-11-02 02:28:47] L3323 fecha:'24-03-24'->2024-03-24
[2025-11-02 02:28:47] L3324 fecha:'10-03-25'->2025-03-10
[2025-11-02 02:28:47] L3325 fecha:'30-08-24'->2024-08-30
[2025-11-02 02:28:47] L3326 fecha:'30-06-24'->2024-06-30
[2025-11-02 02:28:47] L3327 fecha:'03-07-25'->2025-07-03
[2025-11-02 02:28:47] L3328 fecha:'19-04-25'->2025-04-19
[2025-11-02 02:28:47] L3329 fecha:'13-02-24'->2024-02-13
[2025-11-02 02:28:47] L3330 fecha:'12-01-24'->2024-01-12
[2025-11-02 02:28:47] L3331 fecha:'09-06-24'->2024-06-09
[2025-11-02 02:28:47] L3332 fecha:'14-04-24'->2024-04-14
[2025-11-02 02:28:47] L3333 fecha:'03-09-24'->2024-09-03
[2025-11-02 02:28:47] L3334 fecha:'08-08-24'->2024-08-08
[2025-11-02 02:28:47] L3335 fecha:'27-05-24'->2024-05-27
[2025-11-02 02:28:47] L3336 fecha:'16-01-24'->2024-01-16
[2025-11-02 02:28:47] L3337 fecha:'22-05-25'->2025-05-22
[2025-11-02 02:28:47] L3338 fecha:'21-05-25'->2025-05-21
[2025-11-02 02:28:47] L3339 fecha:'21-03-24'->2024-03-21
[2025-11-02 02:28:47] L3340 fecha:'02-12-24'->2024-12-02
[2025-11-02 02:28:47] L3341 fecha:'09-03-24'->2024-03-09
[2025-11-02 02:28:47] L3342 fecha:'13-05-24'->2024-05-13
[2025-11-02 02:28:47] L3343 fecha:'30-01-24'->2024-01-30
[2025-11-02 02:28:47] L3344 fecha:'07-07-24'->2024-07-07
[2025-11-02 02:28:47] L3345 fecha:'09-03-24'->2024-03-09
[2025-11-02 02:28:47] L3346 fecha:'07-05-24'->2024-05-07
[2025-11-02 02:28:47] L3347 fecha:'18-01-24'->2024-01-18
[2025-11-02 02:28:47] L3348 fecha:'23-06-25'->2025-06-23
[2025-11-02 02:28:47] L3349 fecha:'06-11-24'->2024-11-06
[2025-11-02 02:28:47] L3350 fecha:'08-02-25'->2025-02-08
[2025-11-02 02:28:47] L3351 fecha:'17-12-24'->2024-12-17
[2025-11-02 02:28:47] L3352 fecha:'20-05-24'->2024-05-20
[2025-11-02 02:28:47] L3353 fecha:'06-06-25'->2025-06-06
[2025-11-02 02:28:47] L3354 fecha:'21-05-25'->2025-05-21
[2025-11-02 02:28:47] L3355 fecha:'29-06-24'->2024-06-29
[2025-11-02 02:28:47] L3356 fecha:'22-09-24'->2024-09-22
[2025-11-02 02:28:47] L3357 fecha:'06-04-24'->2024-04-06
[2025-11-02 02:28:47] L3358 fecha:'14-01-24'->2024-01-14
[2025-11-02 02:28:47] L3359 fecha:'09-03-25'->2025-03-09
[2025-11-02 02:28:47] L3360 fecha:'28-09-24'->2024-09-28
[2025-11-02 02:28:47] L3361 fecha:'07-12-24'->2024-12-07
[2025-11-02 02:28:47] L3362 fecha:'22-01-24'->2024-01-22
[2025-11-02 02:28:47] L3363 fecha:'04-04-24'->2024-04-04
[2025-11-02 02:28:47] L3364 fecha:'06-07-24'->2024-07-06
[2025-11-02 02:28:47] L3365 fecha:'06-02-24'->2024-02-06
[2025-11-02 02:28:47] L3366 fecha:'21-09-24'->2024-09-21
[2025-11-02 02:28:47] L3367 fecha:'20-04-25'->2025-04-20
[2025-11-02 02:28:47] L3368 fecha:'06-03-24'->2024-03-06
[2025-11-02 02:28:47] L3369 fecha:'23-02-24'->2024-02-23
[2025-11-02 02:28:47] L3370 fecha:'09-08-24'->2024-08-09
[2025-11-02 02:28:47] L3371 fecha:'13-03-24'->2024-03-13
[2025-11-02 02:28:47] L3372 fecha:'31-12-24'->2024-12-31
[2025-11-02 02:28:47] L3373 fecha:'23-12-24'->2024-12-23
[2025-11-02 02:28:47] L3374 fecha:'13-08-25'->2025-08-13
[2025-11-02 02:28:47] L3375 fecha:'01-07-24'->2024-07-01
[2025-11-02 02:28:47] L3376 fecha:'25-07-25'->2025-07-25
[2025-11-02 02:28:47] L3377 fecha:'22-08-24'->2024-08-22
[2025-11-02 02:28:47] L3378 fecha:'01-11-24'->2024-11-01
[2025-11-02 02:28:47] L3379 fecha:'26-02-25'->2025-02-26
[2025-11-02 02:28:47] L3380 fecha:'16-03-24'->2024-03-16
[2025-11-02 02:28:47] L3381 fecha:'23-11-24'->2024-11-23
[2025-11-02 02:28:47] L3382 fecha:'28-04-24'->2024-04-28
[2025-11-02 02:28:47] L3383 fecha:'26-10-24'->2024-10-26
[2025-11-02 02:28:47] L3384 fecha:'25-02-24'->2024-02-25
[2025-11-02 02:28:47] L3385 fecha:'10-07-24'->2024-07-10
[2025-11-02 02:28:47] L3386 fecha:'10-01-24'->2024-01-10
[2025-11-02 02:28:47] L3387 fecha:'05-08-24'->2024-08-05
[2025-11-02 02:28:47] L3388 fecha:'10-08-24'->2024-08-10
[2025-11-02 02:28:47] L3389 fecha:'15-02-25'->2025-02-15
[2025-11-02 02:28:47] L3390 fecha:'15-06-24'->2024-06-15
[2025-11-02 02:28:47] L3391 fecha:'07-08-24'->2024-08-07
[2025-11-02 02:28:47] L3392 fecha:'26-04-24'->2024-04-26
[2025-11-02 02:28:47] L3393 fecha:'25-06-25'->2025-06-25
[2025-11-02 02:28:47] L3394 fecha:'24-04-25'->2025-04-24
[2025-11-02 02:28:47] L3395 fecha:'13-06-24'->2024-06-13
[2025-11-02 02:28:47] L3396 fecha:'06-06-25'->2025-06-06
[2025-11-02 02:28:47] L3397 fecha:'23-06-24'->2024-06-23
[2025-11-02 02:28:47] L3398 fecha:'08-02-24'->2024-02-08
[2025-11-02 02:28:47] L3399 fecha:'16-04-24'->2024-04-16
[2025-11-02 02:28:47] L3400 fecha:'29-03-25'->2025-03-29
[2025-11-02 02:28:47] L3401 fecha:'05-02-24'->2024-02-05
[2025-11-02 02:28:47] L3402 fecha:'25-07-25'->2025-07-25
[2025-11-02 02:28:47] L3403 fecha:'06-06-24'->2024-06-06
[2025-11-02 02:28:47] L3404 fecha:'05-02-25'->2025-02-05
[2025-11-02 02:28:47] L3405 fecha:'27-12-24'->2024-12-27
[2025-11-02 02:28:47] L3406 fecha:'19-03-24'->2024-03-19
[2025-11-02 02:28:47] L3407 fecha:'12-06-24'->2024-06-12
[2025-11-02 02:28:47] L3408 fecha:'08-05-25'->2025-05-08
[2025-11-02 02:28:47] L3409 fecha:'06-10-24'->2024-10-06
[2025-11-02 02:28:47] L3410 fecha:'10-07-24'->2024-07-10
[2025-11-02 02:28:47] L3411 fecha:'07-11-24'->2024-11-07
[2025-11-02 02:28:47] L3412 fecha:'04-11-24'->2024-11-04
[2025-11-02 02:28:47] L3413 fecha:'30-12-24'->2024-12-30
[2025-11-02 02:28:47] L3414 fecha:'29-03-25'->2025-03-29
[2025-11-02 02:28:47] L3415 fecha:'07-05-25'->2025-05-07
[2025-11-02 02:28:47] L3416 fecha:'05-07-24'->2024-07-05
[2025-11-02 02:28:47] L3417 fecha:'08-02-25'->2025-02-08
[2025-11-02 02:28:47] L3418 fecha:'22-11-24'->2024-11-22
[2025-11-02 02:28:47] L3419 fecha:'28-07-25'->2025-07-28
[2025-11-02 02:28:47] L3420 fecha:'10-03-25'->2025-03-10
[2025-11-02 02:28:47] L3421 fecha:'06-04-24'->2024-04-06
[2025-11-02 02:28:47] L3422 fecha:'28-08-25'->2025-08-28
[2025-11-02 02:28:47] L3423 fecha:'24-08-24'->2024-08-24
[2025-11-02 02:28:47] L3424 fecha:'23-05-25'->2025-05-23
[2025-11-02 02:28:47] L3425 fecha:'09-02-24'->2024-02-09
[2025-11-02 02:28:47] L3426 fecha:'20-10-24'->2024-10-20
[2025-11-02 02:28:47] L3427 fecha:'24-07-24'->2024-07-24
[2025-11-02 02:28:47] L3428 fecha:'10-09-24'->2024-09-10
[2025-11-02 02:28:47] L3429 fecha:'04-11-24'->2024-11-04
[2025-11-02 02:28:47] L3430 fecha:'30-01-25'->2025-01-30
[2025-11-02 02:28:47] L3431 fecha:'03-04-24'->2024-04-03
[2025-11-02 02:28:47] L3432 fecha:'13-07-25'->2025-07-13
[2025-11-02 02:28:47] L3433 fecha:'12-10-24'->2024-10-12
[2025-11-02 02:28:47] L3434 fecha:'29-07-24'->2024-07-29
[2025-11-02 02:28:47] L3435 fecha:'03-07-25'->2025-07-03
[2025-11-02 02:28:47] L3436 fecha:'25-02-25'->2025-02-25
[2025-11-02 02:28:47] L3437 fecha:'23-03-25'->2025-03-23
[2025-11-02 02:28:47] L3438 fecha:'31-07-24'->2024-07-31
[2025-11-02 02:28:47] L3439 fecha:'14-05-24'->2024-05-14
[2025-11-02 02:28:47] L3440 fecha:'30-07-24'->2024-07-30
[2025-11-02 02:28:47] L3441 fecha:'07-03-24'->2024-03-07
[2025-11-02 02:28:47] L3442 fecha:'07-06-25'->2025-06-07
[2025-11-02 02:28:47] L3443 fecha:'25-05-24'->2024-05-25
[2025-11-02 02:28:47] L3444 fecha:'11-07-24'->2024-07-11
[2025-11-02 02:28:47] L3445 fecha:'07-02-24'->2024-02-07
[2025-11-02 02:28:47] L3446 fecha:'09-06-25'->2025-06-09
[2025-11-02 02:28:47] L3447 fecha:'04-06-24'->2024-06-04
[2025-11-02 02:28:47] L3448 fecha:'08-04-25'->2025-04-08
[2025-11-02 02:28:47] L3449 fecha:'14-06-25'->2025-06-14
[2025-11-02 02:28:47] L3450 fecha:'26-05-25'->2025-05-26
[2025-11-02 02:28:47] L3451 fecha:'24-04-25'->2025-04-24
[2025-11-02 02:28:47] L3452 fecha:'04-11-24'->2024-11-04
[2025-11-02 02:28:47] L3453 fecha:'27-04-25'->2025-04-27
[2025-11-02 02:28:47] L3454 fecha:'31-08-24'->2024-08-31
[2025-11-02 02:28:47] L3455 fecha:'27-07-25'->2025-07-27
[2025-11-02 02:28:47] L3456 fecha:'21-09-24'->2024-09-21
[2025-11-02 02:28:47] L3457 fecha:'07-02-24'->2024-02-07
[2025-11-02 02:28:47] L3458 fecha:'27-04-24'->2024-04-27
[2025-11-02 02:28:47] L3459 fecha:'15-04-24'->2024-04-15
[2025-11-02 02:28:47] L3460 fecha:'22-06-24'->2024-06-22
[2025-11-02 02:28:47] L3461 fecha:'18-09-24'->2024-09-18
[2025-11-02 02:28:47] L3462 fecha:'29-08-25'->2025-08-29
[2025-11-02 02:28:47] L3463 fecha:'15-01-24'->2024-01-15
[2025-11-02 02:28:47] L3464 fecha:'26-02-24'->2024-02-26
[2025-11-02 02:28:47] L3465 fecha:'27-10-24'->2024-10-27
[2025-11-02 02:28:47] L3466 fecha:'25-12-24'->2024-12-25
[2025-11-02 02:28:47] L3467 fecha:'20-05-25'->2025-05-20
[2025-11-02 02:28:47] L3468 fecha:'20-12-24'->2024-12-20
[2025-11-02 02:28:47] L3469 fecha:'22-01-24'->2024-01-22
[2025-11-02 02:28:47] L3470 fecha:'16-06-24'->2024-06-16
[2025-11-02 02:28:47] L3471 fecha:'03-02-25'->2025-02-03
[2025-11-02 02:28:47] L3472 fecha:'03-03-24'->2024-03-03
[2025-11-02 02:28:47] L3473 fecha:'26-07-24'->2024-07-26
[2025-11-02 02:28:47] L3474 fecha:'01-07-25'->2025-07-01
[2025-11-02 02:28:47] L3475 fecha:'24-02-25'->2025-02-24
[2025-11-02 02:28:47] L3476 fecha:'28-11-24'->2024-11-28
[2025-11-02 02:28:47] L3477 fecha:'26-02-24'->2024-02-26
[2025-11-02 02:28:47] L3478 fecha:'25-01-25'->2025-01-25
[2025-11-02 02:28:47] L3479 fecha:'04-08-24'->2024-08-04
[2025-11-02 02:28:47] L3480 fecha:'06-12-24'->2024-12-06
[2025-11-02 02:28:47] L3481 fecha:'21-09-24'->2024-09-21
[2025-11-02 02:28:47] L3482 fecha:'26-07-25'->2025-07-26
[2025-11-02 02:28:47] L3483 fecha:'06-01-24'->2024-01-06
[2025-11-02 02:28:47] L3484 fecha:'01-07-24'->2024-07-01
[2025-11-02 02:28:47] L3485 fecha:'05-02-24'->2024-02-05
[2025-11-02 02:28:47] L3486 fecha:'26-01-25'->2025-01-26
[2025-11-02 02:28:47] L3487 fecha:'10-01-24'->2024-01-10
[2025-11-02 02:28:47] L3488 fecha:'26-07-24'->2024-07-26
[2025-11-02 02:28:47] L3489 fecha:'23-03-24'->2024-03-23
[2025-11-02 02:28:47] L3490 fecha:'10-07-24'->2024-07-10
[2025-11-02 02:28:47] L3491 fecha:'04-02-24'->2024-02-04
[2025-11-02 02:28:47] L3492 fecha:'29-04-24'->2024-04-29
[2025-11-02 02:28:47] L3493 fecha:'22-01-25'->2025-01-22
[2025-11-02 02:28:47] L3494 fecha:'24-07-24'->2024-07-24
[2025-11-02 02:28:47] L3495 fecha:'13-04-24'->2024-04-13
[2025-11-02 02:28:47] L3496 fecha:'12-02-25'->2025-02-12
[2025-11-02 02:28:47] L3497 fecha:'20-04-24'->2024-04-20
[2025-11-02 02:28:47] L3498 fecha:'08-03-25'->2025-03-08
[2025-11-02 02:28:47] L3499 fecha:'17-05-25'->2025-05-17
[2025-11-02 02:28:47] L3500 fecha:'13-08-25'->2025-08-13
[2025-11-02 02:28:47] L3501 fecha:'14-03-24'->2024-03-14
[2025-11-02 02:28:47] L3502 fecha:'29-01-25'->2025-01-29
[2025-11-02 02:28:47] L3503 fecha:'02-07-24'->2024-07-02
[2025-11-02 02:28:47] L3504 fecha:'17-07-25'->2025-07-17
[2025-11-02 02:28:47] L3505 fecha:'11-01-24'->2024-01-11
[2025-11-02 02:28:47] L3506 fecha:'17-04-24'->2024-04-17
[2025-11-02 02:28:47] L3507 fecha:'28-08-24'->2024-08-28
[2025-11-02 02:28:47] L3508 fecha:'23-08-25'->2025-08-23
[2025-11-02 02:28:47] L3509 fecha:'01-12-24'->2024-12-01
[2025-11-02 02:28:47] L3510 fecha:'28-11-24'->2024-11-28
[2025-11-02 02:28:47] L3511 fecha:'19-04-25'->2025-04-19
[2025-11-02 02:28:47] L3512 fecha:'30-01-24'->2024-01-30
[2025-11-02 02:28:47] L3513 fecha:'07-10-24'->2024-10-07
[2025-11-02 02:28:47] L3514 fecha:'09-04-24'->2024-04-09
[2025-11-02 02:28:47] L3515 fecha:'22-06-25'->2025-06-22
[2025-11-02 02:28:47] L3516 fecha:'26-03-24'->2024-03-26
[2025-11-02 02:28:47] L3517 fecha:'27-06-24'->2024-06-27
[2025-11-02 02:28:47] L3518 fecha:'25-01-24'->2024-01-25
[2025-11-02 02:28:47] L3519 fecha:'08-08-25'->2025-08-08
[2025-11-02 02:28:47] L3520 fecha:'11-09-24'->2024-09-11
[2025-11-02 02:28:47] L3521 fecha:'12-03-24'->2024-03-12
[2025-11-02 02:28:47] L3522 fecha:'29-06-24'->2024-06-29
[2025-11-02 02:28:47] L3523 fecha:'20-04-24'->2024-04-20
[2025-11-02 02:28:47] L3524 fecha:'18-05-24'->2024-05-18
[2025-11-02 02:28:47] L3525 fecha:'08-02-24'->2024-02-08
[2025-11-02 02:28:47] L3526 fecha:'21-04-24'->2024-04-21
[2025-11-02 02:28:47] L3527 fecha:'19-02-24'->2024-02-19
[2025-11-02 02:28:47] L3528 fecha:'27-04-25'->2025-04-27
[2025-11-02 02:28:47] L3529 fecha:'28-02-24'->2024-02-28
[2025-11-02 02:28:47] L3530 fecha:'14-04-24'->2024-04-14
[2025-11-02 02:28:47] L3531 fecha:'09-08-24'->2024-08-09
[2025-11-02 02:28:47] L3532 fecha:'25-04-25'->2025-04-25
[2025-11-02 02:28:47] L3533 fecha:'13-03-24'->2024-03-13
[2025-11-02 02:28:47] L3534 fecha:'29-11-24'->2024-11-29
[2025-11-02 02:28:47] L3535 fecha:'04-04-25'->2025-04-04
[2025-11-02 02:28:47] L3536 fecha:'17-07-25'->2025-07-17
[2025-11-02 02:28:47] L3537 fecha:'22-09-24'->2024-09-22
[2025-11-02 02:28:47] L3538 fecha:'26-02-24'->2024-02-26
[2025-11-02 02:28:47] L3539 fecha:'02-03-25'->2025-03-02
[2025-11-02 02:28:47] L3540 fecha:'19-01-25'->2025-01-19
[2025-11-02 02:28:47] L3541 fecha:'14-09-24'->2024-09-14
[2025-11-02 02:28:47] L3542 fecha:'01-07-24'->2024-07-01
[2025-11-02 02:28:47] L3543 fecha:'06-10-24'->2024-10-06
[2025-11-02 02:28:47] L3544 fecha:'19-01-25'->2025-01-19
[2025-11-02 02:28:47] L3545 fecha:'27-03-25'->2025-03-27
[2025-11-02 02:28:47] L3546 fecha:'11-09-24'->2024-09-11
[2025-11-02 02:28:47] L3547 fecha:'18-07-24'->2024-07-18
[2025-11-02 02:28:47] L3548 fecha:'18-07-24'->2024-07-18
[2025-11-02 02:28:47] L3549 fecha:'08-09-24'->2024-09-08
[2025-11-02 02:28:47] L3550 fecha:'14-02-24'->2024-02-14
[2025-11-02 02:28:47] L3551 fecha:'17-03-25'->2025-03-17
[2025-11-02 02:28:47] L3552 fecha:'07-10-24'->2024-10-07
[2025-11-02 02:28:47] L3553 fecha:'09-10-24'->2024-10-09
[2025-11-02 02:28:47] L3554 fecha:'06-09-24'->2024-09-06
[2025-11-02 02:28:47] L3555 fecha:'21-07-25'->2025-07-21
[2025-11-02 02:28:47] L3556 fecha:'04-06-25'->2025-06-04
[2025-11-02 02:28:47] L3557 fecha:'04-08-24'->2024-08-04
[2025-11-02 02:28:47] L3558 fecha:'05-07-24'->2024-07-05
[2025-11-02 02:28:47] L3559 fecha:'12-09-24'->2024-09-12
[2025-11-02 02:28:47] L3560 fecha:'13-09-24'->2024-09-13
[2025-11-02 02:28:47] L3561 fecha:'13-07-25'->2025-07-13
[2025-11-02 02:28:47] L3562 fecha:'14-03-25'->2025-03-14
[2025-11-02 02:28:47] L3563 fecha:'02-03-24'->2024-03-02
[2025-11-02 02:28:47] L3564 fecha:'17-02-24'->2024-02-17
[2025-11-02 02:28:47] L3565 fecha:'25-12-24'->2024-12-25
[2025-11-02 02:28:47] L3566 fecha:'20-05-25'->2025-05-20
[2025-11-02 02:28:47] L3567 fecha:'24-10-24'->2024-10-24
[2025-11-02 02:28:47] L3568 fecha:'29-03-25'->2025-03-29
[2025-11-02 02:28:47] L3569 fecha:'16-02-25'->2025-02-16
[2025-11-02 02:28:47] L3570 fecha:'12-02-25'->2025-02-12
[2025-11-02 02:28:47] L3571 fecha:'07-03-25'->2025-03-07
[2025-11-02 02:28:47] L3572 fecha:'08-05-24'->2024-05-08
[2025-11-02 02:28:47] L3573 fecha:'27-07-25'->2025-07-27
[2025-11-02 02:28:47] L3574 fecha:'14-02-25'->2025-02-14
[2025-11-02 02:28:47] L3575 fecha:'27-09-24'->2024-09-27
[2025-11-02 02:28:47] L3576 fecha:'17-12-24'->2024-12-17
[2025-11-02 02:28:47] L3577 fecha:'12-04-25'->2025-04-12
[2025-11-02 02:28:47] L3578 fecha:'17-05-25'->2025-05-17
[2025-11-02 02:28:47] L3579 fecha:'16-05-25'->2025-05-16
[2025-11-02 02:28:47] L3580 fecha:'03-02-25'->2025-02-03
[2025-11-02 02:28:47] L3581 fecha:'25-03-24'->2024-03-25
[2025-11-02 02:28:47] L3582 fecha:'15-03-24'->2024-03-15
[2025-11-02 02:28:47] L3583 fecha:'26-05-25'->2025-05-26
[2025-11-02 02:28:47] L3584 fecha:'24-10-24'->2024-10-24
[2025-11-02 02:28:47] L3585 fecha:'19-06-24'->2024-06-19
[2025-11-02 02:28:47] L3586 fecha:'08-03-24'->2024-03-08
[2025-11-02 02:28:47] L3587 fecha:'19-05-25'->2025-05-19
[2025-11-02 02:28:47] L3588 fecha:'14-10-24'->2024-10-14
[2025-11-02 02:28:47] L3589 fecha:'19-08-25'->2025-08-19
[2025-11-02 02:28:47] L3590 fecha:'27-04-24'->2024-04-27
[2025-11-02 02:28:47] L3591 fecha:'06-11-24'->2024-11-06
[2025-11-02 02:28:47] L3592 fecha:'28-01-24'->2024-01-28
[2025-11-02 02:28:47] L3593 fecha:'10-05-25'->2025-05-10
[2025-11-02 02:28:47] L3594 fecha:'12-08-24'->2024-08-12
[2025-11-02 02:28:47] L3595 fecha:'17-02-25'->2025-02-17
[2025-11-02 02:28:47] L3596 fecha:'30-12-24'->2024-12-30
[2025-11-02 02:28:47] L3597 fecha:'11-09-24'->2024-09-11
[2025-11-02 02:28:47] L3598 fecha:'10-08-24'->2024-08-10
[2025-11-02 02:28:47] L3599 fecha:'20-08-25'->2025-08-20
[2025-11-02 02:28:47] L3600 fecha:'23-08-25'->2025-08-23
[2025-11-02 02:28:47] L3601 fecha:'12-07-25'->2025-07-12
[2025-11-02 02:28:47] L3602 fecha:'16-04-25'->2025-04-16
[2025-11-02 02:28:47] L3603 fecha:'10-11-24'->2024-11-10
[2025-11-02 02:28:47] L3604 fecha:'08-05-24'->2024-05-08
[2025-11-02 02:28:47] L3605 fecha:'10-12-24'->2024-12-10
[2025-11-02 02:28:47] L3606 fecha:'03-11-24'->2024-11-03
[2025-11-02 02:28:47] L3607 fecha:'29-12-24'->2024-12-29
[2025-11-02 02:28:47] L3608 fecha:'15-05-24'->2024-05-15
[2025-11-02 02:28:47] L3609 fecha:'28-01-25'->2025-01-28
[2025-11-02 02:28:47] L3610 fecha:'22-07-25'->2025-07-22
[2025-11-02 02:28:47] L3611 fecha:'04-03-24'->2024-03-04
[2025-11-02 02:28:47] L3612 fecha:'25-08-24'->2024-08-25
[2025-11-02 02:28:47] L3613 fecha:'22-03-24'->2024-03-22
[2025-11-02 02:28:47] L3614 fecha:'10-11-24'->2024-11-10
[2025-11-02 02:28:47] L3615 fecha:'18-01-24'->2024-01-18
[2025-11-02 02:28:47] L3616 fecha:'12-01-25'->2025-01-12
[2025-11-02 02:28:47] L3617 fecha:'13-04-24'->2024-04-13
[2025-11-02 02:28:47] L3618 fecha:'25-03-24'->2024-03-25
[2025-11-02 02:28:47] L3619 fecha:'02-08-25'->2025-08-02
[2025-11-02 02:28:47] L3620 fecha:'25-04-25'->2025-04-25
[2025-11-02 02:28:47] L3621 fecha:'16-01-24'->2024-01-16
[2025-11-02 02:28:47] L3622 fecha:'02-02-24'->2024-02-02
[2025-11-02 02:28:47] L3623 fecha:'13-12-24'->2024-12-13
[2025-11-02 02:28:47] L3624 fecha:'21-08-24'->2024-08-21
[2025-11-02 02:28:47] L3625 fecha:'12-12-24'->2024-12-12
[2025-11-02 02:28:47] L3626 fecha:'04-10-24'->2024-10-04
[2025-11-02 02:28:47] L3627 fecha:'15-11-24'->2024-11-15
[2025-11-02 02:28:47] L3628 fecha:'01-12-24'->2024-12-01
[2025-11-02 02:28:47] L3629 fecha:'24-06-24'->2024-06-24
[2025-11-02 02:28:47] L3630 fecha:'10-11-24'->2024-11-10
[2025-11-02 02:28:47] L3631 fecha:'03-08-25'->2025-08-03
[2025-11-02 02:28:47] L3632 fecha:'11-06-25'->2025-06-11
[2025-11-02 02:28:47] L3633 fecha:'27-02-25'->2025-02-27
[2025-11-02 02:28:47] L3634 fecha:'19-02-24'->2024-02-19
[2025-11-02 02:28:47] L3635 fecha:'04-03-25'->2025-03-04
[2025-11-02 02:28:47] L3636 fecha:'08-06-25'->2025-06-08
[2025-11-02 02:28:47] L3637 fecha:'26-01-25'->2025-01-26
[2025-11-02 02:28:47] L3638 fecha:'29-01-24'->2024-01-29
[2025-11-02 02:28:47] L3639 fecha:'26-03-24'->2024-03-26
[2025-11-02 02:28:47] L3640 fecha:'29-09-24'->2024-09-29
[2025-11-02 02:28:47] L3641 fecha:'30-04-24'->2024-04-30
[2025-11-02 02:28:47] L3642 fecha:'04-03-25'->2025-03-04
[2025-11-02 02:28:47] L3643 fecha:'02-03-25'->2025-03-02
[2025-11-02 02:28:47] L3644 fecha:'27-05-25'->2025-05-27
[2025-11-02 02:28:47] L3645 fecha:'29-03-24'->2024-03-29
[2025-11-02 02:28:47] L3646 fecha:'30-11-24'->2024-11-30
[2025-11-02 02:28:47] L3647 fecha:'15-04-25'->2025-04-15
[2025-11-02 02:28:47] L3648 fecha:'02-08-24'->2024-08-02
[2025-11-02 02:28:47] L3649 fecha:'18-09-24'->2024-09-18
[2025-11-02 02:28:47] L3650 fecha:'08-01-24'->2024-01-08
[2025-11-02 02:28:47] L3651 fecha:'11-03-25'->2025-03-11
[2025-11-02 02:28:47] L3652 fecha:'15-08-24'->2024-08-15
[2025-11-02 02:28:47] L3653 fecha:'29-04-25'->2025-04-29
[2025-11-02 02:28:47] L3654 fecha:'10-01-25'->2025-01-10
[2025-11-02 02:28:47] L3655 fecha:'16-06-25'->2025-06-16
[2025-11-02 02:28:47] L3656 fecha:'17-12-24'->2024-12-17
[2025-11-02 02:28:47] L3657 RUN paciente 621187-9 sin referencia -> ERR
[2025-11-02 02:28:47] L3658 fecha:'23-06-25'->2025-06-23
[2025-11-02 02:28:47] L3659 fecha:'08-06-25'->2025-06-08
[2025-11-02 02:28:47] L3660 fecha:'13-03-24'->2024-03-13
[2025-11-02 02:28:47] L3661 fecha:'25-01-25'->2025-01-25
[2025-11-02 02:28:47] L3662 fecha:'30-03-24'->2024-03-30
[2025-11-02 02:28:47] L3663 fecha:'13-10-24'->2024-10-13
[2025-11-02 02:28:47] L3664 fecha:'11-04-24'->2024-04-11
[2025-11-02 02:28:47] L3665 fecha:'05-01-24'->2024-01-05
[2025-11-02 02:28:47] L3666 fecha:'26-07-25'->2025-07-26
[2025-11-02 02:28:47] L3667 fecha:'15-01-25'->2025-01-15
[2025-11-02 02:28:47] L3668 fecha:'27-06-24'->2024-06-27
[2025-11-02 02:28:47] L3669 fecha:'08-01-25'->2025-01-08
[2025-11-02 02:28:47] L3670 fecha:'18-01-25'->2025-01-18
[2025-11-02 02:28:47] L3671 fecha:'01-08-24'->2024-08-01
[2025-11-02 02:28:47] L3672 fecha:'04-09-24'->2024-09-04
[2025-11-02 02:28:47] L3673 fecha:'20-05-25'->2025-05-20
[2025-11-02 02:28:47] L3674 fecha:'13-08-24'->2024-08-13
[2025-11-02 02:28:47] L3675 fecha:'04-05-24'->2024-05-04
[2025-11-02 02:28:47] L3676 fecha:'15-09-24'->2024-09-15
[2025-11-02 02:28:47] L3677 fecha:'23-12-24'->2024-12-23
[2025-11-02 02:28:47] L3678 fecha:'01-04-24'->2024-04-01
[2025-11-02 02:28:47] L3679 fecha:'03-02-25'->2025-02-03
[2025-11-02 02:28:47] L3680 fecha:'06-02-24'->2024-02-06
[2025-11-02 02:28:47] L3681 fecha:'21-07-25'->2025-07-21
[2025-11-02 02:28:47] L3682 fecha:'24-07-25'->2025-07-24
[2025-11-02 02:28:47] L3683 fecha:'04-07-24'->2024-07-04
[2025-11-02 02:28:47] L3684 fecha:'09-02-25'->2025-02-09
[2025-11-02 02:28:47] L3685 fecha:'03-04-25'->2025-04-03
[2025-11-02 02:28:47] L3686 fecha:'02-11-24'->2024-11-02
[2025-11-02 02:28:47] L3687 fecha:'26-07-25'->2025-07-26
[2025-11-02 02:28:47] L3688 fecha:'18-03-24'->2024-03-18
[2025-11-02 02:28:47] L3689 fecha:'21-03-24'->2024-03-21
[2025-11-02 02:28:47] L3690 fecha:'05-03-25'->2025-03-05
[2025-11-02 02:28:47] L3691 fecha:'11-02-25'->2025-02-11
[2025-11-02 02:28:47] L3692 fecha:'06-07-25'->2025-07-06
[2025-11-02 02:28:47] L3693 fecha:'28-08-25'->2025-08-28
[2025-11-02 02:28:47] L3694 fecha:'14-02-25'->2025-02-14
[2025-11-02 02:28:47] L3695 fecha:'20-05-24'->2024-05-20
[2025-11-02 02:28:47] L3696 fecha:'03-12-24'->2024-12-03
[2025-11-02 02:28:47] L3697 fecha:'29-04-25'->2025-04-29
[2025-11-02 02:28:47] L3698 fecha:'08-08-24'->2024-08-08
[2025-11-02 02:28:47] L3699 fecha:'02-11-24'->2024-11-02
[2025-11-02 02:28:47] L3700 fecha:'21-11-24'->2024-11-21
[2025-11-02 02:28:47] L3701 fecha:'15-01-25'->2025-01-15
[2025-11-02 02:28:47] L3702 fecha:'30-06-24'->2024-06-30
[2025-11-02 02:28:47] L3703 fecha:'08-05-24'->2024-05-08
[2025-11-02 02:28:47] L3704 fecha:'16-03-24'->2024-03-16
[2025-11-02 02:28:47] L3705 fecha:'04-12-24'->2024-12-04
[2025-11-02 02:28:47] L3706 fecha:'12-03-25'->2025-03-12
[2025-11-02 02:28:47] L3707 fecha:'14-07-24'->2024-07-14
[2025-11-02 02:28:47] L3708 fecha:'23-05-25'->2025-05-23
[2025-11-02 02:28:47] L3709 fecha:'10-03-24'->2024-03-10
[2025-11-02 02:28:47] L3710 fecha:'22-06-24'->2024-06-22
[2025-11-02 02:28:47] L3711 fecha:'28-01-24'->2024-01-28
[2025-11-02 02:28:47] L3712 fecha:'04-05-25'->2025-05-04
[2025-11-02 02:28:47] L3713 fecha:'07-01-25'->2025-01-07
[2025-11-02 02:28:47] L3714 fecha:'23-05-24'->2024-05-23
[2025-11-02 02:28:47] L3715 fecha:'05-05-25'->2025-05-05
[2025-11-02 02:28:47] L3716 fecha:'30-10-24'->2024-10-30
[2025-11-02 02:28:47] L3717 fecha:'11-08-24'->2024-08-11
[2025-11-02 02:28:47] L3718 fecha:'31-10-24'->2024-10-31
[2025-11-02 02:28:47] L3719 fecha:'17-05-24'->2024-05-17
[2025-11-02 02:28:47] L3720 fecha:'20-10-24'->2024-10-20
[2025-11-02 02:28:47] L3721 fecha:'23-03-24'->2024-03-23
[2025-11-02 02:28:47] L3722 fecha:'08-01-24'->2024-01-08
[2025-11-02 02:28:47] L3723 fecha:'15-08-25'->2025-08-15
[2025-11-02 02:28:47] L3724 fecha:'26-01-25'->2025-01-26
[2025-11-02 02:28:47] L3725 fecha:'30-06-25'->2025-06-30
[2025-11-02 02:28:47] L3726 fecha:'27-03-24'->2024-03-27
[2025-11-02 02:28:47] L3727 fecha:'28-08-24'->2024-08-28
[2025-11-02 02:28:47] L3728 fecha:'14-10-24'->2024-10-14
[2025-11-02 02:28:47] L3729 fecha:'24-05-25'->2025-05-24
[2025-11-02 02:28:47] L3730 fecha:'28-05-24'->2024-05-28
[2025-11-02 02:28:47] L3731 fecha:'19-03-25'->2025-03-19
[2025-11-02 02:28:47] L3732 fecha:'06-07-25'->2025-07-06
[2025-11-02 02:28:47] L3733 fecha:'30-11-24'->2024-11-30
[2025-11-02 02:28:47] L3734 fecha:'02-08-25'->2025-08-02
[2025-11-02 02:28:47] L3735 fecha:'20-02-24'->2024-02-20
[2025-11-02 02:28:47] L3736 fecha:'28-05-24'->2024-05-28
[2025-11-02 02:28:47] L3737 fecha:'08-02-24'->2024-02-08
[2025-11-02 02:28:47] L3738 fecha:'19-05-24'->2024-05-19
[2025-11-02 02:28:47] L3739 fecha:'13-02-24'->2024-02-13
[2025-11-02 02:28:47] L3740 fecha:'06-03-25'->2025-03-06
[2025-11-02 02:28:47] L3741 fecha:'23-04-25'->2025-04-23
[2025-11-02 02:28:47] L3742 fecha:'29-05-24'->2024-05-29
[2025-11-02 02:28:47] L3743 fecha:'25-04-25'->2025-04-25
[2025-11-02 02:28:47] L3744 fecha:'24-01-25'->2025-01-24
[2025-11-02 02:28:47] L3745 fecha:'12-03-25'->2025-03-12
[2025-11-02 02:28:47] L3746 fecha:'29-05-24'->2024-05-29
[2025-11-02 02:28:47] L3747 fecha:'11-10-24'->2024-10-11
[2025-11-02 02:28:47] L3748 fecha:'26-05-25'->2025-05-26
[2025-11-02 02:28:47] L3749 fecha:'19-08-24'->2024-08-19
[2025-11-02 02:28:47] L3750 fecha:'23-02-25'->2025-02-23
[2025-11-02 02:28:47] L3751 fecha:'31-05-25'->2025-05-31
[2025-11-02 02:28:47] L3752 fecha:'29-08-25'->2025-08-29
[2025-11-02 02:28:47] L3753 fecha:'30-07-25'->2025-07-30
[2025-11-02 02:28:47] L3754 fecha:'25-02-25'->2025-02-25
[2025-11-02 02:28:47] L3755 fecha:'03-08-24'->2024-08-03
[2025-11-02 02:28:47] L3756 fecha:'03-06-25'->2025-06-03
[2025-11-02 02:28:47] L3757 fecha:'28-02-24'->2024-02-28
[2025-11-02 02:28:47] L3758 fecha:'10-03-25'->2025-03-10
[2025-11-02 02:28:47] L3759 fecha:'08-04-25'->2025-04-08
[2025-11-02 02:28:47] L3760 fecha:'13-04-24'->2024-04-13
[2025-11-02 02:28:47] L3761 fecha:'22-10-24'->2024-10-22
[2025-11-02 02:28:47] L3762 fecha:'19-01-24'->2024-01-19
[2025-11-02 02:28:47] L3763 fecha:'08-06-24'->2024-06-08
[2025-11-02 02:28:47] L3764 fecha:'18-12-24'->2024-12-18
[2025-11-02 02:28:47] L3765 fecha:'04-02-25'->2025-02-04
[2025-11-02 02:28:47] L3766 fecha:'17-02-24'->2024-02-17
[2025-11-02 02:28:47] L3767 fecha:'11-02-25'->2025-02-11
[2025-11-02 02:28:47] L3768 fecha:'22-08-25'->2025-08-22
[2025-11-02 02:28:47] L3769 fecha:'25-08-25'->2025-08-25
[2025-11-02 02:28:47] L3770 fecha:'02-04-24'->2024-04-02
[2025-11-02 02:28:47] L3771 fecha:'09-02-24'->2024-02-09
[2025-11-02 02:28:47] L3772 fecha:'03-12-24'->2024-12-03
[2025-11-02 02:28:47] L3773 fecha:'20-12-24'->2024-12-20
[2025-11-02 02:28:47] L3774 fecha:'03-03-25'->2025-03-03
[2025-11-02 02:28:47] L3775 fecha:'09-03-24'->2024-03-09
[2025-11-02 02:28:47] L3776 fecha:'06-12-24'->2024-12-06
[2025-11-02 02:28:47] L3777 fecha:'06-08-25'->2025-08-06
[2025-11-02 02:28:47] L3778 fecha:'28-07-25'->2025-07-28
[2025-11-02 02:28:47] L3779 fecha:'01-09-24'->2024-09-01
[2025-11-02 02:28:47] L3780 fecha:'10-06-25'->2025-06-10
[2025-11-02 02:28:47] L3781 fecha:'03-11-24'->2024-11-03
[2025-11-02 02:28:47] L3782 fecha:'28-10-24'->2024-10-28
[2025-11-02 02:28:47] L3783 fecha:'10-02-25'->2025-02-10
[2025-11-02 02:28:47] L3784 fecha:'19-05-24'->2024-05-19
[2025-11-02 02:28:47] L3785 fecha:'31-05-25'->2025-05-31
[2025-11-02 02:28:47] L3786 fecha:'04-01-25'->2025-01-04
[2025-11-02 02:28:47] L3787 fecha:'03-07-24'->2024-07-03
[2025-11-02 02:28:47] L3788 fecha:'11-07-25'->2025-07-11
[2025-11-02 02:28:47] L3789 fecha:'18-04-25'->2025-04-18
[2025-11-02 02:28:47] L3790 fecha:'01-10-24'->2024-10-01
[2025-11-02 02:28:47] L3791 fecha:'16-11-24'->2024-11-16
[2025-11-02 02:28:47] L3792 fecha:'22-03-24'->2024-03-22
[2025-11-02 02:28:47] L3793 fecha:'07-08-25'->2025-08-07
[2025-11-02 02:28:47] L3794 fecha:'25-07-25'->2025-07-25
[2025-11-02 02:28:47] L3795 fecha:'23-07-24'->2024-07-23
[2025-11-02 02:28:47] L3796 fecha:'04-06-25'->2025-06-04
[2025-11-02 02:28:47] L3797 fecha:'17-07-24'->2024-07-17
[2025-11-02 02:28:47] L3798 fecha:'20-08-25'->2025-08-20
[2025-11-02 02:28:47] L3799 fecha:'08-09-24'->2024-09-08
[2025-11-02 02:28:47] L3800 fecha:'02-04-25'->2025-04-02
[2025-11-02 02:28:47] L3801 fecha:'04-04-25'->2025-04-04
[2025-11-02 02:28:47] L3802 fecha:'29-04-25'->2025-04-29
[2025-11-02 02:28:47] L3803 fecha:'17-09-24'->2024-09-17
[2025-11-02 02:28:47] L3804 fecha:'03-04-24'->2024-04-03
[2025-11-02 02:28:47] L3805 fecha:'04-03-24'->2024-03-04
[2025-11-02 02:28:47] L3806 fecha:'02-03-24'->2024-03-02
[2025-11-02 02:28:47] L3807 fecha:'14-08-24'->2024-08-14
[2025-11-02 02:28:47] L3808 fecha:'24-03-24'->2024-03-24
[2025-11-02 02:28:47] L3809 RUN paciente 802322-0 sin referencia -> ERR
[2025-11-02 02:28:47] L3810 fecha:'18-05-25'->2025-05-18
[2025-11-02 02:28:47] L3811 fecha:'24-06-25'->2025-06-24
[2025-11-02 02:28:47] L3812 fecha:'15-07-24'->2024-07-15
[2025-11-02 02:28:47] L3813 fecha:'12-07-25'->2025-07-12
[2025-11-02 02:28:47] L3814 fecha:'22-06-24'->2024-06-22
[2025-11-02 02:28:47] L3815 fecha:'05-01-25'->2025-01-05
[2025-11-02 02:28:47] L3816 fecha:'26-08-24'->2024-08-26
[2025-11-02 02:28:47] L3817 fecha:'10-01-24'->2024-01-10
[2025-11-02 02:28:47] L3818 fecha:'28-08-24'->2024-08-28
[2025-11-02 02:28:47] L3819 fecha:'20-01-25'->2025-01-20
[2025-11-02 02:28:47] L3820 fecha:'08-11-24'->2024-11-08
[2025-11-02 02:28:47] L3821 fecha:'14-06-25'->2025-06-14
[2025-11-02 02:28:47] L3822 fecha:'03-12-24'->2024-12-03
[2025-11-02 02:28:47] L3823 fecha:'27-07-24'->2024-07-27
[2025-11-02 02:28:47] L3824 fecha:'01-01-24'->2024-01-01
[2025-11-02 02:28:47] L3825 fecha:'22-12-24'->2024-12-22
[2025-11-02 02:28:47] L3826 fecha:'23-08-25'->2025-08-23
[2025-11-02 02:28:47] L3827 fecha:'25-01-24'->2024-01-25
[2025-11-02 02:28:47] L3828 fecha:'02-09-24'->2024-09-02
[2025-11-02 02:28:47] L3829 fecha:'17-09-24'->2024-09-17
[2025-11-02 02:28:47] L3830 fecha:'20-03-24'->2024-03-20
[2025-11-02 02:28:47] L3831 fecha:'17-04-25'->2025-04-17
[2025-11-02 02:28:47] L3832 fecha:'09-01-25'->2025-01-09
[2025-11-02 02:28:47] L3833 fecha:'22-07-25'->2025-07-22
[2025-11-02 02:28:47] L3834 fecha:'21-08-25'->2025-08-21
[2025-11-02 02:28:47] L3835 fecha:'26-08-25'->2025-08-26
[2025-11-02 02:28:47] L3836 fecha:'16-12-24'->2024-12-16
[2025-11-02 02:28:47] L3837 fecha:'05-12-24'->2024-12-05
[2025-11-02 02:28:47] L3838 fecha:'16-05-25'->2025-05-16
[2025-11-02 02:28:47] L3839 fecha:'18-06-25'->2025-06-18
[2025-11-02 02:28:47] L3840 fecha:'19-02-24'->2024-02-19
[2025-11-02 02:28:47] L3841 fecha:'04-07-24'->2024-07-04
[2025-11-02 02:28:47] L3842 fecha:'24-08-25'->2025-08-24
[2025-11-02 02:28:47] L3843 fecha:'19-05-25'->2025-05-19
[2025-11-02 02:28:47] L3844 fecha:'11-06-25'->2025-06-11
[2025-11-02 02:28:47] L3845 fecha:'18-04-24'->2024-04-18
[2025-11-02 02:28:47] L3846 fecha:'03-04-25'->2025-04-03
[2025-11-02 02:28:47] L3847 fecha:'05-01-24'->2024-01-05
[2025-11-02 02:28:47] L3848 fecha:'04-01-24'->2024-01-04
[2025-11-02 02:28:47] L3849 fecha:'13-09-24'->2024-09-13
[2025-11-02 02:28:47] L3850 fecha:'19-11-24'->2024-11-19
[2025-11-02 02:28:47] L3851 fecha:'20-01-25'->2025-01-20
[2025-11-02 02:28:47] L3852 fecha:'30-01-25'->2025-01-30
[2025-11-02 02:28:47] L3853 fecha:'18-12-24'->2024-12-18
[2025-11-02 02:28:47] L3854 fecha:'22-10-24'->2024-10-22
[2025-11-02 02:28:47] L3855 fecha:'12-01-25'->2025-01-12
[2025-11-02 02:28:47] L3856 fecha:'11-02-24'->2024-02-11
[2025-11-02 02:28:47] L3857 fecha:'19-04-24'->2024-04-19
[2025-11-02 02:28:47] L3858 fecha:'08-04-24'->2024-04-08
[2025-11-02 02:28:47] L3859 fecha:'06-03-25'->2025-03-06
[2025-11-02 02:28:47] L3860 fecha:'16-09-24'->2024-09-16
[2025-11-02 02:28:47] L3861 fecha:'12-07-24'->2024-07-12
[2025-11-02 02:28:47] L3862 fecha:'15-08-24'->2024-08-15
[2025-11-02 02:28:47] L3863 fecha:'22-02-25'->2025-02-22
[2025-11-02 02:28:47] L3864 fecha:'04-03-25'->2025-03-04
[2025-11-02 02:28:47] L3865 fecha:'04-05-24'->2024-05-04
[2025-11-02 02:28:47] L3866 fecha:'07-08-24'->2024-08-07
[2025-11-02 02:28:47] L3867 fecha:'03-10-24'->2024-10-03
[2025-11-02 02:28:47] L3868 fecha:'05-04-25'->2025-04-05
[2025-11-02 02:28:47] L3869 fecha:'29-04-25'->2025-04-29
[2025-11-02 02:28:47] L3870 fecha:'12-05-24'->2024-05-12
[2025-11-02 02:28:47] L3871 fecha:'05-07-25'->2025-07-05
[2025-11-02 02:28:47] L3872 fecha:'19-06-25'->2025-06-19
[2025-11-02 02:28:47] L3873 fecha:'01-03-24'->2024-03-01
[2025-11-02 02:28:47] L3874 fecha:'10-04-24'->2024-04-10
[2025-11-02 02:28:47] L3875 fecha:'02-01-25'->2025-01-02
[2025-11-02 02:28:47] L3876 fecha:'31-07-25'->2025-07-31
[2025-11-02 02:28:47] L3877 fecha:'29-07-24'->2024-07-29
[2025-11-02 02:28:47] L3878 fecha:'06-10-24'->2024-10-06
[2025-11-02 02:28:47] L3879 fecha:'10-11-24'->2024-11-10
[2025-11-02 02:28:47] L3880 fecha:'27-04-25'->2025-04-27
[2025-11-02 02:28:47] L3881 fecha:'30-07-24'->2024-07-30
[2025-11-02 02:28:47] L3882 fecha:'04-08-25'->2025-08-04
[2025-11-02 02:28:47] L3883 fecha:'20-04-25'->2025-04-20
[2025-11-02 02:28:47] L3884 fecha:'15-07-25'->2025-07-15
[2025-11-02 02:28:47] L3885 fecha:'04-08-24'->2024-08-04
[2025-11-02 02:28:47] L3886 fecha:'06-08-25'->2025-08-06
[2025-11-02 02:28:47] L3887 fecha:'14-10-24'->2024-10-14
[2025-11-02 02:28:47] L3888 fecha:'17-06-24'->2024-06-17
[2025-11-02 02:28:47] L3889 fecha:'24-01-25'->2025-01-24
[2025-11-02 02:28:47] L3890 fecha:'09-02-25'->2025-02-09
[2025-11-02 02:28:47] L3891 fecha:'26-07-24'->2024-07-26
[2025-11-02 02:28:47] L3892 fecha:'16-10-24'->2024-10-16
[2025-11-02 02:28:47] L3893 fecha:'07-05-25'->2025-05-07
[2025-11-02 02:28:47] L3894 fecha:'30-04-25'->2025-04-30
[2025-11-02 02:28:47] L3895 fecha:'19-03-25'->2025-03-19
[2025-11-02 02:28:47] L3896 fecha:'28-07-24'->2024-07-28
[2025-11-02 02:28:47] L3897 fecha:'01-03-24'->2024-03-01
[2025-11-02 02:28:47] L3898 fecha:'31-03-25'->2025-03-31
[2025-11-02 02:28:47] L3899 fecha:'16-02-25'->2025-02-16
[2025-11-02 02:28:47] L3900 fecha:'16-06-25'->2025-06-16
[2025-11-02 02:28:47] L3901 fecha:'08-03-25'->2025-03-08
[2025-11-02 02:28:47] L3902 fecha:'23-04-25'->2025-04-23
[2025-11-02 02:28:47] L3903 fecha:'16-08-25'->2025-08-16
[2025-11-02 02:28:47] L3904 fecha:'27-02-25'->2025-02-27
[2025-11-02 02:28:47] L3905 fecha:'26-08-25'->2025-08-26
[2025-11-02 02:28:47] L3906 fecha:'21-02-24'->2024-02-21
[2025-11-02 02:28:47] L3907 fecha:'13-03-24'->2024-03-13
[2025-11-02 02:28:47] L3908 fecha:'17-01-24'->2024-01-17
[2025-11-02 02:28:47] L3909 fecha:'28-03-24'->2024-03-28
[2025-11-02 02:28:47] L3910 fecha:'03-04-24'->2024-04-03
[2025-11-02 02:28:47] L3911 fecha:'05-07-25'->2025-07-05
[2025-11-02 02:28:47] L3912 fecha:'19-02-24'->2024-02-19
[2025-11-02 02:28:47] L3913 fecha:'01-03-25'->2025-03-01
[2025-11-02 02:28:47] L3914 fecha:'13-10-24'->2024-10-13
[2025-11-02 02:28:47] L3915 fecha:'07-01-25'->2025-01-07
[2025-11-02 02:28:47] L3916 fecha:'03-02-24'->2024-02-03
[2025-11-02 02:28:47] L3917 fecha:'17-03-25'->2025-03-17
[2025-11-02 02:28:47] L3918 fecha:'12-06-25'->2025-06-12
[2025-11-02 02:28:47] L3919 fecha:'16-10-24'->2024-10-16
[2025-11-02 02:28:47] L3920 fecha:'22-11-24'->2024-11-22
[2025-11-02 02:28:47] L3921 fecha:'01-10-24'->2024-10-01
[2025-11-02 02:28:47] L3922 fecha:'12-05-25'->2025-05-12
[2025-11-02 02:28:47] L3923 fecha:'19-03-25'->2025-03-19
[2025-11-02 02:28:47] L3924 fecha:'19-09-24'->2024-09-19
[2025-11-02 02:28:47] L3925 fecha:'16-08-24'->2024-08-16
[2025-11-02 02:28:47] L3926 fecha:'05-02-24'->2024-02-05
[2025-11-02 02:28:47] L3927 fecha:'28-01-24'->2024-01-28
[2025-11-02 02:28:47] L3928 fecha:'08-05-24'->2024-05-08
[2025-11-02 02:28:47] L3929 fecha:'11-03-25'->2025-03-11
[2025-11-02 02:28:47] L3930 fecha:'14-01-24'->2024-01-14
[2025-11-02 02:28:47] L3931 fecha:'04-04-25'->2025-04-04
[2025-11-02 02:28:47] L3932 fecha:'21-07-24'->2024-07-21
[2025-11-02 02:28:47] L3933 fecha:'01-06-24'->2024-06-01
[2025-11-02 02:28:47] L3934 fecha:'02-04-25'->2025-04-02
[2025-11-02 02:28:47] L3935 fecha:'11-05-25'->2025-05-11
[2025-11-02 02:28:47] L3936 fecha:'23-09-24'->2024-09-23
[2025-11-02 02:28:47] L3937 fecha:'25-07-25'->2025-07-25
[2025-11-02 02:28:47] L3938 fecha:'25-11-24'->2024-11-25
[2025-11-02 02:28:47] L3939 fecha:'27-03-24'->2024-03-27
[2025-11-02 02:28:47] L3940 fecha:'05-07-25'->2025-07-05
[2025-11-02 02:28:47] L3941 fecha:'09-05-25'->2025-05-09
[2025-11-02 02:28:47] L3942 fecha:'17-03-24'->2024-03-17
[2025-11-02 02:28:47] L3943 fecha:'10-01-25'->2025-01-10
[2025-11-02 02:28:47] L3944 fecha:'07-09-24'->2024-09-07
[2025-11-02 02:28:47] L3945 fecha:'26-04-25'->2025-04-26
[2025-11-02 02:28:47] L3946 fecha:'20-01-24'->2024-01-20
[2025-11-02 02:28:47] L3947 fecha:'22-01-24'->2024-01-22
[2025-11-02 02:28:47] L3948 fecha:'27-06-25'->2025-06-27
[2025-11-02 02:28:47] L3949 fecha:'27-10-24'->2024-10-27
[2025-11-02 02:28:47] L3950 fecha:'15-01-24'->2024-01-15
[2025-11-02 02:28:47] L3951 fecha:'09-04-25'->2025-04-09
[2025-11-02 02:28:47] L3952 fecha:'17-07-24'->2024-07-17
[2025-11-02 02:28:47] L3953 fecha:'29-06-25'->2025-06-29
[2025-11-02 02:28:47] L3954 fecha:'14-05-25'->2025-05-14
[2025-11-02 02:28:47] L3955 fecha:'29-07-24'->2024-07-29
[2025-11-02 02:28:47] L3956 fecha:'17-04-24'->2024-04-17
[2025-11-02 02:28:47] L3957 fecha:'16-02-24'->2024-02-16
[2025-11-02 02:28:47] L3958 fecha:'08-02-25'->2025-02-08
[2025-11-02 02:28:47] L3959 fecha:'02-03-25'->2025-03-02
[2025-11-02 02:28:47] L3960 fecha:'03-08-24'->2024-08-03
[2025-11-02 02:28:47] L3961 fecha:'04-01-25'->2025-01-04
[2025-11-02 02:28:47] L3962 fecha:'26-09-24'->2024-09-26
[2025-11-02 02:28:47] L3963 fecha:'14-02-25'->2025-02-14
[2025-11-02 02:28:47] L3964 fecha:'28-10-24'->2024-10-28
[2025-11-02 02:28:47] L3965 fecha:'28-10-24'->2024-10-28
[2025-11-02 02:28:47] L3966 fecha:'12-02-25'->2025-02-12
[2025-11-02 02:28:47] L3967 fecha:'20-11-24'->2024-11-20
[2025-11-02 02:28:47] L3968 fecha:'13-04-24'->2024-04-13
[2025-11-02 02:28:47] L3969 fecha:'17-07-25'->2025-07-17
[2025-11-02 02:28:47] L3970 fecha:'11-06-25'->2025-06-11
[2025-11-02 02:28:47] L3971 fecha:'26-09-24'->2024-09-26
[2025-11-02 02:28:47] L3972 fecha:'16-11-24'->2024-11-16
[2025-11-02 02:28:47] L3973 fecha:'10-07-25'->2025-07-10
[2025-11-02 02:28:47] L3974 fecha:'01-07-25'->2025-07-01
[2025-11-02 02:28:47] L3975 fecha:'19-06-25'->2025-06-19
[2025-11-02 02:28:47] L3976 fecha:'12-09-24'->2024-09-12
[2025-11-02 02:28:47] L3977 fecha:'02-10-24'->2024-10-02
[2025-11-02 02:28:47] L3978 fecha:'09-03-24'->2024-03-09
[2025-11-02 02:28:47] L3979 fecha:'20-06-24'->2024-06-20
[2025-11-02 02:28:47] L3980 fecha:'10-07-25'->2025-07-10
[2025-11-02 02:28:47] L3981 fecha:'25-01-24'->2024-01-25
[2025-11-02 02:28:47] L3982 fecha:'30-06-24'->2024-06-30
[2025-11-02 02:28:47] L3983 fecha:'08-01-25'->2025-01-08
[2025-11-02 02:28:47] L3984 fecha:'06-02-24'->2024-02-06
[2025-11-02 02:28:47] L3985 fecha:'02-06-24'->2024-06-02
[2025-11-02 02:28:47] L3986 fecha:'19-07-25'->2025-07-19
[2025-11-02 02:28:47] L3987 fecha:'01-07-24'->2024-07-01
[2025-11-02 02:28:47] L3988 fecha:'15-02-24'->2024-02-15
[2025-11-02 02:28:47] L3989 fecha:'06-10-24'->2024-10-06
[2025-11-02 02:28:47] L3990 fecha:'16-01-25'->2025-01-16
[2025-11-02 02:28:47] L3991 fecha:'25-08-25'->2025-08-25
[2025-11-02 02:28:47] L3992 fecha:'21-11-24'->2024-11-21
[2025-11-02 02:28:47] L3993 fecha:'21-05-25'->2025-05-21
[2025-11-02 02:28:47] L3994 fecha:'30-09-24'->2024-09-30
[2025-11-02 02:28:47] L3995 fecha:'08-02-25'->2025-02-08
[2025-11-02 02:28:47] L3996 fecha:'05-06-25'->2025-06-05
[2025-11-02 02:28:47] L3997 fecha:'10-06-24'->2024-06-10
[2025-11-02 02:28:47] L3998 fecha:'12-01-24'->2024-01-12
[2025-11-02 02:28:47] L3999 fecha:'14-07-24'->2024-07-14
[2025-11-02 02:28:47] L4000 fecha:'03-04-25'->2025-04-03
[2025-11-02 02:28:47] L4001 fecha:'14-03-24'->2024-03-14
[2025-11-02 02:28:47] L4002 fecha:'15-06-24'->2024-06-15
[2025-11-02 02:28:47] L4003 fecha:'11-03-24'->2024-03-11
[2025-11-02 02:28:47] L4004 fecha:'18-01-25'->2025-01-18
[2025-11-02 02:28:47] L4005 fecha:'24-07-24'->2024-07-24
[2025-11-02 02:28:47] L4006 fecha:'13-06-24'->2024-06-13
[2025-11-02 02:28:47] L4007 fecha:'22-12-24'->2024-12-22
[2025-11-02 02:28:47] L4008 fecha:'15-05-24'->2024-05-15
[2025-11-02 02:28:47] L4009 fecha:'05-10-24'->2024-10-05
[2025-11-02 02:28:47] L4010 fecha:'17-12-24'->2024-12-17
[2025-11-02 02:28:47] L4011 fecha:'29-07-25'->2025-07-29
[2025-11-02 02:28:47] L4012 fecha:'12-03-25'->2025-03-12
[2025-11-02 02:28:47] L4013 fecha:'29-12-24'->2024-12-29
[2025-11-02 02:28:47] L4014 fecha:'30-01-25'->2025-01-30
[2025-11-02 02:28:47] L4015 fecha:'03-06-24'->2024-06-03
[2025-11-02 02:28:47] L4016 fecha:'04-12-24'->2024-12-04
[2025-11-02 02:28:47] L4017 fecha:'07-12-24'->2024-12-07
[2025-11-02 02:28:47] L4018 fecha:'15-02-24'->2024-02-15
[2025-11-02 02:28:47] L4019 fecha:'17-10-24'->2024-10-17
[2025-11-02 02:28:47] L4020 fecha:'22-05-25'->2025-05-22
[2025-11-02 02:28:47] L4021 fecha:'10-03-24'->2024-03-10
[2025-11-02 02:28:47] L4022 fecha:'20-02-25'->2025-02-20
[2025-11-02 02:28:47] L4023 fecha:'01-01-24'->2024-01-01
[2025-11-02 02:28:47] L4024 fecha:'09-12-24'->2024-12-09
[2025-11-02 02:28:47] L4025 fecha:'13-12-24'->2024-12-13
[2025-11-02 02:28:47] L4026 fecha:'15-03-25'->2025-03-15
[2025-11-02 02:28:47] L4027 fecha:'24-06-24'->2024-06-24
[2025-11-02 02:28:47] L4028 fecha:'10-07-24'->2024-07-10
[2025-11-02 02:28:47] L4029 fecha:'14-06-24'->2024-06-14
[2025-11-02 02:28:47] L4030 fecha:'10-05-25'->2025-05-10
[2025-11-02 02:28:47] L4031 fecha:'09-08-24'->2024-08-09
[2025-11-02 02:28:47] L4032 fecha:'01-08-25'->2025-08-01
[2025-11-02 02:28:47] L4033 fecha:'12-02-25'->2025-02-12
[2025-11-02 02:28:47] L4034 fecha:'07-05-25'->2025-05-07
[2025-11-02 02:28:47] L4035 fecha:'23-05-24'->2024-05-23
[2025-11-02 02:28:47] L4036 fecha:'22-11-24'->2024-11-22
[2025-11-02 02:28:47] L4037 fecha:'11-07-24'->2024-07-11
[2025-11-02 02:28:47] L4038 fecha:'22-03-24'->2024-03-22
[2025-11-02 02:28:47] L4039 fecha:'10-07-25'->2025-07-10
[2025-11-02 02:28:47] L4040 fecha:'13-11-24'->2024-11-13
[2025-11-02 02:28:47] L4041 fecha:'14-01-24'->2024-01-14
[2025-11-02 02:28:47] L4042 fecha:'09-02-24'->2024-02-09
[2025-11-02 02:28:47] L4043 fecha:'21-05-25'->2025-05-21
[2025-11-02 02:28:47] L4044 fecha:'12-11-24'->2024-11-12
[2025-11-02 02:28:47] L4045 fecha:'21-03-25'->2025-03-21
[2025-11-02 02:28:47] L4046 fecha:'26-05-25'->2025-05-26
[2025-11-02 02:28:47] L4047 fecha:'31-03-24'->2024-03-31
[2025-11-02 02:28:47] L4048 fecha:'12-07-25'->2025-07-12
[2025-11-02 02:28:47] L4049 fecha:'12-01-25'->2025-01-12
[2025-11-02 02:28:47] L4050 fecha:'06-01-24'->2024-01-06
[2025-11-02 02:28:47] L4051 fecha:'18-07-25'->2025-07-18
[2025-11-02 02:28:47] L4052 fecha:'07-01-25'->2025-01-07
[2025-11-02 02:28:47] L4053 fecha:'02-05-25'->2025-05-02
[2025-11-02 02:28:47] L4054 fecha:'14-09-24'->2024-09-14
[2025-11-02 02:28:47] L4055 fecha:'17-07-24'->2024-07-17
[2025-11-02 02:28:47] L4056 fecha:'01-06-24'->2024-06-01
[2025-11-02 02:28:47] L4057 fecha:'15-08-25'->2025-08-15
[2025-11-02 02:28:47] L4058 fecha:'21-02-24'->2024-02-21
[2025-11-02 02:28:47] L4059 fecha:'03-05-25'->2025-05-03
[2025-11-02 02:28:47] L4060 fecha:'10-06-25'->2025-06-10
[2025-11-02 02:28:47] L4061 fecha:'29-01-25'->2025-01-29
[2025-11-02 02:28:47] L4062 fecha:'23-02-24'->2024-02-23
[2025-11-02 02:28:47] L4063 fecha:'23-06-24'->2024-06-23
[2025-11-02 02:28:47] L4064 fecha:'26-08-25'->2025-08-26
[2025-11-02 02:28:47] L4065 fecha:'07-06-24'->2024-06-07
[2025-11-02 02:28:47] L4066 fecha:'19-08-25'->2025-08-19
[2025-11-02 02:28:47] L4067 fecha:'05-03-24'->2024-03-05
[2025-11-02 02:28:47] L4068 fecha:'15-01-24'->2024-01-15
[2025-11-02 02:28:47] L4069 fecha:'10-10-24'->2024-10-10
[2025-11-02 02:28:47] L4070 fecha:'19-08-24'->2024-08-19
[2025-11-02 02:28:47] L4071 fecha:'15-11-24'->2024-11-15
[2025-11-02 02:28:47] L4072 fecha:'21-04-25'->2025-04-21
[2025-11-02 02:28:47] L4073 fecha:'12-03-24'->2024-03-12
[2025-11-02 02:28:47] L4074 fecha:'07-01-24'->2024-01-07
[2025-11-02 02:28:47] L4075 fecha:'07-10-24'->2024-10-07
[2025-11-02 02:28:47] L4076 fecha:'25-09-24'->2024-09-25
[2025-11-02 02:28:47] L4077 fecha:'04-03-24'->2024-03-04
[2025-11-02 02:28:47] L4078 fecha:'03-02-24'->2024-02-03
[2025-11-02 02:28:47] L4079 fecha:'18-09-24'->2024-09-18
[2025-11-02 02:28:47] L4080 fecha:'06-03-24'->2024-03-06
[2025-11-02 02:28:47] L4081 fecha:'27-04-25'->2025-04-27
[2025-11-02 02:28:47] L4082 fecha:'01-06-24'->2024-06-01
[2025-11-02 02:28:47] L4083 fecha:'23-05-24'->2024-05-23
[2025-11-02 02:28:47] L4084 fecha:'07-02-25'->2025-02-07
[2025-11-02 02:28:47] L4085 fecha:'16-05-25'->2025-05-16
[2025-11-02 02:28:47] L4086 fecha:'14-06-25'->2025-06-14
[2025-11-02 02:28:47] L4087 fecha:'16-02-24'->2024-02-16
[2025-11-02 02:28:47] L4088 fecha:'17-09-24'->2024-09-17
[2025-11-02 02:28:47] L4089 fecha:'07-01-24'->2024-01-07
[2025-11-02 02:28:47] L4090 fecha:'22-03-25'->2025-03-22
[2025-11-02 02:28:47] L4091 fecha:'30-01-24'->2024-01-30
[2025-11-02 02:28:47] L4092 fecha:'09-02-24'->2024-02-09
[2025-11-02 02:28:47] L4093 fecha:'05-07-24'->2024-07-05
[2025-11-02 02:28:47] L4094 fecha:'27-12-24'->2024-12-27
[2025-11-02 02:28:47] L4095 fecha:'30-01-24'->2024-01-30
[2025-11-02 02:28:47] L4096 fecha:'21-08-25'->2025-08-21
[2025-11-02 02:28:47] L4097 fecha:'23-07-25'->2025-07-23
[2025-11-02 02:28:47] L4098 fecha:'22-06-25'->2025-06-22
[2025-11-02 02:28:47] L4099 fecha:'02-04-25'->2025-04-02
[2025-11-02 02:28:47] L4100 fecha:'09-03-25'->2025-03-09
[2025-11-02 02:28:47] L4101 fecha:'06-06-25'->2025-06-06
[2025-11-02 02:28:47] L4102 fecha:'01-01-25'->2025-01-01
[2025-11-02 02:28:47] L4103 fecha:'22-04-24'->2024-04-22
[2025-11-02 02:28:47] L4104 fecha:'06-11-24'->2024-11-06
[2025-11-02 02:28:47] L4105 fecha:'02-08-24'->2024-08-02
[2025-11-02 02:28:47] L4106 fecha:'04-01-24'->2024-01-04
[2025-11-02 02:28:47] L4107 fecha:'02-05-24'->2024-05-02
[2025-11-02 02:28:47] L4108 fecha:'03-10-24'->2024-10-03
[2025-11-02 02:28:47] L4109 fecha:'15-05-24'->2024-05-15
[2025-11-02 02:28:47] L4110 fecha:'02-05-25'->2025-05-02
[2025-11-02 02:28:47] L4111 fecha:'16-07-24'->2024-07-16
[2025-11-02 02:28:47] L4112 fecha:'19-08-24'->2024-08-19
[2025-11-02 02:28:47] L4113 fecha:'27-01-25'->2025-01-27
[2025-11-02 02:28:47] L4114 fecha:'05-05-24'->2024-05-05
[2025-11-02 02:28:47] L4115 fecha:'08-04-24'->2024-04-08
[2025-11-02 02:28:47] L4116 fecha:'23-07-25'->2025-07-23
[2025-11-02 02:28:47] L4117 fecha:'24-03-24'->2024-03-24
[2025-11-02 02:28:47] L4118 fecha:'05-08-25'->2025-08-05
[2025-11-02 02:28:47] L4119 fecha:'30-05-24'->2024-05-30
[2025-11-02 02:28:47] L4120 fecha:'09-07-25'->2025-07-09
[2025-11-02 02:28:47] L4121 fecha:'04-05-24'->2024-05-04
[2025-11-02 02:28:47] L4122 fecha:'24-06-25'->2025-06-24
[2025-11-02 02:28:47] L4123 fecha:'14-08-24'->2024-08-14
[2025-11-02 02:28:47] L4124 fecha:'08-09-24'->2024-09-08
[2025-11-02 02:28:47] L4125 fecha:'03-06-25'->2025-06-03
[2025-11-02 02:28:47] L4126 fecha:'28-07-24'->2024-07-28
[2025-11-02 02:28:47] L4127 fecha:'26-07-24'->2024-07-26
[2025-11-02 02:28:47] L4128 fecha:'13-08-24'->2024-08-13
[2025-11-02 02:28:47] L4129 fecha:'01-08-25'->2025-08-01
[2025-11-02 02:28:47] L4130 fecha:'05-05-24'->2024-05-05
[2025-11-02 02:28:47] L4131 fecha:'24-11-24'->2024-11-24
[2025-11-02 02:28:47] L4132 fecha:'07-02-25'->2025-02-07
[2025-11-02 02:28:47] L4133 fecha:'15-07-25'->2025-07-15
[2025-11-02 02:28:47] L4134 fecha:'09-11-24'->2024-11-09
[2025-11-02 02:28:47] L4135 fecha:'04-07-24'->2024-07-04
[2025-11-02 02:28:47] L4136 fecha:'01-08-25'->2025-08-01
[2025-11-02 02:28:47] L4137 fecha:'24-06-24'->2024-06-24
[2025-11-02 02:28:47] L4138 fecha:'22-05-24'->2024-05-22
[2025-11-02 02:28:47] L4139 fecha:'07-01-25'->2025-01-07
[2025-11-02 02:28:47] L4140 fecha:'27-11-24'->2024-11-27
[2025-11-02 02:28:47] L4141 fecha:'07-02-24'->2024-02-07
[2025-11-02 02:28:47] L4142 fecha:'15-05-24'->2024-05-15
[2025-11-02 02:28:47] L4143 fecha:'22-02-24'->2024-02-22
[2025-11-02 02:28:47] L4144 fecha:'26-07-25'->2025-07-26
[2025-11-02 02:28:47] L4145 fecha:'10-06-24'->2024-06-10
[2025-11-02 02:28:47] L4146 fecha:'24-01-25'->2025-01-24
[2025-11-02 02:28:47] L4147 fecha:'15-02-24'->2024-02-15
[2025-11-02 02:28:47] L4148 fecha:'07-04-24'->2024-04-07
[2025-11-02 02:28:47] L4149 fecha:'07-05-25'->2025-05-07
[2025-11-02 02:28:47] L4150 fecha:'16-02-25'->2025-02-16
[2025-11-02 02:28:47] L4151 fecha:'20-02-24'->2024-02-20
[2025-11-02 02:28:47] L4152 fecha:'29-06-25'->2025-06-29
[2025-11-02 02:28:47] L4153 fecha:'08-06-25'->2025-06-08
[2025-11-02 02:28:47] L4154 fecha:'23-02-24'->2024-02-23
[2025-11-02 02:28:47] L4155 fecha:'19-07-25'->2025-07-19
[2025-11-02 02:28:47] L4156 fecha:'08-07-25'->2025-07-08
[2025-11-02 02:28:47] L4157 fecha:'02-03-24'->2024-03-02
[2025-11-02 02:28:47] L4158 fecha:'25-11-24'->2024-11-25
[2025-11-02 02:28:47] L4159 fecha:'21-11-24'->2024-11-21
[2025-11-02 02:28:47] L4160 fecha:'03-08-25'->2025-08-03
[2025-11-02 02:28:47] L4161 fecha:'03-07-24'->2024-07-03
[2025-11-02 02:28:47] L4162 fecha:'18-10-24'->2024-10-18
[2025-11-02 02:28:47] L4163 fecha:'29-04-25'->2025-04-29
[2025-11-02 02:28:47] L4164 fecha:'07-02-25'->2025-02-07
[2025-11-02 02:28:47] L4165 fecha:'22-10-24'->2024-10-22
[2025-11-02 02:28:47] L4166 fecha:'19-03-25'->2025-03-19
[2025-11-02 02:28:47] L4167 fecha:'16-08-25'->2025-08-16
[2025-11-02 02:28:47] L4168 fecha:'16-08-24'->2024-08-16
[2025-11-02 02:28:47] L4169 fecha:'08-03-24'->2024-03-08
[2025-11-02 02:28:47] L4170 fecha:'13-05-24'->2024-05-13
[2025-11-02 02:28:47] L4171 fecha:'12-07-24'->2024-07-12
[2025-11-02 02:28:47] L4172 fecha:'29-03-25'->2025-03-29
[2025-11-02 02:28:47] L4173 fecha:'25-06-24'->2024-06-25
[2025-11-02 02:28:47] L4174 fecha:'31-05-24'->2024-05-31
[2025-11-02 02:28:47] L4175 fecha:'15-12-24'->2024-12-15
[2025-11-02 02:28:47] L4176 fecha:'30-06-24'->2024-06-30
[2025-11-02 02:28:47] L4177 fecha:'14-02-24'->2024-02-14
[2025-11-02 02:28:47] L4178 fecha:'15-05-25'->2025-05-15
[2025-11-02 02:28:47] L4179 fecha:'28-03-25'->2025-03-28
[2025-11-02 02:28:47] L4180 fecha:'07-02-25'->2025-02-07
[2025-11-02 02:28:47] L4181 fecha:'01-03-25'->2025-03-01
[2025-11-02 02:28:47] L4182 fecha:'01-08-24'->2024-08-01
[2025-11-02 02:28:47] L4183 fecha:'17-09-24'->2024-09-17
[2025-11-02 02:28:47] L4184 fecha:'24-08-25'->2025-08-24
[2025-11-02 02:28:47] L4185 fecha:'16-11-24'->2024-11-16
[2025-11-02 02:28:47] L4186 fecha:'03-04-25'->2025-04-03
[2025-11-02 02:28:47] L4187 fecha:'03-11-24'->2024-11-03
[2025-11-02 02:28:47] L4188 fecha:'08-02-25'->2025-02-08
[2025-11-02 02:28:47] L4189 fecha:'14-04-25'->2025-04-14
[2025-11-02 02:28:47] L4190 fecha:'14-03-24'->2024-03-14
[2025-11-02 02:28:47] L4191 fecha:'09-08-25'->2025-08-09
[2025-11-02 02:28:47] L4192 fecha:'16-04-25'->2025-04-16
[2025-11-02 02:28:47] L4193 fecha:'06-08-24'->2024-08-06
[2025-11-02 02:28:47] L4194 fecha:'19-03-25'->2025-03-19
[2025-11-02 02:28:47] L4195 fecha:'12-12-24'->2024-12-12
[2025-11-02 02:28:47] L4196 fecha:'06-06-24'->2024-06-06
[2025-11-02 02:28:47] L4197 fecha:'15-02-25'->2025-02-15
[2025-11-02 02:28:47] L4198 fecha:'24-03-24'->2024-03-24
[2025-11-02 02:28:47] L4199 fecha:'25-03-24'->2024-03-25
[2025-11-02 02:28:47] L4200 fecha:'18-05-25'->2025-05-18
[2025-11-02 02:28:47] L4201 fecha:'03-05-25'->2025-05-03
[2025-11-02 02:28:47] L4202 fecha:'14-04-24'->2024-04-14
[2025-11-02 02:28:47] L4203 fecha:'27-12-24'->2024-12-27
[2025-11-02 02:28:47] L4204 fecha:'05-12-24'->2024-12-05
[2025-11-02 02:28:47] L4205 fecha:'09-07-25'->2025-07-09
[2025-11-02 02:28:47] L4206 fecha:'27-03-24'->2024-03-27
[2025-11-02 02:28:47] L4207 fecha:'17-05-24'->2024-05-17
[2025-11-02 02:28:47] L4208 fecha:'09-08-25'->2025-08-09
[2025-11-02 02:28:47] L4209 fecha:'04-06-25'->2025-06-04
[2025-11-02 02:28:47] L4210 fecha:'02-09-24'->2024-09-02
[2025-11-02 02:28:47] L4211 fecha:'08-10-24'->2024-10-08
[2025-11-02 02:28:47] L4212 fecha:'30-12-24'->2024-12-30
[2025-11-02 02:28:47] L4213 fecha:'29-09-24'->2024-09-29
[2025-11-02 02:28:47] L4214 fecha:'16-10-24'->2024-10-16
[2025-11-02 02:28:47] L4215 fecha:'02-08-24'->2024-08-02
[2025-11-02 02:28:47] L4216 fecha:'20-03-24'->2024-03-20
[2025-11-02 02:28:47] L4217 fecha:'09-01-24'->2024-01-09
[2025-11-02 02:28:47] L4218 fecha:'01-08-25'->2025-08-01
[2025-11-02 02:28:47] L4219 fecha:'27-07-25'->2025-07-27
[2025-11-02 02:28:47] L4220 fecha:'17-03-24'->2024-03-17
[2025-11-02 02:28:47] L4221 fecha:'17-02-25'->2025-02-17
[2025-11-02 02:28:47] L4222 fecha:'01-12-24'->2024-12-01
[2025-11-02 02:28:47] L4223 fecha:'15-08-25'->2025-08-15
[2025-11-02 02:28:47] L4224 fecha:'23-10-24'->2024-10-23
[2025-11-02 02:28:47] L4225 fecha:'29-06-25'->2025-06-29
[2025-11-02 02:28:47] L4226 fecha:'24-06-24'->2024-06-24
[2025-11-02 02:28:47] L4227 fecha:'12-12-24'->2024-12-12
[2025-11-02 02:28:47] L4228 fecha:'09-02-24'->2024-02-09
[2025-11-02 02:28:47] L4229 fecha:'02-07-25'->2025-07-02
[2025-11-02 02:28:47] L4230 fecha:'06-07-24'->2024-07-06
[2025-11-02 02:28:47] L4231 fecha:'21-03-25'->2025-03-21
[2025-11-02 02:28:47] L4232 fecha:'29-08-24'->2024-08-29
[2025-11-02 02:28:47] L4233 fecha:'23-01-25'->2025-01-23
[2025-11-02 02:28:47] L4234 fecha:'31-03-25'->2025-03-31
[2025-11-02 02:28:47] L4235 fecha:'03-06-24'->2024-06-03
[2025-11-02 02:28:47] L4236 fecha:'11-08-24'->2024-08-11
[2025-11-02 02:28:47] L4237 fecha:'29-05-25'->2025-05-29
[2025-11-02 02:28:47] L4238 fecha:'11-03-25'->2025-03-11
[2025-11-02 02:28:47] L4239 fecha:'18-03-25'->2025-03-18
[2025-11-02 02:28:47] L4240 fecha:'06-07-25'->2025-07-06
[2025-11-02 02:28:47] L4241 fecha:'07-02-24'->2024-02-07
[2025-11-02 02:28:47] L4242 fecha:'17-08-25'->2025-08-17
[2025-11-02 02:28:47] L4243 fecha:'09-09-24'->2024-09-09
[2025-11-02 02:28:47] L4244 fecha:'08-06-25'->2025-06-08
[2025-11-02 02:28:47] L4245 fecha:'21-10-24'->2024-10-21
[2025-11-02 02:28:47] L4246 fecha:'13-06-25'->2025-06-13
[2025-11-02 02:28:47] L4247 fecha:'01-01-24'->2024-01-01
[2025-11-02 02:28:47] L4248 fecha:'27-09-24'->2024-09-27
[2025-11-02 02:28:47] L4249 fecha:'02-02-25'->2025-02-02
[2025-11-02 02:28:47] L4250 fecha:'26-09-24'->2024-09-26
[2025-11-02 02:28:47] L4251 fecha:'06-02-24'->2024-02-06
[2025-11-02 02:28:47] L4252 fecha:'12-05-24'->2024-05-12
[2025-11-02 02:28:47] L4253 fecha:'06-03-25'->2025-03-06
[2025-11-02 02:28:47] L4254 fecha:'12-03-25'->2025-03-12
[2025-11-02 02:28:47] L4255 fecha:'04-01-25'->2025-01-04
[2025-11-02 02:28:47] L4256 fecha:'30-11-24'->2024-11-30
[2025-11-02 02:28:47] L4257 fecha:'29-06-25'->2025-06-29
[2025-11-02 02:28:47] L4258 fecha:'17-04-24'->2024-04-17
[2025-11-02 02:28:47] L4259 fecha:'18-07-25'->2025-07-18
[2025-11-02 02:28:47] L4260 fecha:'13-02-24'->2024-02-13
[2025-11-02 02:28:47] L4261 fecha:'18-05-25'->2025-05-18
[2025-11-02 02:28:47] L4262 fecha:'21-03-24'->2024-03-21
[2025-11-02 02:28:47] L4263 fecha:'17-01-25'->2025-01-17
[2025-11-02 02:28:47] L4264 fecha:'07-05-24'->2024-05-07
[2025-11-02 02:28:47] L4265 fecha:'07-04-25'->2025-04-07
[2025-11-02 02:28:47] L4266 fecha:'06-01-25'->2025-01-06
[2025-11-02 02:28:47] L4267 fecha:'15-12-24'->2024-12-15
[2025-11-02 02:28:47] L4268 fecha:'06-02-24'->2024-02-06
[2025-11-02 02:28:47] L4269 fecha:'05-12-24'->2024-12-05
[2025-11-02 02:28:47] L4270 fecha:'19-07-25'->2025-07-19
[2025-11-02 02:28:47] L4271 fecha:'18-08-24'->2024-08-18
[2025-11-02 02:28:47] L4272 fecha:'07-05-25'->2025-05-07
[2025-11-02 02:28:47] L4273 fecha:'25-04-24'->2024-04-25
[2025-11-02 02:28:47] L4274 fecha:'05-02-24'->2024-02-05
[2025-11-02 02:28:47] L4275 fecha:'06-07-25'->2025-07-06
[2025-11-02 02:28:47] L4276 fecha:'13-04-25'->2025-04-13
[2025-11-02 02:28:47] L4277 fecha:'23-01-24'->2024-01-23
[2025-11-02 02:28:47] L4278 fecha:'20-03-25'->2025-03-20
[2025-11-02 02:28:47] L4279 fecha:'22-01-24'->2024-01-22
[2025-11-02 02:28:47] L4280 fecha:'10-01-24'->2024-01-10
[2025-11-02 02:28:47] L4281 fecha:'01-03-24'->2024-03-01
[2025-11-02 02:28:47] L4282 fecha:'30-07-25'->2025-07-30
[2025-11-02 02:28:47] L4283 fecha:'20-05-25'->2025-05-20
[2025-11-02 02:28:47] L4284 fecha:'31-07-25'->2025-07-31
[2025-11-02 02:28:47] L4285 fecha:'07-02-25'->2025-02-07
[2025-11-02 02:28:47] L4286 fecha:'19-09-24'->2024-09-19
[2025-11-02 02:28:47] L4287 fecha:'29-04-25'->2025-04-29
[2025-11-02 02:28:47] L4288 fecha:'29-07-24'->2024-07-29
[2025-11-02 02:28:47] L4289 fecha:'22-05-25'->2025-05-22
[2025-11-02 02:28:47] L4290 fecha:'15-11-24'->2024-11-15
[2025-11-02 02:28:47] L4291 fecha:'26-07-24'->2024-07-26
[2025-11-02 02:28:47] L4292 fecha:'24-06-24'->2024-06-24
[2025-11-02 02:28:47] L4293 fecha:'01-07-24'->2024-07-01
[2025-11-02 02:28:47] L4294 fecha:'29-03-24'->2024-03-29
[2025-11-02 02:28:47] L4295 fecha:'28-11-24'->2024-11-28
[2025-11-02 02:28:47] L4296 fecha:'22-12-24'->2024-12-22
[2025-11-02 02:28:47] L4297 fecha:'13-07-25'->2025-07-13
[2025-11-02 02:28:47] L4298 fecha:'06-08-24'->2024-08-06
[2025-11-02 02:28:47] L4299 fecha:'02-02-25'->2025-02-02
[2025-11-02 02:28:47] L4300 fecha:'13-06-25'->2025-06-13
[2025-11-02 02:28:47] L4301 fecha:'15-06-25'->2025-06-15
[2025-11-02 02:28:47] L4302 fecha:'19-07-24'->2024-07-19
[2025-11-02 02:28:47] L4303 fecha:'13-02-24'->2024-02-13
[2025-11-02 02:28:47] L4304 fecha:'04-01-25'->2025-01-04
[2025-11-02 02:28:47] L4305 fecha:'23-07-24'->2024-07-23
[2025-11-02 02:28:47] L4306 fecha:'17-05-25'->2025-05-17
[2025-11-02 02:28:47] L4307 fecha:'04-04-25'->2025-04-04
[2025-11-02 02:28:47] L4308 fecha:'10-03-25'->2025-03-10
[2025-11-02 02:28:47] L4309 fecha:'13-04-24'->2024-04-13
[2025-11-02 02:28:47] L4310 fecha:'21-11-24'->2024-11-21
[2025-11-02 02:28:47] L4311 fecha:'13-11-24'->2024-11-13
[2025-11-02 02:28:47] L4312 fecha:'26-07-25'->2025-07-26
[2025-11-02 02:28:47] L4313 fecha:'23-04-24'->2024-04-23
[2025-11-02 02:28:47] L4314 fecha:'02-05-24'->2024-05-02
[2025-11-02 02:28:47] L4315 fecha:'16-03-24'->2024-03-16
[2025-11-02 02:28:47] L4316 fecha:'08-12-24'->2024-12-08
[2025-11-02 02:28:47] L4317 fecha:'29-11-24'->2024-11-29
[2025-11-02 02:28:47] L4318 fecha:'10-05-24'->2024-05-10
[2025-11-02 02:28:47] L4319 fecha:'22-12-24'->2024-12-22
[2025-11-02 02:28:47] L4320 fecha:'16-01-24'->2024-01-16
[2025-11-02 02:28:47] L4321 fecha:'05-07-24'->2024-07-05
[2025-11-02 02:28:47] L4322 fecha:'07-10-24'->2024-10-07
[2025-11-02 02:28:47] L4323 fecha:'14-04-24'->2024-04-14
[2025-11-02 02:28:47] L4324 fecha:'07-04-25'->2025-04-07
[2025-11-02 02:28:47] L4325 fecha:'04-04-24'->2024-04-04
[2025-11-02 02:28:47] L4326 fecha:'15-02-25'->2025-02-15
[2025-11-02 02:28:47] L4327 fecha:'24-03-25'->2025-03-24
[2025-11-02 02:28:47] L4328 fecha:'18-09-24'->2024-09-18
[2025-11-02 02:28:47] L4329 fecha:'08-05-25'->2025-05-08
[2025-11-02 02:28:47] L4330 fecha:'13-03-25'->2025-03-13
[2025-11-02 02:28:47] L4331 fecha:'11-07-25'->2025-07-11
[2025-11-02 02:28:47] L4332 fecha:'08-09-24'->2024-09-08
[2025-11-02 02:28:47] L4333 fecha:'09-11-24'->2024-11-09
[2025-11-02 02:28:47] L4334 fecha:'02-07-24'->2024-07-02
[2025-11-02 02:28:47] L4335 fecha:'27-08-25'->2025-08-27
[2025-11-02 02:28:47] L4336 fecha:'15-07-25'->2025-07-15
[2025-11-02 02:28:47] L4337 fecha:'01-03-25'->2025-03-01
[2025-11-02 02:28:47] L4338 fecha:'03-05-24'->2024-05-03
[2025-11-02 02:28:47] L4339 fecha:'28-02-25'->2025-02-28
[2025-11-02 02:28:47] L4340 fecha:'09-06-24'->2024-06-09
[2025-11-02 02:28:47] L4341 fecha:'05-07-25'->2025-07-05
[2025-11-02 02:28:47] L4342 fecha:'02-04-25'->2025-04-02
[2025-11-02 02:28:47] L4343 fecha:'07-02-25'->2025-02-07
[2025-11-02 02:28:47] L4344 fecha:'04-01-24'->2024-01-04
[2025-11-02 02:28:47] L4345 fecha:'19-09-24'->2024-09-19
[2025-11-02 02:28:47] L4346 fecha:'12-02-24'->2024-02-12
[2025-11-02 02:28:47] L4347 fecha:'02-02-24'->2024-02-02
[2025-11-02 02:28:47] L4348 fecha:'18-08-24'->2024-08-18
[2025-11-02 02:28:47] L4349 fecha:'18-06-25'->2025-06-18
[2025-11-02 02:28:47] L4350 fecha:'14-11-24'->2024-11-14
[2025-11-02 02:28:47] L4351 fecha:'17-11-24'->2024-11-17
[2025-11-02 02:28:47] L4352 fecha:'10-08-24'->2024-08-10
[2025-11-02 02:28:47] L4353 fecha:'14-02-24'->2024-02-14
[2025-11-02 02:28:47] L4354 fecha:'30-11-24'->2024-11-30
[2025-11-02 02:28:47] L4355 fecha:'01-05-25'->2025-05-01
[2025-11-02 02:28:47] L4356 fecha:'26-03-25'->2025-03-26
[2025-11-02 02:28:47] L4357 fecha:'02-03-25'->2025-03-02
[2025-11-02 02:28:47] L4358 fecha:'15-08-25'->2025-08-15
[2025-11-02 02:28:47] L4359 fecha:'07-08-24'->2024-08-07
[2025-11-02 02:28:47] L4360 fecha:'23-10-24'->2024-10-23
[2025-11-02 02:28:47] L4361 fecha:'30-11-24'->2024-11-30
[2025-11-02 02:28:47] L4362 fecha:'06-11-24'->2024-11-06
[2025-11-02 02:28:47] L4363 fecha:'23-11-24'->2024-11-23
[2025-11-02 02:28:47] L4364 fecha:'07-06-24'->2024-06-07
[2025-11-02 02:28:47] L4365 fecha:'27-03-25'->2025-03-27
[2025-11-02 02:28:47] L4366 fecha:'20-09-24'->2024-09-20
[2025-11-02 02:28:47] L4367 fecha:'01-07-25'->2025-07-01
[2025-11-02 02:28:47] L4368 fecha:'19-01-24'->2024-01-19
[2025-11-02 02:28:47] L4369 fecha:'05-07-25'->2025-07-05
[2025-11-02 02:28:47] L4370 fecha:'18-09-24'->2024-09-18
[2025-11-02 02:28:47] L4371 fecha:'16-04-24'->2024-04-16
[2025-11-02 02:28:47] L4372 fecha:'07-06-25'->2025-06-07
[2025-11-02 02:28:47] L4373 fecha:'09-10-24'->2024-10-09
[2025-11-02 02:28:47] L4374 fecha:'28-05-24'->2024-05-28
[2025-11-02 02:28:47] L4375 fecha:'18-06-24'->2024-06-18
[2025-11-02 02:28:47] L4376 fecha:'08-12-24'->2024-12-08
[2025-11-02 02:28:47] L4377 fecha:'05-12-24'->2024-12-05
[2025-11-02 02:28:47] L4378 fecha:'23-02-25'->2025-02-23
[2025-11-02 02:28:47] L4379 fecha:'22-08-25'->2025-08-22
[2025-11-02 02:28:47] L4380 fecha:'27-12-24'->2024-12-27
[2025-11-02 02:28:47] L4381 fecha:'10-08-25'->2025-08-10
[2025-11-02 02:28:47] L4382 fecha:'24-05-24'->2024-05-24
[2025-11-02 02:28:47] L4383 fecha:'29-01-25'->2025-01-29
[2025-11-02 02:28:47] L4384 fecha:'05-09-24'->2024-09-05
[2025-11-02 02:28:47] L4385 fecha:'04-04-25'->2025-04-04
[2025-11-02 02:28:47] L4386 fecha:'20-07-25'->2025-07-20
[2025-11-02 02:28:47] L4387 fecha:'03-04-24'->2024-04-03
[2025-11-02 02:28:47] L4388 fecha:'01-08-24'->2024-08-01
[2025-11-02 02:28:47] L4389 fecha:'21-04-25'->2025-04-21
[2025-11-02 02:28:47] L4390 fecha:'09-06-24'->2024-06-09
[2025-11-02 02:28:47] L4391 fecha:'18-07-25'->2025-07-18
[2025-11-02 02:28:47] L4392 fecha:'13-07-25'->2025-07-13
[2025-11-02 02:28:47] L4393 fecha:'26-08-24'->2024-08-26
[2025-11-02 02:28:47] L4394 fecha:'04-03-25'->2025-03-04
[2025-11-02 02:28:47] L4395 fecha:'02-09-24'->2024-09-02
[2025-11-02 02:28:47] L4396 fecha:'08-08-25'->2025-08-08
[2025-11-02 02:28:47] L4397 fecha:'15-02-25'->2025-02-15
[2025-11-02 02:28:47] L4398 fecha:'05-05-24'->2024-05-05
[2025-11-02 02:28:47] L4399 fecha:'19-09-24'->2024-09-19
[2025-11-02 02:28:47] L4400 fecha:'23-04-25'->2025-04-23
[2025-11-02 02:28:47] L4401 fecha:'12-12-24'->2024-12-12
[2025-11-02 02:28:47] L4402 fecha:'22-02-25'->2025-02-22
[2025-11-02 02:28:47] L4403 fecha:'21-05-25'->2025-05-21
[2025-11-02 02:28:47] L4404 fecha:'30-04-25'->2025-04-30
[2025-11-02 02:28:47] L4405 fecha:'29-03-25'->2025-03-29
[2025-11-02 02:28:47] L4406 fecha:'04-09-24'->2024-09-04
[2025-11-02 02:28:47] L4407 fecha:'30-03-25'->2025-03-30
[2025-11-02 02:28:47] L4408 fecha:'17-05-25'->2025-05-17
[2025-11-02 02:28:47] L4409 fecha:'07-07-24'->2024-07-07
[2025-11-02 02:28:47] L4410 fecha:'06-06-25'->2025-06-06
[2025-11-02 02:28:47] L4411 fecha:'10-07-25'->2025-07-10
[2025-11-02 02:28:47] L4412 fecha:'31-05-25'->2025-05-31
[2025-11-02 02:28:47] L4413 fecha:'23-08-25'->2025-08-23
[2025-11-02 02:28:47] L4414 fecha:'04-11-24'->2024-11-04
[2025-11-02 02:28:47] L4415 fecha:'31-12-24'->2024-12-31
[2025-11-02 02:28:47] L4416 fecha:'17-01-24'->2024-01-17
[2025-11-02 02:28:47] L4417 fecha:'08-03-25'->2025-03-08
[2025-11-02 02:28:47] L4418 fecha:'24-06-24'->2024-06-24
[2025-11-02 02:28:47] L4419 fecha:'22-06-25'->2025-06-22
[2025-11-02 02:28:47] L4420 fecha:'01-09-24'->2024-09-01
[2025-11-02 02:28:47] L4421 fecha:'30-08-25'->2025-08-30
[2025-11-02 02:28:47] L4422 fecha:'12-03-25'->2025-03-12
[2025-11-02 02:28:47] L4423 fecha:'03-05-25'->2025-05-03
[2025-11-02 02:28:47] L4424 fecha:'16-01-25'->2025-01-16
[2025-11-02 02:28:47] L4425 fecha:'21-02-24'->2024-02-21
[2025-11-02 02:28:47] L4426 fecha:'20-08-25'->2025-08-20
[2025-11-02 02:28:47] L4427 fecha:'15-01-25'->2025-01-15
[2025-11-02 02:28:47] L4428 fecha:'12-02-24'->2024-02-12
[2025-11-02 02:28:47] L4429 fecha:'01-03-24'->2024-03-01
[2025-11-02 02:28:47] L4430 fecha:'07-11-24'->2024-11-07
[2025-11-02 02:28:47] L4431 fecha:'23-02-24'->2024-02-23
[2025-11-02 02:28:47] L4432 fecha:'29-11-24'->2024-11-29
[2025-11-02 02:28:47] L4433 fecha:'18-05-25'->2025-05-18
[2025-11-02 02:28:47] L4434 fecha:'21-06-24'->2024-06-21
[2025-11-02 02:28:47] L4435 fecha:'14-08-24'->2024-08-14
[2025-11-02 02:28:47] L4436 fecha:'12-02-25'->2025-02-12
[2025-11-02 02:28:47] L4437 fecha:'12-08-25'->2025-08-12
[2025-11-02 02:28:47] L4438 fecha:'07-12-24'->2024-12-07
[2025-11-02 02:28:47] L4439 fecha:'06-07-24'->2024-07-06
[2025-11-02 02:28:47] L4440 fecha:'17-01-25'->2025-01-17
[2025-11-02 02:28:47] L4441 fecha:'23-09-24'->2024-09-23
[2025-11-02 02:28:47] L4442 fecha:'22-09-24'->2024-09-22
[2025-11-02 02:28:47] L4443 fecha:'14-04-25'->2025-04-14
[2025-11-02 02:28:47] L4444 fecha:'14-02-24'->2024-02-14
[2025-11-02 02:28:47] L4445 fecha:'12-04-25'->2025-04-12
[2025-11-02 02:28:47] L4446 fecha:'10-01-24'->2024-01-10
[2025-11-02 02:28:47] L4447 fecha:'20-09-24'->2024-09-20
[2025-11-02 02:28:47] L4448 fecha:'27-02-24'->2024-02-27
[2025-11-02 02:28:47] L4449 fecha:'08-11-24'->2024-11-08
[2025-11-02 02:28:47] L4450 fecha:'11-03-25'->2025-03-11
[2025-11-02 02:28:47] L4451 fecha:'20-09-24'->2024-09-20
[2025-11-02 02:28:47] L4452 fecha:'23-03-25'->2025-03-23
[2025-11-02 02:28:47] L4453 fecha:'26-03-24'->2024-03-26
[2025-11-02 02:28:47] L4454 fecha:'28-07-25'->2025-07-28
[2025-11-02 02:28:47] L4455 fecha:'19-04-25'->2025-04-19
[2025-11-02 02:28:47] L4456 fecha:'20-07-24'->2024-07-20
[2025-11-02 02:28:47] L4457 fecha:'30-05-24'->2024-05-30
[2025-11-02 02:28:47] L4458 fecha:'03-06-25'->2025-06-03
[2025-11-02 02:28:47] L4459 fecha:'25-02-24'->2024-02-25
[2025-11-02 02:28:47] L4460 fecha:'04-02-25'->2025-02-04
[2025-11-02 02:28:47] L4461 fecha:'29-03-24'->2024-03-29
[2025-11-02 02:28:47] L4462 fecha:'07-01-25'->2025-01-07
[2025-11-02 02:28:47] L4463 fecha:'30-11-24'->2024-11-30
[2025-11-02 02:28:47] L4464 fecha:'21-02-24'->2024-02-21
[2025-11-02 02:28:47] L4465 fecha:'17-12-24'->2024-12-17
[2025-11-02 02:28:47] L4466 fecha:'07-05-24'->2024-05-07
[2025-11-02 02:28:47] L4467 fecha:'18-07-25'->2025-07-18
[2025-11-02 02:28:47] L4468 fecha:'04-04-25'->2025-04-04
[2025-11-02 02:28:47] L4469 fecha:'09-08-25'->2025-08-09
[2025-11-02 02:28:47] L4470 fecha:'03-07-24'->2024-07-03
[2025-11-02 02:28:47] L4471 fecha:'29-12-24'->2024-12-29
[2025-11-02 02:28:47] L4472 fecha:'27-03-25'->2025-03-27
[2025-11-02 02:28:47] L4473 fecha:'26-01-25'->2025-01-26
[2025-11-02 02:28:47] L4474 fecha:'06-12-24'->2024-12-06
[2025-11-02 02:28:47] L4475 fecha:'11-07-25'->2025-07-11
[2025-11-02 02:28:47] L4476 fecha:'11-07-24'->2024-07-11
[2025-11-02 02:28:47] L4477 fecha:'05-06-25'->2025-06-05
[2025-11-02 02:28:47] L4478 fecha:'27-03-24'->2024-03-27
[2025-11-02 02:28:47] L4479 fecha:'02-11-24'->2024-11-02
[2025-11-02 02:28:47] L4480 fecha:'23-05-24'->2024-05-23
[2025-11-02 02:28:47] L4481 fecha:'06-07-25'->2025-07-06
[2025-11-02 02:28:47] L4482 fecha:'02-09-24'->2024-09-02
[2025-11-02 02:28:47] L4483 fecha:'15-03-24'->2024-03-15
[2025-11-02 02:28:47] L4484 fecha:'22-06-25'->2025-06-22
[2025-11-02 02:28:47] L4485 fecha:'20-03-24'->2024-03-20
[2025-11-02 02:28:47] L4486 fecha:'23-07-25'->2025-07-23
[2025-11-02 02:28:47] L4487 fecha:'01-02-24'->2024-02-01
[2025-11-02 02:28:47] L4488 fecha:'19-07-25'->2025-07-19
[2025-11-02 02:28:47] L4489 fecha:'14-06-24'->2024-06-14
[2025-11-02 02:28:47] L4490 fecha:'02-08-24'->2024-08-02
[2025-11-02 02:28:47] L4491 fecha:'09-03-25'->2025-03-09
[2025-11-02 02:28:47] L4492 fecha:'15-08-24'->2024-08-15
[2025-11-02 02:28:47] L4493 fecha:'17-11-24'->2024-11-17
[2025-11-02 02:28:47] L4494 fecha:'17-06-25'->2025-06-17
[2025-11-02 02:28:47] L4495 fecha:'13-03-25'->2025-03-13
[2025-11-02 02:28:47] L4496 fecha:'25-08-25'->2025-08-25
[2025-11-02 02:28:47] L4497 fecha:'11-04-25'->2025-04-11
[2025-11-02 02:28:47] L4498 fecha:'23-02-24'->2024-02-23
[2025-11-02 02:28:47] L4499 fecha:'30-07-24'->2024-07-30
[2025-11-02 02:28:47] L4500 fecha:'28-05-25'->2025-05-28
[2025-11-02 02:28:47] L4501 fecha:'11-11-24'->2024-11-11
[2025-11-02 02:28:47] L4502 fecha:'26-01-25'->2025-01-26
[2025-11-02 02:28:47] L4503 fecha:'29-01-25'->2025-01-29
[2025-11-02 02:28:47] L4504 fecha:'08-10-24'->2024-10-08
[2025-11-02 02:28:47] L4505 fecha:'27-05-25'->2025-05-27
[2025-11-02 02:28:47] L4506 fecha:'04-02-24'->2024-02-04
[2025-11-02 02:28:47] L4507 fecha:'15-09-24'->2024-09-15
[2025-11-02 02:28:47] L4508 fecha:'13-08-25'->2025-08-13
[2025-11-02 02:28:47] L4509 fecha:'21-07-25'->2025-07-21
[2025-11-02 02:28:47] L4510 fecha:'25-08-24'->2024-08-25
[2025-11-02 02:28:47] L4511 fecha:'11-11-24'->2024-11-11
[2025-11-02 02:28:47] L4512 fecha:'10-03-25'->2025-03-10
[2025-11-02 02:28:47] L4513 fecha:'26-02-25'->2025-02-26
[2025-11-02 02:28:47] L4514 fecha:'01-05-24'->2024-05-01
[2025-11-02 02:28:47] L4515 fecha:'23-01-25'->2025-01-23
[2025-11-02 02:28:47] L4516 fecha:'07-09-24'->2024-09-07
[2025-11-02 02:28:47] L4517 fecha:'17-11-24'->2024-11-17
[2025-11-02 02:28:47] L4518 fecha:'31-08-24'->2024-08-31
[2025-11-02 02:28:47] L4519 fecha:'02-09-24'->2024-09-02
[2025-11-02 02:28:47] L4520 fecha:'11-11-24'->2024-11-11
[2025-11-02 02:28:47] L4521 fecha:'11-07-25'->2025-07-11
[2025-11-02 02:28:47] L4522 fecha:'02-05-24'->2024-05-02
[2025-11-02 02:28:47] L4523 fecha:'05-01-24'->2024-01-05
[2025-11-02 02:28:47] L4524 fecha:'04-04-25'->2025-04-04
[2025-11-02 02:28:47] L4525 fecha:'10-06-25'->2025-06-10
[2025-11-02 02:28:47] L4526 fecha:'29-04-24'->2024-04-29
[2025-11-02 02:28:47] L4527 fecha:'24-08-25'->2025-08-24
[2025-11-02 02:28:47] L4528 fecha:'20-02-25'->2025-02-20
[2025-11-02 02:28:47] L4529 fecha:'26-08-24'->2024-08-26
[2025-11-02 02:28:47] L4530 fecha:'05-01-25'->2025-01-05
[2025-11-02 02:28:47] L4531 fecha:'16-01-25'->2025-01-16
[2025-11-02 02:28:47] L4532 fecha:'07-02-25'->2025-02-07
[2025-11-02 02:28:47] L4533 fecha:'28-07-24'->2024-07-28
[2025-11-02 02:28:47] L4534 fecha:'02-07-25'->2025-07-02
[2025-11-02 02:28:47] L4535 fecha:'13-05-24'->2024-05-13
[2025-11-02 02:28:47] L4536 fecha:'28-07-24'->2024-07-28
[2025-11-02 02:28:47] L4537 fecha:'27-09-24'->2024-09-27
[2025-11-02 02:28:47] L4538 fecha:'16-11-24'->2024-11-16
[2025-11-02 02:28:47] L4539 fecha:'17-04-24'->2024-04-17
[2025-11-02 02:28:47] L4540 fecha:'18-04-24'->2024-04-18
[2025-11-02 02:28:47] L4541 fecha:'30-06-25'->2025-06-30
[2025-11-02 02:28:47] L4542 fecha:'02-07-25'->2025-07-02
[2025-11-02 02:28:47] L4543 fecha:'28-04-25'->2025-04-28
[2025-11-02 02:28:47] L4544 fecha:'16-11-24'->2024-11-16
[2025-11-02 02:28:47] L4545 fecha:'26-05-24'->2024-05-26
[2025-11-02 02:28:47] L4546 fecha:'29-07-25'->2025-07-29
[2025-11-02 02:28:47] L4547 fecha:'09-06-25'->2025-06-09
[2025-11-02 02:28:47] L4548 fecha:'04-03-24'->2024-03-04
[2025-11-02 02:28:47] L4549 fecha:'07-03-25'->2025-03-07
[2025-11-02 02:28:47] L4550 fecha:'18-08-24'->2024-08-18
[2025-11-02 02:28:47] L4551 fecha:'27-06-25'->2025-06-27
[2025-11-02 02:28:47] L4552 fecha:'15-06-25'->2025-06-15
[2025-11-02 02:28:47] L4553 fecha:'20-09-24'->2024-09-20
[2025-11-02 02:28:47] L4554 fecha:'15-05-24'->2024-05-15
[2025-11-02 02:28:47] L4555 fecha:'12-04-24'->2024-04-12
[2025-11-02 02:28:47] L4556 fecha:'04-03-25'->2025-03-04
[2025-11-02 02:28:47] L4557 fecha:'27-08-25'->2025-08-27
[2025-11-02 02:28:47] L4558 fecha:'12-09-24'->2024-09-12
[2025-11-02 02:28:47] L4559 fecha:'10-03-24'->2024-03-10
[2025-11-02 02:28:47] L4560 fecha:'05-02-25'->2025-02-05
[2025-11-02 02:28:47] L4561 fecha:'10-05-24'->2024-05-10
[2025-11-02 02:28:47] L4562 fecha:'02-10-24'->2024-10-02
[2025-11-02 02:28:47] L4563 fecha:'19-05-24'->2024-05-19
[2025-11-02 02:28:47] L4564 fecha:'21-11-24'->2024-11-21
[2025-11-02 02:28:47] L4565 fecha:'13-07-24'->2024-07-13
[2025-11-02 02:28:47] L4566 fecha:'01-03-24'->2024-03-01
[2025-11-02 02:28:47] L4567 fecha:'07-03-24'->2024-03-07
[2025-11-02 02:28:47] L4568 fecha:'20-05-25'->2025-05-20
[2025-11-02 02:28:47] L4569 fecha:'03-07-25'->2025-07-03
[2025-11-02 02:28:47] L4570 fecha:'09-08-24'->2024-08-09
[2025-11-02 02:28:47] L4571 fecha:'14-07-24'->2024-07-14
[2025-11-02 02:28:47] L4572 fecha:'05-05-25'->2025-05-05
[2025-11-02 02:28:47] L4573 fecha:'12-12-24'->2024-12-12
[2025-11-02 02:28:47] L4574 fecha:'21-05-24'->2024-05-21
[2025-11-02 02:28:47] L4575 fecha:'25-05-24'->2024-05-25
[2025-11-02 02:28:47] L4576 fecha:'26-08-25'->2025-08-26
[2025-11-02 02:28:47] L4577 fecha:'10-02-24'->2024-02-10
[2025-11-02 02:28:47] L4578 fecha:'16-07-24'->2024-07-16
[2025-11-02 02:28:47] L4579 fecha:'05-05-24'->2024-05-05
[2025-11-02 02:28:47] L4580 fecha:'23-11-24'->2024-11-23
[2025-11-02 02:28:47] L4581 fecha:'03-05-24'->2024-05-03
[2025-11-02 02:28:47] L4582 fecha:'05-05-25'->2025-05-05
[2025-11-02 02:28:47] L4583 fecha:'10-08-24'->2024-08-10
[2025-11-02 02:28:47] L4584 fecha:'02-02-25'->2025-02-02
[2025-11-02 02:28:47] L4585 fecha:'31-05-24'->2024-05-31
[2025-11-02 02:28:47] L4586 fecha:'16-04-24'->2024-04-16
[2025-11-02 02:28:47] L4587 fecha:'21-01-24'->2024-01-21
[2025-11-02 02:28:47] L4588 fecha:'08-06-25'->2025-06-08
[2025-11-02 02:28:47] L4589 fecha:'18-04-24'->2024-04-18
[2025-11-02 02:28:47] L4590 fecha:'22-08-24'->2024-08-22
[2025-11-02 02:28:47] L4591 fecha:'23-10-24'->2024-10-23
[2025-11-02 02:28:47] L4592 fecha:'26-06-25'->2025-06-26
[2025-11-02 02:28:47] L4593 fecha:'18-10-24'->2024-10-18
[2025-11-02 02:28:47] L4594 fecha:'10-09-24'->2024-09-10
[2025-11-02 02:28:47] L4595 fecha:'03-01-24'->2024-01-03
[2025-11-02 02:28:47] L4596 fecha:'23-05-24'->2024-05-23
[2025-11-02 02:28:47] L4597 fecha:'21-04-25'->2025-04-21
[2025-11-02 02:28:47] L4598 fecha:'18-02-25'->2025-02-18
[2025-11-02 02:28:47] L4599 fecha:'12-12-24'->2024-12-12
[2025-11-02 02:28:47] L4600 fecha:'10-04-25'->2025-04-10
[2025-11-02 02:28:47] L4601 fecha:'13-06-24'->2024-06-13
[2025-11-02 02:28:47] L4602 fecha:'28-04-25'->2025-04-28
[2025-11-02 02:28:47] L4603 fecha:'20-04-25'->2025-04-20
[2025-11-02 02:28:47] L4604 fecha:'15-08-25'->2025-08-15
[2025-11-02 02:28:47] L4605 fecha:'15-04-24'->2024-04-15
[2025-11-02 02:28:47] L4606 fecha:'25-09-24'->2024-09-25
[2025-11-02 02:28:47] L4607 fecha:'19-04-24'->2024-04-19
[2025-11-02 02:28:47] L4608 fecha:'01-06-24'->2024-06-01
[2025-11-02 02:28:47] L4609 fecha:'10-10-24'->2024-10-10
[2025-11-02 02:28:47] L4610 fecha:'12-10-24'->2024-10-12
[2025-11-02 02:28:47] L4611 fecha:'02-04-25'->2025-04-02
[2025-11-02 02:28:47] L4612 fecha:'03-07-25'->2025-07-03
[2025-11-02 02:28:47] L4613 fecha:'22-11-24'->2024-11-22
[2025-11-02 02:28:47] L4614 fecha:'21-02-24'->2024-02-21
[2025-11-02 02:28:47] L4615 fecha:'21-03-24'->2024-03-21
[2025-11-02 02:28:47] L4616 fecha:'19-01-25'->2025-01-19
[2025-11-02 02:28:47] L4617 fecha:'13-03-24'->2024-03-13
[2025-11-02 02:28:47] L4618 fecha:'17-05-25'->2025-05-17
[2025-11-02 02:28:47] L4619 fecha:'21-11-24'->2024-11-21
[2025-11-02 02:28:47] L4620 fecha:'06-09-24'->2024-09-06
[2025-11-02 02:28:47] L4621 fecha:'07-03-25'->2025-03-07
[2025-11-02 02:28:47] L4622 fecha:'21-05-24'->2024-05-21
[2025-11-02 02:28:47] L4623 fecha:'30-08-24'->2024-08-30
[2025-11-02 02:28:47] L4624 fecha:'27-02-25'->2025-02-27
[2025-11-02 02:28:47] L4625 fecha:'01-08-24'->2024-08-01
[2025-11-02 02:28:47] L4626 fecha:'02-05-24'->2024-05-02
[2025-11-02 02:28:47] L4627 fecha:'01-03-24'->2024-03-01
[2025-11-02 02:28:47] L4628 fecha:'13-01-24'->2024-01-13
[2025-11-02 02:28:47] L4629 fecha:'11-12-24'->2024-12-11
[2025-11-02 02:28:47] L4630 fecha:'01-01-24'->2024-01-01
[2025-11-02 02:28:47] L4631 fecha:'18-10-24'->2024-10-18
[2025-11-02 02:28:47] L4632 fecha:'23-02-24'->2024-02-23
[2025-11-02 02:28:47] L4633 fecha:'04-07-24'->2024-07-04
[2025-11-02 02:28:47] L4634 fecha:'05-05-25'->2025-05-05
[2025-11-02 02:28:47] L4635 fecha:'11-02-24'->2024-02-11
[2025-11-02 02:28:47] L4636 fecha:'26-08-25'->2025-08-26
[2025-11-02 02:28:47] L4637 fecha:'20-09-24'->2024-09-20
[2025-11-02 02:28:47] L4638 fecha:'14-10-24'->2024-10-14
[2025-11-02 02:28:47] L4639 fecha:'13-04-24'->2024-04-13
[2025-11-02 02:28:47] L4640 fecha:'12-08-25'->2025-08-12
[2025-11-02 02:28:47] L4641 fecha:'27-05-25'->2025-05-27
[2025-11-02 02:28:47] L4642 fecha:'29-03-24'->2024-03-29
[2025-11-02 02:28:47] L4643 fecha:'02-01-24'->2024-01-02
[2025-11-02 02:28:47] L4644 fecha:'26-05-25'->2025-05-26
[2025-11-02 02:28:47] L4645 fecha:'11-06-25'->2025-06-11
[2025-11-02 02:28:47] L4646 fecha:'23-10-24'->2024-10-23
[2025-11-02 02:28:47] L4647 fecha:'20-07-24'->2024-07-20
[2025-11-02 02:28:47] L4648 fecha:'29-07-25'->2025-07-29
[2025-11-02 02:28:47] L4649 fecha:'28-08-25'->2025-08-28
[2025-11-02 02:28:47] L4650 fecha:'06-10-24'->2024-10-06
[2025-11-02 02:28:47] L4651 fecha:'20-11-24'->2024-11-20
[2025-11-02 02:28:47] L4652 fecha:'07-11-24'->2024-11-07
[2025-11-02 02:28:47] L4653 fecha:'01-07-24'->2024-07-01
[2025-11-02 02:28:47] L4654 fecha:'29-08-24'->2024-08-29
[2025-11-02 02:28:47] L4655 fecha:'13-05-25'->2025-05-13
[2025-11-02 02:28:47] L4656 fecha:'08-10-24'->2024-10-08
[2025-11-02 02:28:47] L4657 fecha:'20-11-24'->2024-11-20
[2025-11-02 02:28:47] L4658 fecha:'24-05-24'->2024-05-24
[2025-11-02 02:28:47] L4659 fecha:'29-09-24'->2024-09-29
[2025-11-02 02:28:47] L4660 fecha:'10-07-24'->2024-07-10
[2025-11-02 02:28:47] L4661 fecha:'02-03-25'->2025-03-02
[2025-11-02 02:28:47] L4662 fecha:'25-04-24'->2024-04-25
[2025-11-02 02:28:47] L4663 fecha:'08-06-25'->2025-06-08
[2025-11-02 02:28:47] L4664 fecha:'18-08-24'->2024-08-18
[2025-11-02 02:28:47] L4665 fecha:'10-05-24'->2024-05-10
[2025-11-02 02:28:47] L4666 fecha:'16-02-25'->2025-02-16
[2025-11-02 02:28:47] L4667 fecha:'28-04-25'->2025-04-28
[2025-11-02 02:28:47] L4668 fecha:'13-05-24'->2024-05-13
[2025-11-02 02:28:47] L4669 fecha:'21-06-25'->2025-06-21
[2025-11-02 02:28:47] L4670 fecha:'23-10-24'->2024-10-23
[2025-11-02 02:28:47] L4671 fecha:'02-01-25'->2025-01-02
[2025-11-02 02:28:47] L4672 fecha:'31-07-25'->2025-07-31
[2025-11-02 02:28:47] L4673 fecha:'08-07-25'->2025-07-08
[2025-11-02 02:28:47] L4674 fecha:'01-01-25'->2025-01-01
[2025-11-02 02:28:47] L4675 fecha:'05-01-25'->2025-01-05
[2025-11-02 02:28:47] L4676 fecha:'07-03-24'->2024-03-07
[2025-11-02 02:28:47] L4677 fecha:'28-02-24'->2024-02-28
[2025-11-02 02:28:47] L4678 fecha:'12-01-24'->2024-01-12
[2025-11-02 02:28:47] L4679 fecha:'08-04-24'->2024-04-08
[2025-11-02 02:28:47] L4680 fecha:'01-03-25'->2025-03-01
[2025-11-02 02:28:47] L4681 fecha:'27-05-24'->2024-05-27
[2025-11-02 02:28:47] L4682 fecha:'27-04-24'->2024-04-27
[2025-11-02 02:28:47] L4683 fecha:'03-08-25'->2025-08-03
[2025-11-02 02:28:47] L4684 fecha:'26-01-25'->2025-01-26
[2025-11-02 02:28:47] L4685 fecha:'17-06-25'->2025-06-17
[2025-11-02 02:28:47] L4686 fecha:'04-09-24'->2024-09-04
[2025-11-02 02:28:47] L4687 fecha:'02-12-24'->2024-12-02
[2025-11-02 02:28:47] L4688 fecha:'02-04-25'->2025-04-02
[2025-11-02 02:28:47] L4689 fecha:'29-04-24'->2024-04-29
[2025-11-02 02:28:47] L4690 fecha:'13-09-24'->2024-09-13
[2025-11-02 02:28:47] L4691 fecha:'13-04-25'->2025-04-13
[2025-11-02 02:28:47] L4692 fecha:'26-10-24'->2024-10-26
[2025-11-02 02:28:47] L4693 fecha:'04-12-24'->2024-12-04
[2025-11-02 02:28:47] L4694 fecha:'15-10-24'->2024-10-15
[2025-11-02 02:28:47] L4695 fecha:'05-02-24'->2024-02-05
[2025-11-02 02:28:47] L4696 fecha:'03-09-24'->2024-09-03
[2025-11-02 02:28:47] L4697 fecha:'18-10-24'->2024-10-18
[2025-11-02 02:28:47] L4698 fecha:'12-02-24'->2024-02-12
[2025-11-02 02:28:47] L4699 fecha:'25-05-25'->2025-05-25
[2025-11-02 02:28:47] L4700 fecha:'26-03-25'->2025-03-26
[2025-11-02 02:28:47] L4701 fecha:'20-05-25'->2025-05-20
[2025-11-02 02:28:47] L4702 fecha:'08-12-24'->2024-12-08
[2025-11-02 02:28:47] L4703 fecha:'05-02-24'->2024-02-05
[2025-11-02 02:28:47] L4704 fecha:'06-03-24'->2024-03-06
[2025-11-02 02:28:47] L4705 fecha:'14-01-24'->2024-01-14
[2025-11-02 02:28:47] L4706 fecha:'03-04-25'->2025-04-03
[2025-11-02 02:28:47] L4707 fecha:'31-05-24'->2024-05-31
[2025-11-02 02:28:47] L4708 fecha:'25-05-24'->2024-05-25
[2025-11-02 02:28:47] L4709 fecha:'14-05-24'->2024-05-14
[2025-11-02 02:28:47] L4710 fecha:'20-01-24'->2024-01-20
[2025-11-02 02:28:47] L4711 fecha:'03-07-25'->2025-07-03
[2025-11-02 02:28:47] L4712 fecha:'30-06-24'->2024-06-30
[2025-11-02 02:28:47] L4713 fecha:'21-08-24'->2024-08-21
[2025-11-02 02:28:47] L4714 fecha:'11-09-24'->2024-09-11
[2025-11-02 02:28:47] L4715 fecha:'24-02-24'->2024-02-24
[2025-11-02 02:28:47] L4716 fecha:'06-01-24'->2024-01-06
[2025-11-02 02:28:47] L4717 fecha:'26-01-24'->2024-01-26
[2025-11-02 02:28:47] L4718 fecha:'13-07-24'->2024-07-13
[2025-11-02 02:28:47] L4719 fecha:'04-04-24'->2024-04-04
[2025-11-02 02:28:47] L4720 fecha:'10-04-25'->2025-04-10
[2025-11-02 02:28:47] L4721 fecha:'20-04-25'->2025-04-20
[2025-11-02 02:28:47] L4722 fecha:'27-04-25'->2025-04-27
[2025-11-02 02:28:47] L4723 fecha:'24-05-25'->2025-05-24
[2025-11-02 02:28:47] L4724 fecha:'30-09-24'->2024-09-30
[2025-11-02 02:28:47] L4725 fecha:'27-12-24'->2024-12-27
[2025-11-02 02:28:47] L4726 fecha:'06-01-25'->2025-01-06
[2025-11-02 02:28:47] L4727 fecha:'25-08-25'->2025-08-25
[2025-11-02 02:28:47] L4728 fecha:'11-03-25'->2025-03-11
[2025-11-02 02:28:47] L4729 fecha:'17-06-24'->2024-06-17
[2025-11-02 02:28:47] L4730 fecha:'11-04-24'->2024-04-11
[2025-11-02 02:28:47] L4731 fecha:'24-09-24'->2024-09-24
[2025-11-02 02:28:47] L4732 fecha:'27-01-25'->2025-01-27
[2025-11-02 02:28:47] L4733 fecha:'22-06-24'->2024-06-22
[2025-11-02 02:28:47] L4734 fecha:'06-05-24'->2024-05-06
[2025-11-02 02:28:47] L4735 fecha:'20-06-24'->2024-06-20
[2025-11-02 02:28:47] L4736 fecha:'29-03-24'->2024-03-29
[2025-11-02 02:28:47] L4737 fecha:'06-08-25'->2025-08-06
[2025-11-02 02:28:47] L4738 fecha:'29-06-24'->2024-06-29
[2025-11-02 02:28:47] L4739 fecha:'16-10-24'->2024-10-16
[2025-11-02 02:28:47] L4740 fecha:'07-02-25'->2025-02-07
[2025-11-02 02:28:47] L4741 fecha:'26-07-25'->2025-07-26
[2025-11-02 02:28:47] L4742 fecha:'05-06-25'->2025-06-05
[2025-11-02 02:28:47] L4743 fecha:'30-10-24'->2024-10-30
[2025-11-02 02:28:47] L4744 fecha:'16-04-25'->2025-04-16
[2025-11-02 02:28:47] L4745 fecha:'18-11-24'->2024-11-18
[2025-11-02 02:28:47] L4746 fecha:'30-04-24'->2024-04-30
[2025-11-02 02:28:47] L4747 fecha:'02-07-25'->2025-07-02
[2025-11-02 02:28:47] L4748 fecha:'27-01-25'->2025-01-27
[2025-11-02 02:28:47] L4749 fecha:'21-06-25'->2025-06-21
[2025-11-02 02:28:47] L4750 fecha:'24-08-25'->2025-08-24
[2025-11-02 02:28:47] L4751 fecha:'09-11-24'->2024-11-09
[2025-11-02 02:28:47] L4752 fecha:'12-06-25'->2025-06-12
[2025-11-02 02:28:47] L4753 fecha:'15-03-24'->2024-03-15
[2025-11-02 02:28:47] L4754 fecha:'30-09-24'->2024-09-30
[2025-11-02 02:28:47] L4755 fecha:'10-06-25'->2025-06-10
[2025-11-02 02:28:47] L4756 fecha:'14-05-24'->2024-05-14
[2025-11-02 02:28:47] L4757 fecha:'25-12-24'->2024-12-25
[2025-11-02 02:28:47] L4758 fecha:'01-12-24'->2024-12-01
[2025-11-02 02:28:47] L4759 fecha:'18-01-24'->2024-01-18
[2025-11-02 02:28:47] L4760 fecha:'11-02-25'->2025-02-11
[2025-11-02 02:28:47] L4761 fecha:'04-03-24'->2024-03-04
[2025-11-02 02:28:47] L4762 fecha:'02-02-25'->2025-02-02
[2025-11-02 02:28:47] L4763 fecha:'08-02-24'->2024-02-08
[2025-11-02 02:28:47] L4764 fecha:'14-01-25'->2025-01-14
[2025-11-02 02:28:47] L4765 fecha:'07-01-25'->2025-01-07
[2025-11-02 02:28:47] L4766 fecha:'05-08-24'->2024-08-05
[2025-11-02 02:28:47] L4767 fecha:'05-05-25'->2025-05-05
[2025-11-02 02:28:47] L4768 fecha:'04-09-24'->2024-09-04
[2025-11-02 02:28:47] L4769 fecha:'07-01-25'->2025-01-07
[2025-11-02 02:28:47] L4770 fecha:'13-12-24'->2024-12-13
[2025-11-02 02:28:47] L4771 fecha:'28-06-25'->2025-06-28
[2025-11-02 02:28:47] L4772 fecha:'11-01-24'->2024-01-11
[2025-11-02 02:28:47] L4773 fecha:'30-08-25'->2025-08-30
[2025-11-02 02:28:47] L4774 fecha:'12-11-24'->2024-11-12
[2025-11-02 02:28:47] L4775 fecha:'16-09-24'->2024-09-16
[2025-11-02 02:28:47] L4776 fecha:'15-06-25'->2025-06-15
[2025-11-02 02:28:47] L4777 fecha:'12-04-24'->2024-04-12
[2025-11-02 02:28:47] L4778 fecha:'31-12-24'->2024-12-31
[2025-11-02 02:28:47] L4779 fecha:'24-07-24'->2024-07-24
[2025-11-02 02:28:47] L4780 fecha:'09-06-25'->2025-06-09
[2025-11-02 02:28:47] L4781 fecha:'23-01-25'->2025-01-23
[2025-11-02 02:28:47] L4782 fecha:'14-08-25'->2025-08-14
[2025-11-02 02:28:47] L4783 fecha:'28-02-24'->2024-02-28
[2025-11-02 02:28:47] L4784 fecha:'16-01-25'->2025-01-16
[2025-11-02 02:28:47] L4785 fecha:'04-11-24'->2024-11-04
[2025-11-02 02:28:47] L4786 fecha:'25-05-24'->2024-05-25
[2025-11-02 02:28:47] L4787 fecha:'22-11-24'->2024-11-22
[2025-11-02 02:28:47] L4788 fecha:'15-06-25'->2025-06-15
[2025-11-02 02:28:47] L4789 fecha:'20-07-24'->2024-07-20
[2025-11-02 02:28:47] L4790 fecha:'20-01-25'->2025-01-20
[2025-11-02 02:28:47] L4791 fecha:'27-04-24'->2024-04-27
[2025-11-02 02:28:47] L4792 fecha:'01-06-24'->2024-06-01
[2025-11-02 02:28:47] L4793 fecha:'28-11-24'->2024-11-28
[2025-11-02 02:28:47] L4794 fecha:'22-12-24'->2024-12-22
[2025-11-02 02:28:47] L4795 fecha:'10-12-24'->2024-12-10
[2025-11-02 02:28:47] L4796 fecha:'05-02-24'->2024-02-05
[2025-11-02 02:28:47] L4797 fecha:'06-06-25'->2025-06-06
[2025-11-02 02:28:47] L4798 fecha:'12-08-25'->2025-08-12
[2025-11-02 02:28:47] L4799 fecha:'27-08-24'->2024-08-27
[2025-11-02 02:28:47] L4800 fecha:'20-05-24'->2024-05-20
[2025-11-02 02:28:47] L4801 fecha:'13-04-24'->2024-04-13
[2025-11-02 02:28:47] L4802 fecha:'21-08-24'->2024-08-21
[2025-11-02 02:28:47] L4803 fecha:'04-12-24'->2024-12-04
[2025-11-02 02:28:47] L4804 fecha:'13-02-24'->2024-02-13
[2025-11-02 02:28:47] L4805 fecha:'18-09-24'->2024-09-18
[2025-11-02 02:28:47] L4806 fecha:'02-10-24'->2024-10-02
[2025-11-02 02:28:47] L4807 fecha:'22-01-25'->2025-01-22
[2025-11-02 02:28:47] L4808 fecha:'19-09-24'->2024-09-19
[2025-11-02 02:28:47] L4809 fecha:'05-01-24'->2024-01-05
[2025-11-02 02:28:47] L4810 fecha:'30-05-25'->2025-05-30
[2025-11-02 02:28:47] L4811 fecha:'12-01-24'->2024-01-12
[2025-11-02 02:28:47] L4812 fecha:'13-11-24'->2024-11-13
[2025-11-02 02:28:47] L4813 fecha:'12-11-24'->2024-11-12
[2025-11-02 02:28:47] L4814 fecha:'20-02-25'->2025-02-20
[2025-11-02 02:28:47] L4815 fecha:'29-08-25'->2025-08-29
[2025-11-02 02:28:47] L4816 fecha:'25-11-24'->2024-11-25
[2025-11-02 02:28:47] L4817 fecha:'06-03-24'->2024-03-06
[2025-11-02 02:28:47] L4818 fecha:'17-04-24'->2024-04-17
[2025-11-02 02:28:47] L4819 fecha:'06-01-25'->2025-01-06
[2025-11-02 02:28:47] L4820 fecha:'16-07-25'->2025-07-16
[2025-11-02 02:28:47] L4821 fecha:'17-01-24'->2024-01-17
[2025-11-02 02:28:47] L4822 fecha:'03-01-24'->2024-01-03
[2025-11-02 02:28:47] L4823 fecha:'07-01-24'->2024-01-07
[2025-11-02 02:28:47] L4824 fecha:'10-08-25'->2025-08-10
[2025-11-02 02:28:47] L4825 fecha:'31-08-24'->2024-08-31
[2025-11-02 02:28:47] L4826 fecha:'12-03-25'->2025-03-12
[2025-11-02 02:28:47] L4827 fecha:'08-08-24'->2024-08-08
[2025-11-02 02:28:47] L4828 fecha:'28-03-25'->2025-03-28
[2025-11-02 02:28:47] L4829 fecha:'25-02-25'->2025-02-25
[2025-11-02 02:28:47] L4830 fecha:'08-07-24'->2024-07-08
[2025-11-02 02:28:47] L4831 fecha:'20-02-25'->2025-02-20
[2025-11-02 02:28:47] L4832 fecha:'10-03-25'->2025-03-10
[2025-11-02 02:28:47] L4833 fecha:'07-02-25'->2025-02-07
[2025-11-02 02:28:47] L4834 fecha:'20-12-24'->2024-12-20
[2025-11-02 02:28:47] L4835 fecha:'23-05-25'->2025-05-23
[2025-11-02 02:28:47] L4836 fecha:'21-12-24'->2024-12-21
[2025-11-02 02:28:47] L4837 fecha:'02-08-24'->2024-08-02
[2025-11-02 02:28:47] L4838 fecha:'16-06-25'->2025-06-16
[2025-11-02 02:28:47] L4839 fecha:'30-07-24'->2024-07-30
[2025-11-02 02:28:47] L4840 fecha:'06-04-25'->2025-04-06
[2025-11-02 02:28:47] L4841 fecha:'18-05-25'->2025-05-18
[2025-11-02 02:28:47] L4842 fecha:'09-04-24'->2024-04-09
[2025-11-02 02:28:47] L4843 fecha:'24-04-25'->2025-04-24
[2025-11-02 02:28:47] L4844 fecha:'26-01-25'->2025-01-26
[2025-11-02 02:28:47] L4845 fecha:'16-01-25'->2025-01-16
[2025-11-02 02:28:47] L4846 fecha:'18-06-24'->2024-06-18
[2025-11-02 02:28:47] L4847 fecha:'26-03-25'->2025-03-26
[2025-11-02 02:28:47] L4848 fecha:'22-04-25'->2025-04-22
[2025-11-02 02:28:47] L4849 fecha:'25-02-25'->2025-02-25
[2025-11-02 02:28:47] L4850 fecha:'02-06-24'->2024-06-02
[2025-11-02 02:28:47] L4851 fecha:'09-10-24'->2024-10-09
[2025-11-02 02:28:47] L4852 fecha:'05-07-24'->2024-07-05
[2025-11-02 02:28:47] L4853 fecha:'06-01-25'->2025-01-06
[2025-11-02 02:28:47] L4854 fecha:'15-02-24'->2024-02-15
[2025-11-02 02:28:47] L4855 fecha:'16-06-25'->2025-06-16
[2025-11-02 02:28:47] L4856 fecha:'16-03-24'->2024-03-16
[2025-11-02 02:28:47] L4857 fecha:'11-02-25'->2025-02-11
[2025-11-02 02:28:47] L4858 fecha:'30-03-25'->2025-03-30
[2025-11-02 02:28:47] L4859 fecha:'03-05-25'->2025-05-03
[2025-11-02 02:28:47] L4860 fecha:'27-01-25'->2025-01-27
[2025-11-02 02:28:47] L4861 fecha:'20-10-24'->2024-10-20
[2025-11-02 02:28:47] L4862 fecha:'26-03-25'->2025-03-26
[2025-11-02 02:28:47] L4863 fecha:'06-09-24'->2024-09-06
[2025-11-02 02:28:47] L4864 fecha:'29-07-24'->2024-07-29
[2025-11-02 02:28:47] L4865 fecha:'04-03-25'->2025-03-04
[2025-11-02 02:28:47] L4866 fecha:'10-07-25'->2025-07-10
[2025-11-02 02:28:47] L4867 fecha:'04-06-24'->2024-06-04
[2025-11-02 02:28:47] L4868 fecha:'23-07-24'->2024-07-23
[2025-11-02 02:28:47] L4869 fecha:'09-01-24'->2024-01-09
[2025-11-02 02:28:47] L4870 fecha:'02-01-24'->2024-01-02
[2025-11-02 02:28:47] L4871 fecha:'23-10-24'->2024-10-23
[2025-11-02 02:28:47] L4872 fecha:'19-02-25'->2025-02-19
[2025-11-02 02:28:47] L4873 fecha:'26-06-24'->2024-06-26
[2025-11-02 02:28:47] L4874 fecha:'31-05-25'->2025-05-31
[2025-11-02 02:28:47] L4875 fecha:'11-07-24'->2024-07-11
[2025-11-02 02:28:47] L4876 fecha:'18-10-24'->2024-10-18
[2025-11-02 02:28:47] L4877 fecha:'04-02-24'->2024-02-04
[2025-11-02 02:28:47] L4878 fecha:'12-05-24'->2024-05-12
[2025-11-02 02:28:47] L4879 fecha:'30-08-25'->2025-08-30
